,comment,comment_id,reply_count,like_count,updated_at,calificacion
413.0,"I love these videos! I never thought I would like yoga but I am really enjoying learning from you, Adriene. These videos are helping me heal my body and spirit!",Ugxey2L5xsk9aVVMGXB4AaABAg,0.0,2.0,2022-01-11T03:24:56Z,0.9998489618301392
414.0,"Thank you Adriene for another lovely practice! Day nine, just in time!",UgwDOpVMIAze-JRYTEd4AaABAg,0.0,1.0,2022-01-11T03:20:34Z,0.9998273849487305
415.0,This is was the first day that I almost didn’t show up until an hour before bed and I knew I’d be disappointed in myself the next day. It was kind of funny that she addressed those feelings in today’s practice ☺️,UgxW25uo2oI0dq6QA4N4AaABAg,1.0,1.0,2022-01-11T03:17:10Z,0.9978200197219849
416.0,I can't believe we're almost a third of the way through Move! AHH! We've got this!,Ugwy-ZrMdMdTSOUgvdd4AaABAg,2.0,0.0,2022-01-11T03:17:04Z,0.9989626407623291
417.0,I almost didn’t show up today. It is almost my bedtime and I was exhausted. I did it and so:glad I showed up. Now to get ready for bed and looking forward to tomorrow’s practice.,UgxWE-9IhTQ0FaMlMCF4AaABAg,0.0,1.0,2022-01-11T03:14:56Z,-0.6509027481079102
418.0,Thank  you for the great  opportunity to practice with you for the next 30 days Move yoga with you (Adrienne.) You are awesome teacher and making this section fun for everyone who are here to practice.,UgxecxmUnWg7jQoh3Zh4AaABAg,0.0,0.0,2022-01-11T03:13:12Z,0.9998738765716553
419.0,"This is the hardest year by far. External forces and circumstances are leaving me completely emotionally, mentally & physically drained by the end of the day. Showing up is the absolute hardest part & lately I very begrudgingly get on the mat trying not to curse the world too much. There have been a lot of tears through this journey. 
But at the end of each video, I do feel better. My favorite part though, is seeing all of the wonderful comments. The love and support that each one of you brings and gives to help build a community so beautiful is breathtaking. 
You are all so awesome. 
Thank you for sharing your light <3 
Thanks for bringing us all together, Adriene.",UgycwjL-28UjJwYONUx4AaABAg,2.0,1.0,2022-01-11T03:11:31Z,0.9992293119430542
420.0,"I have a balance disorder, and I feel so much better about everything, being on this journey, that it doesn't bother me that Tree was out of my reach today.  Thank you so much for this gift, and for the reminder I need to practice Tree on a daily basis as I go through this flare up.",Ugz_jUs-4W_LEz-JB594AaABAg,2.0,0.0,2022-01-11T03:09:18Z,0.9983285069465637
421.0,I had a lot of fun in this practice,UgxpuIdasm48UvkKpcx4AaABAg,0.0,0.0,2022-01-11T03:05:03Z,0.9997268319129944
422.0,"I love how each day is different, but still meshes so well together.   I didn’t make it this morning and am so happy with the opportunity to to show up this evening.",UgzJSEhYcQafBoZHdKR4AaABAg,0.0,3.0,2022-01-11T03:05:00Z,0.9997621178627014
423.0,"Have the sniffles so inhaling and exhaling was a challenge but I did whatever I could because ultimately this is what it is all about. Grateful for this practice and the community. Have a good week everyone. Good vibes from Karachi, Pakistan.",UgzaDK7oez-daJJ7pZF4AaABAg,0.0,2.0,2022-01-11T03:03:19Z,0.9997608065605164
424.0,"When you invited us to any gentle movement at the end of this practice, I felt called to do that core move that we did in an earlier day - where you have your legs straight out in front of you, point your hands in front of you in a finger gun, and slowly roll down and up using your abs. The time we did it before, I couldn’t come back up without my feet splaying out and coming up in the air in the process. Today, I can do it with my feet on the ground the whole time! No splaying! I did it like 10 times! I said out loud “woah. Woah. WOAH!” Each time because I’m not used to making physical fitness progress like this where it’s so noticeable! So proud of myself!",UgxnRc1YKBBAJxx1fmF4AaABAg,1.0,0.0,2022-01-11T03:01:38Z,0.9810636043548584
425.0,"When Adriene said ""Don't be afraid to take up space, you are worthy,"" I almost broke down in tears. I felt that. I have allowed others to make me feel unworthy and this daily practice reminds me that I am worthy. I can take up space. I needed that. I needed this practice.",UgyQa-1CBjM5BAknu014AaABAg,1.0,6.0,2022-01-11T02:56:38Z,0.9990251064300537
426.0,Look at us! Right at a third of the way done with this challenge! Very proud of us all for making it 🙏,UgxOJA7-xunYQu1fx-x4AaABAg,0.0,8.0,2022-01-11T02:51:32Z,0.9998588562011719
427.0,Honestly I feel like Adrienne knows what I need each day. I had a 2 hour commute today abs didn’t get to do this practice until nearly bedtime. It really hit. Thank you. Thank you all for this beautiful community. ❤️,UgycGj512Kt3aKTOJt14AaABAg,0.0,2.0,2022-01-11T02:50:46Z,0.9996852874755859
428.0,"I'm embarrassed to say, I was a bit disappointed in the Rest day and yet, was grateful today's was so short. How all over the map I am...it feels good to stay committed and I'm thankful to be on this journey, for free!",Ugzf-5TThWInbTtLbdt4AaABAg,0.0,0.0,2022-01-11T02:46:41Z,0.9982479810714722
429.0,Thank you for Day 9! I loved every minute of today's practice. Let's allow ourselves to have more fun:),UgzXQQiK0jgsQ6-f-vh4AaABAg,0.0,0.0,2022-01-11T02:46:15Z,0.999761164188385
430.0,Thank you Adriene! This is what I needed this evening ❤🙌🏾🧘🏽‍♀️🙏🏽,UgzO92MN-LQxbGULjJ94AaABAg,0.0,0.0,2022-01-11T02:43:26Z,0.9996774196624756
431.0,:),Ugw_dEpI-HGMNX9F5El4AaABAg,0.0,0.0,2022-01-11T02:42:44Z,0.6489290595054626
432.0,"I could barely keep my eyes open to do this practice and I thought a lot about saying no and catching up later, but I knew that would never happen. I told myself to just try. So I fell out and out and out of tree pose (one I usually love and can hold peacefully), just laughing at the fact that it’s okay to not get it right every time. Sometimes you just have to show up and hope for the best. And now I feel better for having done so!",UgzwSjhaHdSBd52vO-p4AaABAg,0.0,0.0,2022-01-11T02:40:35Z,0.8879159092903137
433.0,"my thighs can't stop trembling now when I'm bending my knees! 😂 whoo, I don't think I've done 9 days of yoga in a row before. Resisting the temptation to skip a day after doing 3 or more in a row is tough. namaste.",UgwndLRfbRwEbT6omzJ4AaABAg,0.0,0.0,2022-01-11T02:34:54Z,-0.9741888642311096
434.0,Came here because I was not feeling like coming to the mat today. All I needed was to read a few of your encouraging words . Wow. Just feeling uplifted. So glad I showed up. So proud of all of us! 😭 ❤️,UgyJPoXcANhR_gHGSYF4AaABAg,1.0,85.0,2022-01-11T02:33:18Z,0.999821126461029
435.0,This is the first day I didn’t feel like doing it because I was stressed and had a messy head... probably the most important day to do it! So of course I did it. Probably needed an extra long session today because I still didn’t feel relaxed at the end but probably better having done it :),UgzOqvI11IUa8F1AWPd4AaABAg,0.0,4.0,2022-01-11T02:31:13Z,-0.9276220798492432
436.0,How did you know I would feel like skipping the video today? So glad I showed up.,UgzaxLxM_BBFyjWc4414AaABAg,0.0,0.0,2022-01-11T02:25:25Z,-0.9901132583618164
437.0,I have mild COVID and was worried I would need to skip today. But this actually felt just right. Thank you. ❤️,UgxEXXhTE1SXwL7AZLp4AaABAg,0.0,0.0,2022-01-11T02:23:12Z,0.999818742275238
438.0,Adriene helps me remember to keep visiting my curious inner child. :),UgwohN67rucCw6EB3jF4AaABAg,0.0,0.0,2022-01-11T02:20:49Z,0.999613344669342
439.0,"I have been loving following along. This is my first time trying yoga, but I've done every day of the challenge and I feel proud of myself! I love how nonjudgmental this space is, regardless of ability level. It has inspired me to share some basic yoga with my students when we have a ""stress-free day"" in April.",UgwSF9WYVRDDEbfbVKl4AaABAg,0.0,0.0,2022-01-11T02:19:51Z,0.9997560381889343
440.0,I’ve done a few of your videos before. But never stuck to a challenge usually hop in on a random day but this is the first month I’ve decided to start from the beginning and stick with it. Today was a very overwhelming day just sensory overload but reminded myself to take the moment for myself even if I really just wanted to rest. And I’m so happy that I did it. I feel so much calmer and ready to finish this night on a good note! Thank you so much for this practice!!,UgxFOSb7B4kts-9eMa54AaABAg,0.0,0.0,2022-01-11T02:17:48Z,0.9992270469665527
441.0,"Day 9 and my Fibro pain is finally starting to ease up.  I've been coming to the mat with a happy heart, but the physical challenge has felt almost like a trial by fire. All the same, it's starting to pay off.",Ugw1CbSy1t5zSgTh-Il4AaABAg,0.0,0.0,2022-01-11T02:17:04Z,0.9990214109420776
442.0,"Today was NOT a good day, and all I had left was to skip this practice. Thank you Adriene for the reminder to commit to this and to myself ❤❤",Ugzcz6S3ruA9Nmv09Hd4AaABAg,0.0,2.0,2022-01-11T02:14:09Z,-0.9951801300048828
443.0,The falling practice was really humbling for me. I tend to be a perfectionist and hate to make mistakes. I didn’t realize I was doing that with yoga and this was a reminder that I and my practice are evolving.,UgypAWmITiOa2U8tI5R4AaABAg,0.0,0.0,2022-01-11T02:13:27Z,0.9970030188560486
444.0,done :),UgytVSA6ePRfMqxiz3B4AaABAg,0.0,0.0,2022-01-11T02:08:39Z,0.8443470001220703
445.0,"yesterday I was hit with unexpected life that resulted in me not being able to practice, I started this practice with shame, but it ended with acceptance and understanding. I am looking forward to tomorrow. life is easier when you are kind to yourself.",UgzAqQrZTceMoE6I_jl4AaABAg,0.0,0.0,2022-01-11T02:01:00Z,0.9989074468612671
446.0,Day 10/9 complete my sister thought it was 'nifty' I thought it was good. 01/10/2022,UgyD4YFSnvLda-lv5zp4AaABAg,0.0,0.0,2022-01-11T02:00:09Z,0.9993903636932373
447.0,"Thanx, Adriene",Ugy6a_yJvlLlPfM6oEJ4AaABAg,0.0,0.0,2022-01-11T01:58:16Z,0.7280842661857605
448.0,"This was such a fun practice! I laughed at myself when I fell out tree pose, and I loved raising my arms and then swishing them back.",UgxYqqQUQq2LF-bhR0F4AaABAg,0.0,3.0,2022-01-11T01:55:24Z,0.9997140765190125
449.0,Beautiful. Peaceful. Energetic. Thank you!,Ugz_4FtjodbTZXoGkx14AaABAg,0.0,0.0,2022-01-11T01:53:26Z,0.9998805522918701
450.0,Thank you Adriene!,UgzrGbY8U6EGVEoiwP54AaABAg,0.0,0.0,2022-01-11T01:53:04Z,0.9998526573181152
451.0,"I'm still on this journey. I wasn't sure if I was going to make it this far, but I'm still here! And it's getting easier for me to keep up",UgywsdtPAwLrJeSvhZ54AaABAg,0.0,1.0,2022-01-11T01:52:07Z,0.9769330024719238
452.0,"My laptop stopped working today. I had such a rough Monday and then I remembered about my daily date with Adriene and Benji and couldn't say no to centering myself and forgetting, temporarily, about the negative emotions of today. Thank you for showing me that I can always find my center within.",Ugx_8Y6TqV_AmDEFFF14AaABAg,0.0,0.0,2022-01-11T01:49:51Z,0.9980770349502563
453.0,Day 10(9) of January ❤️🙏🏼 day 315,UgwiwCHEr7d4vkV0f894AaABAg,0.0,0.0,2022-01-11T01:45:52Z,-0.6656625866889954
454.0,Day 9 Tree Pose was very challenging but I'm determined to get it down without falling all over the place. Have a great night everyone.,UgwiwRXVz3xveihWI2d4AaABAg,0.0,0.0,2022-01-11T01:44:51Z,0.999204695224762
455.0,Loved it so much!,UgwbcJtnkPlbhNN9aGh4AaABAg,0.0,0.0,2022-01-11T01:44:30Z,0.9998819828033447
456.0,Didn't do the last few days and got back into it today; yay!,UgwOGN9p8AWzb68oOC14AaABAg,0.0,0.0,2022-01-11T01:44:04Z,0.9711942672729492
457.0,"I am so excited every day to come home to do these daily practices, I cannot wait to follow along this whole year with the playlists you create for each month! Thank you so much Adriene, you have changed my life and I'm forever grateful to have found this wonderful mind and body connection through yoga!! Never have I ever felt more and more like me 💖 namaste ✌️💖",UgwhIS_mRl8Vl69bdK14AaABAg,0.0,0.0,2022-01-11T01:37:34Z,0.9997898936271667
458.0,"I just felt so mentally disconnected from this practice today. I felt the opposite of curious and that I was just going through the motions, BUT I still showed up. Even a little bit of something is better than nothing, and I know that each day will be different.",UgyGdzEpLSM8EFnSb8F4AaABAg,0.0,0.0,2022-01-11T01:37:13Z,0.9962045550346375
459.0,Thank you 🙏,Ugx3qCCuVHpxix142IV4AaABAg,0.0,0.0,2022-01-11T01:35:50Z,0.9998127818107605
460.0,"Thank you. I am a very positive person but a bit stuck. Thank you for letting me feel ""un-stuck"" with this sweet practice. Mwuah.",Ugyo-lLmaBs7ULhyXEJ4AaABAg,0.0,0.0,2022-01-11T01:29:12Z,-0.8640894293785095
461.0,thank you Adrienne.  Always feel refreshed after the session!,UgzITNjwNCqmeM-EutN4AaABAg,0.0,1.0,2022-01-11T01:26:06Z,0.9998811483383179
462.0,Thank you Adriene 🧘🏼‍♀️,UgwvJgZwohUvmnlW6Fh4AaABAg,0.0,1.0,2022-01-11T01:23:30Z,0.9997859597206116
463.0,This was my favourite day so far! Yesterday I found it so difficult to stay still and rest. Today woke me up and I feel so energised! Was already laughing at myself falling during tree pose when you started talking about falling 😂,Ugx-zeCrl1xnm-pETr54AaABAg,0.0,2.0,2022-01-11T01:23:22Z,-0.696392834186554
464.0,Day 9! 🎉 ( but my first day w/ move but decided to just hop in instead of being down/perfectionistic because i missed the first week.,UgxpZhELpjWqhoK5Hw94AaABAg,0.0,2.0,2022-01-11T01:17:42Z,-0.9956570863723755
465.0,"Adriene, I’d love any tips you have for getting into folding poses with bigger bellies and chests. I try to do my best, but sometimes my tummy is like 🙅🏻‍♀️🙅🏻‍♀️🙅🏻‍♀️",Ugz0PVvLc-_BcXdj7f94AaABAg,0.0,0.0,2022-01-11T01:16:40Z,-0.9564027190208435
466.0,Absolutely amazing session! I am beyond happy to be part of this and noticing a positive change in myself through these practices. Thank you for these session!,Ugzcwlan1NvVmZIMvYJ4AaABAg,0.0,2.0,2022-01-11T01:10:19Z,0.9998472929000854
467.0,Done day 9,UgyZIfxkEvfUFZvCSHx4AaABAg,0.0,1.0,2022-01-11T01:07:06Z,0.9784085750579834
468.0,"Somehow I’m not getting the emails, I checked in my inbox and my junk mail… If anyone in the community knows how to get them let me know thank you!",UgytJDolXrKxRAvstw54AaABAg,0.0,0.0,2022-01-11T01:06:50Z,-0.998444139957428
469.0,I absolutely love this channel and the wholesome posts on every video. I can honestly say yoga has been the first form of exercise that I have done that makes me want more after each session.,Ugz-uIY1h7N-CJm24TF4AaABAg,0.0,1.0,2022-01-11T01:01:05Z,0.9995716214179993
470.0,Another awesome day of Yoga.  This course is just the best.  Definitely going to work on my Tree Pose a bit more.  I knew it was coming.  Just didn't think it would be this soon.  Until tomorrow all of you wonderful people. Namaste everyone.,Ugxuiw8jzgbkBc6WPDV4AaABAg,0.0,2.0,2022-01-11T00:56:28Z,0.9998238682746887
471.0,I found myself giggling each time I fell out of the tree pose - loving the opportunity to stay playful and curious. Thank you!!,UgzoBOKFsuA5uQcbzjd4AaABAg,0.0,6.0,2022-01-11T00:53:58Z,0.999882698059082
472.0,"So glad that I found Adriene at the start of the pandemic! I have  made progress in my yoga life at home, and don't really miss the gym anymore. I'm 69 and have been practicing yoga for over 10 years. When I fall out of the habit for a few days, my body tells me that I need to keep moving and stretching and being flexible. After almost two years of taking advantage of all the free yoga, I felt it was time to support this wonderful cause and I joined the paid site. I've convinced several people to join with Adriene and Benji, and we all feel that it has added wonderful value to our lives. Thank you so much!!",UgxvmMzm8jiR4On9uGN4AaABAg,0.0,2.0,2022-01-11T00:39:07Z,0.9995962977409363
473.0,Thank you for taking the time to share everyday!! I look forward to these sessions everyday!,UgxCGyROCuUx04DNK8l4AaABAg,0.0,1.0,2022-01-11T00:33:37Z,0.9998703002929688
474.0,I love the new vocabulary being introduced. I also love that we're building strength little by little.,Ugx2cPs0I0fWgDqu1OR4AaABAg,0.0,1.0,2022-01-11T00:32:18Z,0.9998699426651001
475.0,"great 1...Jan 10, 2022",UgxkY1b6c8aHCdU8KYl4AaABAg,0.0,1.0,2022-01-11T00:32:03Z,0.9905479550361633
476.0,I am so grateful to be here w/ everyone ❤️,UgztB9UmeqsCWgQRu354AaABAg,0.0,1.0,2022-01-11T00:29:02Z,0.9990731477737427
477.0,"Just finished 💪 nunca llegué tan lejos, gracias Adriene 😌",UgwvSl7H7bnZqijVTA54AaABAg,0.0,1.0,2022-01-11T00:21:29Z,-0.8796656131744385
478.0,Thank you for todays practice. ❤️,Ugy1Utc4LRiQtrprtEV4AaABAg,0.0,1.0,2022-01-11T00:20:35Z,0.9997857213020325
479.0,"I've been doing yoga for years, I've never heard of the 'hydrant pose'. What is that and what is the image Adriene is referring to?",Ugx49keE3XuKHjM00RV4AaABAg,0.0,0.0,2022-01-11T00:11:34Z,-0.9229344129562378
480.0,"Oh man, I just could not stop laughing during the hydrant leg thing... My 6'5 husband next to me, doing it eagerly, grinning at me... I was out laughing for about three or four min of this practice",Ugy2S-8Dl10waIS4EWl4AaABAg,1.0,3.0,2022-01-11T00:11:29Z,0.9926315546035767
481.0,"Any Fitbit Versa 2 users? 
How many calories did you burn this session? (Mines only said 86, trying to get some statistics here)",UgyXRuBhFuDC6Je1XkZ4AaABAg,0.0,0.0,2022-01-11T00:09:01Z,-0.9993267059326172
482.0,"Still here, Adrienne, and loving every minute. Thank you for this gift",UgyC6Y4KOKlYWOzLMxN4AaABAg,0.0,6.0,2022-01-11T00:07:35Z,0.9998838901519775
483.0,have an exam tomorrow so I nearly didn't show up in the name of studying but I remembered the commitment I made. here's to keeping up with curiousity!,Ugy8OWpOjumzX2lSh6p4AaABAg,0.0,4.0,2022-01-11T00:07:18Z,0.9991170763969421
484.0,"Thank you for another wonderful practice, Adriene! Day 10 tomorrow with this beautiful community.",UgzAzOrEJwc5_TZM-zN4AaABAg,0.0,1.0,2022-01-11T00:06:52Z,0.9998754262924194
485.0,"After 9 consecutive days of yoga, I'm feeling fantastic!!  Really becoming more in tune with my breath and can tell that I've gotten a smidge more flexible.  This is my 4th year doing the January challenge and it never ceases to amaze me how much better I feel and MOVE when I take small amounts of time to care for myself each day!",Ugx7FTKwLmwFHfQYk6p4AaABAg,0.0,5.0,2022-01-11T00:05:49Z,0.9997898936271667
486.0,"My friend recommended this yoga program to me so I am going to pay it forward. I am absolutely loving this series and I am going to recommend it to my mom, sisters and girlfriends.  Thank you!",UgySq17zVXbID6NvYuJ4AaABAg,0.0,2.0,2022-01-11T00:03:53Z,0.999863862991333
487.0,Love a good wide-legged stance! Feel your power everyone - we do deserve to take up space!!,UgxvuRSaxVXa8bJa0_d4AaABAg,0.0,1.0,2022-01-11T00:03:05Z,0.9997314810752869
488.0,Did anyone else hear Adriene's heartbeat right after tree pose? 💓,UgzZj4mDO-qi8JLgXK94AaABAg,0.0,0.0,2022-01-11T00:02:14Z,-0.9959320425987244
489.0,I don’t have to be curious about falling out of tree pose! I can’t even balance with my toes on the ground! But I’ve shown up every day so far and really enjoying it!,UgyuhLps1lOzIefKRiV4AaABAg,0.0,2.0,2022-01-11T00:01:39Z,0.9998050332069397
490.0,"Hello to the 7,500 who joined day 9 practice at the same time as me. Was this an after work workout for you? Good job showing up. On to day 10. i'll see you there!",Ugw64RtDoey84XvXiU94AaABAg,0.0,1.0,2022-01-10T23:56:05Z,0.9997162222862244
491.0,"I nearly missed out, talked to my daughter and it got late. But I made it, beautiful session. Good night from CET+1.",Ugz8DsLi4bXdTpDNCMB4AaABAg,0.0,6.0,2022-01-10T23:54:43Z,0.9996930360794067
492.0,"So happy I showed up to the mat today even though it was about 11:30PM because I had so many other things I had to take care of on this rainy Monday in the UK. This practice is helping me keep my sanity during an extreme stressful and trying time in my life, and I couldn't be more grateful. Thank you Adriene for making this available! You're truly saving us out here.",UgxHpJ7WzEKBQw8syQZ4AaABAg,0.0,0.0,2022-01-10T23:51:26Z,0.9997885823249817
493.0,"Love a good tree pose, helps test my balance. Which is improving too!",UgyQra-xudipdAmIld14AaABAg,0.0,0.0,2022-01-10T23:44:45Z,0.9996894598007202
494.0,"Loved today's practice. Warrior pose reminds me of how much strength I have, it's all within...And I had forgotten about tree pose, even when falling, just remembered about standing tall in my self. Confidence, you are there.",UgzZ6sXn8I6XPFhmG1J4AaABAg,0.0,0.0,2022-01-10T23:44:41Z,0.9996503591537476
495.0,Day 9 I really enjoyed today 🇨🇮❤️,Ugw4Y9ojRC-kBq-Z6nF4AaABAg,0.0,0.0,2022-01-10T23:38:51Z,0.9997568726539612
496.0,"7k lovely friends joined me this evening. I've had a rough day, and I really appreciated this practice. Thank you, Adriene ❤️",UgwJkRtHnRx6YnXs2aJ4AaABAg,0.0,0.0,2022-01-10T23:35:14Z,0.9998372793197632
497.0,"This is my first yoga routine since I sprained my ankle a few weeks back. I saw the name ‘curiosity’ and felt curious to explore the limits to my body after several weeks of not doing any exercise or working my muscles. The whole routine felt like a blessing to my body. My bones, joints, muscles, everything was reignited. I was really sad when I couldn’t get tree pose on my left foot as the ankle is still quite weak and painful but I breathed into it and found a spot where it felt right. Injury is really something that puts you down when you are already struggling mentally to show up to your routines and make the time for your body. I’m so glad I did this today.",UgztJ062ue2XoS72J994AaABAg,0.0,0.0,2022-01-10T23:35:11Z,0.909835934638977
498.0,"being curious about the falling..... yes!! found myself nodding when you said this: it feels so applicable to so many areas of life. i'm a musician, and during my other daily practice (on my instrument) you have to be present in the moment, listen to your mistakes and observe them fully to be able to go about correcting them: to not judge them and get aggravated over them, but first accept them so you can understand them!! the joy of yoga is that the falling is neither correct nor incorrect, yoga just lives in the process :) rambling aside, thank you for today!! loved the swift childlike movement after the stillness of yesterday xx",Ugw4ZdxEEafu9Q2G_Ed4AaABAg,0.0,0.0,2022-01-10T23:34:39Z,0.9978961944580078
499.0,Just starting day 9..I have a feeling this is gonna be an a$$ whoopin.,UgwJ6fnpSSYK45Yxjed4AaABAg,1.0,0.0,2022-01-10T23:30:19Z,-0.9958654642105103
500.0,"Move | Day 9 | January 10, 2022 | Such a great way to stretch, move and breathe space into my body after a full day on Zoom. And thank you for the reminder to stay curious, and ask better questions! 🙏🧘‍♀",Ugx2G-ESIpKqRJ4k5UF4AaABAg,0.0,0.0,2022-01-10T23:29:49Z,0.9994662404060364
501.0,"I lovvvveeeddddd this one, my favourite so far in this series. Thank you Adriene 🙏💗",UgweyDT1H6Hij4Tedb54AaABAg,0.0,0.0,2022-01-10T23:27:12Z,0.9968833327293396
502.0,How cute is Benji sitting pretty as Adriene sits up tall before seated forward fold?,UgxzQoYPTdDrIqYvufd4AaABAg,0.0,0.0,2022-01-10T23:22:28Z,0.9967154264450073
503.0,Every day is something to look forward to! :),UgwZyv_YnpGQJBYQtld4AaABAg,0.0,0.0,2022-01-10T23:20:18Z,0.9997618794441223
504.0,This was awesome and fun! I’m glad I didn’t wimp out! 😉 Ty my friend! You are a blessing! 🥰 🤗 🙏 🧘🏼‍♂️,Ugwblm3EmhYtAV2FDb14AaABAg,0.0,0.0,2022-01-10T23:20:15Z,0.999841570854187
505.0,"Today's practice really showed me how resilient my body is. I was surprised to find out I haven't lost all the flexibility I had gained when I was doing yoga regularly before I got pregnant at the beginning of 2020 and fell off the yoga horse because I was too exhausted most days to get to the mat. Now I'm sneaking yoga sessions in while my 15 month old naps. I was sure I'd be back to square one because I hardly had time or energy the last year and a half to do it but my body says ""hello, I'm still willing to let you do a seated forward fold and reach your toes"" even though I couldn't get that far before I started yoga a few years ago! So glad my previous progress wasn't lost and my body is still here for me after all it's been through. And I'm glad you're still here for me with 30 days of yoga, Adriene!",UgyOckpQPozLbR7OZjF4AaABAg,0.0,0.0,2022-01-10T23:20:12Z,0.9926971793174744
506.0,Nine days in; that was a fun one! Thank you!,UgzrhbaVCtNwX_LD1hd4AaABAg,0.0,0.0,2022-01-10T23:18:58Z,0.9998732805252075
507.0,"It's been a busy day, but this was awesome. Hooray day 9!!!",Ugy_MOgxqyDPd_uDXjJ4AaABAg,0.0,0.0,2022-01-10T23:18:52Z,0.9997351765632629
508.0,"Busy day, but I don't want to skip my daily yoga. Usually I don't do the practice so late. I am so pleased that I was able to do this before I go to sleep. I would not have missed it: Namaste 🙏❤️",Ugwc2BqGq7uPGPMzvv94AaABAg,0.0,0.0,2022-01-10T23:18:35Z,0.9983776807785034
509.0,"Day 9. Today challenged me in a way that didn’t make me angry. I don’t know if that means I am getting a little better or if today’s practice was more in my wheelhouse.  Either way, I am happy to leave the mat feeling lighter and not angry with myself for what I couldn’t do. It was all fun and games until that tree pose almost took me out lol.  It’s funny how just hearing that it is ok to fall made me feel better about falling.  I sometimes forget to give myself grace during these practices. I am ready for day 10. Thanks again. Hi Benji.",UgxmUPhYyS4pNRJWAz94AaABAg,0.0,0.0,2022-01-10T23:17:50Z,0.9986609220504761
