,comment,comment_id,reply_count,like_count,updated_at,calificacion
1100.0,"What a Beautiful way to meditate, honouring your being.  Thank you so much for doing this Adriene.",UgxoqggyO066lH4UMeJ4AaABAg,0.0,0.0,2022-01-09T19:24:43Z,0.9998598098754883
1101.0,"Me: oh okay fine, I'll unfold my blanket and lay it out on my mat. 
Childhood memory of playing on the floor on my favorite quilt unlocked!",UgysgeIuKOpjHZgfGt14AaABAg,0.0,0.0,2022-01-09T19:23:37Z,0.994320273399353
1102.0,"How good was this but how hard to put the mind to rest… thank you Adriene for keeping me company on this cold Sunday in London, when nothing ever seems to stop and take a rest.",UgwBgtt6dwcUHW9kZbp4AaABAg,0.0,0.0,2022-01-09T19:22:27Z,0.9957078695297241
1103.0,This was beautiful practice 😊❤️ exactly what I need ❤️,Ugy1JTaI0hUNVplJ4ep4AaABAg,0.0,0.0,2022-01-09T19:21:44Z,0.9995787739753723
1104.0,Can’t believe I’m still here! I have a hard time showing up for myself but I’m glad that I am.,UgzHF-eDmIsQnvJWk8J4AaABAg,0.0,0.0,2022-01-09T19:20:35Z,0.9994916915893555
1105.0,"So amazingly relaxing and tranquil. I felt overwhelmingly in joy and love. Thank you Adriene for leading this practice, and thank you to all who bring their energy to this video. ❤️💙❤️",Ugztf4oLRqh81pPsl_N4AaABAg,0.0,0.0,2022-01-09T19:20:33Z,0.999883770942688
1106.0,237 day❤️🧘🏼‍♀️,UgyKxYemIVlxPRfVog94AaABAg,0.0,0.0,2022-01-09T19:19:40Z,-0.6054686307907104
1107.0,Thank you Adriene for blessing us! ❤️,UgzEC8hoK11bauxJI3F4AaABAg,0.0,0.0,2022-01-09T19:17:07Z,0.9997442364692688
1108.0,So relaxing!Best practice ever!To give one mind a rest is such a release!Thank you Adriene,Ugyy_V0UrwP2aGXjGxF4AaABAg,0.0,0.0,2022-01-09T19:17:00Z,0.9998528957366943
1109.0,Gorgeous.  Just what I needed. Thank you 💜,Ugwf5tRLOFnKIyyzCiV4AaABAg,0.0,0.0,2022-01-09T19:15:33Z,0.9998830556869507
1110.0,Absolutely beautiful,UgwTCisH8ptTzM0kl_d4AaABAg,0.0,0.0,2022-01-09T19:14:28Z,0.9998800754547119
1111.0,This was blissful. I'm just getting over a case of covid and have been so stuffed up today but for the full 30 minutes of this practice I could breathe so clearly. It's freezing rain today and a major cold front is moving in in full force tonight to last much of this week. I definitely found some solace in this practice today.,UgycYWCIWlMRVDB_3x94AaABAg,0.0,0.0,2022-01-09T19:13:34Z,0.9993165731430054
1112.0,"I loved your practice, I started with you this 30 days journey and is a gift to don't know what is going to be this day like every time in the life. Thank you for show us that meditation is relaxation for mind. That we must be patience with ourselves and is just a step by step dayly. Also, it is so cute watch Benji. God bless you. Namaste 🙏🙏",UgxPRLMy8SsLj5dv3SF4AaABAg,0.0,0.0,2022-01-09T19:13:29Z,0.9997597336769104
1113.0,simply wonderful - thank u xoxo,UgzFle9fz0X0ivbxofh4AaABAg,0.0,0.0,2022-01-09T19:13:10Z,0.9998795986175537
1114.0,I loved todays practice.  I felt like I was finally taking care of myself and helping myself just ‘be’.  Thank you!,UgxKrUN1BBWYRBFYthN4AaABAg,0.0,0.0,2022-01-09T19:13:03Z,0.9998427629470825
1115.0,"Thank you for this time of peace, conection and slowing down it was just a gift . So wonderful !",UgwshmtPV3TaxIRQylN4AaABAg,0.0,0.0,2022-01-09T19:12:39Z,0.9998791217803955
1116.0,"Has been the most challenge practice so far, truth be told. Still, I'm here and through with it. Thank you very much, Adriene, I really look forward to meeting you each day 🤍",Ugz6o7lELBN5js0e-8p4AaABAg,0.0,0.0,2022-01-09T19:12:32Z,0.999843955039978
1117.0,Day 8 complete!,UgymIJfnRdKkjy6eqC14AaABAg,0.0,0.0,2022-01-09T19:11:27Z,0.999382734298706
1118.0,"Thank you, Adriene. Love your show.  This would make a fantastic night time, before bed, wind down practice. 
My little orange girl was slow to join savasana… she usually hears the word and comes trotting over, but perhaps because was eased slowly into it, she missed the cue. So as we were to turn onto our side, I opened my eyes (so I didn’t spill my tea) and she looked insulted that I was moving to the next thing without doing us time which she had finally sauntered over for. So I spent the end of the video on my back with Ms Sonja curled up on my chest and belly, purring.",UgxdUL_qvS-fdgwbRex4AaABAg,0.0,0.0,2022-01-09T19:09:15Z,0.91893070936203
1119.0,Just finished - feels amazing. Quite an emotional one for me because I really feel as if I'm looking after myself. Then i looked up and saw andriene and benji so peacefully curled up and imagined how many people around the world are doing the same thanks to this series. Thank you so much Adriene for bringing peace to my life everyday.,UgzdFgJ-8Wg-TBcB9jh4AaABAg,0.0,0.0,2022-01-09T19:05:22Z,0.9998687505722046
1120.0,"aS a MoNkey I wOuld LikE tO see HaNumAnaSanA poSe, buT tHis wAs beAutIFuL! oOh OoH Ah aH ￼🕉🐵",Ugy_BBai3yOhxxOBQMd4AaABAg,0.0,0.0,2022-01-09T19:04:44Z,0.9986030459403992
1121.0,Day 9(8) of January ❤️🙏🏼 day 314,UgycE5ZGxcMhEY9PGil4AaABAg,0.0,0.0,2022-01-09T19:04:25Z,0.5137344598770142
1122.0,"I surprised myself by getting emotional during the part when I hugged myself ... for the first time I felt the comfort I can be to myself, what strength and stability and love I have inside me that I can wrap myself in mentally and physically. I had the feeling come to me that I'm the type of friend I seek out ... wow. 💛",UgyLnOFwaBlCtku4oDV4AaABAg,0.0,0.0,2022-01-09T19:01:25Z,0.9996064305305481
1123.0,😭tears of peace & joy 🙏,Ugykwop_DZE56dPel1t4AaABAg,0.0,0.0,2022-01-09T19:01:21Z,0.9994223117828369
1124.0,Move Day 8: So thankful for today’s meditation.,UgxdqenpCKDoDwkw3hp4AaABAg,0.0,0.0,2022-01-09T19:01:20Z,0.999679684638977
1125.0,"When you almost fall asleep and you fall short to like the video because another has already started.. i enjoyed it so so much its like every day is the best practice ever.. you teach me how to love myself in measurable ways like massaging my neck or hugging myself in days when i have no one else to do that.. and i used to hate this ""loneliness"" but i am so not there ever since i have started yoga because i learn how to aprriciate my alone time and honor it and face its awesome values.. i am so thankful to Go-d who made me know you you are an amazing massager of him. Keep doing it for us, aprriciate you so much and thank you adriene ♥️♥️♥️♥️♥️",UgzDUTkst1tFs93jSc94AaABAg,0.0,1.0,2022-01-09T18:59:58Z,0.9995095729827881
1126.0,"Thank you so much! Lots of love, Adriene! ❤️🔮✨",UgxmPQtKn9jvo3nXppd4AaABAg,0.0,0.0,2022-01-09T18:59:48Z,0.9998775720596313
1127.0,I’m so glad Benjie got his own blanket,Ugwslai5I2sXlxMEVTx4AaABAg,0.0,0.0,2022-01-09T18:59:03Z,0.9957504272460938
1128.0,"Did this on Sunday evening (EET). Felt like having a friend stay over. (Also, I want a dog.)

Thank you.",UgwYuYMN--ZY3vLHeh54AaABAg,0.0,0.0,2022-01-09T18:58:31Z,0.9991945624351501
1129.0,"And her outfit for today's practice is unbelievable, even when you see her you can get what the practice is all about... Feeling cozy and relaxed 🧘🏻‍♀️ Sending lots of love to you Adriene ❤️❤️❤️",UgzK3OFBpqHo4zKQBwB4AaABAg,0.0,0.0,2022-01-09T18:55:55Z,0.999778687953949
1130.0,Thank you again Adriene!,UgzTH8210KmG00XXLV54AaABAg,0.0,0.0,2022-01-09T18:55:52Z,0.9998311996459961
1131.0,Thank you for the stillness.,UgyV0roepxdtAFkiWKd4AaABAg,0.0,0.0,2022-01-09T18:55:34Z,0.9998249411582947
1132.0,The final fetal position really took me away. I felt a childlike support and the tears finally fell from my eyes. Beautiful.,UgxKXtSoQKEyR-23G_R4AaABAg,0.0,0.0,2022-01-09T18:52:51Z,0.9969180822372437
1133.0,So relaxing!,UgwXrQP4byGG3BwuoZV4AaABAg,0.0,0.0,2022-01-09T18:52:38Z,0.999862790107727
1134.0,beautiful - thank you. And your guided meditation was accompanied by the snoring of my dogs - win-win!! xx,Ugy-6Xi_nGJbOkzDFPd4AaABAg,0.0,0.0,2022-01-09T18:46:18Z,0.999690055847168
1135.0,"ADRIENE! Thank you for this generous, open practice, and for encouraging/allowing each of us to be vulnerable by being vulnerable with us.",UgzWp8LzEByiEHA2Q_B4AaABAg,0.0,0.0,2022-01-09T18:43:49Z,0.999842643737793
1136.0,"i loved the practice <3 truly restoring. i was pretty hang over today. and because i drank yesterday so much and had allot to do ist missed day 7. but then i did 2 viedeos today so am back on track 4 day 9 tomorrow, so proud of my self...or i don't know :) have nice day every one! greetings von hamburg in Germany",Ugy2Opwb_odkS8ogaTR4AaABAg,0.0,0.0,2022-01-09T18:43:10Z,0.9993475079536438
1137.0,My baby fit perfectly in between my body down in the fetal position and I realize now I can rest while protecting my baby,UgxuMx7Ic-LrtrIdx1Z4AaABAg,0.0,0.0,2022-01-09T18:40:58Z,0.9746227264404297
1138.0,Beautiful pause! Thanks,UgxaUBPaGDPr9hLOgSZ4AaABAg,0.0,0.0,2022-01-09T18:40:26Z,0.9998680353164673
1139.0,This was so needed and appreciated! Thank you!,UgyHvu4M6888h_4uhAl4AaABAg,0.0,0.0,2022-01-09T18:38:46Z,0.9998433589935303
1140.0,"This was a hard practice for me.  I just wanted to get up and do something, but I made myself continue.  I think I will do it again this evening when Im ready to relax.",Ugw_EchHsjB-hd2_4lN4AaABAg,0.0,0.0,2022-01-09T18:38:23Z,0.9963996410369873
1141.0,"Love love love this session! It's amazing. Thank you so much Adrienne❤❤
""Think of the how"" part made me cry! on how easy it's of just take the decision and everything will flow smoothly.. profound AHA moment for me.",Ugz9CIEPQXzOlY9UwT14AaABAg,0.0,0.0,2022-01-09T18:37:46Z,0.9998517036437988
1142.0,Thank you 🌞,UgySqrygnerCqEyZbCN4AaABAg,0.0,0.0,2022-01-09T18:35:37Z,0.9998127818107605
1143.0,"i needed this, thanks adriene! <3",UgwCS7mCtXizHqKVKNJ4AaABAg,0.0,0.0,2022-01-09T18:34:52Z,0.9987603425979614
1144.0,"I'm so happy that I'm well-disciplined ,i showed  today to this beautiful practice  Namaste Yogis",UgwWwWkl3qBUXYALIIB4AaABAg,0.0,0.0,2022-01-09T18:34:04Z,0.9997560381889343
1145.0,Beautiful Sunday afternoon yoga.,UgwutkZFGWKCVMreMjB4AaABAg,0.0,0.0,2022-01-09T18:33:48Z,0.999846339225769
1146.0,"Amazing, inspiring, peaceful class. Thank you ❤️",UgxzGPyr3qhZqLxzpll4AaABAg,0.0,0.0,2022-01-09T18:30:34Z,0.9998857975006104
1147.0,Love u. Wonderful meditation time. I never take time to rest. I will keep this day 8 meditation session in my favorites to come back to it,UgwSjGP1uKL7uyIXGk54AaABAg,0.0,0.0,2022-01-09T18:28:44Z,0.9998308420181274
1148.0,"I've been with us since day 1 and I'm very grateful to have found this channel. I can already feel a change, physically and mentally. I would like to adjust my diet. Who gave me tips on what diet goes well with yoga?",UgyMB-BW4vyvYtFDbWl4AaABAg,0.0,1.0,2022-01-09T18:28:39Z,0.9965327978134155
1149.0,Ohhh this is so what I needed today.  Thank you Adriene.,UgwbZXkgzezjghBOYBZ4AaABAg,0.0,0.0,2022-01-09T18:28:33Z,0.9997125267982483
1150.0,Lovely practice today. I actually caught up and did day 7 and 8 today. Worked out great. Very calming and a nice deep stretch. See everyone tomorrow.,Ugw3nxTiWZTIVSzHSmh4AaABAg,0.0,1.0,2022-01-09T18:28:03Z,0.9998270869255066
1151.0,"🌟🙏🏽🙏🏽🙏🏽 I am happy, I love you too, and yes God willing see you tomorrow. Jai Namaste.",Ugx5H_od2JMMXuuRzNt4AaABAg,0.0,0.0,2022-01-09T18:27:56Z,0.9998258948326111
1152.0,Day 8 was amazing! This was a very good feeling. Thank you,Ugy01Jk6WHpCxYnXyM94AaABAg,0.0,0.0,2022-01-09T18:27:40Z,0.9998849630355835
1153.0,I'm so grateful for this practice today because I had a plasma donation gone wrong yesterday and ended up loosing blood so I didn't think i'd be able to participate in yoga today but this rest exercise is perfect. Thank you Adriene!,Ugw8uLWgD5K4ma3_Ujt4AaABAg,0.0,0.0,2022-01-09T18:27:18Z,0.9996300935745239
1154.0,"Last night, my husband and I had a very deep conversation about how I'm always seeking more and how I'm always on a search to fix something deep inside of me. He told me, ""I think you run on an engine of anxiety and you just need to rest, I just wish you would rest because you deserve it more than anyone in my eyes.""

And then came today's practice. I don't know how you do it, but it's always what I need. Toward the end, when you said to let go, tears fell from my eyes. I had an internal mantra of, ""It's okay to rest."" And that was profound for me today. I hope I can carry this with me through the day and through the week. Thank you for being you.",Ugxhb6FZ6uwY2AyCHAV4AaABAg,0.0,0.0,2022-01-09T18:26:44Z,0.9986961483955383
1155.0,"This was exactly what I needed this morning, thank you!!",Ugx3WF9HWtG1Xpn4C-R4AaABAg,0.0,0.0,2022-01-09T18:26:02Z,0.999848484992981
1156.0,great exactly what I need today!,Ugz0vYZ0f5WPExYY7tp4AaABAg,0.0,0.0,2022-01-09T18:25:34Z,0.9998779296875
1157.0,"I am still here! And this is the longest I've stayed with the program live(though there is no shame in taking a day off if needed). I've woken up excited to do my yoga for the day and today's practice was hard for me! I feel so strong and energized, albeit sore from all the strength building. I was ready to move, stretch, flex, I k kept telling myself ""I am patient"" and ""I am in control of my energy and now I am choosing to dial it down"" one breath at a time.",Ugx0DjolOYyGLDXtzP54AaABAg,0.0,0.0,2022-01-09T18:25:23Z,0.986909806728363
1158.0,Perfection for my Sunday. So good!,Ugx2mZ5hJs0OLh8_dId4AaABAg,0.0,0.0,2022-01-09T18:24:59Z,0.999873161315918
1159.0,"I am doing this challenge from the UK, today's session was after my Volleyball practice and I have say it was perfect timing, just what I needed. Due to time of day I did it with a waxing moon shining into my room, every time I looked up at her I thought... ""This is exactly where I am meant to be"". Thank you Adriene, you are an angel x",UgyXychU5RWKlHcmYNZ4AaABAg,0.0,1.0,2022-01-09T18:24:11Z,0.999678373336792
1160.0,"Benji always has his very own yoga blanket. He motivates me to take it easy. Sweetness. I thought he was an Australian Shepherd. Check it out, extremely similar. Thank You! Day 8!! Meditate! I love you all so much. 
❤🧡💛💚💙🤎💜🖤🤍✌",UgzFZDVzb_ppfvP3O-R4AaABAg,0.0,1.0,2022-01-09T18:24:00Z,0.9997698664665222
1161.0,Day 8 brought me to tears- first time I have felt relaxed in months- thank you thank you!,Ugy0sb2Byb4uwzyG6Gd4AaABAg,0.0,0.0,2022-01-09T18:22:30Z,0.9998268485069275
1162.0,"Todays practice was amazing! 
I loved the soft music in the last part. 
Thanks for today, thanks for Move. 
Hugs from Sweden 🇸🇪",UgyEId98z18C5Rz3WEx4AaABAg,0.0,0.0,2022-01-09T18:22:10Z,0.9998538494110107
1163.0,What a wonderful treat and on a Sunday no less!!! 🧘🏼‍♀️,UgzQuWsEy5ZWH7SZJ8Z4AaABAg,0.0,0.0,2022-01-09T18:19:42Z,0.9998787641525269
1164.0,"Pretty bummed to see this ""practice"" in a series entitled Move - I understand rest is important, but I come to YWA videos for yoga, the sitting and breathing doesn't really interest me, as I already have a meditation practice as a part of my daily routine. Oh well, maybe tomorrow will be better.",UgxxH__Hh7KA97ARzyt4AaABAg,2.0,0.0,2022-01-09T18:19:02Z,-0.9986119270324707
1165.0,"I needed this today. The world has felt so harsh lately, this bit of shared kindness meant everything. I love you 💕",UgwNIKgSOhZ5egVKqZZ4AaABAg,0.0,0.0,2022-01-09T18:18:06Z,0.9991990923881531
1166.0,"I never really comment on these videos, but man, this session was great.
I am a teenager with an anxiety disorder and yoga has helped me so much.
Tomorrow is the first Day of school after 2 weeks of winter break and it always makes me anxious to go back but I know I can do it and this practise made me realise that ever more. Loving day 8, namaste 🙏🏻",UgyOuXAlPdvxsPhuPl94AaABAg,0.0,1.0,2022-01-09T18:17:42Z,0.9990697503089905
1167.0,"Oh, i love, love, loved this.. Thank you so much. ❤️ 🙏 🧘🏼‍♀️",UgzBstqdBkddRzDze7J4AaABAg,0.0,0.0,2022-01-09T18:14:42Z,0.9998679161071777
1168.0,You are so loved Adriene. I am so grateful for your existence.,UgzfIN6NEYM9E6r-YoJ4AaABAg,0.0,0.0,2022-01-09T18:14:23Z,0.9998568296432495
1169.0,"This was exactly what I needed today... was secretly hoping for it yesterday... I have had a cold (got a test- NOT covid) - and also had my woman times... so I was feeling particularly run down the last few days... but this has me on my way to feeling better today. Adriene's voice is so soothing to me- just to hear someone say you're doing great, you showed up, take the time, take care of yourself.... I really also need to get my own therapist... though in the meantime... this is very helpful. I have done several of the other 30 day yoga journeys and I have the FWFG app that I paid for a year for my 40th birthday... thinking I might go back through all the other 30 day journeys during the rest of the year...",UgxXUo2tNGUScjfpE3V4AaABAg,0.0,0.0,2022-01-09T18:12:19Z,0.9930134415626526
1170.0,"Thank you, Adriene for this magical rest. And thanks to all of you sharing your Move experiences here. I do these later in the day, so it's really wonderful to read your comments and gain a sense of community through them.  This is my 2nd time attempting 30 Days ( life got in the way of completing Breath last year). Making it to day 8 feels just like the huge hugs we gave ourselves in this practice. I'm excited for what comes next!",UgzVA0TINI7_aj0nN1R4AaABAg,0.0,1.0,2022-01-09T18:06:57Z,0.9998420476913452
1171.0,Thank you so much!,UgxXAbPDbZhebCLhb_14AaABAg,0.0,0.0,2022-01-09T18:06:05Z,0.9998546838760376
1172.0,Loved today’s practice. Muchas gracias Adriene!  Who else had to stop the video to blow your nose?,Ugzdn4ERAejKy_z1K1l4AaABAg,0.0,0.0,2022-01-09T18:03:24Z,0.9586288332939148
1173.0,Thank you From the bottom of my heart for this one Adriene 💖💕❤ it was - is - exactly what I need. A true gift 💖💖💖 something to cherish ❤,Ugx4QakW34YOJs00JZh4AaABAg,0.0,0.0,2022-01-09T18:01:41Z,0.9996867179870605
1174.0,"Your yoga expertise is obvious, but your sense of humor is what makes you diferent in my experience. It creates a space for me to be me in this practice, to relax, and to enjoy. Really grateful for that.",UgzUkTApgE9jv7rIJRp4AaABAg,0.0,0.0,2022-01-09T17:59:53Z,0.9996308088302612
1175.0,Thanks. Always  a treat to have a cosy session. Namaste. Sue x,UgwqbmyumLRg3ZR0V_54AaABAg,0.0,0.0,2022-01-09T17:57:48Z,0.9994082450866699
1176.0,"When someone you don't personally says, ""I love you"" and you know it's true, that is profound. I struggled today with this practice because at times I had to confront how alone I often feel and with no clear direction as to what direction I next want to take in the area of my career, as well as other areas of my life. Wrapping myself in my blanket, I felt safe and comforted. I will come back for a second time to this practice later today. But I am so grateful that I am saying yes to this practice. And the next step for me to take today in this practice is to pray, to acknowledge that in fact I am safe, that I am secure, and the Universe and Spirit has my back and always has. So yeah, this practice of simply resting has been incredibly confronting. But I know that I can handle it. Thank you Adrienne for today's practice.",Ugy0RKDoHAJV_n6XguJ4AaABAg,32.0,1096.0,2022-01-09T17:56:02Z,0.9992411136627197
1177.0,"Love this one that much I did it twice. Keeping this one as my favorite.
I follow your lessons for years but never posted something.
Keep doing this because I really need this in my life right now since I have a burn out.",UgyxAZk8Z3ltH6HaoOJ4AaABAg,0.0,0.0,2022-01-09T17:55:27Z,0.999451220035553
1178.0,thanks for giving benji a lil restorative blankie too,Ugxepwonto4wCRZ3FPJ4AaABAg,0.0,0.0,2022-01-09T17:53:36Z,0.9927680492401123
1179.0,I always end up on these nostril breathing days when I have a stuffy nose! 🤣🤣🤣,UgzCUkzXQO_5RZCsgcV4AaABAg,0.0,0.0,2022-01-09T17:53:26Z,-0.9831622838973999
1180.0,Oh wow the “I love you” at the end made me unexpectedly emotional! ❤️,UgxmvMXppzHU-5p92Ix4AaABAg,0.0,1.0,2022-01-09T17:53:25Z,0.9996404647827148
1181.0,That was a very special experience - thank you so much!,Ugxs1kMqc5hZ66mHCld4AaABAg,0.0,0.0,2022-01-09T17:52:09Z,0.9998691082000732
1182.0,"This was amazing! Definitely going to have to start to taking time for myself to meditate!! Thank you, Adriene!! 💜",Ugy9mvFJP_ZfYBxqX1R4AaABAg,0.0,0.0,2022-01-09T17:49:21Z,0.9997988343238831
1183.0,This was so nourishing and well deserved! Namaste 🙏🏼,UgxLwZmoNmhbcBpFBkd4AaABAg,0.0,0.0,2022-01-09T17:48:12Z,0.9997573494911194
1184.0,Thank you for the ease of rest.,Ugyrc_NXzVcw9SjNnE14AaABAg,0.0,0.0,2022-01-09T17:47:55Z,0.9997736811637878
1185.0,Love this reminder to be....thanks Adriene,UgzMQiQzUJFyhcDwoSB4AaABAg,0.0,0.0,2022-01-09T17:47:50Z,0.9998636245727539
1186.0,Thank you Adriene.  I've been nervous and jittery after few unsatisfying rot days. This mediation helped a lot.,UgzCZpD55D9mVyB7SaB4AaABAg,0.0,0.0,2022-01-09T17:47:23Z,0.9959139227867126
1187.0,"The timing of this practice was perfect, I got two teeth extracted yesterday and I really needed this rest for today 🤍",UgzWm9T0Z-1WbVhOoG94AaABAg,0.0,0.0,2022-01-09T17:45:49Z,-0.9814671874046326
1188.0,"This was so nourishing 🤍🌿 love the blend of gentle movement, breath work and meditation… just lovely",Ugz7FYrd-OITI37OS5l4AaABAg,0.0,0.0,2022-01-09T17:45:27Z,0.9998782873153687
1189.0,Thank you for your kindness Adriene 🙏 2 years ago I started an everyday yoga  journey with you and your 30 day challenge and... here I am - still here ❤,UgyV5yTKbB4B_SewSIp4AaABAg,0.0,0.0,2022-01-09T17:43:59Z,0.9994781613349915
1190.0,"Thank you. I'm currently recovering from an ed, am used to large amounts of daily training and movement and hugely depend on it and decided to spend the whole day indoors, binge-watching The Office (didn't even take a walk). It's one of my huge fears, and I was anxious preparing to do the daily practice because it would remind me of how unactive I'd been today. Somehow, you're always one step ahead of me and serve me with just what I need - a reminder that rest is just as necessary as movement.",Ugz8Z1pv9js-DDUeoKZ4AaABAg,0.0,0.0,2022-01-09T17:43:28Z,0.9935653805732727
1191.0,Wonderful relaxing practice today 🙏🙏🙏,UgxQ23ra5OowzE9FVbh4AaABAg,0.0,0.0,2022-01-09T17:43:16Z,0.9998670816421509
1192.0,"Tears streaming down my face at the end of this practice. Release. Let it all go. It feels so nourishing to carve out this time for myself. Thank you, Adriene. Om Shanti 🕉🙏🏼💕",Ugz4UQt0zvDIxQ7KJq14AaABAg,0.0,0.0,2022-01-09T17:43:07Z,0.9992701411247253
1193.0,That was amazing! x,UgyArbDEoWIxUhiikg14AaABAg,0.0,0.0,2022-01-09T17:42:16Z,0.9998766183853149
1194.0,I needed this ❤️,UgytGVQqeWVYilwq4ap4AaABAg,0.0,0.0,2022-01-09T17:42:04Z,-0.9716572761535645
1195.0,"i was a little sad that i had to miss yoga today because i got my covid booster shot yesterday. but as if you'd known, today's practice is one i can still do. thank you!",UgzC2GrC1AD-dt1vnQR4AaABAg,0.0,0.0,2022-01-09T17:40:49Z,0.9996728897094727
1196.0,Just shared this with all of my friends and asked them to give this as a gift to themselves.  Thank you Adriene.  I am really enjoying this 30 day journey with you and Benji!,Ugw4bzI7F_nXvfuQimV4AaABAg,0.0,0.0,2022-01-09T18:56:06Z,0.9998708963394165
1197.0,I put my mind at rest today. Day 8 done.,UgynekJPxmh4XAyzw694AaABAg,0.0,0.0,2022-01-09T17:39:30Z,-0.981333315372467
1198.0,Ahhhhhhhh. Thank you for this.,UgwkQ8Dd0T0_WZhmHM54AaABAg,0.0,0.0,2022-01-09T17:39:23Z,0.9997379183769226
1199.0,Thank you. ❤️,UgwuamUD5QZv0aUqfod4AaABAg,0.0,0.0,2022-01-09T17:39:10Z,0.9998420476913452
1200.0,I started my bleed last night so this was just the yumminess my body needed 💚 thank you 🙏,UgxquthIJFOVxVOqTEp4AaABAg,0.0,0.0,2022-01-09T17:38:18Z,-0.8552135825157166
1201.0,"Wow, that was next level, bravo Adriene!!!!",UgyJp54r2PhjxQLNNeB4AaABAg,0.0,0.0,2022-01-09T17:38:08Z,0.998460054397583
1202.0,"Loved it!, the extended pranayama and savasana... thank you for another wonderful practice!!!",UgxITu6cC-w_XskbMBl4AaABAg,0.0,0.0,2022-01-09T17:36:26Z,0.9998832941055298
1203.0,thank you… ❤️,Ugx83T8z42uk9fApLCZ4AaABAg,0.0,0.0,2022-01-09T17:36:24Z,0.9998412132263184
1204.0,This. Was. Beautiful 🧘🏻‍♀️🧘🏻‍♀️,Ugwbna5mxZSLDVDVf1h4AaABAg,0.0,0.0,2022-01-09T17:35:55Z,0.9998045563697815
1205.0,"I didn't have a blue heeler, but I did have a black lab aussie mix that snuggled with me during this practice! Truly restful and restorative. Thank you!",Ugxbbxxwi1oxKfoOeLp4AaABAg,0.0,0.0,2022-01-09T17:34:32Z,0.9997413754463196
1206.0,"Stillness, satiates, the spirit of my ❤️ heart! Being ognizant and grateful for my breath, grounds my being        .May all of Humanity be Graced by The Hush! And may all beings receive whatever they need. Be it food, shelter, water,medical help, or love. May my practice today  be an act of Self-Love and World Affection. Smooches😘",UgybTSybtTgpKMt7s-B4AaABAg,0.0,0.0,2022-01-09T17:33:17Z,0.9972901344299316
1207.0,That was so beautiful 😍 I really felt like I wrung the last moments of rest out of my extended holiday before going back to the chaos of work tomorrow. Then the last few seconds something magic happened. One of my cats is extremely standoffish but she snuck in and touched her sweet nose to mine then started to lick me 🥰 she has never ever done this before,UgyY9VWZrE3b4JUG1Sd4AaABAg,0.0,0.0,2022-01-09T17:31:42Z,0.9928328990936279
1208.0,Day 8 complete :) see you tomorrow.❤️,UgyRbT3jIx6ZwUvUx894AaABAg,0.0,0.0,2022-01-09T17:30:15Z,0.9988698363304138
