,comment,comment_id,reply_count,like_count,updated_at,calificacion
778.0,"I don't do restorative practices enough so thank you for incorporating in this 30 day program.  My body and mind calm so quickly during these sessions.  Sure it may wander here and there, but it always returns to comfort and ease.",UgxAz7OU-HKcrr8BTwh4AaABAg,0.0,0.0,2022-01-10T03:03:03Z,0.9983144998550415
779.0,This was the perfect practice for today. So glad for day 8.,UgwuPnYwH_l3PdnA5294AaABAg,0.0,0.0,2022-01-10T02:57:46Z,0.9995771050453186
780.0,I loved it! Thank you Adriene ❣️❣️❣️,UgwXNemYxhgAv9kmeqF4AaABAg,0.0,0.0,2022-01-10T02:57:23Z,0.9998775720596313
781.0,It's Monday morning here in Pakistan. And today's practice is a reminder for me to take it slow and easy and mindfully through the week. Namaste everyone.,Ugxs8x5xhsj0FatpiXF4AaABAg,0.0,0.0,2022-01-10T02:54:24Z,0.9978556036949158
782.0,best sleep aid ever. I might just do this before bedtime!,UgwB82805cgBNBFBJVh4AaABAg,0.0,0.0,2022-01-10T02:53:44Z,0.9485390186309814
783.0,"From the deepest of my heart... Thank you Adrienne, Benji and the whole YWA team! Adrienne! you are a most beautiful human!... This moment was so sweet and full of love! 💗 LOVE YOU TOO! 🙏 Namaste",UgxLWhp1bo5PWg9Ces54AaABAg,0.0,0.0,2022-01-10T02:57:43Z,0.9998767375946045
784.0,"This was so needed and a great remedy for my ""Sunday Scaries"". I have loved the ides of how we move matters since I heard Adriene explain it just like how we speak is more than the words we say. Lovely practice, thank you YWA team!! 🙏",UgznTFlda6NWnJYLgdx4AaABAg,0.0,1.0,2022-01-10T02:50:11Z,0.9997782111167908
785.0,LOVE THIS,Ugwn61AUKyeqfR2RB-14AaABAg,0.0,0.0,2022-01-10T02:49:48Z,0.9998822212219238
786.0,Exactly the practice I needed today. Thank you. ♡,UgwwRzsiNrTAKlyKKn54AaABAg,0.0,0.0,2022-01-10T02:47:22Z,0.9998156428337097
787.0,Wonderful practice for a rainy Sunday evening. I am a strong believer in carving out time to rest and to reflect. Look forward to Monday evening with you.,UgwMV-2Su8tAnWZwKGB4AaABAg,0.0,0.0,2022-01-10T02:44:11Z,0.999854326248169
788.0,"Perfect way to end my weekend.  
My kitten curled up with me on the blanket at the end there 
😻",UgxrZ2XSaVxEn98nj6l4AaABAg,0.0,0.0,2022-01-10T02:42:03Z,0.9995799660682678
789.0,"Love you Adriene, see you tomorrow.",UgwVSV2HEjZVPky5lfh4AaABAg,0.0,0.0,2022-01-10T02:39:34Z,0.9998300075531006
790.0,Yummy and restful! Just what I needed. Thank you Adriene!,Ugwf3IjhLSNp7z48Izl4AaABAg,0.0,0.0,2022-01-10T02:37:55Z,0.9998358488082886
791.0,"This practice truly was the gift of relaxation. Thank you for this moment of peace, Adriene!",UgxKNrtx15uFXSyaAyB4AaABAg,0.0,0.0,2022-01-10T02:35:59Z,0.9998655319213867
792.0,"have you always had music during the practice (not the opening and closing songs, or the day 30 music, btw)? I'm just noticing LOL. also, i noticed Benji shuffling a bunch till he got comfortable 😍",UgwEDFZ1b92cHLpzGcV4AaABAg,0.0,0.0,2022-01-10T02:34:55Z,-0.9286912679672241
793.0,So magical. Thank you! <3,UgzUNCrZCN4yijtvrVd4AaABAg,0.0,0.0,2022-01-10T02:34:45Z,0.9998764991760254
794.0,Integrating music to your video was magic! Thank you Adriene for this sweet practice and the awesome week that we just go trough! :),Ugx0B7bqmNbmigCGdaV4AaABAg,0.0,0.0,2022-01-10T02:34:31Z,0.9996774196624756
795.0,"I've always found pranayama breath really difficult. One of my nasal passages is always blocked at any given time, and I end up having to breathe quite forcefully through that side to get any breath in or out. Do you have any tips to unblock a nasal passage for this type of breath?",UgyXWhoBAnP9mc3wzpJ4AaABAg,0.0,0.0,2022-01-10T02:31:17Z,-0.9984569549560547
796.0,Adrienne is a very sweet person. She is so loving♥️ So thankful my daughter informed me about her and to be apart of Adrienne's 30 day Yoga!!,UgzTtn-CgNWd0jZxehB4AaABAg,0.0,2.0,2022-01-10T02:28:06Z,0.9997970461845398
797.0,Loved it so much!!,UgxPIlYJxG_KbLWB_654AaABAg,0.0,0.0,2022-01-10T02:27:22Z,0.9998832941055298
798.0,"Thank you. Life is a struggle right now with trying to be a great mom to two littles at the same time I am teaching from home on the computer to students who want to be taught in a school setting. I needed to take the time to notice, observe and give space to my emotions. I spent the last 5 minutes of the video crying. Thank you for reminding us to love ourselves and to give our own bodies the love and attention we give others.",UgzsuINNdf_sEKE9oQJ4AaABAg,0.0,0.0,2022-01-10T02:27:17Z,0.5444255471229553
799.0,"made it but late, day 8",Ugw3GtAmw_PSpy8N-714AaABAg,0.0,0.0,2022-01-10T02:22:53Z,0.534830629825592
800.0,Perfect way to end my day 🧘🏼‍♀️,Ugy9ZRk_Xb2F9YBL87t4AaABAg,0.0,0.0,2022-01-10T02:15:07Z,0.9997226595878601
801.0,"Loved it. With earplugs, you can easily hear the sound of Adriene's heart. So nice. Thank you for this journey.",UgxbvOSVW3cFrCk2j854AaABAg,1.0,3.0,2022-01-10T02:14:56Z,0.9998745918273926
802.0,"To quote the Fab Four ""Getting Better all the time.""  I was definitely a goer until my health finally forced me to slow down a good bit.  I regularly take a Sabbath for myself to rest and recuperate.  Projects and jobs and chores and laundry will always be there, but your mental or physical health won't be if you never stop.  Namaste you wonderful people.",Ugy9kcLd-_GyRrEagBF4AaABAg,0.0,0.0,2022-01-10T02:14:24Z,0.9987236857414246
803.0,My cat ran up to the screen and started sniffing benji 😹,Ugz2OncM76X51mbAS7d4AaABAg,0.0,0.0,2022-01-10T02:14:15Z,-0.9476667046546936
804.0,Does anybody else have a hard time sitting in the legs crossed position? My back starts to ache and my ankles get very uncomfortable with the pressure. Can anyone recommend an alternative seated position?,Ugxka-E1tzx-31JXL9B4AaABAg,0.0,0.0,2022-01-10T02:13:12Z,-0.9983308911323547
805.0,I did feel like a very relaxed pretzel. I’m very proud I’ve come this far!,UgyaKq98wyyalsAKRsZ4AaABAg,0.0,0.0,2022-01-10T02:10:23Z,0.9998781681060791
806.0,"Hello everyone,  what a beautiful way to start a Sunday morning. Sunday always =rest n relax day for me and after a full wk of core work and a little sore abs... Alternate nostril breathing and just being still & present was soooo beautiful. Thank you for your offering Adriene 🙏🧘‍♀️ Namaste",UgyX3rldy-HSHECT1yZ4AaABAg,0.0,0.0,2022-01-10T02:08:54Z,0.9995566010475159
807.0,I was looking forward to doing this practice all day - it was worth it!,Ugzb0RQZFXsmmQZnwSt4AaABAg,0.0,0.0,2022-01-10T02:06:19Z,0.9998650550842285
808.0,this was one of my favourite practices! and so perfect that day 8 fell on a Sunday! We can end our week with peace and tranquility. I will definitely come back to this video on a Sunday in the future,Ugya3fVo1efh8k5mp-54AaABAg,0.0,2.0,2022-01-10T02:06:13Z,0.9997156262397766
809.0,Day 9/8 complete my sister and I loved this one. My sister was so relaxed she dozed a few times. 01/09/2022,Ugx2AWKhzX3xpS6PJvh4AaABAg,0.0,0.0,2022-01-10T02:04:34Z,0.9979189038276672
810.0,Wow that was so powerful! Thank you!,UgydLBE0TXu0O857ilR4AaABAg,0.0,0.0,2022-01-10T02:03:10Z,0.9998792409896851
811.0,"Happy day eight, everyone. <3",UgzgbPg751Dz5Kbc6cl4AaABAg,0.0,0.0,2022-01-10T01:59:22Z,0.9998375177383423
812.0,Bold of you to assume I can breathe out of my nose...,Ugyedm0VOhrxvYqBVbJ4AaABAg,0.0,0.0,2022-01-10T01:58:52Z,0.9987001419067383
813.0,Hello to the 6000 yoga snugglers who practiced along. This was delicious.,Ugy8CstQruFhyWbO59p4AaABAg,0.0,0.0,2022-01-10T01:58:37Z,0.9998434782028198
814.0,The pranayama practice is very challenging for me as I have a nose deformity that makes that I almost only breath through one nostril (maybe 10-20% from the other) does someone has a suggestion of an alternative practice for me?,Ugyu2zJwgXdLS3HECLZ4AaABAg,0.0,0.0,2022-01-10T01:57:07Z,-0.9874563813209534
815.0,🥰😍,UgylE0c2iugUImWfjz94AaABAg,0.0,0.0,2022-01-10T01:55:39Z,-0.6970567107200623
816.0,loved this today!,UgxZwiPQLSSPyqOjvfd4AaABAg,0.0,0.0,2022-01-10T01:54:43Z,0.9998764991760254
817.0,Day 8 complete. Thank you.,UgyIW4r67w1DGLlLeQp4AaABAg,0.0,0.0,2022-01-10T01:50:11Z,0.9998668432235718
818.0,I kept falling asleep during shavasana at the end lol,Ugx3cB2Tpedeh6XcPb14AaABAg,0.0,0.0,2022-01-10T01:46:53Z,-0.9914685487747192
819.0,"A lovely practice to just breathe, mediate, and engage in the SILENT LISTEN.  Thank you. Namaste 💛",Ugx4FCZ7MwKBnpi8GxF4AaABAg,0.0,0.0,2022-01-10T01:44:25Z,0.9998509883880615
820.0,"Day 8, gosh I’m really this 😆",UgxW3HLOV8ONJHmcUJV4AaABAg,0.0,0.0,2022-01-10T01:44:08Z,0.9930264949798584
821.0,AMAZING!! INCREDIBLE! FANTASTIC!,UgwH6FdAZRVGcc4z4ap4AaABAg,0.0,0.0,2022-01-10T01:43:49Z,0.9998846054077148
822.0,Nighty night.,UgxBFNCCqBF7f6wIRPp4AaABAg,0.0,0.0,2022-01-10T01:42:40Z,0.987677276134491
823.0,Absolutely loved this! I’m going to do it in bed sometimes to usher in a restful night sleep. Maybe even the hubby will join me!,Ugx7-dFsEjE41PRmI8h4AaABAg,0.0,0.0,2022-01-10T01:38:43Z,0.9985566735267639
824.0,"I have been strength training and practicing Y.W.A. all week. Today I told myself to relax and take it easy. I am slowly admiring myself more and more through this Journey. It's always been go go go to see results and to feel like I've done something good for myself/body. This practice opened my eyes more than anything. It's ok to turn it down a notch, ease into my skin and admire every part of my beautiful body. I felt content and in love with myself and went along with my breath. Wonderful practice truly exquisite. Thank you Adriene. ❤",UgzBBTrd4PV1sSn8Olp4AaABAg,0.0,0.0,2022-01-10T01:38:01Z,0.9998558759689331
825.0,i love your videos! love LJ,UgxvUX7ajM5rQkY4KXB4AaABAg,0.0,0.0,2022-01-10T01:37:33Z,0.9998588562011719
826.0,"We feel your love, thank you for always being here <3",UgzQF1Y1ekmrhexvctF4AaABAg,0.0,0.0,2022-01-10T01:36:29Z,0.9998453855514526
827.0,"""Practice just being"" really stuck out to me to day. With all the discourse around productivity (especially around the new year) it’s easy to just feel stagnant. After today’s video was over I just layer there and did !Nothing! :)  felt so good.",UgzE23hurVfNYD0Dc3p4AaABAg,0.0,41.0,2022-01-10T01:32:18Z,-0.9984738230705261
828.0,Really loved the breathing technique. Thank you ❤️🙏🏼,UgyhKBN8NMY585WJigh4AaABAg,0.0,0.0,2022-01-10T01:29:18Z,0.9998667240142822
829.0,Exquisite practice. Thank you for this gift of time and space.,UgyK0FZvfIADXKi0EzZ4AaABAg,0.0,0.0,2022-01-10T01:28:20Z,0.9998772144317627
830.0,Day 8 of trying to figure out if It’s mine or her heartbeat I keep hearing! Great stuff first challenge and going to complete past ones after this for sure!,UgzGsebQUwrFpepJSNN4AaABAg,0.0,0.0,2022-01-10T01:25:52Z,0.9812411665916443
831.0,Benji is such a professional! None of my dogs would've ever let me lay on the floor like that without pouncing me!,UgxOrGVoGzhPGaQjPfp4AaABAg,0.0,0.0,2022-01-10T01:24:02Z,0.997204065322876
832.0,I finally understood how my breathing guides me. Thank you very much!,Ugxk9egHNMaRzdp5ETJ4AaABAg,0.0,0.0,2022-01-10T01:20:50Z,0.9998527765274048
833.0,"Believe it or not, this was the hardest practice for me so far. My mind wanders so easily and I can't sit perfectly still for more than a few minutes. I've always struggled to meditate for anymore than 5 minutes. I knew my body needed this restorative session but I dreaded seeing that the video was essentially going to be 30 minutes of being still. I fidgeted throughout the entire second half of the video and my mind wandered like crazy but I managed to stay on the mat the whole time even when I was getting bored and antsy!",UgyiQw6TZ0m37WPDkMZ4AaABAg,3.0,124.0,2022-01-10T01:19:35Z,-0.9895834922790527
834.0,"Something tells me that we’re gonna get that fire burning tomorrow after such a calming, soothing, and easy-going practice today lol 🥳",UgxzSJHzPaYqbTuMP0F4AaABAg,0.0,8.0,2022-01-10T01:18:11Z,0.9311535954475403
835.0,It’s so nice to hear the soothing and calming music companying today’s practice! Please keep it playing in all future classes!! Namaste.,UgxCfbmf_zRT7jAcrX54AaABAg,0.0,9.0,2022-01-10T01:17:25Z,0.999836802482605
836.0,"This is the best Day 8 ever, by far <3",Ugw7GLlolf7Rxfv9_-l4AaABAg,0.0,0.0,2022-01-10T01:16:20Z,0.999778687953949
837.0,Perfect ending to a whirlwind of a day. My body both needed and deserved this rest.,UgxR7Jfrqq3cCjEpq-J4AaABAg,0.0,3.0,2022-01-10T01:13:30Z,0.9978138208389282
838.0,I choose to do today's practice in the evening by candle light with my pillow and weighted blanket across my legs. It was the most relaxing practice I have ever had. So glad be on this adventure with all of you. Day 8 was just what I needed. Thank you.,UgzsqZpcMXHcWFmdiPt4AaABAg,2.0,53.0,2022-01-10T01:13:14Z,0.9998003840446472
839.0,This session was exactly what I needed... what a beautiful experience it is to slow our bodies down... to demonstrate restful wakefulness... sometimes when I listen to Adriene I get a little teary-eyed... I’ve missed this valuable time with myself and an incredible friend... thank you to everyone on this journey 🙏🏼,UgyXjbhU1nd5F1FwwCB4AaABAg,0.0,2.0,2022-01-10T01:09:49Z,0.9670666456222534
840.0,This was lovely. Thank heaven for Day 8 cause I am still feeling Day 6 lol,UgzFsFARJEA7YYP4_Zh4AaABAg,0.0,2.0,2022-01-10T01:06:16Z,0.9996803998947144
841.0,This practice was so beautiful. I almost started crying at the end. I’ve never felt this at peace with myself and the world and my heart felt so light and full. I entered a surreal state of mind. Thank you so much Adriene.,Ugyz2zYP59IVCVPpG_J4AaABAg,1.0,179.0,2022-01-10T01:04:41Z,0.9996898174285889
842.0,Thank you Adriene 🧘🏼‍♀️,Ugy_4ox4xedsWrzjJlZ4AaABAg,0.0,0.0,2022-01-10T01:03:45Z,0.9997859597206116
843.0,I was in dying need of this!!,Ugy-8-4rOuaDaC6B34F4AaABAg,0.0,0.0,2022-01-10T01:03:36Z,-0.9961991906166077
844.0,I wasn't supposed to see this ... but Benji getting cozy on the blanket just warmed my heart.,UgzmOVXIYel_aLTMZPF4AaABAg,0.0,1.0,2022-01-10T01:03:03Z,0.9993543028831482
845.0,What a beautiful first 8 days of Yoga. I dont regret saying yes to myself on this. Thank you for your love Adriene. I really appreciate your beingness and purpose. Keep on sharing your light. I look forward to seeing you in flesh soon. I dont know when and how but I trust 100% that it will manifest. Trust and surrender 🙏☝️,UgyvY7A0bweWgb-q57h4AaABAg,0.0,0.0,2022-01-10T01:01:28Z,0.9998062252998352
846.0,"Day 8 is always so yummy and relaxing!!
This practice was so beautiful, soothing, calming, and freeing!! I loved it <3
See you tomorrow on the mat for day 9 :)",UgxdSwhKUa4OoFqNys94AaABAg,0.0,0.0,2022-01-10T01:00:12Z,0.9998658895492554
847.0,"So lovely, thank you ❤",Ugym_Ybe8cfYvBspC6B4AaABAg,0.0,0.0,2022-01-10T00:59:40Z,0.9998623132705688
848.0,Even Benji had a blanket 😊❤️,Ugx8c0b_k7IWw4MB74Z4AaABAg,0.0,0.0,2022-01-10T00:55:18Z,-0.9453461170196533
849.0,Just what I needed! That was priceless 😘,UgwssO72ZdnrEWFgvFR4AaABAg,0.0,0.0,2022-01-10T00:54:04Z,0.9991317391395569
850.0,Day 8 ✅.  Greetings from Bxv NY.  Very nice restorative class. Felt good.,UgyquuEPUeO5wxezooN4AaABAg,0.0,0.0,2022-01-10T00:53:37Z,0.9998074173927307
851.0,Thank you so much!,Ugw1idqa0AdvrJz9hLZ4AaABAg,0.0,0.0,2022-01-10T00:53:26Z,0.9998546838760376
852.0,"Thank you very much Adriene for this beautiful practise. That's exactly what I needed today. See you tomorrow!
Kisses and hugs💝💕",UgxTg0tqZJ54_y8Xo054AaABAg,0.0,1.0,2022-01-10T00:52:30Z,0.9998488426208496
853.0,"this was perhaps my favorite session yet. Muchas gracias, Adriene, from C in New Mexico. Much needed stretching, alternate-nostril breathing & rest today.",Ugx5ZMtcCq3tHM8ctkV4AaABAg,0.0,0.0,2022-01-10T00:52:30Z,0.9916459918022156
854.0,Thank you!🙏,UgwzSfP97f7Gv0jpAiZ4AaABAg,0.0,0.0,2022-01-10T00:52:28Z,0.9998544454574585
855.0,Loved it! Thanks so much 🙏💙,Ugx_cARD2hddyJrN8hd4AaABAg,0.0,0.0,2022-01-10T00:51:13Z,0.9998660087585449
856.0,Best. evening. eva. Thank you. Namaste beautiful peeps,UgwK9IZ39m5eGiQ9Vdl4AaABAg,0.0,2.0,2022-01-10T00:50:25Z,0.9998524188995361
857.0,Love this but I ended it early because I did not want to lie down and think for 10 minutes thanks girl,Ugwf-Cu_vhUqP64b12N4AaABAg,1.0,0.0,2022-01-10T00:47:49Z,0.9699904918670654
858.0,"It's so very hard for me to be still and listen to me rather than all the noise in my head. I thought the breathing/ meditation part was going long until that spark hit and, I truly felt at peace, quiet, and in the moment. Boy, that was a struggle! By the end of the practice I felt I'd finally connected to my inner self and let the noise go. Thank you, Adriene, for a powerful practice on Day 8.",UgzPt1rLeYlJCZNzg0V4AaABAg,0.0,0.0,2022-01-10T00:47:11Z,0.9945164322853088
859.0,"It's amazing how your videos are synced with my mood. Lately I've been feeling very anxious. I really needed some rest and even got emotional during this lovely practice. Sometimes I get stuck in these negative and ""scary"" thought patterns but I try to convince myself that it's ok to feel this way, I don't have to pretend like everything is alright and brush it off. If there's something I've learned from ywa it's that i get to move in my own pace, and fwfg for me, in this moment. Yes this feels like sh*t right now,  however better times will come. Growth and improvement isn't linear after all. 

I have come so far in my journey and I will keep moving forward. And as you mention, with the tools of yoga a little goes a long way . In the end I know that these thoughts come from insecurities, and lets face it: they are just thoughts, not facts. Sending love to anyone who is going through tough times. 

Thank you Adriene <3",UgyjI9w3WuuPFNYxZV54AaABAg,0.0,1.0,2022-01-10T00:50:31Z,0.9938905239105225
860.0,I was throughly relaxed at the end of this practice. I had a moment at the end where some bad memories surfaced as I was lying on the pillow in fetal position but I was able to let them go. Usually if memories like that surfaced in any other situation it would of triggered my anxiety. But I was so at peace after this practice and a whole week of practice that I wasn't bothered by them. I just acknowledged them reminded myself they were from the past and couldn't be changed and chose to focus on the present moment. Thank You Adriene. I feel relaxed and calm.,Ugwim31IHRh35RfgmcJ4AaABAg,0.0,2.0,2022-01-10T00:44:26Z,0.9967057108879089
861.0,We can hear your heartbeats while you're breathing and it's so relaxing 🤗❤️,UgxXpEKTXtlk3vrvsTZ4AaABAg,0.0,0.0,2022-01-10T00:43:28Z,0.9998314380645752
862.0,"Day 8 and, after years of trying, I'm officially further into a 30 Days Challenge than I have ever been. Thank goodness for an amazing accountability buddy and for all of the lovely comments below these videos that are keeping me inspired!",UgzVPnWAK_X7xPSQsLF4AaABAg,4.0,207.0,2022-01-10T00:40:44Z,0.9996353387832642
863.0,I did this in bed with fuzzy socks on. So relaxing! 💜✨,Ugynz9T-qVXcElarJYR4AaABAg,0.0,0.0,2022-01-10T00:38:15Z,0.9992076754570007
864.0,I love day 8.,UgzsykTbi-nvvgagu0B4AaABAg,0.0,0.0,2022-01-10T00:37:45Z,0.9997860789299011
865.0,A perfect practice after shoveling snow for 2 hours. I really enjoyed the alternate nostril breathing.  It is so relaxing.,UgzJhI-fDNj-O9SHGgV4AaABAg,0.0,1.0,2022-01-10T00:36:08Z,0.9998133778572083
866.0,"Day 8. Very gentle practice and my body was grateful. Today I noticed how much space my body takes up. Yes, I know I am plus sized, but I mean the physical space my body takes up is not something I usually pay attention to and today’s practice brought that awareness. Crossing my legs was not difficult, but keeping them crossing without holding them was and so was threading the needle. The fetal position was nonexistent because my thighs, belly and chest made that a no-go, but the stillness was there. The rest that we were meant to take today was my main focus and at that, I excelled.  I made sure to focus on what I was good at today and clearing my mind, body awareness and relaxing… those were pretty on point. I really enjoyed this practice and am actually happy that I waited until right before bed to do this one. Thank you for this guided meditation…. Night Benji.",UgwaSotIv8Fi0Gn04mF4AaABAg,0.0,0.0,2022-01-10T00:36:02Z,0.9992629885673523
867.0,"Best. Yoga. Ever. Oh my gosh, I am so zen'd out, I feel like I just did a two hour meditation and got a massage! Thank you for this phenomenal practice!!",Ugy8vTsJ0LpvXnkFl2h4AaABAg,0.0,2.0,2022-01-10T00:33:33Z,0.999671459197998
868.0,I am so glad you mentioned yesterday that today would be restorative. I had to do both in one day. I was tempting to put off today restore and u am so glad I squeeze it in at the end of my Sunday. What love! Namaste,Ugwa6R1FpMgXx__-RXp4AaABAg,0.0,3.0,2022-01-10T00:30:36Z,0.9994181394577026
869.0,"Super sneaky self-care plug and training. I will be returning to this, and be kinder to myself about what meditation is and be willing to find meditation in my own way each day.",UgyXlL77Zf-j-u8NGXt4AaABAg,0.0,1.0,2022-01-10T00:28:56Z,0.9939017295837402
870.0,I fell asleep towards the end. Woke up like a minute before it actually ended. I feel GREAT ! Thank Adriene and The Yogi community!,Ugw1Wu-8W0xse4KEiJx4AaABAg,3.0,113.0,2022-01-10T00:28:18Z,0.9972187280654907
871.0,"Love when I see the blankets out!   Even Benji had his own hehehe so cute.   

Absolutely loved today's practice felt delicious.   Too bad the guy downstairs decided to listen to Metallica,  during it hahahaga.

(By guy downstairs i mean my husband in the basement, I would have said something but they were good songs.  Of course he switched to Adele when it was over hahaha)",UgxCrT2l-_TjPqzSoM14AaABAg,0.0,1.0,2022-01-10T00:27:23Z,0.9973227381706238
872.0,I do believe this will become part of my nighttime routine. Thank you 💜🦋💜,Ugyu42QCUE5D5liq8Tx4AaABAg,0.0,1.0,2022-01-10T00:27:00Z,0.9992244243621826
873.0,Namaste,Ugzi6ms8LUCZ5OntuwR4AaABAg,0.0,0.0,2022-01-10T00:26:39Z,0.7529826164245605
874.0,"I love you so much, Adriene. Thank you for this particular practice. One I will never forget. <3",UgyUrRTptWhcLaJPv3B4AaABAg,0.0,1.0,2022-01-10T00:23:09Z,0.9998494386672974
875.0,Feeling the Sunday scaries today and this was medicine for my soul 🧡🙏 All my favorite wind down and calming postures couples with Shushumna Nadi which I added some calming essential oil to helped calm my ADHD monkey mind 🙏🙏🙏🙏,Ugylvr4V31l69MvkK0p4AaABAg,0.0,0.0,2022-01-10T00:20:33Z,0.9493128657341003
876.0,"Left Nostril: *normal breathing sounds*
Right Nostril: *chainsaw mixed with dial-up internet noises* 😆

That aside, I did the entire practice wrapped up in a blanket, and it was lovely. So grateful for today. ❤",UgwqBaaGzCYmyUq_dBB4AaABAg,1.0,2.0,2022-01-10T00:16:07Z,0.9987949132919312
877.0,Thank you Adriene to this 'rest time' moment with you all. I am slowly healing from a lower back pain and will continue to MOVE everyday with everyone! Happy and Safe New Year!,UgyBCBloMl2mQheIcT14AaABAg,0.0,1.0,2022-01-10T00:14:27Z,0.9998536109924316
878.0,"Thank you, Adriene 🐵😌😴✨",Ugxy3zpYzdPYuParT714AaABAg,0.0,0.0,2022-01-10T00:11:08Z,0.9998267292976379
879.0,"Thank you, take good care too, Namaste.",UgwH7CIhLYiOGk-jcj94AaABAg,0.0,0.0,2022-01-10T00:08:42Z,0.9998170733451843
880.0,I practiced today. Happy  new  year  2022 have a great  year everyone .,Ugy77_6rMsVKC9XqNoh4AaABAg,0.0,0.0,2022-01-10T00:04:29Z,0.9998588562011719
881.0,Can somebody help me figure out where her microphone is hidden? I’ve been doing this for five years with Adrienne and she must have some new technological microphone set up.,UgyZ4kezjrvW6QzBbYl4AaABAg,0.0,0.0,2022-01-10T00:03:06Z,-0.9989981055259705
882.0,This was just what I  needed! Thank you!,UgzYWXgi4ygboFZRmcx4AaABAg,0.0,0.0,2022-01-10T00:03:04Z,0.9998596906661987
883.0,"Weirdly... I struggled the most with today's practice.  Usually I get so much out of our down time in our yoga practices but today I was craving some challenge to overcome.  In all the still, for once, I couldn't turn off my brain and enjoy my it.
I'm a teacher, and suddenly my brain was awash with ideas for the new English unit I'm designing.  I felt guilty and unsettled for feeling drawn to work... but also, I embraced that jotting down my ideas was what my body needed today. Thank you Adriene for enabling a burst of inspiration!",UgwPHaFupX5uipHRjBx4AaABAg,0.0,0.0,2022-01-10T00:15:28Z,0.9865380525588989
884.0,Glad I wore a onesie for this one!,UgzEn92Q_MZhxzs-m0J4AaABAg,0.0,1.0,2022-01-10T00:02:25Z,0.9978498220443726
885.0,Best practice ever!!,UgypNKvZG62ntS1n2kF4AaABAg,0.0,0.0,2022-01-09T23:59:46Z,0.9997820258140564
886.0,My fav practice so far,UgxJoyLxUsZPTHYEP_N4AaABAg,0.0,0.0,2022-01-09T23:57:26Z,0.9936417937278748
887.0,"Full of gratitude 🌸🍃🌸🍃🌸🍃🌸🍃🌸🍃🌸
Thank you",UgzhvgBMPy5LdTm-tBh4AaABAg,0.0,0.0,2022-01-09T23:53:30Z,0.999854326248169
888.0,"such sweet practice. . .thank you, Adriene 💛",Ugxo1GfevRTRqlaA85h4AaABAg,0.0,0.0,2022-01-09T23:51:05Z,0.9998176693916321
889.0,Simply amazing !🙏🏻,Ugxasdcq4bqXVTnNzat4AaABAg,0.0,0.0,2022-01-09T23:44:47Z,0.9998849630355835
890.0,"It’s incredible that 10,000 people did this practice at the same time as I did! It makes me feel so connected to the world, thank you Adrienne for bringing millions of us together 🙏🏻😇",UgxvJ4Zs5R41OFiiPuZ4AaABAg,0.0,72.0,2022-01-09T23:44:31Z,0.999870777130127
891.0,I took a peak at the screen toward the end and got to see sweet Benji making his blanket all comfy and lying down! I love your videos and love seeing your precious dog with you. My cats sometimes get on the mat with me too. The more the merrier!,UgwglGj5JgoeRvILCbB4AaABAg,0.0,0.0,2022-01-09T23:39:47Z,0.9997108578681946
