,comment,comment_id,reply_count,like_count,updated_at,calificacion
195.0,Love the Yoga Move Journey. It's a time of emptying the well to replenish. Thanks Adriene and Benji 💗,UgwySag3HtALE89vKyd4AaABAg,0.0,0.0,2022-01-15T04:19:15Z,0.9973951578140259
196.0,"I'm a few days late to this practice, but I just have to say that I felt such unbelievable joy falling out of tree pose. I couldn't stop laughing, which probably made me fall even more. Surprisingly though, on the second side, I actually stayed in the pose with my eyes closed! Balance is such a wild thing. Thank you for such a fun and curious practice.",UgyXG7-rIcvZkjdqkAB4AaABAg,0.0,4.0,2022-01-15T02:52:12Z,0.999640703201294
197.0,"""So in the coming days you might feel or you might've already felt like not showing up for practice."" And I laughed :)))) You are always funny that's why I keep coming back.",UgyNo8a2MOWlv_nQ8Pt4AaABAg,0.0,0.0,2022-01-15T00:34:13Z,0.9988896250724792
198.0,"I really did not feel like getting on my mat today, but I knew I had to. And I was so glad I did! I feel so much better now after this practice. I never regret gettin' on the mat :)",UgzKJS4geTaDXAAojrN4AaABAg,0.0,0.0,2022-01-14T22:24:25Z,0.9996311664581299
199.0,"Day 9 sweet, thank you so much! Not on daily as missed but continue from where I left off! 🙏🙏🙏🤗🤗🤗💛💛💛",Ugw7g0NwfbLkX287F7J4AaABAg,0.0,0.0,2022-01-14T21:07:21Z,0.9984691739082336
200.0,"Great practice, thank you",UgxMgZ72s7ysx9Xkewd4AaABAg,0.0,0.0,2022-01-14T20:31:32Z,0.9998745918273926
201.0,"Hey ♥️ Yoga fam! 
I almost didn’t show up due to my period 🥺
But I did it anyway! Felt good to stand tall like a tree even though my tree was shaking lol 
Hope all is well!♥️♥️♥️",UgxiuJ8e7K75tx_Wl794AaABAg,0.0,2.0,2022-01-14T17:40:14Z,0.9994643330574036
202.0,This was my favorite to date! <3,UgyOqsq5l85DCtX_fOR4AaABAg,0.0,0.0,2022-01-14T17:23:04Z,0.9997583031654358
203.0,"Super behind in this yoga journey due to falling ill, but back on the saddle today <3",UgxqTG2imHvgB7wtmh94AaABAg,0.0,1.0,2022-01-14T17:19:13Z,-0.516343355178833
204.0,"Day 9 was great.  I was definitely not doing so well balancing with tree pose today.  I loved the way you instructed us to just embrace and experience the fall.  I normally feel a little defeated
when I can't nail tree pose.  Awesome practice.  On to day 10.  Namaste!",UgxRJtsrIiJIXPnC-ph4AaABAg,0.0,1.0,2022-01-14T16:08:26Z,0.9990366697311401
205.0,"I closed my eyes for the first time ever in tree pose and fell and fell and fell and I was laughing, thank you for the push to explore and the humor behind failure. You rock !!!",Ugz5XCCkwMZjUFxS48t4AaABAg,0.0,1.0,2022-01-14T16:07:45Z,0.9990983009338379
206.0,Another beautiful day. So far I feel awesome. Lots of love Adriene and Benji.,Ugx8xYu7OZmzDuJc2ad4AaABAg,0.0,1.0,2022-01-14T13:57:46Z,0.9998891353607178
207.0,"fell off the wagon for a couple of days, but im still here!!",UgwTd8CTjYZPGFaDZ1h4AaABAg,0.0,2.0,2022-01-14T11:51:44Z,0.9959642887115479
208.0,"I can't hold tree at all unless my bare foot is on my bare leg - I've tried various clothing options but anything but skin on skin just means my foot slides down the leg immediately.
Is this normal or am I doing something wrong?",Ugykytl2orWQv-B3GyB4AaABAg,2.0,2.0,2022-01-14T11:32:53Z,-0.9917049407958984
209.0,"I was feeling bad about falling 'behind' with these videos today - until I refreshed the page and found that 1000 other people had done the practice together with me! Such a wonderful feeling, to do something alone and yet together with so many others.",Ugy5lw-4KX6zo4Dw4OR4AaABAg,1.0,2.0,2022-01-14T10:44:25Z,0.9987931251525879
210.0,Glad to see in the comments I am not the only one behind ! I have been sick but am not giving up :),UgzOCPCyFWZSfbI7je94AaABAg,0.0,1.0,2022-01-14T08:29:13Z,0.9959433674812317
211.0,"You changed my life and my relationship with my body, I have learned to listen. Thank you",Ugyv2r0rPN-HE7DUxDl4AaABAg,0.0,0.0,2022-01-14T07:49:48Z,0.9997430443763733
212.0,I got all behind with the daily practice - it's now Jan 14th! Plenty to enjoy catching up on...Being a tree was interesting. My branches are definitely lopsided...the right branches much stiffer than the ones on the left😂,Ugzs1ykgFk23pGwUX_t4AaABAg,0.0,1.0,2022-01-14T07:41:31Z,0.9211612343788147
213.0,"im in love with series"" move"". it has made my body free not from the tension it was holding but also from the bids i was holding inside my heart. thank you adriene",Ugzm3mipbBL1RQJ1pHZ4AaABAg,0.0,0.0,2022-01-14T05:08:13Z,0.9996024966239929
214.0,I was about to quit and now I’m 3 days behind but today I came back to the practice and it felt so good 😊,Ugz2UFAas5je8ae9JMl4AaABAg,0.0,0.0,2022-01-14T03:52:42Z,0.9997134804725647
215.0,I still had a lot of pent up energy at the end so I did some moves that I learned in previous practices afterwards on my own :),Ugy8M7xRw_HnXPUvZYF4AaABAg,0.0,0.0,2022-01-14T01:02:46Z,0.9894893765449524
216.0,Day 9 feeling no fine 😁,Ugzp0lXn3AqtomgJYc94AaABAg,0.0,0.0,2022-01-13T23:59:07Z,-0.9970990419387817
217.0,Ok I quit. I've had enough downward dog.,UgzzAu1hDKluln7WkMV4AaABAg,0.0,0.0,2022-01-13T22:41:17Z,-0.9964015483856201
218.0,"I am so thankful for discovering Yoga with Adriene at the onset of the pandemic in early 2020! I have enjoyed and repeated several 30 Day Yoga practices over and over, missing a day in succession but getting through them: Home, Yoga Camp, Revolution, Breath, True and Dedicate. Thank you Adriene for coming into my life!",UgyIcD5UTkLRuYXHaBp4AaABAg,0.0,0.0,2022-01-13T22:41:07Z,0.9994094371795654
219.0,Day nine finished! Had to stop and take breaks this time during the session as I think my muscles in my legs and feet were too worn out today from work. But I’m happy I kept with it and haven’t missed a day,UgxmWYvdDLURi8z9H8t4AaABAg,0.0,0.0,2022-01-13T21:18:37Z,0.9991077780723572
220.0,Thank-you! I really enjoyed this one - not that I don't enjoy most of them but this one was fun!,UgyJPS0gwqi4Syacb_N4AaABAg,0.0,0.0,2022-01-13T21:15:30Z,0.999850869178772
221.0,Wow that move in the ‘hydrant’ pose caused my hip to make really weird noises! Anyone else?,UgxOLKqaL5J7cafKrE54AaABAg,0.0,0.0,2022-01-13T21:02:26Z,0.5999456644058228
222.0,I liked this practice. Tree pose is one of my favorites and falling is something I never practiced enough but putting it into context with curiosity rather than failure gives it a new perspective.,Ugw1gV1_sIUoC3cAVwh4AaABAg,0.0,0.0,2022-01-13T20:55:52Z,0.998202919960022
223.0,hallelujah,UgwAa6Po-jMzYP-g0xh4AaABAg,0.0,0.0,2022-01-13T19:12:08Z,0.9987887740135193
224.0,The falling tree was incredible!! Thank you Adrienne <3,UgxQJ1XxhLemD8U_i1B4AaABAg,0.0,0.0,2022-01-13T18:56:33Z,0.9998530149459839
225.0,"I love that these are around 30 minutes long. I find it easier to show up for that time frame than 45 or 60 minutes.
I can also repeat another set if I want more than 30 minutes that day.
I really feel good.
Thanks 🙏🏼",Ugzv5SukZ8FrpvNQEA94AaABAg,0.0,0.0,2022-01-13T17:43:51Z,0.9977872371673584
226.0,Do i need to repeat the 12 videos to make the 30 days journey?,UgzezPGC0kBirRnRp5x4AaABAg,0.0,0.0,2022-01-13T16:20:01Z,-0.9991249442100525
227.0,💛,UgyKObdQ6RSWf8KiwVF4AaABAg,0.0,0.0,2022-01-13T13:52:34Z,-0.6970567107200623
228.0,my cat came to lie on top of me at the end of practice today and it was honestly such a lovely peaceful way to end today's session 💕,Ugz96EgqVZCO0JKOp2p4AaABAg,0.0,0.0,2022-01-13T13:24:18Z,0.9997990727424622
229.0,I am behind on the videos but am committed to completing them even if I go beyond the thirty days to do so. Love your practice and your patience.,UgyX86AKnbsfsASGP1p4AaABAg,1.0,3.0,2022-01-13T12:52:23Z,0.9997021555900574
230.0,!!!!!!!!!!!!!!!!!!!!!!!!!!!!!!!!!!!!!!!!!!!!!!!!!!!!!!!!!!!!!!!!!!!!!!!!!!,UgynEJPRn1em2RPlCtp4AaABAg,0.0,1.0,2022-01-13T12:04:15Z,0.9985460042953491
231.0,"Just a couple days behind, just finished day 9. Thank you for all you do, Adriene.",UgyhO3Zj2BIvEtgcE8x4AaABAg,0.0,1.0,2022-01-13T11:01:22Z,0.9997110962867737
232.0,"thanks for your video, helps me to move freely whenever I want/can and that's for the best",Ugwq_6x71WWI_DXM96t4AaABAg,0.0,0.0,2022-01-13T10:57:00Z,0.9998461008071899
233.0,"Every time I do cat/cow pose lately I see something different outside my window. Today as I looked up in cow pose I saw a squirrel climbing the big oak outside. And I remember doing one practice right before Christmas, and as I looked up in cow pose it had started snowing! How magical is that? It’s the little things that bring you joy. See you all tomorrow.",Ugxi_Icyvuuuo56sd1J4AaABAg,0.0,1.0,2022-01-13T10:20:08Z,0.9995324611663818
234.0,"This one premiered a couple of hours before I had to have my fifteen year old dog put to sleep.  I'm heartbroken, but going to try to pick up from here today x",UgxrDJ6b5EFCI_W5O7h4AaABAg,0.0,0.0,2022-01-13T09:25:06Z,-0.994025468826294
235.0,I absolutely love today's yoga session ❤,UgwXF1PDN8aCZdUp3iZ4AaABAg,0.0,1.0,2022-01-13T08:48:00Z,0.9997451901435852
236.0,thank you ❤,UgzXZifwy-NTmgGzDqV4AaABAg,0.0,0.0,2022-01-13T08:46:30Z,0.9998127818107605
237.0,🍀,Ugx46O7oVy13v42UQp94AaABAg,0.0,0.0,2022-01-13T06:48:42Z,-0.6970567107200623
238.0,My hips and back feel AMAZING after this practice! I feel like I really let something go.,Ugx1YHbrJFtJWKX6VYJ4AaABAg,0.0,1.0,2022-01-13T05:49:32Z,-0.905767023563385
239.0,"This sparked my curiosity to try another Adriene video I’ve done a bunch of time before starting this 30 day journey to see if I notice a difference in my strength and balance. I was pleasantly surprised to learn how much I’ve improved my strength, balance, and focus. So cool.",Ugx9PsbeQn28SuOmdsp4AaABAg,0.0,1.0,2022-01-13T05:31:07Z,0.9997555613517761
240.0,"I have been skipping days of the Move Challenge and been doing two videos the next day to catch up. I know that's not perfect, but I am trying. It is my first year staying on time and consistent with the yearly 30-day journey. I am proud of myself:)",UgxTmj0kkGXyho_IuFp4AaABAg,1.0,5.0,2022-01-13T04:19:07Z,0.9988448619842529
241.0,I love Benji so much 🥰 and Adrienne too of course!!! I am no longer able to have another yoga teacher; Yoga with Adriene is part of me now❤ Thanks for everything xxx,UgyrdtcShEj6L2zfXVl4AaABAg,0.0,1.0,2022-01-13T03:57:13Z,0.9953961968421936
242.0,"I took a break on day 9... and then got discouraged yesterday. But I'm here on the 12th Jan to continue. I hope you all are having a good journey! Remember, fall seven times, get up 8.. I'm trying to accept this too. Namaste. ❤🙏",Ugw9oipyfmsexeFNJ3h4AaABAg,2.0,1.0,2022-01-12T22:58:44Z,0.9984111785888672
243.0,Taken a few days to ease a bit of a sore back but so pleased to be back with another amazing practice. Cheers Adriene!,UgzP6FaY_c8IlEGUAYZ4AaABAg,0.0,0.0,2022-01-12T22:08:42Z,0.9997939467430115
244.0,"9th day in a row, towards the end of each session i feel like i do not want it to end",UgzDgPjlgD5MkESthjx4AaABAg,0.0,1.0,2022-01-12T21:47:17Z,-0.9990348815917969
245.0,"I'm 2 days late but made it! I concussed myself on day 7 (not yoga related!) and was worried the enforced rest would break my rhythm but it hasn't and I'm so thrilled to be back on the mat! This was a fabulous way for me to restart, Adrienne, thank you!",UgzvIK9hJJyWf4CRg294AaABAg,0.0,4.0,2022-01-12T21:42:13Z,0.9997329115867615
246.0,Gracias⭐️⭐️⭐️,Ugwg46nqhRyxqwjYk2Z4AaABAg,0.0,0.0,2022-01-12T21:31:06Z,-0.6970567107200623
247.0,"What’s the song at the beginning and end? It’s so good, perfect for yoga, feeling like it’s perfect to synchronize breath✨",UgxYBpTN7M1AtKaPa0d4AaABAg,0.0,0.0,2022-01-12T21:04:38Z,0.9998764991760254
248.0,"today not only I am not the only one who showed up to practice. when you said ""falling graciously out of tree pose..."" tears began to show up, too, as I suddenly realized that falling sometimes is okay. mistakes and relapses are okay. we are human. 
usually i never comment anywhere but today, i really wanted to say: thank you adriene for your truly wonderful yoga lessons. i don't know how many times they lightened up my days. thank you for this wonderful community filled with support and peace. 
if you read this: you got this, whereever you are. we all got this. ❤️",UgzukUfgMCbCTZ9Jlax4AaABAg,0.0,1.0,2022-01-12T20:58:26Z,0.9996147155761719
249.0,Really enjoyed this practice. Exactly what I needed today. Namaste,UgxZBjgpbG9g_7gG4dh4AaABAg,0.0,0.0,2022-01-12T20:02:23Z,0.9998636245727539
250.0,the hardest part really is showing up shoooot,UgwlPbTWw2S1nilo-YZ4AaABAg,0.0,0.0,2022-01-12T20:01:52Z,-0.9008364677429199
251.0,And now day 9!! See you tomorrow! :D,UgyghwqInZGr10IB4tV4AaABAg,0.0,0.0,2022-01-12T19:48:36Z,0.9991926550865173
252.0,"""You are worthy"" This sentence alone already moved me. I loved falling out of the tree with curiosity, and look forward to the rest of the challenge 💕",UgwcdCKeYsccn7hFmph4AaABAg,0.0,0.0,2022-01-12T19:27:14Z,0.999110758304596
253.0,"Ooh lovely practice 😁 I did 5 mins on the day and was soooo tired I got into bed and did REST from the previous day again and my own practice last night, back today and oh how I missed it 🙏🧡",UgyiPkLkcqkytT3AR714AaABAg,0.0,0.0,2022-01-12T19:08:34Z,-0.9981860518455505
254.0,"Ooh lovely practice 😁 I did 5 mins on the day and was soooo tired I got into bed and did REST from the previous day again and my own practice last night, back today and oh how I missed it 🙏🧡",Ugy8KQToi_LzMipekLd4AaABAg,0.0,0.0,2022-01-12T19:07:52Z,-0.9981860518455505
255.0,"I loved todays practice, one of my favourites so far this month:) Thank you Adriene, namaste:)",UgyiNzCWCMszamfluKx4AaABAg,0.0,1.0,2022-01-12T16:15:19Z,0.999737560749054
256.0,Tree pose was STRONG today. Thank you Adriene!!,Ugxgv7U8vh35LZZSitl4AaABAg,0.0,0.0,2022-01-12T15:00:26Z,0.999868631362915
257.0,I’m a few days behind because taking care of some sick family,UgwWqR5SAfalGYXwTxJ4AaABAg,0.0,0.0,2022-01-12T14:58:57Z,-0.9847331643104553
258.0,Thank you so much,Ugx7Xu8eyEfCA13GsCd4AaABAg,0.0,0.0,2022-01-12T14:51:53Z,0.9998414516448975
259.0,"I caught COVID this past week, so I'm behind on the journey. I'd been kinda beating myself up for letting myself fall behind, even though I've felt crappy for days. But Adriene's reminder to practice falling reminded me that it really doesn't matter. In the end, I'm having my journey the way I need to have it this year. So if you're reading this because you're also following along behind, I just want you to keep showing up. You don't have to have the picture perfect 30-day experience. You just have to have YOUR experience, whatever that looks like. Namaste, friends.",UgzBwoYpTNFwQD9KFzh4AaABAg,0.0,1.0,2022-01-12T13:31:13Z,0.9945130348205566
260.0,This practice was so fun and different from our usual (I love the usual too!). Loved the permission to fall out of tree pose. I need to be reminded that it’s ok to fall sometimes.,Ugzdv7bL3NruqCUNmNl4AaABAg,0.0,1.0,2022-01-12T13:09:47Z,0.9996978044509888
261.0,"Didn't want to come to the mat, started thinking of all the reasons why I shouldn't. I reminded myself I want to learn to be more consistent and committed and here I am, feeling real great after today's practice 😊Sending love to everyone here!",Ugy3caZixi0CTN7i9Nt4AaABAg,0.0,1.0,2022-01-12T12:50:21Z,0.9994914531707764
262.0,"For extra challenge during tree pose, I had my cat Blaze rubbing up against my standing leg 😂",Ugzue7VKw5BW9SLrIrR4AaABAg,0.0,1.0,2022-01-12T10:07:10Z,-0.9419505000114441
263.0,"I loved it, the falling - experience was making me laugh with my self, thank you for always choosing such amazing poses and putting them together into a balanced, themed, amazing - to - follow and explore practice💕🙏",Ugw1pOD_pM-sPfPzptJ4AaABAg,0.0,0.0,2022-01-12T09:20:02Z,0.9998797178268433
264.0,This felt lovely. 🤩,Ugy7YS_keGFdU2plcwR4AaABAg,0.0,0.0,2022-01-12T08:47:43Z,0.9998337030410767
265.0,"Closing the eyes in tree pose was incredible, the way you have to feel into your body to keep the balance, find stillness and focus without any guidance of the exterior world. Then my baby woke up from her nap crying halfway through the second foot and I fell over straight away.  😄",UgxElPkcyFpGrII3X_V4AaABAg,0.0,0.0,2022-01-12T08:44:04Z,-0.6270526051521301
266.0,Good morning everyone. Day late clubber here and can’t wait to give this one a go. Hope everyone gets a yogatastic start to their day!,UgypaeWPlZ2tyzr044B4AaABAg,0.0,0.0,2022-01-12T08:18:15Z,0.9996522665023804
267.0,Thank you Adriene 🙏🏾,UgyFqdZubwLP0jfwKH94AaABAg,0.0,0.0,2022-01-12T07:51:39Z,0.9997859597206116
268.0,Thank you to the whole Yoga with Adriene Team! You are one of the best things on the internet!,Ugww1Oox5VH_PrxuWnh4AaABAg,0.0,1.0,2022-01-12T07:25:38Z,0.9998725652694702
269.0,"Wonderful 😊 really hoping we get into some deep stretches soon, feels like my body needs it",Ugxu5M3YrUG-jv9BjM54AaABAg,0.0,1.0,2022-01-12T06:53:03Z,-0.9406045079231262
270.0,Getting curious... So good! I went on my own flow after this session and it felt so great! Thank you!,UgxVgs1YLP9nXGXGFuh4AaABAg,0.0,1.0,2022-01-12T06:02:09Z,0.9998782873153687
271.0,"We adopted a puppy yesterday, and he is DEFINITELY taking the ""I am curious"" mantra to heart. While we were attempting yoga, he discovered slippers (!) and plastic garbage bags (!!)",UgwIlobXdispPSkhK394AaABAg,0.0,0.0,2022-01-12T05:28:14Z,0.9762579798698425
272.0,Curious poses like falling tree helped me understand the difference in balance strength btwn right & left having to adjust my foot to find the spot....Reverse Triangle was a curious treat...yes always begins breath focus ....more please....,Ugz5UUD6SN58Y_kvghV4AaABAg,0.0,0.0,2022-01-12T05:10:18Z,0.9979467988014221
273.0,Day 9 completed. Thank you 💖,UgwXwToud_xZ6hHum4l4AaABAg,0.0,0.0,2022-01-12T03:56:13Z,0.9997366070747375
274.0,Yas 👏,UgzIJZ-tCID6-A5DdS94AaABAg,0.0,0.0,2022-01-12T03:36:13Z,-0.891848087310791
275.0,"Definitely need to work on my balance. Tree pose was a bit tricky today. Got the right leg to stay bent and then noticed not so much when it came to the left side...I got the wobbles lol. Was curious in lifting hands above head wide like a beach ball and tried closing my eyes.... hahaha no go.

It's good to be curious in our practices. Like Alice says ""curiouser and curiouser""",UgzdNP-MWoLFGj1f0C94AaABAg,0.0,1.0,2022-01-12T03:20:01Z,0.9825254678726196
276.0,This was such a fun one! I usually feel so frustrated to not perfect a pose but to see Adriene inviting us to fall out of the tree pose was really freeing,UgxO0DM20E1YAzuGBAx4AaABAg,0.0,1.0,2022-01-12T02:18:45Z,0.9971012473106384
277.0,Might have been because I did today's practice with ear buds in but her heartbeat was very pronounced and very comforting.,UgyM21KYqvxqkEKYwPF4AaABAg,0.0,0.0,2022-01-12T02:04:31Z,0.9996095299720764
278.0,thankyou,UgyyzIEvmTkzqoV0sKd4AaABAg,0.0,0.0,2022-01-12T00:13:24Z,0.9998428821563721
279.0,😊❤🌲,Ugxp__FNuPmF6TSRt5V4AaABAg,0.0,0.0,2022-01-11T23:14:05Z,-0.6970567107200623
280.0,Day nine: Done!,UgxAU2nbDRIZ8wzbpR94AaABAg,0.0,0.0,2022-01-11T22:45:35Z,0.6772509813308716
281.0,"Thank you, Adriene!",Ugw60QRw9r-m3BqHwiJ4AaABAg,0.0,0.0,2022-01-11T22:02:24Z,0.9998525381088257
282.0,"Had to skip yesterday (original day 9) due to sitting at the airport all day, so proud of myself for picking it back up today, I and you can do this!",UgzFd1Un9XD_MnSBwp94AaABAg,0.0,1.0,2022-01-11T21:56:09Z,0.9985507130622864
283.0,"Does anyone know what kind of yoga mat Adriene is using? I've been in love with it since Day 1. 
Happy yoga lovely humans <3",UgyQf4Pg0_DJYLI8qoB4AaABAg,0.0,0.0,2022-01-11T21:55:37Z,0.9990172386169434
284.0,🤍💜💙,UgxRtxfdoT3ANl7EuKt4AaABAg,0.0,0.0,2022-01-11T21:22:08Z,-0.6970567107200623
285.0,💖💖💖💖💖,UgwSD7c_yxhtCiYOfjx4AaABAg,0.0,0.0,2022-01-11T21:11:14Z,-0.6970567107200623
286.0,"Well it must have been windy in here, my tree was flopping all over the place! Hahahaha",UgyeaoipzTGIMPfaNPN4AaABAg,0.0,0.0,2022-01-11T20:39:13Z,-0.9996786117553711
287.0,I ended up skipping yesterday since my body was in desperate need of complete rest. I hopped back in where I left off and I feel so energized today! This practice is exactly what I needed this morning! 😁,UgykWCel3b2R5JCDi_54AaABAg,0.0,0.0,2022-01-11T20:16:53Z,0.9986013770103455
288.0,Thank you 🙏,UgxLEs-Bpz641-kvw4x4AaABAg,0.0,0.0,2022-01-11T20:15:12Z,0.9998127818107605
289.0,"Curiosity was my 'move' word, thoroughly enjoying this journey.  I am hoping to improve my flexibility and be able to hold the the tree pose with my eyes closed ... today I was disappointed I couldn't achieve but accept practice makes perfect.   Thank you Adriene for your calming motivation  ... I look forward to being flexible and vibrant  xx",UgxXm90MI3UatApG3VR4AaABAg,0.0,0.0,2022-01-11T20:04:27Z,0.9997815489768982
290.0,"I must admit that I signed up for this series largely because of ""sweet Benji.""  I used to have a Heeler and love that breed of dog.  It warms my heart to see how he's almost always in the picture with Adriene. ❤  However, I've been made aware of how vital it is to have some kind of daily exercise program, and yoga is perfect for me given my age and health issues.  When this series is over, I'm going to look into Adriene's 10-minute morning warmups to continue on!",Ugyh_P8XmsG7XpWaFIp4AaABAg,0.0,0.0,2022-01-11T20:02:02Z,0.9985254406929016
291.0,That was so good 🧘🏻‍♂️ Thank you 🙏,UgxtBIEb804tCTkQnJ54AaABAg,0.0,0.0,2022-01-11T19:51:22Z,0.9998642206192017
292.0,"I dare say, I had....fun? Today? I had fun! Yes, I fell out of my trees, but who cares? I did my best. I had fun. The forward folds with the arm throwing at the end was really good for my frozen shoulder. Stuff like that really helps get things moving in it.",Ugz5nvCeBQxONhGLQih4AaABAg,0.0,0.0,2022-01-11T19:29:12Z,0.9995360374450684
293.0,"Yheeee I did it, I am so glad I didn't skip today, 
So I do my practice in the mornings since its out in my country(RSA) mid day, 
Today i woke up late and I had the whole day to plan and save my energy for my practice, night time done and dusted so Proud of my self,.,.,.,.,.,",UgzWA7DeqR1CIBTT5Ex4AaABAg,0.0,1.0,2022-01-11T19:13:53Z,0.9894411563873291
294.0,"I missed a day so I’m catching up, but in an unhurried way. I really needed todays practice. So grateful for this time and sharing it with you all. Going to take tree falling into my next team meeting as an invite to others. Namaste",Ugxh51kb5xtHniJb7Tx4AaABAg,0.0,0.0,2022-01-11T18:48:50Z,0.9990505576133728
295.0,Enjoying this 30 day thing so far. First time Yoga.,UgwkDknXWrR2RbQpHkB4AaABAg,0.0,0.0,2022-01-11T18:31:58Z,0.9997380375862122
296.0,"""...getting more curious about how we find this balance between opposition... [haha] not a bad practice"" - AMEN, SISTER! I love thinking about 300K + people doing this practice each day, and how we all have different perspectives, world views, opinions... Here's to rippling out being curious about finding the BALANCE between opposition this year. Love to yaz all",UgzzLoOf2vY7QlTEHIF4AaABAg,0.0,0.0,2022-01-11T18:26:02Z,0.9977712631225586
297.0,This practice is pure magic ✨,UgwjviWpsD-8IsHt-ZR4AaABAg,0.0,0.0,2022-01-11T18:24:58Z,0.9989424347877502
298.0,Tree pose closing your eyes is really hard 😅,Ugz0eW2GcWccoJDASBx4AaABAg,0.0,0.0,2022-01-11T18:22:35Z,-0.992145836353302
299.0,"Amazing, energizing, and approachable. Thank you, Adriene.",Ugx2JITNnDEAMg0InDh4AaABAg,0.0,0.0,2022-01-11T18:01:42Z,0.9998764991760254
300.0,"Excellent,",UgyEaYhfxTNEkNHaAgp4AaABAg,0.0,0.0,2022-01-11T17:17:56Z,0.9998441934585571
301.0,"Second year doing this challenge! This time am 30+ weeks pregnant, so a few modifications are needed. But YWA has helped SO much with back pain in pregnancy. Doing this challenge for me and my little one <3",Ugw6FBLNdze3xrIy4KR4AaABAg,0.0,0.0,2022-01-11T17:15:40Z,0.9872679114341736
302.0,"Dear Adriene, thank you so much to share this wonderful experience. I am practising from Sao Paulo, Brazil and this brings calm and strength in the same time!!!",Ugxhb7Ttj3JqiRU32AF4AaABAg,0.0,0.0,2022-01-11T17:14:22Z,0.9998838901519775
303.0,"Nothing can express my feelings as much as the inner & outer love in felt at the invitation to whisper NAMASTE, thank you Adriene and love to all.",Ugzdd9QcD4bNR-JtBVZ4AaABAg,0.0,0.0,2022-01-11T17:06:22Z,-0.9385327100753784
304.0,"OH sweet freaking Adriene! You are really getting me through this pandemic sister, offering soothing and energy and breath therapy. So so grateful for you sis.",Ugy7nIbLuO0kc096AsZ4AaABAg,0.0,0.0,2022-01-11T17:06:00Z,0.9997979998588562
305.0,"9th day in a row <3 Today I've had a heavy day, and didn't feel like showing up for myself, but I did it, and I am so proud of myself. Thank you Adriene, for this practice and for seeing me with the sentence ""maybe you already felt like not showing up for practice""",Ugy_HBd9bEDZCPdbjK94AaABAg,0.0,0.0,2022-01-11T17:04:22Z,0.9993517994880676
306.0,"Day nine and I’m feeling so HAPPY and STRONG! I’ve been sick in covid since day 3, but still showing up for yoga every day 💪🏻 I’m learning how to be kind to my body and mind, all while getting stronger and more flexible 😍 Thank you for this amazing opportunity, I will continue to show up for myself every day ❤️",UgxFf3WiN1sFP2xj1sV4AaABAg,0.0,0.0,2022-01-11T16:42:02Z,0.9998013377189636
307.0,"My inner child every time I raise my arms high in tree pose: LOOK AT ME, I'M A TREE!!! I'm obviously talking to the trees in my backyard. Ok that will be all lol 😅",UgycMVlmNzqB2Hyy2wZ4AaABAg,0.0,0.0,2022-01-11T16:24:04Z,0.9994283318519592
