,comment,comment_id,reply_count,like_count,updated_at,calificacion
731.0,Didn't feel like doing day 9 today. Showed up anyway. Got frustrated but also understood I was cranky because of dehydration. And stayed afterwards for some gentle stretches. ✨,Ugyb4k0yhbngJz_LZ7t4AaABAg,0.0,0.0,2022-01-10T16:33:58Z,-0.9578433036804199
732.0,"This is my second round of starting a new year with Adriene. Adriene - I'm abundantly grateful for your authenticity and love in every video. They leave me feeling refreshed, strong and loving myself. 1 million thank yous!",Ugw02Zpht1UQOdqHGLN4AaABAg,0.0,11.0,2022-01-10T16:33:42Z,0.9998867511749268
733.0,find someone who looks at you the way Benji looks at Adriene in the intro <3,UgzKqrZ0juZRn677MZ54AaABAg,0.0,0.0,2022-01-10T16:31:37Z,0.9585891366004944
734.0,Today's practice was so fun!,UgwLycaHNdW-uhUMz714AaABAg,0.0,0.0,2022-01-10T16:28:56Z,0.9997957348823547
735.0,"Started this practice in a freezing cold house. The movements didn't warm me up but somehow I forgot that I was cold for 22 mins. Amazing what this practice does for the mind. Even if I don't see or feel the results of yoga each day, I have seen and felt enough to know that they make my days better, and it's that faith that brings me comfort and brings me to the mat",Ugx7zoPJXJV92RLVYHh4AaABAg,0.0,0.0,2022-01-10T16:28:37Z,0.9995343685150146
736.0,I feel amazing and confident today! We are doing Day 5 again for more energy. Thank you!,Ugw8pfLDB20kyqDzoZl4AaABAg,0.0,1.0,2022-01-10T16:26:09Z,0.999889612197876
737.0,"Thanks so much, After being hunched over a computer task all day, this wasn't just needed, it was necessary. Thank You. psst  I ended with a bridge",UgwB3ylkjAooYbiuodx4AaABAg,0.0,0.0,2022-01-10T16:25:43Z,0.9995203018188477
738.0,I am healthy and strong!!!,Ugy4X9KXmsTr3a9c8CZ4AaABAg,0.0,1.0,2022-01-10T16:24:34Z,0.9998753070831299
739.0,"Day 9 done, committed. Great work out, again, Namaste.",UgyZm1e6YxsKKWKHR3J4AaABAg,0.0,0.0,2022-01-10T16:22:33Z,0.9989872574806213
740.0,"""Staying curious about the falling"" (15:30+).  I was In tree pose, eyes shut and falling when my knee-jerk reaction was to quickly recover (did anyone see me?) and move on.  On the next side, as Adriene suggested, I stayed curious AND remembered to bring the breath.  Steadier, yet still humbled but more open to fruits of falling. Thank you.",UgyPeeBx1HgrBjA75w54AaABAg,0.0,2.0,2022-01-10T16:19:40Z,0.9968177080154419
741.0,"Grief is making it challenging to “be” with my body. Send me some love, healing energy yoga peeps. 
Thanks in advance
.🙏🏻",UgzbXrmaFpKKmpretsh4AaABAg,2.0,6.0,2022-01-10T16:16:16Z,0.999403715133667
742.0,I feel the burn oooooo let do this !!!!!!!!!!!!,UgwLJXjxwL2vEoOSDmZ4AaABAg,0.0,0.0,2022-01-10T16:15:06Z,0.9453650712966919
743.0,"""Be curious about the fall.""  I tried to stay present and be curious when I closed my eyes in tree pose. I realized that I always came out of the pose not because I lost my balance, but because I THOUGHT I was going to lose my balance.  I'm not sure why this made me emotional but it probably says something about how I deal with things in life :') What's the worst that can happen if we fail something we try?  Step out of tree pose and just try again!  Thank you for everything, once again",UgyRLifLGuaYHpwsBlZ4AaABAg,0.0,58.0,2022-01-10T16:13:33Z,-0.9895009398460388
744.0,"I just loved ""Falling in the tree pose and also falling back in love with my body and inner me!"". Adriene, you Rock!  I am curiously excited for what's next to learn!😄",Ugxyc43XVeh7cqS67Q94AaABAg,0.0,0.0,2022-01-10T16:07:39Z,0.9997946619987488
745.0,"Does anyone else refresh the video after their practice to see how many people they practiced with? I did this practice with over 5,000 people! How amazing ❤️",Ugyt4IPP1RNatMyRHtx4AaABAg,2.0,8.0,2022-01-10T16:05:23Z,0.9990254640579224
746.0,The intro song absolutely slaps,Ugyy03IckWhIX7PHE1B4AaABAg,0.0,0.0,2022-01-10T16:05:05Z,0.66888427734375
747.0,"Adriene, I'm curious, who do you follow and learn from? 💜",UgyJR-qBMDtglnRc8jh4AaABAg,1.0,1.0,2022-01-10T16:00:17Z,0.857232391834259
748.0,"Namaste to you all. Beautiful yoga session so thank you, Adriene. J and C in New Mexico",Ugyj19U-H0oFeaT_vkZ4AaABAg,0.0,0.0,2022-01-10T15:58:42Z,0.9998584985733032
749.0,"Dear Adriene, I started my yoga journey with you about one and a half years ago and I'm definitely still curious. I completed a 200h YTT at the end of last year but I still feel that I have so much to learn. I took your invitation today to continue exploring through my self practice, adding a little inversion sequence and a long relaxation, it just felt like the right thing to do after your lovely session. Thank you so much for taking me on this journey. From my heart to yours💞💞",UgxgWmLdqbkiNwfotxF4AaABAg,0.0,0.0,2022-01-10T15:58:18Z,0.9997875094413757
750.0,💚,UgxF5zpqipyld1gMTyR4AaABAg,0.0,0.0,2022-01-10T15:57:11Z,-0.6970567107200623
751.0,"My friend Jenny invited me to be her yoga buddy on this 30 day challenge!  I am LOVING it!  I am a longtime yogini, but have been very demoralized in the practice since the start of Covid.  (I think I miss in-class instruction!)  This is really reviving me.  Love the length of the sessions, and the new focus each day on a theme.  AND, I have my blue heeler mix beside me as I practice!  Thanks, Adriene!!!",UgzhsKr8GzOQGqB7yjV4AaABAg,0.0,2.0,2022-01-10T15:55:52Z,0.999563992023468
752.0,"Hi All, can you please advise if it's normal to feel nauseous after a yoga session.?",Ugy8Lj73CdcDCVaRLzp4AaABAg,1.0,0.0,2022-01-10T15:46:01Z,-0.9957895874977112
753.0,"I learnt a lot today about my tight hamstrings (used to wear high heels a lot in life) and this exercise helped me to try and flatten my legs as I lean forwards - will try No 9 again now to see if any improvement. Am loving returning to yoga, thank you A. 😀💜",UgzBMSXql-H5GT8K3WB4AaABAg,0.0,0.0,2022-01-10T15:45:17Z,0.9978762865066528
754.0,I continue to do this series because Adriene is looking forward to see me everyday!,UgzqkFcSkwt6C6gyPD94AaABAg,0.0,0.0,2022-01-10T15:43:01Z,0.9998300075531006
755.0,Wowwww I loved the falling practice! It made me go all giggly and take myself less seriously. Definitely taking that into today with me ❤️,UgzBJ4kArdWjltlVP7x4AaABAg,0.0,0.0,2022-01-10T15:40:58Z,0.9802442789077759
756.0,That was very challenging with that tree pose cause I fell so many times 😂😂😂 but I never made it this far. I guess I really want it this time. I wanna do this and learn to breathe and take time to relax. Thank you Adriene for helping me out with your practice’s…with lots of love from Sweden 🇸🇪lots of love to you and Benji 💕🐶,Ugwh_oby5JgbwceOI0x4AaABAg,0.0,0.0,2022-01-10T15:37:56Z,0.9995837807655334
757.0,"This was a workout for me! Good especially after ""resting"" yesterday!",Ugx72D-Ar5A0Pp2UXlZ4AaABAg,0.0,2.0,2022-01-10T15:35:42Z,0.9989564418792725
758.0,Enjoyed this session.  Thank you.  I certainly did not have a perfect pose but I finished strong.  I was curious to see how my balance is at 53 years old.  I see I need to keep working at it.,UgwxsCvlMFOfHso9B5B4AaABAg,0.0,0.0,2022-01-10T15:34:33Z,0.9983571171760559
759.0,"My back is not ready for those deep seated forward folds, but I remembered to just be where I'm at today. No sense pushing and re-injuring myself.",UgyNsEQ-SBQddK9eWE54AaABAg,0.0,1.0,2022-01-10T15:34:12Z,-0.9894040822982788
760.0,"Good Morning! Happy to have this practice and my mat and my yogi guiding me onward, downward, upward! Loving this! Namaste🧘🏻‍♀️🥰❤️🙏",Ugz0nhz_OOs9Sff72np4AaABAg,0.0,0.0,2022-01-10T15:31:59Z,0.9998764991760254
761.0,Thank you 😊,UgysvEhkxvMMTvyfT1F4AaABAg,0.0,0.0,2022-01-10T15:31:42Z,0.9998127818107605
762.0,Thank you Adriene<3 this felt absolutely amazing,UgwXImnmAohFKgsuxR94AaABAg,0.0,0.0,2022-01-10T15:31:33Z,0.9998564720153809
763.0,"Namaste, YWA friends! I hope today's exploration on the mat leaves you open to rediscover the beauty that is already around you. Keep showing up!! 🙏",Ugx2WMtoxDFUERBtnnx4AaABAg,0.0,14.0,2022-01-10T15:31:09Z,0.9998015761375427
764.0,Thank you Adriene...thank you Yoga...thank you to all of us showing up here to roll out our mats another day...we are strong...we carry on...we are together.,UgwFLxc1chgpWX_Yqut4AaABAg,0.0,1.0,2022-01-10T15:30:31Z,0.9998555183410645
765.0,"I am in medical school and started the semester last week. After days of following you along, I stopped for 4 days, telling myself I didn't have the time. But.... I felt sad. This is the only thing I'm doing for myself right now. I need to treasure it. So I came back today. Thank you Adriene for saying today that made a commitment to ourselves in starting this challenge. Exactly describes why I felt so sad for stopping - I was breaking a promise with myself. I can't let the little joys of life be taken away by school and work. This is for me. My body is for me.",Ugx_R8C7_0JaC82WwVN4AaABAg,11.0,291.0,2022-01-10T15:29:05Z,0.9676740765571594
766.0,😊💙,UgwPHTw59vuCkx_lkfh4AaABAg,0.0,0.0,2022-01-10T15:26:54Z,-0.6970567107200623
767.0,🙏,Ugx9STUpG6QLuJlDI7J4AaABAg,0.0,0.0,2022-01-10T15:21:00Z,-0.6970567107200623
768.0,Done with Day 9's session. Definitely tripped at least dozen times doing tree poses but tried my absolute best. Downward dog is becoming my rest pose with practice. I pushing my body to see what wonders it can do.,UgwbcWov-sCwtMnQkzl4AaABAg,0.0,1.0,2022-01-10T15:18:51Z,0.9009173512458801
769.0,Namaste 🙏🏾 🇧🇷,Ugz0Kebf4EIJO_-naWh4AaABAg,0.0,0.0,2022-01-10T15:17:33Z,-0.8709813952445984
770.0,Day 9 ✅.  30% of the journey done!! Wow!  Greetings from Bronxville NY (aka Bxv),UgzP2UEa_Q52eouiXBd4AaABAg,0.0,0.0,2022-01-10T15:16:48Z,0.9960476756095886
771.0,🥰🥰🥰🤩,Ugym99SH1VvCKoPrPCN4AaABAg,0.0,0.0,2022-01-10T15:15:03Z,-0.6970567107200623
772.0,Namaste x,Ugy1iqv295M1B8GtRod4AaABAg,0.0,0.0,2022-01-10T15:11:02Z,0.7073049545288086
773.0,"Dear Adriene, thank you so much...I never imagined I would get even this far! I have one question for anyone to advise...often during the sessions I start to feel nauseous! Is that normal or something is wrong? Love you x",UgynuglSoGfwO2Q85gR4AaABAg,0.0,0.0,2022-01-10T15:10:40Z,0.9564117193222046
774.0,"I have been following Adriene for a while, and I just wish that she would name some of the poses in there traditional way. It would honor yoga and let people learn where it came from. No way hate she is such a good teacher just it could be cultivated in a way to let people learn something new!",UgwyYKOcI2m5AAnMXJZ4AaABAg,0.0,0.0,2022-01-10T15:10:27Z,0.9896981120109558
775.0,Wow this one only felt like 5 minutes of work! It went by so quickly!,UgxGMs_osajWi887ucR4AaABAg,0.0,0.0,2022-01-10T15:09:58Z,-0.9976890087127686
776.0,Did anyone else not receive the daily email today?,Ugzn7a3z7APlgSpOAgB4AaABAg,0.0,0.0,2022-01-10T15:09:15Z,-0.9970381259918213
777.0,Curiosity…this is what I needed today…thankssss,UgySb5EqoWggwsMwHDl4AaABAg,0.0,0.0,2022-01-10T15:08:42Z,0.9962484240531921
778.0,"Loved todays practice! ❤️ Tree pose gets harder for me over time, not easier, but I listened and I fell!! Wide legged forward fold my favourite though… so yummy 🙏🏻 xx",UgyuKXPkcys456N7TsR4AaABAg,0.0,0.0,2022-01-10T15:05:16Z,0.8801844120025635
779.0,Loved the tree in this! Well done everyone who is keeping going. I have noticed small subtle changes in my way of being. Thank you! Xx,UgziTqCLDoyNvbsyERB4AaABAg,0.0,0.0,2022-01-10T15:04:54Z,0.9998281002044678
780.0,"I am truly loving this daily practice. The length of each practice is doable. I loved falling out of my very modified tree pose today. Adrienne, I too wish you would move just a little bit slower. My breaths and transitions take a bit longer.",Ugwn8euozf_EYIHI_ud4AaABAg,0.0,0.0,2022-01-10T15:04:49Z,0.996051013469696
781.0,So grateful for you and for this daily practice!  Thank you Adriene!!,UgxEV5Mc6gPRr-AOG854AaABAg,0.0,0.0,2022-01-10T15:04:09Z,0.999829888343811
782.0,Oh my goodness the close your eyes an fall exercise!!!! Ahhh! So good! I need to practice falling more often! Thank you Adrienne!,Ugznb9oEIHt8jVc-zWF4AaABAg,0.0,0.0,2022-01-10T15:04:00Z,0.9997000694274902
783.0,Thank you Adriene...,Ugxykae9jKPmgAe2G_Z4AaABAg,0.0,0.0,2022-01-10T15:03:26Z,0.9998272061347961
784.0,I really enjoyed today's practice ! It made me feel very powerful and thank you for that !!!!,Ugyek4PE5S1ObjTLH0x4AaABAg,0.0,0.0,2022-01-10T15:02:39Z,0.9998856782913208
785.0,Here! Had fun exploring my curiosity on what would happen if I close my eyes while standing in one legged tree pose (I fell immediately haha!),UgzTvxDtb_V_odHi0jp4AaABAg,0.0,0.0,2022-01-10T15:02:12Z,0.9655511379241943
786.0,Nice to feel those glutes stretching today!,UgxE72h7XihscwoSK6h4AaABAg,0.0,0.0,2022-01-10T14:58:27Z,0.9996998310089111
787.0,Thankyou this is definitely getting me stronger mentally and physically see you tomorrow 👍,UgxsHQvz7eJnVtL3jcN4AaABAg,0.0,0.0,2022-01-10T14:58:16Z,0.9997351765632629
788.0,"I wasnt on the mood of doing today any physical activity, but I said to myself: you commited to this and that pushed me to doing today video. So one day more of sticking to yoga practices💜🙏😘",UgyGeG98MEmU0Z7uFAJ4AaABAg,0.0,9.0,2022-01-10T14:54:52Z,-0.726009726524353
789.0,Day 9 Completed ✅🎉,UgwFqPy6eZzbISXsi9R4AaABAg,0.0,0.0,2022-01-10T14:54:48Z,0.9822513461112976
790.0,my body made a shape its never made before <3,UgyapsDibkBxHGsijNl4AaABAg,0.0,0.0,2022-01-10T14:54:39Z,0.9964046478271484
791.0,Thank you 🙏 💕,UgySgw-xMZ5EPdalYvR4AaABAg,0.0,0.0,2022-01-10T14:54:37Z,0.9997535347938538
792.0,Yoga in the morning makes me stand up taller and straighter all day! Namaste.,Ugyv4d11tUpTq-MdPhV4AaABAg,0.0,0.0,2022-01-10T14:54:14Z,0.9943704009056091
793.0,Thank you!,UgyEN_nLp674dKrxIcx4AaABAg,0.0,0.0,2022-01-10T14:50:59Z,0.9998581409454346
794.0,"Adriene, will these be up past the 30 days? I tend to do them every other day because I intersperse with running and weights but loving this challenge.",UgzzgKwyjRmmP6TqMxl4AaABAg,0.0,0.0,2022-01-10T14:49:49Z,0.9994242191314697
795.0,“Take Up Space. You are Worthy”🥰,UgzgPPx5RHveB7Drk-V4AaABAg,0.0,0.0,2022-01-10T14:49:34Z,0.9998447895050049
796.0,My 20 year old son and I are doing these daily with you. It has been such a bonding experience for us 💙 ThanQ!,UgzaU7807a8ckpOFXxR4AaABAg,0.0,20.0,2022-01-10T14:47:19Z,0.9986674785614014
797.0,"After a few years of missing yoga, I'm on day 9 and feeling better than I have been in a very long time. Thank you Adriene! 🙏♥️",Ugw8nvpWTdkShORhDvV4AaABAg,0.0,0.0,2022-01-10T14:45:26Z,0.9994699358940125
798.0,"You were right, Adriene, this WAS fun! 🥰",UgzatstcIz3HUifh2Nh4AaABAg,0.0,0.0,2022-01-10T14:44:15Z,0.9998443126678467
799.0,This may be one of my favorite practices !! So fun  i really enjoyed it,UgzKS7mwC_ulcBuFxxh4AaABAg,0.0,0.0,2022-01-10T14:42:31Z,0.9998657703399658
800.0,Yoga=Life--fall--accept--get back up--reset--try again! Thanks Adriene!!🙏❤ PS - I just know that soon you are gonna break into an Itty bitty song or two soon!! 👍👏❤,UgwEHkW7wAFzP5eZw8t4AaABAg,0.0,0.0,2022-01-10T14:42:09Z,0.82746821641922
801.0,Thank you! Love you all! Greetings from Caracas 😘,UgxBkqmVgEe1F1phJHB4AaABAg,0.0,0.0,2022-01-10T14:41:06Z,0.9998683929443359
802.0,"I actually felt a little pushed for time today, but so pleased I did the practice, feel much better. You make everything beautiful Adriene, thank you. It is like being read poetry while we move, you have a generous heart 💕",Ugwg4KtJlxpVou2s5SB4AaABAg,0.0,0.0,2022-01-10T14:39:10Z,0.9998754262924194
803.0,💖,UgxY08UC5Im0Oq3DkKB4AaABAg,0.0,0.0,2022-01-10T14:38:47Z,-0.6970567107200623
804.0,"I have a lot of trouble keeping my foot at the top of my leg on tree pose.  It keeps sliding down.  Any helpful tips?
Thanks.",Ugx3c2XaoiZW0f74N7h4AaABAg,0.0,0.0,2022-01-10T14:38:28Z,-0.9869431257247925
805.0,I adored this practice today because it allowed me to make a space for myself that doesn't demand perfection.,UgxFUu7Osuc3dUcMDKV4AaABAg,0.0,0.0,2022-01-10T14:36:48Z,0.9944338202476501
806.0,So proud to be here on day 9!  Almost missed yesterday's rest practice bc being still and moving slowly is such a challenge for my mind.  What got me to the mat was thinking of this amazing community and the journey that we are all on.  This is my 4th year of practicing yoga (exclusively with YWA & Benji) and I am so inspired to show up day after day for myself in ways that i never had in life.  Thank you everyone that fills this group with soul and thank you Benji for always being adorable.,UgzBqgCPpx-CXTP2EQ14AaABAg,0.0,0.0,2022-01-10T14:34:39Z,0.9997971653938293
807.0,♥️ the balance poses. Adriene you have a wonderful gift that you share with us. Thank you for encouraging us to just give it a try—not to be perfect just what we can achieve this time with the thought that next time we will progress. I know my body is stronger and more flexible since I began 10 years ago. Muchas gracias y abrazos fuertes. Espero que tu mamá sigue bien.,UgwMsxMTEcvf_-LzicB4AaABAg,0.0,0.0,2022-01-10T14:33:13Z,0.99983811378479
808.0,a lovely way to begin the day. ahhh.,UgyaQcE6nNW0LhjcrFd4AaABAg,0.0,0.0,2022-01-10T14:32:33Z,0.9998661279678345
809.0,"I just want to say a huge huge THANK YOU to the whole amazing, wonderful and supportive community! It's nice to know that such wonderful and incredibly unique people are around! I'm genuinely grateful and thankful to each and every one of you, YES, that's right, everyyy single one of you! Thank you wholeheartedly for showing up! Also, I'm grateful to the Universe for having you both in our lives, Adriene & Benji! You are a real blessing! 🦋🌻🦋

Wishing you all a rock 'n' roll time of day!",Ugxw6bHjArI0DWJq_Mx4AaABAg,3.0,333.0,2022-01-10T14:31:09Z,0.9998722076416016
810.0,Loved today when my 6 month puppy Scout got curious about what mom was doing.,UgypzMdvFPRaQ02TVgN4AaABAg,0.0,0.0,2022-01-10T14:20:55Z,0.9996260404586792
811.0,I’m having a blast practicing together with all these beautiful people! Today is my Birthday! What a precious gift to myself! Thanks Miss Adriene! 😊❤️,UgzMDjdWj0p-RzgXDrR4AaABAg,0.0,0.0,2022-01-10T14:20:21Z,0.9998645782470703
812.0,"I almost didn’t show up to today’s practice because I was overwhelmed by all I had to do today. Then I remembered how just 20 minutes with “Move” can change the trajectory of my whole day!! Sending so much love to all of you, I am proud of all of us who showed up today ❤️",UgwYzbtr_VjZG6J51Qd4AaABAg,3.0,316.0,2022-01-10T14:18:21Z,0.9993382096290588
813.0,I think you should officially change the channel name to Yoga With Adriene and Benji! 🤍,UgxU2wjCk3Tjzlj3eO54AaABAg,0.0,1.0,2022-01-10T14:12:28Z,-0.9971217513084412
814.0,"Yum yum yum. Love these! Feeling so good! Thank you, Adriene & global yoga lovers!",UgyFh_IwVcTzf-CgAdV4AaABAg,0.0,0.0,2022-01-10T14:09:43Z,0.9998732805252075
815.0,❤❤❤❤❤❤❤❤❤,UgzXwbYP8jt8x0aDQe14AaABAg,0.0,0.0,2022-01-10T14:07:41Z,-0.6970567107200623
816.0,Thank you for this practice today Adrienne. It helped me release in ways I was not expecting. I currently have my father living with me who has Alzheimer’s disease.  I’ve made a point to commit to this program everyday to help me stay grounded but its also helping release my pain as well. Your service to your community is beautiful.  Thank you 💕,UgxqqtidC8PEn3x9o1Z4AaABAg,0.0,1.0,2022-01-10T14:07:40Z,0.999804675579071
817.0,"I was very resistant to looking up in tree and disturbing my ""nailing"" the pose, but I gave in. Of course, I fell over. The giggling and feeling of joy surprised me! It was a welcome reprieve for the compulsion to always do things ""the right way"". I am very curious about exploring more of that ease and fun. :)",UgwhlbyA6GuaSSJ7Enp4AaABAg,0.0,0.0,2022-01-10T14:15:23Z,0.9994708895683289
818.0,love Adriene but I do not want to pulse during yoga,UgyH3a0Us9rf-icMwi54AaABAg,0.0,1.0,2022-01-10T14:02:26Z,-0.9229934215545654
819.0,"In addition to this challenge, I am walking with a friend during a 14 day meditation challenge in another app.  Today's practice in that space was all about inviting others along for the journey to support us, no matter if they are in our physical space or not.  I couldn't help but think of this community.  How beautiful is it that there are thousands of people actively seeking to heal, to love, to make space?  How powerful is it that we are working together in this way?  It's so easy to look at the world and see all the division, all the fear.  So easy to look at our neighbors and our partners and see them for what they don't provide us, what they can't be.  But if we let go of that fear for a bit, if we get curious about each other and let each other in, magic happens.

Grateful for all of you.  By doing this practice, not only are you serving yourselves, but everyone else you come in contact with.  Keep showing up.",UgzgXphtWSSR9p7qObx4AaABAg,0.0,1.0,2022-01-10T13:56:04Z,0.9993757605552673
820.0,"Day 9
Great morning and great practice.
I have a lot of energy to begin a new week with you and all of us who are doing this journey.
Thank you ❤️
Namaste",UgzIphjknstS8QfIk6p4AaABAg,0.0,0.0,2022-01-10T13:54:49Z,0.9998636245727539
821.0,"Day 9 ❤️💜❤️ fine as wine 🍷 
Thank you Adriene!",UgwEURjj77OwoIr1wpt4AaABAg,0.0,0.0,2022-01-10T13:54:41Z,0.9996412992477417
822.0,Day nine ...feeling so fine!,UgzxnTo1PG5B5oFrxWd4AaABAg,0.0,0.0,2022-01-10T13:54:30Z,0.9998471736907959
823.0,Wonderful practice today!  Thank you so much for this yoga journey.,UgzMXTc9WlVUnCxGfZx4AaABAg,0.0,0.0,2022-01-10T13:53:37Z,0.9998793601989746
824.0,Thank you 💗💗💗,Ugzo8iOdl3nusC3nLqt4AaABAg,0.0,0.0,2022-01-10T13:50:09Z,0.9998127818107605
825.0,Give yourself permission to fall..so beautiful ❤️,Ugw-rfg4x0fM_ctbZ_V4AaABAg,0.0,0.0,2022-01-10T13:49:05Z,0.998954176902771
826.0,"Today I laughed at myself.  At the position of the tree, we place the foot, it falls, we place the fall until it is finished with that same position.  I watched in the mirror as I placed my foot down, how to raise my hands when they were busy putting their foot back.  But I didn't stop until Adriane changed to the next position.🤣🤣🤣",UgxOA_-kTv7qyXDuBC54AaABAg,0.0,0.0,2022-01-10T13:48:14Z,0.961670994758606
827.0,"Loved this practice. Also, I am in the love with the music theme for this month! It reminds me of the music from my favorite video game, haha",UgyK0RF-woqj8EszlAJ4AaABAg,0.0,0.0,2022-01-10T13:47:18Z,0.9998675584793091
828.0,What are you curious about?,UgwuFRLcFS2QmYYW2pp4AaABAg,1.0,0.0,2022-01-12T04:09:11Z,0.9927956461906433
829.0,14:53 for Benji’s side eye. 😂,Ugwb8Jy2nBhpvNRFMFx4AaABAg,0.0,0.0,2022-01-10T13:43:57Z,0.918886125087738
830.0,"Day 9 Curiosity: My thighs definitely felt it in the beginning during the entire sequence in the table top position, a new sequence again. Feeling shivers there :D Looking forward to the new vocabulary in the upcoming days. Yay!",UgyRp2pZ25zgIdrl4594AaABAg,0.0,0.0,2022-01-10T13:42:27Z,0.9945888519287109
831.0,this was my first time doing the practice in the morning lol! I’m so used to doing it so late at night but this was a nice way to start my day,UgyjDEYbFSFYb6yitAd4AaABAg,0.0,3.0,2022-01-10T13:39:49Z,0.9985505938529968
832.0,"Beautiful practice and so enjoyable..
Thanks Adriene 🌸💚",Ugz0EETbUI11cRzOaEZ4AaABAg,0.0,0.0,2022-01-10T13:39:11Z,0.9998894929885864
833.0,Thankful to be here on Day 9 🙏🏻❤️,UgxFS6LZTlDxLN5dveZ4AaABAg,0.0,0.0,2022-01-10T13:38:29Z,0.9992014765739441
834.0,"So, ten days in to 2022 and it is already feeling overwhelming for me. So having this space keep me grounded and reminded me that if I stay focus, center and curious, it could be a good year. Gracias Adriene.",UgxkmY5VANCgA7SlI-h4AaABAg,0.0,3.0,2022-01-10T13:38:07Z,0.999089241027832
835.0,Here for day 9!,UgwNDNaAbZotAXfICqN4AaABAg,0.0,0.0,2022-01-10T13:37:50Z,0.9966530203819275
836.0,I'm feeling grateful for the opportunity to be apart of this🙏🧘🏼‍♀️ Day 9 💜✌,UgzI8SX-sacwUQt4pZB4AaABAg,0.0,0.0,2022-01-10T13:37:09Z,0.99899822473526
837.0,"Adriene, you were right on the money, today it was hard to commit to class.  I did it and felt great to start the day. Thanks for the inspirational words during the session.",Ugx2_embH340YZGNMkB4AaABAg,0.0,0.0,2022-01-10T13:36:04Z,0.9993056058883667
838.0,"Loving MOVE and I find it quite challenging.  Thank you Adriene, you are the bees knees.",UgyFqyJ1PgEddt9vNp14AaABAg,0.0,0.0,2022-01-10T13:35:40Z,0.9998563528060913
839.0,I have loved every day of this journey and really appreciate the different focuses of each practice.  I wonder if you could recommend a quick warm up video to do prior?  I often do these first thing in the morning and need a little warm up stretch first :),Ugy2sbkBXhnJAbrGrpF4AaABAg,0.0,0.0,2022-01-10T13:32:30Z,0.9993728995323181
840.0,Curiosity in you got the curiosity in me good.  Thnx,UgzELedbglGvL6fqmGZ4AaABAg,0.0,0.0,2022-01-10T13:31:38Z,0.9935571551322937
841.0,I was not really wanting to get on my mat this morning after two bad nights of sleep and so much to do but your comments were so motivating. Thank you!,Ugz-nRr4fgm70m0qTHZ4AaABAg,0.0,0.0,2022-01-10T13:28:27Z,0.9988694787025452
842.0,Day 9 ✔️,Ugw0KlrEvIToHkyqa3x4AaABAg,0.0,0.0,2022-01-10T13:28:12Z,0.9003716707229614
843.0,senior citizen check in: fire hydrant pose is really a thing I googled it lol. namaste Larry in FLA,UgwiZyyotcXX1ujr_JZ4AaABAg,0.0,2.0,2022-01-10T13:27:53Z,-0.9968137145042419
844.0,Thank you adriene ♥️♥️ i enjoyed it so much,UgxDzH_R8n94hIW-f9N4AaABAg,0.0,1.0,2022-01-10T13:27:12Z,0.9998400211334229
