1000,comment,Prequalified sentiment,Information,Opinion,Advice,Impression,Progress,Exercise,Body,Video,Length,Reviewer
1872,"Really needed this today since I am in the process of trying to heal from an allergic reaction which gave me the hives - very itchy and annoying.  As I practiced with you this morning, I visualized the itch leaving my body!",-0.9964414239,-0.60,0.70,0.00,0.80,0.80,0.00,-0.80,0.60,223,D
1873,"Adriene: ¨Breath in....pause...empty it out slowly...""
Me (in Dallas): ¨AAAAhhhh-chooooooo!¨",-0.9996134639,-0.50,0.00,0.00,0.60,0.00,0.50,-0.60,0.60,92,D
1874,I love you Adriene,0.9998341799,0.60,0.70,0.00,0.50,0.00,0.00,0.00,0.70,18,D
1875,I felt the love today and boy did I ever need it.  Thank you so much for the opportunity to heal in this beautiful practice today. Sending so much love.,0.9998543262,0.70,0.60,0.00,0.80,0.00,0.40,0.80,0.80,152,D
1876,"What a wonderful session, needed  this relaxing one today, thank you Adrienne you are wonderful 😍",0.9998832941,0.60,0.70,0.00,0.70,0.00,0.60,0.00,0.70,98,D
1877,"When Adriene said to blanket yourself in love, these great heaving sobs came up from my toes and I just ugly cried through the rest of the practice. This practice has been helping me to bring deep inner healing. I am so grateful to have found this tribe! You are my people!!!",0.9722147584,-0.40,0.60,0.00,0.70,0.60,0.60,-0.60,0.70,275,D
1878,"Thank you, thank you, thank you, thank you, thank you, yummers!!",0.9998711348,0.20,0.70,0.00,0.70,0.00,0.00,0.20,0.50,64,D
1879,"Wow, this was amazing! Great practice! Made me cry a lot and also made me feel great! Thanks Adriene for this program and for this practice!",0.9998670816,0.60,0.70,0.00,0.60,0.00,0.00,0.60,0.70,140,D
1880,Namaste 🙏,-0.8081023097,0.00,0.40,0.00,0.60,0.00,0.60,0.00,0.60,10,D
1881,With some delay but I couldn't miss it. I am very new to your channel but it is love from the first sight.  I am thinking to change my yoga mat. The one I have now is not good for my sweaty hands. May I ask you to suggest a brand? Or maybe share features which a good mat should have? Thank you,-0.9917684793,-0.40,0.70,0.80,0.60,0.00,0.00,-0.40,0.60,294,D
1882,"Would be nice to do longer sessions, 25 minutes of joy with Adriene is not enough!",-0.9990971088,-0.60,0.40,-0.60,-0.30,0.00,-0.60,0.00,-0.50,82,D
1883,Been meditating regularly for the past year. I was today years old when I realized how meditative yoga is. #lostinthebreath,-0.9626719952,0.60,0.00,0.00,0.50,0.60,0.50,0.40,0.00,123,D
1884,Good Morning! Appreciate this practice today (always)!! TYA ❤,0.9997621179,0.00,0.60,0.00,0.70,0.00,0.30,0.00,0.70,61,D
1885,Shout out to anyone else who has started this series while they’re in quarantine.  Thank you Adriene for helping me stay calm and fit during these crazy times.,0.9993779659,0.50,0.00,0.50,0.70,0.30,0.00,0.00,0.70,159,D
1886,Thank you Adriene 🧘🏼‍♀️,0.9997859597,0.20,0.70,0.00,0.70,0.00,0.00,0.20,0.50,25,D
1887,thank you for this practice !! showing up on the mat has been hard these last days but I'm proud of myself for not giving up ! I hope everyone is doing well <3,0.9998207688,-0.40,0.70,0.00,0.70,0.60,0.00,-0.30,0.50,159,D
1888,You bring LOVE as the most powerful tool to live with and that makes me feel Imma good person,0.9997978806,0.60,0.70,0.00,0.80,0.00,0.00,0.00,0.70,93,D
1889,"I remember my first pigeon pose about 3 years ago and how difficult it was! I often feel like I don't really make progress but after today I realise how much more flexible I am! Pigeon is easy now! Love you Adriene, thanks for saving my life last year with Dedicate!! ❤️",0.9992194176,0.60,0.70,0.00,0.80,0.70,0.60,0.00,0.60,270,D
1890,"I hurt my lower back due to inactivity this year and it was the scariest, most painful four weeks I’ve ever experienced. I’m better now and want to get back to my daily practise to ensure it doesn’t happen again. I’m ready to start the new year the right way.",-0.5602791905,-0.70,0.00,0.00,0.50,0.60,0.00,-0.80,0.00,259,D
1891,"Hello. I saw you in my news feed. I always wanted to do yoga but I don't know if a beginner would be able to do this challenge.

What time in the day is best to do the yoga?",-0.9647171497,-0.30,0.00,0.80,0.60,-0.40,0.00,0.00,0.00,173,D
1892,will it be posted on youtube free,-0.9620818496,-0.40,0.00,0.60,0.00,0.00,0.00,0.00,0.30,33,D
1893,I’m so excited for this! 💗😌,-0.9806320667,0.60,0.70,0.00,0.60,0.00,0.00,0.00,0.70,29,D
1894,Thank you so much for this i just started to get into yoga again 💕💕💕,0.9990832806,0.40,0.50,0.00,0.30,0.40,0.00,0.00,0.60,71,D
1895,I’m breathing and I’m IN. Looking forward to many more breaths together ❤️,0.9995574355,0.50,0.60,0.00,0.40,0.60,0.00,0.40,0.40,74,D
1896,"Feeling overexcited to start off 2021 with you. Since lockdown I have religiously done yoga with you and that has been a life changer ❤️. I was about to do the Home yoga journey again, I loved this one so much. Love from France 🇫🇷 Thank you Adriene for your generosity. 💙🤍❤️",0.9997505546,0.60,0.70,0.00,0.50,0.70,0.00,0.60,0.50,278,D
1897,"This is such a perfect time with all that is going on right now in the world and my final exams coming, I need this so much ❤️",0.9994470477,-0.40,0.70,0.00,0.60,0.40,0.00,0.00,0.50,126,D
1898,"I've been waiting for the announcement, this will be my first year doing it live and I'm so excited !! Did Home in November, currently doing Dedicate right now, so it's perfect timing! Thank you Adrienne !",0.9998626709,0.80,0.60,0.00,0.60,0.70,0.00,0.00,0.60,205,D
1899,"Adriene after so many years I consider you a friend! Looking forward to welcoming 2021 with you, Benji and all the friends here.
We especially need it now with quarantine, that we don't meet any friends...
Thank you very much for your kind offer! I hope 2021 will be a happier year!",0.9996848106,0.70,0.60,0.00,0.60,0.70,0.00,0.00,0.80,282,D
1900,Namasté from Sarawak 💕,-0.8933899403,0.00,0.40,0.00,0.60,0.00,0.60,0.00,0.60,23,D
1901,I can’t wait for the first yoga video. I’m watching from China but I’m from Colombia.,-0.9737457037,0.40,0.00,0.00,0.50,0.40,0.00,0.00,0.40,85,D
1902,"Hey guys I have a question for you all. I’m thinking about giving the high intensity workouts a rest for a while as I keep hurting my lower back. I do yoga maybe once every few weeks but I’m thinking about doing it every day. For all you yogis does yoga help strengthen and tone the body as if you were using weights or doing high intensity workouts? I was thinking about for cardio riding my stationary bike in the morning and then doing yoga in the afternoons To keep a good balance of cardio and strength. someone told me that the reason I keep hurting my lower back is that maybe because my abs are not strong enough. They also said that yoga is very good in building core muscles is this true? All I know is things to Covid and losing my job I have had no motivation to really work out and the high intensity workouts, when I do go to do them they just seem to hurt me. Thanks for your help",-0.9953867793,-0.40,0.40,0.80,0.50,-0.20,0.40,-0.50,0.00,895,D
1903,Is this suitable for beginners/borderline intermediate?,-0.9195403457,-0.30,0.00,0.70,0.00,0.00,-0.40,-0.50,0.00,55,D
1904,I'm so excited!,0.9997951388,0.40,0.20,0.00,0.60,0.40,0.00,0.00,0.30,15,D
1905,"YAYYYYYYYYY - loving you all from Bellingham, Washington",0.999763906,0.60,0.40,0.00,0.60,0.00,0.00,0.00,0.00,56,D
1906,"Love from Vence on the Côte d'Azur, France",0.9997971654,0.60,0.40,0.00,0.60,0.00,0.00,0.00,0.00,42,D
1907,Hello from Canada!,0.9995488524,0.60,0.00,0.00,0.30,0.20,0.00,0.00,0.30,18,D
1908,Keeping track of my days. Day 4 today!🧘🏼‍♀️🧘🏾🧘🏻‍♂️ 😇🥰you can join in by liking my days which you’re on or commenting your days.🥳🤩🙏🏻😃😃😃🤸🏻🏃🏻‍♂️🙏🏻🙏🏻,0.9968351722,0.50,0.00,0.40,0.60,0.80,0.00,0.00,0.50,168,D
1909,"Bom dia! I am practicing from South Dakota (yikes). This 30 day yoga journey has been giving me something to look forward to. Thank you Adriene, for this wonderful gift to kick off 2021. You have physically, mentally and spiritually guided me through this last year. I have so much admiration for you and I am grateful for your beautiful presence in my life. See you on the mat!  Namaste.",0.9998301268,0.80,0.70,0.00,0.60,0.70,0.00,0.00,0.60,388,D
1910,☀️,-0.6970567107,0.00,0.50,0.00,0.70,0.00,0.00,0.00,0.70,2,D
1911,had to do some different breathing at the beginning as i'm currently suffering with a good old winter cold! hahaha.....,-0.9942684174,-0.40,0.00,0.00,0.60,0.00,0.00,-0.60,0.00,119,D
1912,My cat got the zoomies in the middle of the practice. I may have to redo this one 😅,-0.9984862804,-0.40,0.00,0.00,0.00,-0.30,0.00,0.00,0.00,84,D
1913,As a beginner I just grow more and more frustrated doing this series.,-0.9997268319,-0.80,-0.70,0.00,-0.90,-0.80,-0.60,-0.60,-0.70,69,D
1914,"day 9! this one was fun but hard! i can already feel myself getting better, though :)",0.8256834149,0.60,0.40,0.00,0.70,0.70,-0.30,0.60,0.70,85,D
1915,Love a good Sunday pranayama practice! Thanks for this. 🙌,0.9998394251,0.60,0.60,0.00,0.30,0.00,0.00,0.00,0.40,58,D
1916,Today I dedicate my practice to creativity and balance practice!,0.9964455962,0.70,0.00,0.00,0.60,0.50,0.00,0.00,0.60,64,D
1917,Day 9 ✅✋🏻🤛🏻🤟🏻✌🏻🙏🏻❤️,0.9003716707,0.30,0.40,0.00,0.00,0.70,0.70,0.00,0.00,27,D
1918,I loved your suggestion to push off through the standing leg (not to collapse into it) when flying back into airplane. It really helped me find a stronger foundation and balance for a longer time.,0.9990376234,0.70,0.40,0.50,0.70,0.00,0.80,0.60,0.60,196,D
1919,Exact what I was needed to day 🧘🏼‍♀️🤸🏽‍♀️🙅🏼‍♀️♥️⚖,0.8390020728,0.70,0.50,0.00,0.60,0.00,0.30,0.50,0.70,55,D
1920,🖤🖤🖤🖤🌺🌺🌹🌹🌹,-0.6970567107,0.00,0.50,0.00,0.70,0.00,0.00,0.00,0.70,18,D
1921,Oof. My collarbone feels stuck after this 😬. I didnt feel like I was pushing anything against pain and was having a good time. So confused just now,-0.9667829871,-0.40,0.40,0.00,-0.60,0.00,0.30,-0.60,0.50,148,D
1922,"Benji remained unfazed by the ""Boot, Scoot, and Boogeying""! 😂🐶🤠💛🎶",-0.9865684509,0.00,0.00,0.00,0.60,0.00,0.60,0.00,0.70,70,D
1923,Any tips on improving balance?,-0.9976997972,0.00,0.00,0.80,0.00,0.00,0.00,-0.30,0.00,30,D
1924,"Thank you so much for this practice Adriene! I have committed to your 30 day challenges before, and for one reason or another I didn't follow through. The first, I don't complete until months later. The second, I finished in under 2 months. This time, I'm showing up everyday even on my hardest days. I have to because I need to rebuild a discipline within me, that once came so easy. Thank you again for this. I'm grateful for your presence in my life. 

By the way, I enjoyed the Boot Scootin' Boogie singing. I'm from San Antonio, but moved to Colorado a year ago. It truly helped me reconnect to my roots. 😉💜 You can take the girl out of Texas but you can't take Texas out the girl.",0.9992341995,0.70,0.80,0.00,0.60,0.80,0.70,0.40,0.70,688,D
1925,day 10! so grateful for these videos and this community!,0.999546349,0.70,0.00,0.00,0.60,0.80,0.00,0.00,0.70,56,D
1926,"Yesterday I was super unmotivated to start day 9, I´ve done it in the evening because I knew I would regret this the next day. Today I just finished day 10 and its not even 10am. I´m proud that I finally get there to force myself to keep on track",0.9949547648,-0.50,0.60,0.30,0.60,0.80,0.00,0.70,0.60,246,D
1927,I like the way we can hear 👂 your heartbeat 💓 in this one!,0.9989426732,0.50,0.60,0.00,0.60,0.00,0.00,0.00,0.60,60,D
1928,loved it! grattitude for what you give an receive! Thank you!,0.9998703003,0.20,0.70,0.00,0.70,0.00,0.00,0.20,0.50,61,D
1929,Yay! Knocking on heaven’s door! My fave!,0.9936129451,0.60,0.70,0.00,0.60,0.00,0.80,0.00,0.70,40,D
1930,"Today I did a lunch time practice instead of my typical late evening practice before bed. I am struggling with working from home as it always seems like there's a million important things on my mind and I get overwhelmed, maybe this will help with my focus and productivity.",-0.7349458933,-0.60,0.30,0.30,0.50,0.00,0.00,-0.40,0.60,274,D
1931,Does anyone else have trouble getting their foot up to the lunge from downward facing dog? Any tips would be appreciated :),-0.9304280281,-0.60,0.30,0.90,-0.20,0.00,-0.30,-0.70,0.00,123,D
1932,"I had such a bad day and wanted to skip today's practice. Then I thought, if I don't show up for myself, who will? So here I am, thank your Adriene ❤️",-0.9951530695,-0.60,0.70,0.00,0.00,0.60,0.20,-0.30,0.60,150,D
1933,Almost overslept and missed my chance for the morning.  Helped me get up and moving for sure.,-0.9926613569,-0.40,0.40,0.00,0.60,0.00,0.00,0.60,0.60,93,D
1934,My flow doesn't really flow but I'm trying and that's all I can do.,0.9967330694,-0.60,0.50,0.00,0.70,0.00,0.00,-0.50,0.60,67,D
1935,Yay! I'm at that 'place' now where I really look forward to coming to the mat at the end of my day - I can't imagine not practicing with Adriene every evening now xx,0.993868649,0.70,0.60,0.00,0.60,0.80,0.00,0.60,0.70,165,D
1936,Hi to everyone doing this journey in September 2021! This is a video I will come to again and again; I love a classic flow like this.,0.9998476505,0.60,0.60,0.00,0.70,0.00,0.60,0.40,0.70,133,D
1937,This one was great! I really enjoyed the flow moving from one into another because it kept me focused and helps me dive deeper into the practice.,0.9998605251,0.00,0.60,0.00,0.60,0.00,0.60,0.00,0.70,145,D
1938,serious  moves !!!! love the hip exercises. Namaste Adriene,0.9998255372,0.30,0.60,0.00,0.60,0.00,0.80,0.00,0.60,59,D
1939,"I feel I’m struggling to find who I am with Long Covid, that sporty, energetic, social person I was, I can’t be and it’s rock hard. This session brought tears and release. Thank you A & B & community.",0.9997363687,-0.90,0.60,0.00,-0.60,0.00,-0.60,-0.80,-0.60,200,D
1940,❤️,-0.6970567107,0.00,0.50,0.00,0.70,0.00,0.00,0.00,0.70,2,D
1941,Made it to the mat today but not feeling as strong. Yesterday’s practice wiped me out so today I had to modify. Glad I showed up today and glad you all did too 🙏🏽❤️,-0.9842459559,-0.70,0.30,0.00,0.30,0.40,-0.40,-0.60,0.40,166,D
1942,Could not keep up with any of this from day one. Is there a beginners class for someone whose never done yoga with not so great knees?🙄,-0.999437511,-0.90,0.00,-0.60,-0.70,-0.80,-0.90,-0.80,-0.60,136,D
1943,Day 12 I cried ✨,-0.9652878046,0.30,0.40,0.00,0.00,0.70,0.70,0.00,0.00,16,D
1944,Excellent class Adriane... Lovely time NAMASTÉ 🙏💕,0.9997385144,0.00,0.70,0.00,0.60,0.00,0.70,0.00,0.70,51,D
1945,"I’m having a bit of a tough day with stress and worry today, so it was good to just breathe and feel for awhile so I can try to get off my mat lighter. I’ve really grown to love poses that need more focus, like holding the plank, when I’m in this kind of headspace as it just gives some relief from my thoughts which is so welcome.",0.9990837574,-0.60,0.60,0.00,0.70,0.50,0.80,0.70,0.60,331,D
1946,good 1,0.9998238683,0.60,0.70,0.00,0.70,0.00,0.00,0.00,0.80,6,D
1947,For an 18-minute practice it was a tough one! I'm still quite thankful for it.,0.9991099238,-0.40,0.70,0.00,0.60,0.00,-0.70,0.00,0.00,78,D
1948,"Day 12 very deep and relaxing. Touching words Adriene 👁 👄 🙏🏻 ❤️ “May we always see the truth, speak the truth, feel the truth.”",0.9997550845,0.00,0.70,0.00,0.80,0.00,0.60,0.00,0.80,131,D
1949,"Did today's practice in my undies, felt super freeing!",0.9908066392,0.70,0.70,0.30,0.80,0.00,0.60,0.80,0.70,54,D
1950,💕🕊,-0.6970567107,0.00,0.50,0.00,0.70,0.00,0.00,0.00,0.70,4,D
1951,Anybody else get some extra spinal flexion in today cleaning their mat? 😅🧽,-0.9950585365,-0.60,0.00,-0.60,-0.70,0.00,-0.40,-0.80,0.00,76,D
1952,"One of the night squads.. Done! As a Filipino, squat comes easy (for me anyway), but full boat pose is very shaky!",-0.9990221262,0.60,0.00,0.00,0.50,0.20,-0.60,0.50,0.40,114,D
1953,"Haiku for Day 13
years ago first boat
had me feeling weak, seasick
now I’m a captain",-0.9791619778,-0.40,0.40,0.00,0.60,0.70,0.00,0.00,0.60,84,D
1954,Another great practice! 🙏,0.9988910556,0.20,0.70,0.00,0.70,0.00,0.60,0.00,0.50,26,D
1955,Thank you adriene. I didn’t start my day happily but then i decided to join you and all the people doing this yoga practice and now i feel really good. Wish me luck everybody. Love from Min ❤️,0.9998713732,-0.30,0.60,0.30,0.80,0.00,0.60,0.70,0.70,192,D
1956,:)))  Love this journey :>>>>>,0.9997119308,0.60,0.70,0.00,0.50,0.70,0.00,0.00,0.70,30,D
1957,Beautiful 🌸 thank you so much,0.9998737574,0.20,0.70,0.00,0.70,0.00,0.00,0.20,0.50,30,D
1958,thank you.,0.9998457432,0.20,0.70,0.00,0.70,0.00,0.00,0.20,0.50,10,D
1959,"Thank you for today's practice, Adriene! Tomorrow I have an exam and I've been working on my project all day and barely slept few hours so this practice felt like a gift! ❤️ I'm feeling so light after it. Sending positive vibes to all the people doing this daily challenge!!",0.9997313619,-0.40,0.80,0.40,0.70,0.30,0.70,0.60,0.90,274,D
1960,Day 359 in books ❤️,-0.8799270988,0.30,0.40,0.00,0.00,0.70,0.70,0.00,0.00,19,D
1961,Aww the lil benji on the side bar 😍,-0.976616025,0.00,0.60,0.00,0.50,0.00,0.00,0.00,0.70,36,D
1962,"So, I'm pretty exhausted because of my depression. Just, you know, one of those days when you stare at the wall and wonder why the hell you're so fucking exhausted and you begin to think you'll get stuck in this powerlessness and tiredness forever. Insomnia doesn't help to fight this feeling either. 
And when I saw this 36-minute-long video I thought to myself ""no way, not today"". I just wanted to lay in bed forever and sleep, because that's the closest state to being dead that I can get like NOW. But I remembered Adriene saying ""a little goes a long way"" so I decided just to press start and do like 2 minutes. During the practice I was like ""I'm so done with this, I can't"" but then something changed and I caught myself... smiling. And then, the video ended.
I've survived this day and done a 36-minute-long yoga session with Adriene. Yep, I guess I'm a hero now :D",-0.9919803143,0.70,0.00,0.00,0.00,0.00,0.00,-0.50,0.70,874,A
1963,My creaky old floor misses your creaky old floor.,-0.9995538592,-0.60,0.00,0.00,-0.50,-0.50,0.00,0.00,0.00,49,D
1964,This was the best so far. I feel well spaced 😜 and ready to face the day. Thank you 🙏,0.9998480082,0.30,0.70,0.00,0.60,0.40,0.40,0.70,0.80,87,D
1965,What a learning journey we are all on - best of all there’s more than two weeks of further growth opportunities to look forward to 😃 Thank you so much Adriene 💝,0.9997357726,0.60,0.70,0.00,0.70,0.80,0.00,0.00,0.70,162,D
1966,<3 sweat and <3,0.7867066264,0.00,0.50,0.00,0.30,0.00,0.00,0.00,0.70,15,D
1967,"The theme was space, where were the Star Trek jokes?!?!  Seriously though, the practice was great today.",0.9994918108,0.00,0.70,0.00,-0.40,0.00,0.70,0.00,0.60,104,D
1968,My favorite class so far!! I love love love this practice and the whole 14 days so far. Can’t wait to get to day 30 ❤️,0.9998187423,0.60,0.60,0.00,0.70,0.60,0.70,0.00,0.80,118,D
1969,"Thank you so much for 14 wonderful days of BREATH yoga. I love your word picture prompts for poses (beach ball, angel pose, tick-tock, etc.). They really help me with the postures as I don't feel like I have to keep looking at the scree.. I soooooo look forward to your classes. Thanks for the love and positive energy!",0.9998580217,0.70,0.80,0.00,0.70,0.60,0.70,0.00,0.70,319,D
1970,"Thank you for repeating sequences from prior videos on this journey as we get more dynamic! My son woke up just as we were going into shavasana so he chattered away while I laid there, gotta take it as it comes!",-0.5778478384,0.60,0.70,0.00,0.60,0.80,0.70,0.00,0.00,211,D
1971,Today's practices helped me let go of something I carried around.,-0.9924449325,0.60,0.60,0.00,0.70,0.80,0.60,0.30,0.80,65,D
1972,Anyone else having shoulder problems. I am and the friend I am doing it with is. What are we doing wrong?,-0.9890317321,-0.70,0.00,0.80,-0.80,-0.60,0.00,-0.80,0.00,105,D
1973,"I'm entering a new year of my life today, so the theme of this was very fitting. :) It was a difficult one for me, but I made it through. Also on a proper yoga mat that I got today, so far I've been using some sort of fitness mat that was pretty ""slippery"".",-0.9592329264,-0.60,0.50,0.00,0.60,0.60,-0.40,0.30,0.40,257,D
1974,Thank you so much A,0.9998582602,0.20,0.70,0.00,0.70,0.00,0.00,0.20,0.50,19,D
1975,Loved the transition into warrior two! 🥰 Is Benji ok? 💕,0.9984734654,0.50,0.60,0.00,0.70,0.00,0.70,0.00,0.70,57,D
1976,"This is my 4th year of YWA and my first time doing the 30 day journey while pregnant (just started month 8 🤰🏻). I have been enjoying “Breath” so far, but today was my favorite day. You had all my favorites: knocking on heaven’s door, lion’s breath, and the high lunge/warrior sequence was yummy and fun. Can’t wait to continue the rest of the journey! 💕",0.9995724559,0.70,0.80,0.00,0.80,0.80,0.90,0.60,0.80,356,D
1977,thank you <3 :),0.9998194575,0.20,0.70,0.00,0.70,0.00,0.00,0.20,0.50,15,D
1978,Yay! Now at the halfway mark! Amazing accomplishment for everybody! Sending out lots of love! 💕 ❤️ 💗,0.999871254,0.60,0.70,0.00,0.80,0.80,0.00,0.40,0.60,102,D
1979,"Hi, I keep missing a day through a bad mindset and then I do a session and feel engerised and relaxed. Would anyone like to buddy up with me so I can be more consistent?",0.9992715716,0.60,0.60,0.50,0.60,-0.30,0.00,0.70,0.60,169,D
1980,🙏👍,-0.6970567107,0.00,0.50,0.00,0.70,0.00,0.00,0.00,0.70,4,D
1981,"I thought I understood why this one us called discipline, in those first few minutes, and then I really realized why as we progressed😄",-0.9875730276,-0.30,0.60,0.00,0.70,0.00,0.00,0.00,0.50,135,D
1982,Just what I needed before the school starts again 🧘‍♀️🤍,-0.9793917537,0.60,0.70,0.00,0.70,0.00,0.00,0.40,0.70,57,D
1983,"My smartwatch has this ""stress level"" indicator that gives values up to 100. During this practice, it went from 61 to 20. Just saying.",-0.9841496348,0.70,0.00,0.00,0.70,0.60,0.00,0.80,0.00,134,D
1984,"‘Whatever you’re coming on the mat with today, it’s all good, glad you’re here’. I felt my body lift a little as it heard this. I felt myself grow a little emotional, but I was smiling. Mindfulness to the breath goes... a long way and slowing it down makes you realise just how beautiful the breath really is ♥️",0.9996638298,0.80,0.60,0.00,0.70,0.70,0.00,0.60,0.70,311,D
1985,"Thanks so much! My friend and I do this series in transcontinental Zoom calls (she' in the US, I'm in Europe), and today she's stuck in a cabin with minimal space, so this was the perfect practice for us (and our sore abs). Thanks, Adriene, for all the wonderful inspiration and grounding!",0.9995307922,0.70,0.60,0.00,0.70,0.40,0.70,-0.50,0.80,289,D
1986,"Wonderful, mindful practice today (as it is every day!) Thank you, Adriene and Namaste!",0.9998891354,0.50,0.80,0.00,0.70,0.30,0.00,0.00,0.80,87,D
1987,I have that nice sleepy-can-hardly-hold-my-head-up feeling. what a wonderful sensation and definitely a video for the bed-time yoga playlist,0.9997811913,0.60,0.50,0.00,0.40,0.00,0.00,-0.40,0.80,140,D
1988,"Adriene, ""don't fidget here."" Meanwhile, I'm doing a happy dance, because 1 year ago when I started my personal journey with breath I was really struggling.  I was taking French horn lessons at the time and my mentor introduced the mantra, ""breathing is not weird."" This practice demonstrated how far I have come. Thank you!",0.999520421,0.70,0.70,0.00,0.80,0.90,0.00,0.80,0.70,324,D
1989,more than halfway through the month! This is going great! Thank you for these videos.,0.9998596907,0.60,0.70,0.00,0.70,0.80,0.00,0.00,0.80,85,D
1990,"Today I am 20 weeks into my pregnancy. I am late in this Challenge, because of pregnancy-not-feeling-well-days. And now I have to modify, I should not do any core exercises at this point anymore, what's feels like giving up and I'm frustrated because I love doing YWA practices :/ Maybe I can redoe the challenge after giving birth this summer. Still loving the calm of the videos.",-0.5401591659,0.60,0.80,0.30,-0.50,-0.60,0.60,-0.30,0.70,381,D
1991,Literally finished writing my thesis at 3:30 am and realized I still had to do my daily yoga practice. Best part is that it didn’t bother me at all,-0.9977738261,0.70,0.60,0.00,0.80,0.00,0.00,0.00,0.70,147,D
1992,"My internet glitched and I was exploring in tabletop position for about 5 minutes before I caught the video buffering. I thought ""wow, we're really going on an adventure"" lol.",-0.9803855419,-0.30,0.50,0.00,0.70,0.00,0.40,0.00,0.60,175,D
1993,If you are looking at this video and lacking the motivation: DO IT. Take it from a chronically ill person who will never be able to do anything like this video again - don’t take your health for granted. Check in on yourself. Do the video. Show up for yourself. Do it 🙏🏻♥️,-0.997477591,-0.70,0.30,0.80,0.60,0.00,0.30,-0.80,0.70,274,D
1994,"That was a tough one, I stopped in the middle then resumed. But, I showed up!",0.9881355762,-0.70,0.60,0.00,0.50,0.60,-0.50,-0.50,0.50,77,D
1995,"Explore...reminds me of one of my fave quotes
“WE SHALL NOT CEASE FROM EXPLORATION, AND THE END OF ALL OUR EXPLORING WILL BE TO ARRIVE WHERE WE STARTED AND KNOW THE PLACE FOR THE FIRST TIME.” –     T. S. ELIOT 💓",0.9868963361,0.60,0.00,0.70,0.60,0.50,0.00,0.00,0.60,212,D
1996,Thank you.,0.9998457432,0.20,0.70,0.00,0.70,0.00,0.00,0.20,0.50,10,D
