1000,comment,Prequalified sentiment,Information,Opinion,Advice,Impression,Progress,Exercise,Body,Video,Length,Reviewer
555,"What an awesome experience, I’ve been following Adrienne for almost 3 months now, worked through the challenge and now the camp, yoga became a permanent part of my daily routine and improved my mood and health tenfold. Can’t wait for tomorrow and the revolution",0.9997757077,0.70,0.50,0.00,0.30,0.50,0.00,0.00,0.70,261,C
556,"Today was day 30 of my sixth 30-day yoga journey with Adriene. It's been a few years of going on these journeys interspersed with Adriene's other videos in between. Today felt so freeing (and definitely emotional as all day 30s seem to be!) because for the first time on day 30, I barely looked at the video. I mostly free-styled and found what felt good. At one point when I was attempting crow hoping to get it today, I glanced over and Adriene was doing it too! That was cool. I kinda held it for a second but realized I'll have to keep working on it. Thank you SO much Adriene and the community for being such an important part of my life. Namaste. ❤️",0.9978372455,0.80,0.00,0.00,0.70,0.90,0.00,0.00,0.80,655,A
557,I just completed this yoga camp. I am also finding myself emotional about it. It was a fabulous experience and I plan to continue on with my practice. Adrienne thank you so very much to introducing me to the wonderful world of yoga!,0.9998694658,0.50,0.50,0.00,0.30,0.30,0.30,0.00,0.70,232,C
558,"Thank you Adrienne, I am really proud of myself and loved this series.",0.999874115,0.30,0.50,0.00,0.70,0.00,0.00,0.00,0.30,70,J
559,Fantastic in these awful corona times in Norway! Thank you for 30 wonderful days!,0.9998773336,0.00,0.70,0.00,0.80,0.90,0.00,0.00,0.80,81,J
560,just yummy👍🏾👌🏾,-0.7853990197,0.00,0.50,0.00,0.40,0.00,0.00,0.00,0.50,18,D
561,"I'm not sure if I just had a really long day but my mind and body were not connecting during the vinyasa. It's super hard for me to do the downward dog - leg lift - warrior pose transition. I fell, stopped watched the video tried again fell again and got super frustrated. Maybe I've just had a long day plus it's late a night 11:22 pm in NYC.  I don't know ugh help anyone ?",-0.9996708632,-0.70,-0.30,0.50,-0.30,0.00,-0.50,-0.60,0.00,375,C
562,Only thing I love about these videos is it keeps my client clam he loves your voice,-0.9951444268,0.00,0.50,0.00,0.00,0.00,0.00,0.00,0.50,83,J
563,"I'm so proud i made it to day 4,but my back is killing me though so i think that's where i get my motivation from,to release the pain :)",-0.9927191734,0.40,0.30,0.00,-0.20,0.30,0.20,-0.20,0.50,136,J
564,I love the rickety old floors!!!,0.9993607402,0.20,0.50,0.00,0.40,0.00,0.00,0.00,0.30,32,J
565,"I awaken my control and my motivation.
I'm a few days behind, but I'm so happy I have returned to the mat and are given these wonderful sessions. It's easy to give into temptations and lose sight of what is ahead, but falling into this routine has helped me relieve so much stress and has given me resolve to become the me I have envisioned.
Thank you Adriene!",0.9994433522,0.40,0.50,0.00,0.70,0.20,0.00,0.00,0.40,360,M
566,"Hey, Adriene! I started off my year in the best way possible, quitting my job and starting a new project and joining your yoga camp. Your mantras are on the spot! I am awakening passion in me and in everyone around me this year! Thanks for the inspiration! :*",0.9997603297,0.40,0.50,0.00,0.70,0.00,0.00,0.00,0.30,259,M
567,"Hey my name is Jennifer and I only started yoga 3 days ago because of your videos :-). I've got a lot of stress and Ms and people told me that yoga would be good for me. Every inch of my mussel  are hurting but it makes me feel a life :-) I don't do any other sport, so I hope it's okay for me to do it every day or is that to much? Maybe some people can give me some advice. X Jen",0.7661421299,-0.40,0.60,0.80,0.70,0.20,-0.30,-0.50,0.40,381,M
568,What a joyful practice today. It has awakened a massive smile in me. I will go out into my day and share the love.,0.9998755455,0.60,0.80,0.00,0.60,0.00,0.40,0.20,0.60,114,P
569,"It was so hard for me to do this practice today but I managed to finish it. I had a tough workout, tough day.",0.9847870469,0.30,0.40,0.00,0.60,0.20,-0.40,0.00,0.40,109,M
570,"Adriene : Don’t stop the video yet.

Me: How can I ever? Need the namaste and the serene music in the end ! 💕",-0.5606455207,0.20,0.00,0.00,0.60,0.00,0.00,0.00,0.30,110,M
571,talks too much!,-0.9876816273,-0.60,-0.90,-0.70,-0.60,0.00,-0.70,-0.60,-0.80,15,D
572,"Today I feel alive with pain! 
I’ve been doing YWA everyday for about 3 months, and today was really hard.
Actually it’s happening something wired, I found the low lounges being more difficult then a month ago. What am I doing wrong?",-0.9974116683,-0.50,0.00,-0.80,0.70,0.30,-0.50,-0.30,0.30,233,M
573,When you mis pronounced waist and said west you just pronounced  waist in arabic and i was like heads up 😂,-0.9920566678,0.20,0.00,0.00,0.70,0.00,0.00,0.00,0.30,107,M
574,"When you've had an incredibly stressful, taxing day and yoga is the last thing on your mind, it is probably the best thing for you and your sanity. Thank you for all the tranquility, strength, and acceptance this practice brings!",0.9997763038,0.20,0.50,0.00,0.70,0.00,0.40,0.00,0.20,229,M
575,great and really quite challenging today ........namaste,0.9998511076,0.00,0.70,0.00,0.80,0.00,0.00,0.00,0.40,56,J
576,"I plan to continue advocating for our children 
Day 5 - check!
""I am alive and present""",0.9996483326,0.60,0.00,0.00,0.00,0.30,0.00,0.00,0.00,87,J
577,"I am alive, this I can not deny, I feel It in every breath, Not waiting for the next, Being in the moment, Smelling every scent, And hearing all the sounds, not being held down by any bounds, Yoga is my ease, The light at the end, That makes life worth living again     Thanks for the videos Adriene you make me laugh and enjoy my practice. xoxox.",0.9997912049,0.40,0.60,0.00,0.70,0.00,0.00,0.00,0.30,347,M
578,i love ywa and i love her chit chat in her videos its usually really fun and motivating . Im not too sure if it was just me but i felt i couldn't concentrate today with her constant talking. especially when i was trying to balance xD.,0.9919639826,-0.20,0.30,0.00,0.70,0.00,-0.20,0.00,0.30,234,M
579,"Day 5! Really struggled with the lunges, because my left knee doesn't feel very stable, I usually tend to modify and get off my knees but today it felt so difficult and I took lots of breaks. I kept repeating my mantras for today, as this pose makes me feel vulnerable. I am alive and safe. I am alive and calm. I am alive with my heartbeat.",0.9654837847,-0.30,0.20,0.00,0.70,0.00,-0.20,-0.40,0.30,341,M
580,am i weird to find this meditative?,-0.89167732,0.00,0.40,0.00,0.00,0.00,0.00,0.00,0.30,35,J
581,iPhone prop! :),-0.9604437351,0.40,0.00,0.00,0.00,0.00,0.00,0.00,0.60,15,D
582,My prop was made from tears and shame from failing so bad with this day... t.t,-0.9981861711,-0.70,-0.50,0.00,-0.70,0.00,0.00,0.00,-0.20,78,J
583,Closest thing near me was a house slipper.,-0.9845011234,0.50,0.00,0.00,0.00,0.00,0.00,0.00,0.00,42,J
584,"Prop I used: my best friends sweater 

Favorite song with an eagle: Steve Miller ""fly like an eagle""

Thank you Adriene ❤️😊",0.9982075691,0.20,0.40,0.00,0.70,0.00,0.00,0.00,0.20,124,M
585,You are amazing:) thank u Adriane,0.9998680353,0.40,0.80,0.00,0.70,0.00,0.00,0.20,0.20,33,P
586,"LOVE this sequence! Thank you, again, Adriene!",0.9998749495,0.50,0.80,0.00,0.70,0.00,0.00,0.20,0.30,46,P
587,My dog was very supportive through this one. Made sure to kiss me every chance he got hahaha,0.9995891452,0.80,0.00,0.00,0.30,0.00,0.00,0.00,0.30,92,J
588,My prop was the VHS box set of BBC's Pride and Prejudice. I feel supported by Mr. Darcy's dreamy face as my abs burn.,0.9969013929,0.20,0.00,0.00,0.60,0.00,0.00,0.20,0.20,117,M
589,A+ ab work out! Soothing yet engaging. The song that came to mind when finding eagle legs was E-A-G-L-E-S EAGLES! Probably 'cause that's my home team...but it's not my favorite song lol. Are there any other eagle songs?,0.981433928,0.20,0.20,0.00,0.70,0.00,0.00,0.00,0.20,219,M
590,Better at tree this time around... kind of. If the tree is a sapling. With roots that move! 😆,-0.7875583172,0.30,0.50,0.00,0.70,0.00,0.30,0.00,0.00,94,J
591,"I feel like I know you with all the yoga I've been doing with you, but you don't. It feels weird. I think I just had my first ""Her"" moment.",-0.9882563949,0.20,0.20,0.00,0.70,0.00,0.00,0.00,0.30,139,M
592,"I can balance pretty well when I am in tree pose; however, as soon as I close my eyes, I feel like I lose that balance. Do I just have to keep practicing with it?",-0.9982479811,0.20,0.00,0.80,0.70,0.00,0.20,0.00,0.30,162,M
593,my leggings is slippery,-0.9989367127,0.20,0.00,0.00,0.00,0.00,0.00,0.00,0.00,23,J
594,One of the most relaxing practices yet!. Tree poses and mountain poses really make me feel at peace.,0.9997419715,0.40,0.50,0.00,0.70,0.00,0.60,0.00,0.50,100,M
595,Attempting to secure a new client today and 'I am capable'....... great way to focus my morning !,0.9996430874,0.70,0.60,0.00,0.60,0.00,0.00,0.00,0.50,97,J
596,My left side was collapsing while the tree pose but my right was strong I am capable 😁,0.9970886111,0.70,0.50,0.00,0.00,0.00,0.40,0.30,0.30,87,J
597,I keep finding how uneven my body is. I am capable of finding the balance. Thanks Adriene!,0.9961818457,0.60,0.70,0.00,0.50,0.00,0.00,0.00,0.60,90,J
598,awesome practice adriene:) mudra isnt a bad word btw...it closely translates to 'pose';) Lots of love from India!!,0.9914485812,0.20,0.20,0.00,0.60,0.00,0.00,0.00,0.20,114,M
599,Loved it!,0.9998828173,0.30,0.60,0.00,0.00,0.70,0.00,0.00,0.60,9,D
600,🙏❤️,-0.6970567107,0.00,0.50,0.00,0.70,0.00,0.00,0.00,0.70,4,D
601,"I'm glad today was calm, I have the worst headache because I'm trying to quit coffee 😂",-0.9977105856,0.70,0.30,0.00,0.50,0.00,0.00,0.00,0.30,87,J
602,I choose to not let others define who I am.,-0.9769182205,0.20,0.30,0.00,0.00,0.00,0.00,0.00,0.00,43,J
603,"Honestly this helped me so much. I just went through an incredibly messy breakup and I am still working out what to do. I've had a lot of friends support me and try and give me advice on what I should do, but it has really just left me more confused and torn. I haven't been able to keep my mind off it until this session. It really felt as if you knew what I was going through and was giving me the courage I needed to take care of myself. My mantra today was ""I choose to do what's best for me"".",-0.9396975636,0.90,0.20,0.00,0.50,0.00,0.00,0.00,0.30,497,A
604,I choose to be healthy happy and fit,0.999388814,0.30,0.40,0.00,0.20,0.00,0.20,0.30,0.50,36,J
605,"I choose happiness, creativity, positive vibes, and peace. 

What a lovely session today. <3",0.9998650551,0.50,0.50,0.00,0.30,0.00,0.00,0.00,0.50,92,J
606,"So great, thank you Adriene! I'm doing 31 days of yoga revolution right now but today I needed a soft relaxing practice instead so I chose this one. Glad I did!!! :-) Mindful greetings, Simple Happy Zen",0.9992396832,0.40,0.30,0.00,0.70,0.40,0.30,0.00,0.50,202,M
607,This was great for my upper back and neck!,0.999642849,0.60,0.40,0.00,0.30,0.20,0.80,0.80,0.80,42,J
608,"Adriene I love your hair in general but I love seeing it down and flowing :) This was such a lovely practice and it couldn't have come at a better time along with the mantra :) I love when things work out :D

Love and Light xx",0.9996380806,0.30,0.50,0.00,0.70,0.00,0.30,0.00,0.40,226,M
609,"I did this practice in my pajamas, and it was great!",0.9998561144,0.60,0.40,0.00,0.00,0.00,0.00,0.00,0.40,52,J
610,"Please help. I was doing warrior 2 and my shoulder dislocated! It happens from time to time but I want to continue - I love Yoga with Adrienne, its great, but I am petrified it will happen again. What measures can I take to ensure that my yoga practice is safe? Please advise",-0.5339302421,-0.60,0.30,-0.90,0.70,0.00,-0.50,-0.60,0.30,275,M
611,"The amount of times I do something slightly differently and feel bad for a second, then tell myself ""Nah, Adriene wouldn't mind if I find what feels good!"" ^_^",-0.9919143915,0.20,0.30,0.00,0.70,0.20,0.00,0.00,0.30,159,M
612,Yoga with Adriene videos are the only thing I look forward to all day (i do yoga at night),-0.9876696467,0.70,0.40,0.00,0.00,0.00,0.00,0.00,0.60,90,J
613,"Day 9 on 9th May, 👍 for myself  and 👍 for Andriene. Namaste.",-0.905669868,0.50,0.40,0.00,0.50,0.50,0.30,0.20,0.00,62,P
614,My day Eight.... I am BOLD!,0.9996603727,0.30,0.40,0.00,0.00,0.70,0.70,0.00,0.00,27,D
615,"I'm so thankful I found your channel and committed thus far into 30 day yoga camp. I absolutely love your videos and the way you instruct and guide through them, it makes me feel strong and confident and the constant reminders to check in with myself help keep me in my ""zen"" mode. I wake up every morning and do a yoga practice off your channel, I absolutely love it. Thank you Adrienne. 😊",0.9998036027,0.60,0.40,0.00,0.80,0.50,0.00,0.00,0.40,391,M
616,For the first time I managed to do the warrior poses with eyes closed without losing balance and without taking a rest between the pauses. I am practising boldness!,0.9996711016,0.40,0.00,0.00,0.70,0.50,0.40,0.00,0.40,164,M
617,"I am bold and behind. My dedication is not what it should be,but I will repeat this again. I am bold in my commitment to finish. Namaste,",0.9997033477,0.30,0.00,0.00,0.70,0.00,0.00,0.00,0.30,137,M
618,Hi Adriene! I love your yoga pants! Can you share where you bought them?,0.9996349812,0.00,0.60,0.50,0.00,0.00,0.00,0.00,0.00,72,J
619,Where are you leggings and top from??! Lovee them!!,0.9969718456,0.00,0.50,0.00,0.00,0.00,0.00,0.00,0.00,51,J
620,❤️,-0.6970567107,0.00,0.50,0.00,0.70,0.00,0.00,0.00,0.70,2,D
621,"I started Yoga Camp 6 days ago, however, I catched a cold and wanted to wait until I'm fine again. So do you recommend finishing yoga camp or starting with revolution? :)",-0.9952771664,-0.30,0.00,0.80,0.70,0.00,0.00,-0.20,0.20,170,M
622,Ohh this was posted on my b-day ❤❤❤,-0.9972140193,0.20,0.00,0.00,0.40,0.00,0.00,0.00,0.30,35,J
623,Yaaaasssssss!!!! 🙌🙌🙌,-0.9896454811,0.00,0.00,0.00,0.50,0.00,0.00,0.00,0.60,23,J
624,"Only made it as far as 15 days in a row over the last two 30 Days of Yoga months, I'm sure I'll get further this year :)",0.9071993232,0.30,0.00,0.00,0.60,0.40,0.00,0.00,0.30,120,M
625,"Love how you share the love ❤️ of yoga for free!! You are absolutely beautiful Adriene, one of my most favourite teachers and one of my students told me my teaching style is very similar to yours. Massive compliment 😊😊🙏",0.9997989535,0.40,0.50,0.00,0.70,0.00,0.00,0.00,0.40,222,M
626,"I have finished True and Home now onto Revolution! Thank you so much, Adriene for supplying us with an endless source of yoga, sending you much love and gratitude! <3",0.9998517036,0.30,0.50,0.00,0.70,0.30,0.00,0.00,0.20,166,M
627,"Thank you, Adriene!  Can't WAIT!!",0.9998148084,0.30,0.80,0.00,0.70,0.00,0.00,0.20,0.30,33,P
628,Thank you Adriene 💕 I can't wait 😄,0.999446094,0.30,0.80,0.00,0.70,0.00,0.00,0.20,0.30,36,P
629,"   I have absolutely love love loved the journey so far!! Thank you for offering something so amazing and transformative. The only issue I have is, I was understanding there would be daily emails. Has this changed? I am devouring anything I can get my hands on, and would appreciate some insight, if you have any you'd like to share. 
        Thanks again.",0.9995340109,0.30,0.60,0.80,0.70,0.00,0.00,0.00,0.30,356,M
630,I'm starting the revolution now ....I'm rating to go after 30days of calm 💖,-0.8288176656,0.40,0.50,0.00,0.00,0.10,0.00,0.00,0.00,76,J
631,Can I do this in the evenings/at night? Because during the day I don't have any energy or motivation.,-0.9997422099,-0.40,0.30,0.00,0.60,0.00,0.00,0.00,0.20,101,M
632,"i recently went through a depression and therefore i couldn't take care of myself that well. i'm also having a serious body image issue to the point that i look at the mirror and or photos of myself then i disgusted of what i see, (and i'm actually a size 2) but then again whenever i'm really stressed i go out and binged. i caught bad cold twice in the last  2 months meaning that my immune system is damaged. 

it's 24th january here and two days ago i just turned 24. i subscribed to your channel almost a year ago and i used to religiously do yoga. i watched your introduction of this journey and i cried. i really want to change the way i feel and think about myself and take care of it more. this is my first day, i hope i could go through the journey til the end. i hope to eat healthier and not making too much fuss about what i look on the outside. it's hard but in the end the only person who can help me is myself. please cheer on me Adrienne!",-0.9719974399,0.90,0.00,0.00,0.30,0.30,0.00,0.00,0.40,955,A
633,"Who else is here May 202?  I finished 30 Day OG, Camp, and am now starting this. Any one else having a hard time being easy on yourself? (Why is that kinda funny?)",-0.9934782982,0.40,0.20,0.00,0.70,0.50,0.00,0.00,0.30,163,M
634,"This series remains to be my favorite, maybe because it found me in the right time back in 2017. I'm doing it again and praying.
""Drop the struggle, even if it means you don't go as far - there's an integrity"" this used to and still does make me tear up every time I've seen this video. I need that.",0.9920606613,0.40,0.60,0.00,0.70,0.00,0.00,0.00,0.20,299,M
635,Day one done!,0.9874862432,0.30,0.40,0.00,0.00,0.70,0.70,0.00,0.00,13,D
636,Thank you for this new journey! Happy New Year!🙏❤,0.9998823404,0.20,0.00,0.00,0.50,0.90,0.00,0.00,0.30,50,J
637,"I had to take a week off yoga because of a minor surgery but now I'm back and so thankful! Just like you said on an e-mail a while back ""never feel bad about starting over!"" <3",0.9996606112,-0.20,0.30,0.80,0.70,0.20,0.00,-0.20,0.20,176,M
638,lo empecé!! yaaiiii,0.5266345739,0.60,0.00,0.00,0.60,0.70,0.00,0.00,0.40,19,D
639,"Hi Adriene,

Thanks for this great opportunity to start the new year with a habit creating 31 day yoga plan:)

Greetings from Zurich,

Frank",0.9995849729,0.20,0.40,0.00,0.70,0.20,0.00,0.00,0.30,140,M
640,🙏❤️,-0.6970567107,0.00,0.50,0.00,0.70,0.00,0.00,0.00,0.70,4,D
641,I’ve really been struggling to do these videos because of the length of the videos. Also the amount of time spent talking is a little too much for more of anyone’s feeling the same way or even different let me know.,-0.9995499253,-0.30,0.40,-0.80,0.70,0.00,0.00,0.00,0.00,215,M
642,"I have done yoga on and off but over Christmas vaca I did it everyday. My blood pressure dropped 23 points from 3 months ago, can you believe it?",-0.996850431,0.40,0.20,0.00,0.70,0.30,0.00,0.40,0.20,145,M
643,Dear Adriene. My spine is beginning to feel like its unstrectched and unbalanced. I would love a  practise that'll guide me through to what needs to be lifted and what needs to be let go off to help find my yin and yang. Please and Thank-you 💕,-0.9783822298,-0.50,0.30,-0.90,0.70,0.00,0.00,-0.60,0.00,244,M
644,such a great practice. i feel so renewed after finishing this.,0.9997498393,0.00,0.80,0.00,0.60,0.00,0.00,0.00,0.40,62,J
645,What an enjoyable practice! It is always a pleasure!,0.9998860359,0.00,0.80,0.00,0.60,0.00,0.00,0.00,0.50,52,J
646,"May we always See the truth,
May we always speak the truth,
May we always feel the truth!
Namaste",0.9829287529,0.30,0.00,0.00,0.00,0.00,0.00,0.00,0.00,97,J
647,"May 2021 and still in covid lockdown here. I meditated every day almost a year now (may 19 is my meditation anniversary) and i'm thinking about challenge myself for doing yoga everyday for a year. I showed love for my mind and gained so much awareness in my mind last year, why not gain awareness and strength for my body as well? Yoga is giving me both actually. Thank you Adriene for making me realise that.",0.9983155727,0.80,0.00,0.00,0.00,0.00,0.00,0.00,0.30,409,A
648,"I've had the flu for the past 4 days and obviously had zero energy to get on my mat. Although I was slowly getting over it, I made myself get on my mat yesterday and today to practice days 6-10. I might be sore tomorrow (especially after doing 3 days of practice today), but I know it will be worth it in the end. I've been following you since the fall and since then, I have notice many changes in myself. My mind is clear, I am slowly controlling my anxiety, and my body has changed in ways I did not think yoga would even affect. Thank you, Adriene, for allowing me to love myself more and more everyday and discovering my love and passion I now have for yoga. Much love xx",0.9975814819,0.70,0.00,0.00,0.70,0.40,0.00,0.00,0.50,676,A
649,Done!!😊Adriene I've been doing yoga with you every day over a year but I really feel this revolution yoga is different .It works like a miracle  inside my mind and body .Thank you indeed for your time and energy!!!Namaste❤🙏,0.999820292,0.40,0.70,0.00,0.80,0.60,0.00,0.30,0.50,225,M
650,I'm saving this for later! Half way through I had to take a break to play catch and release with a giant spider! When I got back on the mat I was too tired to carry on so had a few restorative moments instead... I guess I'll catch up with alignment soon! ♥,-0.7033019662,0.20,0.20,0.00,0.70,0.00,0.00,-0.20,0.30,256,M
651,"Still here . Still trying. I think I will do this practice again after work today. In anticipation of big work day, I was constantly distracted. Maybe this evening will be better. I will let you know. Namaste",-0.934448123,0.30,0.00,0.00,0.70,0.00,0.00,0.00,0.20,208,M
652,"Oh man .. I was exhausted today and have felt like I'm coming down with something . I almost didn't show up , but I did . Because I'm not feeling well and was so tired when I started this one tho , I totally messed up on the lunges and did the same side twice . I got really frustrated when I realized that . I got all ocd about it and told myself I'd have to do the whole video over again to even it out . I got really bummed out thinking I did the opposite of aligning myself lol . But ending this practice I've decided to just let it go . I forgive myself for having a human moment and accept the simple fact that shit happens . I showed up for myself and I did my best . I'm not gonna punish myself because I made a mistake . I need to start listening to my body more and not push myself so much . Shake it off ! Tomorrow is a new day ! Never the less , I feel much better after my time on the mat with u and being with my breath . Now to get some much needed rest ! Love ❤ xoxo",-0.9898297191,0.90,0.00,0.00,0.50,0.00,0.00,-0.50,0.70,982,A
653,"great one, but that straight leg seems like a far away dream hahah :D",-0.9810799956,0.30,0.80,0.00,0.00,0.00,0.00,0.00,0.50,69,J
654,Best Teacher EVER! <3,0.9997627139,0.20,0.80,0.00,0.70,0.00,0.00,0.00,0.60,21,J
655,"Feels so good. Like you said Adriene, showing up for myself every day has made a huge difference to my mood and motivation. I'm getting much more done and i don't feel so depressed all the time! Making time for myself has meant making time for other important stuff too. Thank you ❤️",0.9998162389,0.50,0.60,0.00,0.70,0.40,0.00,0.00,0.30,283,M
656,Yay! I was behind a couple of days but I'm all caught up now. Switching from slower to more active practices helped with that :) I was a little stressed this morning with other work but I stayed determined to continue this 30 day program and 5 minutes in I felt my stress melt away.  Hope everyone is having a great time so far.,0.9863498807,0.30,0.20,0.00,0.70,0.20,0.20,0.00,0.40,328,M
657,awesome practice today! thank you Adriene!,0.9998759031,0.20,0.60,0.00,0.70,0.00,0.00,0.00,0.30,42,J
658,"Been sticking with it, I’m actually on day 7,  but I did 2 session some days. feeling great!",0.9996017814,0.40,0.50,0.00,0.00,0.30,0.00,0.00,0.30,92,J
659,"loved this yoga sesh A-dogg, I am going to make that extended leg pose my biotch some day",0.9971375465,0.50,0.40,0.00,0.00,0.00,0.30,0.30,0.30,89,J
660,Namaste 🙏🏼,-0.8081023097,0.00,0.40,0.00,0.60,0.00,0.60,0.00,0.60,12,D
661,"I personally didn’t do well with this practice. This actually frustrated my present mind rather than clearing it. After a year of yoga with adriene, this is my first experience where a video left my mental state worse than when I began. Hopefully day 13 will be better for me!",-0.999594152,-0.60,0.40,0.00,0.80,0.00,-0.50,0.00,0.50,276,M
662,12 days into this Yoga challenge and the only result I can clearly see are the rips in my yoga pants :(. I had bought them brand new just for this challenge and the only lasted 12 days lol.,-0.9975876808,-0.20,0.20,0.00,0.70,0.00,0.00,0.00,0.30,189,M
663,Do foot cramps happen for anyone else while in tree pose? I'm on my feet a lot and even longboard so I'm unsure why it's happening but it must be just my body getting used to being in tree pose for longer periods of time.,-0.994304359,-0.20,0.20,0.00,0.70,0.00,-0.20,-0.20,0.30,221,M
664,Loved it! <3,0.999861598,0.30,0.60,0.00,0.00,0.70,0.00,0.00,0.60,12,D
665,All I wanna do is yoga with Adriene!  I feel so good while practicing with you.  Afterwards I feel so strong and well adjusted.  All the pain and dysfunction seem to be evaporating.,0.9968403578,0.40,0.30,0.00,0.70,0.20,0.30,0.50,0.40,181,M
666,"Loved today's practice. I started off really shaky, but I think focusing on my breathing really helped me finish strong. Thanks for this series, Adriene!",0.9997732043,0.30,0.50,0.00,0.70,0.20,0.20,0.30,0.30,153,M
667,Thank you,0.9998352528,0.20,0.70,0.00,0.70,0.00,0.00,0.20,0.50,9,D
668,I have never laughed so much at myself during a practise like I have just now especially trying to obtain my balance through tree pose. I'm still giggling away. What a superb practice! :D,0.999232769,0.40,0.40,0.00,0.70,0.00,0.50,0.00,0.30,187,M
