1000,comment,Prequalified sentiment,Information,Opinion,Advice,Impression,Progress,Exercise,Body,Video,Length,Reviewer
0,Hello and can I ask you if I can do also other workouts with this yoga? :),-0.8948682547,0.00,0.00,0.70,0.00,0.00,0.40,0.00,0.00,74,J
1,"As a person with Lyme Disease who is chronically ill, I'd like to let everyone out there know that her ""Morning Yoga"" video is waaaaay easier than her ""Yoga for Complete Beginners"" video. So if you want to start with her easiest one, start with her ""Morning Yoga"" one!! :) ",-0.992690742,0.50,0.30,0.90,0.00,0.00,0.40,0.00,0.60,273,J
2,lol przez tą blokadę na czacie czuje się jakbym był zbanowany... nieprzyjemnie się zrobiło tutaj.,-0.988673389,,,,,,,,,97,
3,Has anyone lost weight from this? ❤️,-0.9972082973,0.00,0.00,0.50,0.60,0.00,0.00,0.80,0.00,36,J
4,doing this to start my fourth year of university,0.9916568995,0.50,0.00,0.00,0.00,0.80,0.00,0.00,0.00,48,J
5,Simply love it thought I was in shape until this,0.9998163581,0.20,0.80,0.00,0.40,0.20,0.00,0.50,0.00,48,J
6,Super excited for the 30 days!!,0.9993578792,0.00,0.00,0.00,0.90,0.20,0.00,0.00,0.00,31,J
7,"I have been following your videos for awhile and decided to start #30daysofyoga  I love it I started sceptical and finished these days feeling refreshed, connected and overall a better version of myself. Thank you. Namaste",0.9996279478,0.30,0.30,0.00,0.50,0.80,0.00,0.40,0.00,222,J
8,"I am on Day 9 of 30 Days of Yoga! I am more than happy that I started this journey and more than thankful that you take the time to offer your videos to the public. In this short amount of time, I have already began integrating yoga into my day with easy effort. For awhile, it was hard for me to come to my mat. Last year, I started yoga in the late summer because I get terrible tension headaches from sitting at a desk all day! But in October, I had to have a small lump removed from my breast (no big deal, just hormonal!) and I couldn't practice for over a month. I sat and meditated but eventually the busy holiday season came around and I started neglecting myself. BUT last month, my sister noticed my struggle and she suggested your videos :) Your email is such a blessing in my inbox!! I get so excited to practice with you and it didn't take long for me to find out that yoga is a priority for me, not an option. THANK YOU SO MUCH ADRIENE!  Your flows are amazing and I love how you joke and kid, it makes the experience all the more enjoyable. I adore you :) Lots of 3> from a former Texan, currently in Colorado.",0.9987825751,0.60,0.80,0.00,0.70,0.80,0.00,0.00,0.60,1125,D
9,I really Like you :D ,0.9998534918,0.00,0.80,0.00,0.40,0.00,0.00,0.00,0.00,21,J
10,"Student here, wanting to lose weight but needing something I can do in my small student bedroom, as I really hate exercising in public. Decided I needed a real lifestyle change, and thought this would be the perfect place to start; I just did your ""yoga for complete beginners"" routine and started this straight after, and I'm looking forward to trying to stick to the whole 30 day challenge!",-0.779044807,0.60,0.00,0.00,0.40,0.40,0.40,0.00,0.00,392,J
11,in the final exercise I literally cried...  from no we're...  I was on the floor crying my eyes out...  😐,-0.9980159998,0.00,-0.20,0.00,-0.50,0.00,-0.40,0.00,0.00,106,J
12,hey quick question is your body supposed to ache a bit after doing yoga??. its just I already have back problems and don't want to make those problems worse by doing something wrong. sorry if this sounds really stupid. :-),-0.9981462955,0.00,0.00,0.20,-0.30,0.00,-0.10,-0.50,0.00,222,J
13,"I learned from you ! 
https://youtu.be/-zud0GS7zgI?list=PLRJqAEvmgEbhBh-nkhmpOCIFVH81iFeS6",-0.9802784324,0.40,0.00,0.00,0.00,0.40,0.00,0.00,0.00,90,J
14,"Day 1 complete! That was harder than I expected, but enjoyable ! My hips made quite a loud click on the side I extend my leg out (when doing bicycle crunch move), is that a problem?",0.9977065325,0.20,0.00,0.00,-0.40,0.70,-0.30,0.70,0.00,181,J
15,I'm a full-time student with two jobs. Today I was so stressed out I thought I'd spend some time relaxing in a healthy way. I came across your videos and I'm glad I did! Day one complete! ,0.9991613626,0.40,0.60,0.00,0.60,0.60,0.00,0.00,0.70,188,D
16,I love this!,0.9998764992,0.40,0.80,0.00,0.70,0.00,0.60,0.00,0.70,12,J
17,first day today it was so soothing and relaxing it got my mind off of everything i was stressing about yesterday and days before that! Cannot wait to complete this challenge,0.9988002777,0.70,0.00,0.00,0.50,0.50,0.70,0.00,0.70,173,J
18,I had so much fun with this this morning but couldn't do the third downward dog because I was shaking to bad but this rocked!😃,0.9915685058,0.30,0.60,0.00,-0.20,0.00,-0.20,0.00,0.30,127,J
19,thank you for this great sequence.. I am a Beginner and looking forward to the next 29 days! Peace..,0.9998614788,0.20,0.30,0.00,0.70,0.40,0.00,0.00,0.00,100,J
20,"No matter how I feel on the front end I always feel so much better ( physically, mentally, emotionally ) when done. Namaste 🙏",-0.6511638761,0.40,0.40,0.00,0.50,0.00,0.00,0.60,0.00,126,J
21,What yoga pose or poses can stretch the top and side of my butt?,-0.9911056161,0.00,0.00,0.80,0.00,0.00,0.00,0.00,0.00,64,J
22,This is peerrrrfie early early in the morning before work ✊️👌,-0.9778326154,0.00,0.60,0.20,0.00,0.00,0.00,0.00,0.00,62,J
23,I feel like I'm going to hyperventilate halfway through the video! Guess I'm not used to breathing?  Any tips?,-0.9995520711,-0.30,0.00,0.80,-0.50,0.00,0.00,0.00,-0.50,110,J
24,Day 10- done---yay...it was my birthday. So did the quick yoga and was on my way celebrating my special day :),0.9910417199,0.60,0.00,0.00,0.00,0.60,0.00,0.00,0.00,110,J
25,omgosh best ten minutes ever...seriously tho....where have you been all my life girl?! :) xoxo thanks again!,0.9973178506,0.00,0.70,0.00,0.80,0.00,0.00,0.00,0.80,108,J
26,Perfect video at the perfect time! I will actually do this tomorrow morning because I won't get much sleep due to the golden globes (3-5am here in germany) and then I have to do a very important presentation at uni at 10am... hope that will wake me up ;),0.9966077805,0.30,0.40,0.00,0.00,0.00,0.00,0.00,0.00,254,J
27,"I postponed today's yoga practice as much as I can. It was 1 am when I finally started to do it. I am surprising myself that I am dedicated so far, it must be the positive community at the comments and Adriene's affords to make us love yoga. I never seen a community this positive and supportive anywhere.",0.9988998175,0.20,0.80,0.00,0.70,0.40,0.00,0.00,0.30,305,J
28,"Wow, I just actually enjoyed salute to the sun - that was first. I really want to thank you for this series. I have practised yoga in the past but not for some years.. This is such a lovely way to get back into it and I can already feel the benefits to my nearly seventy year old body. Thank you",0.9998425245,0.40,0.50,0.00,0.60,0.00,0.00,0.00,0.20,295,J
29,My favorite warmup video.  I've started doing this before doing any other videos and it helps loosen me up.,0.9837702513,0.30,0.50,0.00,0.00,0.30,0.00,0.00,0.30,107,J
30,3rd day doing the #ywacreativity...this was a tough one but I managed to do...I can't believe it :D. I'm documenting my journey on instagram @maria4lexy,-0.6647475958,0.30,0.00,0.00,0.00,0.70,0.00,0.00,0.00,152,J
31,that squat at the end had me dyyyying! lol,-0.9965362549,-0.20,0.00,0.00,0.30,0.00,-0.20,0.00,0.20,42,J
32,"I've never done yoga with the exception of the VERY occassional simple routine, and I have a thing about only doing it alone, so that I'm on day 11 of this is an accomplishment. I can keep up with most everything you're doing but I have to say, I have a real issue with downward dog. Like, it looks so nice when you do it but lemme tell you it DOES NOT feel nice when I do it lol. It's actually aggravating, like dude, I'm starting to think my legs are too long or too short compared to the rest of my body and I'm just not built for this :P",-0.9892600775,0.50,0.00,0.00,0.00,0.80,0.00,0.00,0.00,541,J
33,"11 down, 19 to go...",-0.9780946374,0.30,0.00,0.00,0.20,0.30,0.00,0.00,0.00,20,M
34,"I have always thought yoga was just a hipster thing until i tried it out with Adriene. You don't need an $300 mat and the latest must-have yoga pants plus a hefty monthly fee. Really, it takes just a mat, and internet connection. :) Thanks so much, Adriene!",0.9281688333,0.50,0.40,0.00,0.70,0.00,0.00,0.00,0.50,257,M
35,Memorial day May 25 2020 beautiful stretch something I needed everybody have a happy memorial day today.,0.9983583093,0.20,0.00,0.00,0.40,0.00,0.00,0.00,0.00,104,M
36,My favorite of the 30 days practices so far 💕,0.9009808302,0.40,0.70,0.00,0.80,0.70,0.40,0.20,0.60,46,P
37,thank you Adriene for this 30 days it it was amazing,0.9998757839,0.40,0.80,0.00,0.80,0.70,0.40,0.20,0.60,52,P
38,Fewwwwww this video was soooooo sweet ☺️ I was so very very sore from the last few videos but this one hit all the sweet spots. Thank u I feel AMAZING 😃,0.9992778897,0.30,0.40,0.00,0.70,0.20,0.20,0.00,0.40,153,M
39,Adriene...i have a question....can I doing yoga when I get my monthly period or menstruation? Thank you,0.9930497408,0.20,0.20,0.80,0.30,0.00,0.20,0.50,0.00,103,P
40,"i like these videos except for when i get so thrown off by the excessive chit chatting and over explaining during strenuous poses. Perhaps not the true type of yoga i am looking for. I don't want to be thinking of random comments and heyos while i am trying to balance and ground spiritually. This is a work out influenced by yoga, not true yoga. It has helped me but i'm not gonna lie i get soooooo flustered trying to hold a pose, breath and relax hearing you over explain and make silly comments.",-0.7284607291,-0.60,-0.30,0.00,0.70,0.00,-0.60,0.00,-0.60,499,M
41,"12 down, 18 to go...",-0.9711715579,0.30,0.00,0.00,0.20,0.30,0.00,0.00,0.00,20,M
42,The cover girl line was in my head when adriene said it... you can tell I was a teenager in the 90s lol,-0.9870888591,0.40,0.00,0.00,0.60,0.00,0.00,0.00,0.40,103,M
43,Ok so this is my first time doing a yoga and every time she says if you're a beginner you can take an easier pose I become more  determine to do the hard one LOL ( I know I know it's bad and I might injure myself but I listen to my body and if i feel pain or I'm about to twist myself i stop and do the modified version ) for today I tried to do the tree pose like her and i start moving my hands around like a little bird trying to fly lol to find my balance,-0.9651010633,0.50,0.00,0.00,0.60,0.30,0.60,0.40,0.00,459,D
44,"""That's an order!""  Gosh; so bossy.  Teasing.  <3",0.5126152635,0.00,0.30,0.00,0.40,0.00,0.00,0.00,0.40,49,M
45,"What surprised me the most today was that even though I can't do most of the harder poses, I did a great tree and warrior III pose today.
What the heck?

Looking forward to day 13",0.9985639453,-0.20,0.00,0.00,0.70,0.00,-0.20,-0.20,0.00,179,M
46,"I really can't do that downward facing dog variation with the twist, the sides of my hip just cramp up (gluteus medius, I guess). I'll come back to it later. For now, I'm pretty sure I saw a video for yoga for tired legs on the channel, so off to that, gonna do me good.",0.9699316621,-0.30,0.00,0.00,0.70,0.00,-0.40,-0.30,-0.30,270,M
47,"Day 12 done, almost halfway!",0.568503201,0.30,0.00,0.00,0.40,0.30,0.00,0.00,0.00,28,M
48,"I don't understand how I can hold these poses while wearing shoes, but barefoot?  My balance is completely off!  Thanks for the practice, Adriene.  30 days is my third consecutive 30 day session led by you.  Appreciate it!",0.9989264607,0.50,0.30,0.00,0.70,0.00,0.30,0.00,0.40,222,M
49,Loving the 30 days of yoga! Thank you so much!,0.9998793602,0.50,0.70,0.00,0.70,0.40,0.30,0.00,0.60,46,P
50,heels ar starting to kiss the floorintermittently in downward dog. foot yoga day one was brutal but now i do that during every practice even though its not there because my feet dosen't cramp upp when i hike with the pram in the woods.,-0.7914634347,0.40,0.20,0.00,0.70,0.30,0.30,0.30,0.50,235,M
51,20:35. Just sitting up straight stretches my hamstrings and top of my calves/knees,-0.9825542569,0.30,0.00,0.00,0.60,0.00,0.00,0.00,0.20,82,M
52,Really enjoying round 2 of 30 days of yoga.  I can definitely see a difference from the 1st round but my balance is still a wobbly mess:)  Thanks so much Adrienne! ,-0.9825012088,0.30,0.50,0.00,0.70,0.50,0.20,0.00,0.40,164,M
53,wow that eagle pose hurt!,-0.9987344146,-0.40,-0.40,0.00,0.40,0.00,-0.60,-0.40,0.00,25,M
54,"thank you so much for sharing these practices. you're an incredibly soothing and positive person, a perfect yoga instructor. you motivate but don't pressure, you challenge but don't stress :') thank you again, can't wait to do day 14 tomorrow",0.9998333454,0.20,0.50,0.00,0.70,0.30,0.30,0.00,0.50,242,M
55,Thank you for the gift of sharing a yoga class with you Adriene. My body shouts out loud: Give me yoga! #gratitude,0.9994748235,0.20,0.40,0.00,0.60,0.00,0.20,0.40,0.40,114,M
56,I loved this one! Gentle enough for waking up. Thank you!,0.9998810291,0.60,0.80,0.00,0.70,0.00,0.20,0.00,0.60,57,P
57,my ankles started hurting and I had to stop and take a little break. 2 weeks ago I would have been mad at me for not being able to finish the pose. but today I just accepted it and didn't judge.,0.9707500935,-0.30,0.00,0.00,0.70,0.00,-0.30,-0.50,0.30,194,M
58,Loved it!,0.9998828173,0.30,0.60,0.00,0.00,0.00,0.00,0.00,0.70,9,P
59,"Thank you so much, Adriene. I enjoy this challenge so much! It's awesome to have a few minutes just for myself and my yoga practise. I love the balancing poses, it's helps to clear my mind. :) ",0.9998650551,0.80,0.90,0.00,0.80,0.60,0.50,0.60,0.80,193,P
60,"Жопа пацаны, жопа",-0.8544896841,,,,,,,,,17,
61,"I'm a few days behind, it looks like Day 14 is not (yet) in your playlist: https://www.youtube.com/playlist?list=PLui6Eyny-UzwxbWCWDbTzEwsZnnROBTIL",-0.9996997118,0.20,0.00,0.00,0.50,0.00,0.00,0.00,0.20,147,M
62,"It's 9:20pm and I'mdone with day 14. Yay! 💖
Btw, is it okay to do yoga at this time? I'll feel guilty if I miss a day.",-0.9945132732,0.40,0.20,0.80,0.70,0.40,0.00,0.00,0.40,119,M
63,got a little sweatin on today ;),-0.9174906611,0.20,0.00,0.00,0.30,0.00,0.00,0.00,0.20,32,M
64,Day 14: Waking up never feels all that great until I get onto the mat. I feel so alive after today's practice. I decided to take my time and will do day 15 when I am ready instead of setting expectations for myself to keep up with everyone else. ,0.9976214767,0.40,0.40,0.00,0.70,0.80,0.50,0.00,0.00,246,D
65,That was awesome! Thank you Adriene! x,0.9998648167,0.60,0.80,0.00,0.60,0.00,0.00,0.20,0.40,38,P
66,"Today was challenging for me but fun! I still need to work on my flexibility, but I've definitely noticed my heels aren't as high  up now during downward dog :)",0.9776259065,0.50,0.80,0.00,0.70,0.00,0.40,-0.30,0.40,160,G
67,Thank you dear Adriene! This  challenge is so yummy and Im actually finding what feels good! And my back never felt better! Also Im seeing more strength in my arms and more flexibility <3 thank you so much for this beautiful experience <3,0.9998604059,0.60,0.80,0.00,0.90,0.80,0.60,0.60,0.70,238,G
68,Lol I just googled what nameste means and it means I see the light in you,0.9973645806,0.90,0.00,0.00,0.00,0.00,0.00,0.00,0.60,73,G
69,"i think this was the first time i didnt stop a yoga video half way and walk away. I was so surprised when it finished, i thought it was only 5 minutes long. Fantastic job. love the stretches. ",0.9979059696,0.40,0.80,0.00,0.90,0.00,0.70,0.60,0.80,192,G
70,"I'm supposed to be at day 17 but because of the tiredness of the last two days i am here today and for the love of the gods i did not expected half moon to be that hard, but it didn't set me back, i'll keep going to day 30 and more",-0.7096181512,0.70,0.60,0.00,0.50,0.60,-0.80,0.00,0.60,231,D
71,"Balance has never been my strong point so this was a tough one haha, half moon was tough but just about doable in some variation on the right leg but the left leg not so much, falling over the place, two weeks ago that would have made me grumpy and want to give up but today I was just laughing and having fun, my perspective on success has totally shifted! Big love",-0.9643147588,0.50,0.00,0.00,0.70,0.70,0.60,-0.30,0.40,366,D
72,"dumb question 
we breathe out through the nose or the mouth? because, as far as i know, in yoga we breathe in and out through the nose 
but often the breath sound of Adriene sounds like she breathes out through the mouth 

i'm confused, what should i do?",-0.9785118699,0.30,0.30,0.80,0.70,0.00,0.00,0.00,0.20,254,M
73,Today is day 16. I can’t raise my arms bcoz of day 15,-0.9870719314,-0.30,0.00,0.00,0.40,0.00,0.00,-0.50,0.00,53,M
74,"I love how you've been closing your videos lately: with a nice cameltoe peek-a-boo!
27:07  27:29  27:55",0.9969092011,0.20,0.00,0.00,0.60,0.20,0.00,0.00,0.00,103,M
75,Thank you adriene!!,0.9998539686,0.40,0.60,0.00,0.70,0.00,0.00,0.20,0.70,19,P
76,"Adriene! Video after video you spend forever on one side and then rush through the other side and it's really stressful! Please try to make them more even!Also-- I would love to spend 2 minutes in shavasana listening to you breathe (reminding me to breeeaatthhheee) at the end of each video, instead of having to rush up and press pause and then try to get back into the zone of shavasana.I love your channel, I love your videos, I sing your praises literally everywhere. If you could improve on these two things I would be willing to pay for these videos.",0.9982094765,0.40,0.50,-0.80,0.70,0.00,0.00,0.00,0.30,556,M
77,That was challenging but I am glad I did it. Feel so good.,0.9998611212,0.20,0.30,0.00,0.60,0.30,0.30,0.00,0.30,58,M
78,thant was one hard practice! but still enjoyed it :),0.9996584654,0.20,0.30,0.00,0.60,0.00,0.30,0.00,0.30,52,M
79,"Anyone else find one side easier to balance on with the half moon? My left leg is significantly stronger than my right since I am a regular-footed surfer and skater, but I never realised how much I rely on my left leg to support me until today's class!",0.97570467,0.50,0.20,0.00,0.80,0.00,0.00,-0.20,0.40,252,M
80,Quick and dirty today! LOL,-0.8309586048,0.20,0.00,0.00,0.40,0.00,0.20,0.00,0.30,26,M
81,this one was super boring,-0.999738276,-0.20,-0.80,0.00,-0.60,0.00,0.00,0.00,-0.70,25,P
82,i feel so much stronger! when i move i can actually feel muscle volume that has never been there. after only 16 days? what happens after 30 days? or a year of yoga? will i explode??,-0.9360833764,0.30,0.20,0.00,0.70,0.40,0.00,0.40,0.40,181,M
83,Detta var precis det passet jag behövde idag ✌️,-0.9872954488,0.30,0.30,0.00,0.60,0.00,0.00,0.00,0.40,47,M
84,I like reading the comments after. Everyone is so beautiful and positive!,0.9998869896,0.40,0.50,0.00,0.00,0.00,0.00,0.00,0.40,73,P
85,Ohh yeah that hits the spot!! 🙃✌,0.9993941784,0.30,0.20,0.00,0.60,0.00,0.20,0.20,0.30,33,M
86,Thank you Adrienne!🌷🌲🌱,0.9998662472,0.40,0.60,0.00,0.70,0.00,0.00,0.20,0.70,25,P
87,"Thanks for deactivating the ads,,,very rare today.",0.9981137514,0.20,0.30,0.00,0.60,0.00,0.00,0.00,0.20,50,M
88,"I really feel like I had better control of my breath today! usually I’m almost hyperventilating 5 mins in but not this time! I also fell over about 0.5 seconds into side plank and didn’t beat myself up about it, just laughed and tried again. progress :)",0.9687268734,0.50,0.20,0.00,0.70,0.50,0.40,0.30,0.50,253,M
89,"OMG!!!!! this day was HUGE for me in personal growth and progress! I went to the super market and finally did shopping to go back on my healthy diet! starting again a detox for processed suger! and!!! Im so closed to flat my fit on the groung in downward facing dog! I am able to hold in plank longer abd I was able to do a side plank! (one side full the other one weaker, but its a HUGE progress from where I started! you are a life saver (I am very obese due to emotional eating and sugar addiction so, when I say life saver, I mean it), thank you so much",0.826993525,0.60,0.40,0.00,0.80,0.30,0.20,-0.50,0.60,557,M
90,Does anyone have any recommendations for a good non slip mat? Im finding my palms are getting sweaty so in downward dog variations i'm focusing more on not slipping than the actual practice!  Thanks in advance!,-0.7842280865,0.40,0.20,0.80,0.70,0.00,0.00,0.00,0.30,210,M
91,that squat is killing me,-0.9997199178,-0.20,-0.30,0.00,-0.50,0.00,0.30,-0.60,0.00,24,P
92,One of the thoughest practices 👌🏻💦😅,-0.9250485897,-0.60,-0.70,0.00,-0.80,0.00,-0.70,-0.60,-0.60,39,D
93,"I started to cry in shavasana, why? :D",-0.9883412719,0.20,0.00,0.00,0.50,0.00,0.00,0.00,0.00,38,M
94,I love it,0.9998799562,0.30,0.80,0.00,0.80,0.00,0.00,0.00,0.70,9,P
95,"the first 2 weeks of quarantine were awful, but since I started with these videos I feel so much better 💖💖🌱🌱 thank you from spain 💟✨",0.9751328826,0.20,0.40,0.00,0.70,0.30,0.00,0.00,0.30,137,M
96,Ahhhh so good. I'm feeling better after a few days of feeling a bit bleurgh and it felt amazing to get back on the mat again. :D xx,0.9998021722,0.30,0.40,0.00,0.70,0.30,0.00,0.00,0.30,131,M
97,"I don't remember exactly how many videos ago the challenge also included the yoga squat and I remember getting kind of frustrated because my balance was not good enough to hold the pose (I'm a little bit overweight and lockdow has not been helping at all). however, Adriane's encouraging words in every video allowed me to keep trying and allowing my body to slowly ease into this challenge. today, almost without realizing it, I was able to breathe while squatting without wobbling at all. so that's progress hhh.
Thanks Adriane ♥️",0.9914685488,0.50,0.30,0.00,0.80,0.40,0.20,-0.50,0.50,532,M
98,"I felt a little sick in the morning and had a headache. But I took a pill, did yoga 4 when ur a sick, and just got some rest, so I feel good now. I even finally did this practice, it was easy and fun. These 35min passed like 15. I even thought I definitely did something wrong, huh=)",0.998300612,0.30,0.20,0.00,0.70,0.00,0.50,0.00,0.40,283,M
99,Happyyyy!!!!!!!!!!!,0.9995946288,0.50,0.80,0.00,0.40,0.00,0.00,0.00,0.70,19,D
100,十八天打卡,-0.6831805706,,,,,,,,,5,
101,Maybe someone could tell me what to do with this bum right hip. I do left side beautiful and have loss of rotation in the right. Suggestions?,-0.9973618388,0.40,0.00,-0.60,0.00,-0.30,-0.40,-0.50,0.00,141,G
102,This session was soo yummy! Namaste 🙏🏾,-0.9712642431,0.00,0.80,0.00,0.70,0.60,0.70,0.70,0.00,40,G
103,My head when she went down on the one leg squat 🤯🤯🤯,-0.9959369898,0.00,0.70,0.00,0.90,0.00,0.70,0.70,0.60,54,G
104,"Done ✅ 
Thank you 🙏🏻",0.9996721745,0.30,0.80,0.00,0.60,0.40,0.30,0.20,0.70,22,P
105,TODAY WAS THE FIRST DAY I WAS ABLE TO DO A BALANCE POSITION THE ENTIRE TIME WITHOUT FALLING OVER!! Thank you Adriene for helping me stick with it!!,0.9996414185,0.60,0.70,0.00,0.90,0.80,0.80,0.70,0.60,147,G
106,"I did this today after work instead of in the morning. It was such a difference, so much more powerful. Adriene, thank you.",0.9998012185,0.40,0.70,0.00,0.80,0.00,0.30,0.20,0.70,123,P
107,"Hi Adriene, Iv been doing yoga with you during the covid crisis. I am a senior citizen. thank you. I love your calm and calculated approach. Of course at home doesn't matter if I can't be perfect, or am a bit slow.",0.9991648197,0.70,0.70,0.00,0.70,0.50,0.40,0.00,0.70,214,J
108,My balancing poses are getting better!!! :) This was hard but so fun it's nice to have something to work for. Thanks,0.9998130202,0.50,0.40,0.00,0.70,0.40,0.30,0.00,0.40,116,M
109,"On day ""48"" (30 + 18) and feeling great! I noticed that my flat feet are an issue when doing balance postures 😅 (I feel the bows of my feet burning 😥). I guess I'm using muscles I never used before. Thanks  again for your great videos! ",0.9899337888,-0.20,0.30,0.00,0.70,0.00,0.00,-0.50,0.30,238,M
110,Day 486 in books ❤️😀,-0.8346203566,0.20,0.00,0.00,0.50,0.00,0.00,0.00,0.00,21,M
111,Day 18 and 19 done today and my sickness is completely gone now 😁😁,-0.9969803691,0.30,0.00,0.00,0.60,0.40,0.00,0.00,0.30,68,M
112,Day 19 and I still cannot sit how Adriene sit at beginning... :( anyone else?,-0.9977433681,0.40,-0.40,0.60,-0.50,-0.40,-0.40,-0.70,0.00,77,P
113,This is a super great day (they are all but this one worked for me) - odd question. What brand are those yoga pants. I only where shorts but might delve into longer yoga pants. Like that look...,-0.9526780248,0.30,0.50,0.00,0.70,0.00,0.20,0.00,0.40,194,M
114,I realized how much stronger I've become when we went into that hover pose. Thanks for all the support ❤️,0.9980839491,0.40,0.50,0.00,0.70,0.30,0.30,0.00,0.40,105,M
115,the best and biggest  improvement I see in myself is when you say today its a quick practice and I get sad lmao,0.9378976226,0.40,0.00,0.00,0.70,0.50,0.00,0.80,0.40,111,M
116,I've stuck with it so far. Thank you for making these videos free! I feel stronger and more balanced. 🌷,0.9996725321,0.40,0.40,0.00,0.70,0.30,0.00,0.00,0.40,104,M
117,"Lovely Yogi... I've been practicing for years with your amazing videos, and each and every time I find something new to take away. You really have a gift and I thank you so much for sharing that was all of us. It's with deep gratitude that I go into my day now after enjoying this lovely practice",0.9998824596,0.60,0.70,0.00,0.80,0.60,0.00,0.00,0.50,296,M
118,busted out into tears after today's savasana. such a simple sequence today and yet so powerful. Thank you Adriene,0.9997540116,0.40,0.50,0.00,0.70,0.00,0.50,0.00,0.40,113,M
