,comment,comment_id,reply_count,like_count,updated_at,calificacion
887.0,So many things are changing and this practice has been great to bring out feelings of gratitude and appreciation for all the everyday blessings we receive! Thank you Adriene and lovely friends from all over the world who make our coming to the mat even more precious every day! 💛,Ugzm2jtJOj80SH8HuG14AaABAg,0.0,0.0,2021-01-23T15:36:50Z,0.9998723268508911
888.0,This was just magical on this cold Saturday morning <3 Thank you once again,UgxTr-dwYqlpPf525IV4AaABAg,0.0,0.0,2021-01-23T15:36:48Z,0.9996528625488281
889.0,"Knowing that if I do the morning practice, the rest of the day is yoga, thats what pulls me in. Thx A",Ugyn0ypEKVx6rLaHqEt4AaABAg,0.0,0.0,2021-01-23T15:33:45Z,0.997593104839325
890.0,"This is the first time I can lower from plank to the ground without my belly sagging! Can't yet do it through the whole practice, but hey, progress! Also, what a DELICIOUS ending twist. Thank you for guiding this practice on this (for me snowy) Saturday morning.",UgxdrShcg2UNUPXoqqd4AaABAg,0.0,0.0,2021-01-23T15:32:18Z,0.9997206330299377
891.0,Another goodie! Thank you!!!,UgweR0n6DFWZTumBvRd4AaABAg,0.0,0.0,2021-01-23T15:32:10Z,0.9998664855957031
892.0,"This is off the topic of yoga (sort of, not really), but your quotes are so consistently resonant with me! I just purchased O'Donohue's Anam Cara after learning about the philosophy/term in a very mystical way; also love Rumi, Mary Oliver, Thich Nhat Hanh, John Muir, the list goes on....and, well, your practice shoots as an arrow right into my heart. And Benji...oh, Benji. As a ""herding dog"" girl, it's hard to keep my eyes off the screen and focus on my drishti, for fear I'll miss a cuteness. Anyway, sorry for the long post, but I'm fairly new to your practice and felt compelled to share. Thank you for being wonderful YOU!",UgxvUK1re9vkWDTgt3p4AaABAg,0.0,0.0,2021-01-23T15:28:32Z,0.9996064305305481
893.0,"Haiku for Day 22
taking little sips 
of morning time for myself
makes for a good day",UgwzdwPFImiTRYXq1Jx4AaABAg,0.0,1.0,2021-01-23T15:26:35Z,0.9960854053497314
894.0,"My low back is always a mess of tight and crunched up muscles, and crackly cartilage. I take supine twists in bed and I love them so much. Thanks for including them religiously through this journey. 
**Adriene: You might reach around and grab your foot and take a gentle bind” 
Me: Gurl, bye!!
My baby: Bye bye!!!(waves bye bye to Adriene vigorously) 😂❤️ 
Love you!",UgwQWSuiRTKl3mPVaLh4AaABAg,0.0,0.0,2021-01-23T15:23:38Z,0.9991648197174072
895.0,"I am here to commit to making yoga a daily practice.  YWA makes it so easy,  and I am learning that 20 or 30 minutes of yoga a day is powerful, even if it's not ""power"" yoga.  I've never gotten into a twist quite like the one on the floor in today's practice.  It felt amazing!",Ugz3E8rpqTOc53BMbH94AaABAg,0.0,0.0,2021-01-23T15:21:27Z,0.9994156360626221
896.0,Over three weeks of consistent yoga. Three weeks of showing up for myself and it feels so good. Happy Saturday!,Ugwi_kPXRJKwTd0J8Q94AaABAg,0.0,8.0,2021-01-23T15:17:47Z,0.9998632669448853
897.0,One of my favorite practices EVER!  Thank you!,UgxV-ohA_jocWEvhTSF4AaABAg,0.0,0.0,2021-01-23T15:16:37Z,0.9998694658279419
898.0,"Thank you Adriene, I feel good and relax! And today at -12 Celsius, I'm going for a walk for several hours. Good form 🙏❤️☀️👍",UgxzG5Qhbx-yQVgWQah4AaABAg,0.0,0.0,2021-01-23T15:15:15Z,0.9998190999031067
899.0,I looove this practice. I felt so renewed and relaxed after a week of working hard. Thanks Adriene. 1😘,Ugz05y8bm_lEqal0LCp4AaABAg,0.0,0.0,2021-01-23T15:15:04Z,0.9997923970222473
900.0,I can’t believe how far through we are! I already know that my daily practice will continue on far beyond these 30 days! I am so excited to explore what comes next!,UgynKKGHsaQG9xdinH14AaABAg,0.0,0.0,2021-01-23T15:14:55Z,0.9987832903862
901.0,"Thank you, much appreciated ❤️✨",UgwxfMcPg-mQ8TzqdA94AaABAg,0.0,0.0,2021-01-23T15:07:38Z,0.9998494386672974
902.0,"I loved the practice today, I felt strong sand stable. Thank you 💕",UgwbCXoiU_RWgSytjAB4AaABAg,0.0,0.0,2021-01-23T15:02:42Z,0.9998677968978882
903.0,"This renew practice came at the perfect time. While I had still been doing Breath every day, I was feeling kinda ho hum about it the past few days. I’m excited now to return to the mat tomorrow, and for the rest of the 30 days! Thanks Adriene!",UgzcIaPPDkgWl5Sl17t4AaABAg,0.0,2.0,2021-01-23T15:02:37Z,0.9992274045944214
904.0,"Adriene should call the Humble Warrior the Pretzel Warrior.  Talk about pretzels, I've got to do a lot more practice to make those twists truly ""tasty"" !",UgwaTUPOYVqqJrIGuPd4AaABAg,0.0,0.0,2021-01-23T15:00:54Z,0.9993394017219543
905.0,This was such a yummy refreshing practice! Not very pg for me though as I ended up doing it shirtless 😄,Ugwx2zvgxBLu7zYlWkN4AaABAg,0.0,0.0,2021-01-23T15:00:40Z,0.9496282935142517
906.0,Release and let go. Yes. I need to release the stories in my head and LET. DEM. GO! Thanks everyone. It's sunny and cold here in Michigan. Enjoy your weekend. You've earned it! See you tomorrow!,UgzVPp_jrfLd6WM4Qyt4AaABAg,0.0,0.0,2021-01-23T15:00:02Z,0.999859094619751
907.0,"Fascinating how each day my body is a little different. The lunges are hard for me sometimes I can get right into them, sometimes it takes a lot of adjustment, and that's cool! Adriene's videos always allow me the time I need to get set up. She's just the gosh darn best! Also lol at ""YWA is Pg13!""",Ugw8awQ72wK97lOt9nt4AaABAg,0.0,1.0,2021-01-23T14:58:56Z,0.9992770552635193
908.0,"Loved Day 22 Renew. This was one of my favorites so far--my body connecting with itself and taking up space mindfully, joyfully. I feel strong, lithe, and gently empowered. Thank you, Adriene! Peace and love. xoxo",UgzHMvh22_hIkJW135J4AaABAg,0.0,1.0,2021-01-23T14:58:52Z,0.9998795986175537
909.0,"I LOVE a moving meditation! This practice was everything I needed! And I truly think the moving meditation set me up for success because for the first time in this 30-day yoga journey I actually found ease while moving through the Warrior sequence and flow on both the right and the left sides! That is such a fun feeling let me tell you! Thank you for practice Adriene, see you tomorrow! 💙",UgztrFctmCVmnXEoiGV4AaABAg,0.0,1.0,2021-01-23T14:58:08Z,0.9998570680618286
910.0,Thank you Adriene!,UgzrOAeGr4LouD9jFZd4AaABAg,0.0,1.0,2021-01-23T14:58:07Z,0.9998526573181152
911.0,Such a nice energizing practice. I’ll def be coming back to this after the 30 days are over!✨,UgwUNdwIjxbxCCZlVsd4AaABAg,0.0,5.0,2021-01-23T14:57:50Z,0.9992509484291077
912.0,Thank you superb 🥰,Ugwwmf_WtZSzqh1mYcF4AaABAg,0.0,2.0,2021-01-23T14:56:50Z,0.9998786449432373
913.0,"Good morning! I definitely appreciate this practice this morning. I was pretty hard on myself yesterday, but arriving this morning made me think about my why.",Ugyuw8GN6UEjkAFbFH94AaABAg,0.0,2.0,2021-01-23T14:54:35Z,0.9984598159790039
914.0,WOW!  That surprise twist and bind at the end—-so great!!!  ♥️♥️♥️♥️✅,UgwR2xKdFwHgl0lr-CB4AaABAg,0.0,1.0,2021-01-23T14:53:14Z,0.9998637437820435
915.0,These daily themes are so on point with whats going on in my life/mood 👁 she knows,UgzJau4rpZ4Ppj4IoGV4AaABAg,0.0,0.0,2021-01-23T14:52:32Z,0.9925928711891174
916.0,"Done. However, this was difficult due to my mind being not able to concentrate. I took breaks and I was restless but I did it ❤️",Ugx7UxZaQUOv6OdFAE54AaABAg,0.0,0.0,2021-01-23T14:50:21Z,-0.9850814938545227
917.0,Loved it 💞 thank you 💕🏴󠁧󠁢󠁳󠁣󠁴󠁿,UgzqWB2po9nFjonzOvx4AaABAg,0.0,0.0,2021-01-23T14:50:00Z,0.9998680353164673
918.0,Just what I needed. Love the tweaks to familiar poses and stretches.,Ugw-S7dbJm4NyxkwQGp4AaABAg,0.0,0.0,2021-01-23T14:49:55Z,0.9996373653411865
919.0,"Me and the wife like this one a lot more than the last two classes. This one have a nice flow to it with lots of movement too, a great way to start our Saturday.",Ugzk-ZguaRVfUKZ9edN4AaABAg,0.0,0.0,2021-01-23T14:49:05Z,0.9998594522476196
920.0,"Am I the only one who now that it's day 22 and the sessions have been short, find myself craving more by the time we get to Namaste'?! I need a good long 45min session minimum, I've begun exploring her other videos just to satisfy the itch.",UgzwCusdYsEtCpSHyXF4AaABAg,0.0,1.0,2021-01-23T14:43:02Z,-0.9616870880126953
921.0,I will definitely be returning to this practice. Love the humble warrior (best pose name ever!) flow and the awesome twist with hip opener. Love and peace to all.,UgxLoGmASg18JIF-vxx4AaABAg,0.0,0.0,2021-01-23T14:42:04Z,0.9998641014099121
922.0,My why? Because I got lost and am working to find myself.,UgzWmCQjUSo5qG7hqIR4AaABAg,0.0,1.0,2021-01-23T14:41:51Z,-0.9980491399765015
923.0,I really enjoyed this gentle practice this morning. Thankyou!,Ugw7nEMU-GV6RC5KguN4AaABAg,0.0,0.0,2021-01-23T14:41:31Z,0.9998708963394165
924.0,"Love when my cats join me the mat. Especially when I take more time at the end and they just settle in next to me. 🥰
I’m here for me. Health and wellness along with the most important to me is mind, body, & soul. My daughters join me and have truly enjoyed your videos and time you take to help others all around the world. Yoga has so many benefits and for me has helped my Multiple Sclerosis so much. I always start the day with you Adriene and it’s been that way for too many years as I’ve now lost count. Life is good 😌 namaste 🙏🏽",UgywmHhHqpCqIrp2YKd4AaABAg,0.0,0.0,2021-01-23T14:40:47Z,0.999760091304779
925.0,Working through grief and working on learning how to breathe again❤,UgymNmtMFLbdQ4M3-zt4AaABAg,0.0,0.0,2021-01-23T14:39:24Z,0.9675734043121338
926.0,❤️,Ugymh_2OaW4p-JGy5FF4AaABAg,0.0,0.0,2021-01-23T14:39:04Z,-0.6970567107200623
927.0,This felt SO good today - thank you!,UgygzMF54qrMF2YdIXh4AaABAg,0.0,0.0,2021-01-23T14:36:33Z,0.9998732805252075
928.0,"Today I renewed my commitment to be the best and most beautiful version of myself. ♥️
Thank you, Adriene, for another super session. You're simply the best! xx",UgwtvQF52Q0gIt3SCjB4AaABAg,0.0,1.0,2021-01-23T14:35:17Z,0.9998853206634521
929.0,"Hello from UK.....I've caught up...hurray....by doing a couple on several days....and I'm with you all now which feels good even with us doing it in different time zones and different chosen times of day.
Actually, my mornings are really painful and often have to take strong pain meds for fibromyalgia....so I tend to do 'breathe' ywa in mid afternoon.....loving it.....and movement always helps most things😊.
Sending cyber love to all. Xxx",UgwA0Pq5_RuJTlNa0R94AaABAg,0.0,0.0,2021-01-23T14:34:43Z,0.9995391368865967
930.0,Namaste :),UgxpRnUBBccR_GznCwh4AaABAg,0.0,1.0,2021-01-23T14:33:17Z,-0.5511691570281982
931.0,Great video! Well done!,Ugyn5LGFNJuy9E5esgt4AaABAg,0.0,0.0,2021-01-23T14:32:10Z,0.9998518228530884
932.0,Here to say.... I LOVE TEEMILL. My YWA swag is unstoppable now.,Ugzqe9wHTtovzV1PbfJ4AaABAg,0.0,0.0,2021-01-23T14:31:26Z,0.9876905679702759
933.0,power up for the next days!!,UgzGReAlRoZfiTRktz14AaABAg,0.0,0.0,2021-01-23T14:31:02Z,0.9991589784622192
934.0,Thank you for adding Romeo and Juliet to our Namaste this morning. It’s the little things.,UgwDqV-qZgGaSJy51y94AaABAg,0.0,0.0,2021-01-23T14:29:11Z,0.9998064637184143
935.0,This is exactly what I needed. I was having some anxiety last night and this renewal practice today was beautiful! I felt powerful doing the one legged dog hip stack pose. I never new I could feel that way doing a pose like that! My physical and inner strength has grown beyond what I thought was possible during these 22 days. It's crazy how no matter what you're struggling with there is always something each of us can find as an answer or as peace on the mat. Even though the practice is the same it is not the same outcome for each person participating. Its a beautiful idea that everyone can come and do the same thing but come out with different renewals. Namaste!,UgwmZ9RJ88_8y71KSfR4AaABAg,0.0,0.0,2021-01-23T14:28:08Z,0.9981504082679749
936.0,We haven’t even made it through the month of January this year and I feel like I already needed this practice...a renewed breath and a renewed spirit...how did you know the world would need this practice so immensely today Adriene?,UgxIXf0AziQHj_jl-Bh4AaABAg,0.0,0.0,2021-01-23T14:27:48Z,-0.9390245676040649
937.0,That moving meditation was EXACTLY what I needed this morning. Thank you so much for this practice. It is such a blessing in my life.,UgxiWjfcXXLPx2Hy1bp4AaABAg,0.0,0.0,2021-01-23T14:26:52Z,0.9998655319213867
938.0,Gorgeous practice and sweet Romeo and Juliet reference at the end. So much love for you and this community 🥰,UgzPT0kwYMymNJXUP0x4AaABAg,0.0,0.0,2021-01-23T14:26:32Z,0.9998632669448853
939.0,Loved this! Thank you Adriene 🙏,UgyHacZ52J0WBuO5HU14AaABAg,0.0,0.0,2021-01-23T14:25:42Z,0.9998724460601807
940.0,"Loving those rolling ocean breaths at the end...I could really envision the waves on the sea. Another beautiful practice, thank you :)",UgzBymlHLZFu2nHM-Sx4AaABAg,0.0,1.0,2021-01-23T14:25:38Z,0.9998304843902588
941.0,What an amazing 22 days this has been.  Thank you!  This was one of my favorites ❤️,UgxUU4mErNDTr42Wu1J4AaABAg,0.0,1.0,2021-01-23T14:25:30Z,0.9998621940612793
942.0,"22 days have flown past, the practice gliding on the breeze of thousands of collective breaths 🌬️ 🍃",UgwhYq76Rn2NnYWQBi14AaABAg,0.0,1.0,2021-01-23T14:20:55Z,0.9939233660697937
943.0,Can't believe it's already day 22 :'(,Ugxb2Gr2gTaWJ9_i8X94AaABAg,0.0,0.0,2021-01-23T14:20:53Z,-0.9839185476303101
944.0,Thank you Adriene!,UgzwCxbwY2NHlNQuce54AaABAg,0.0,0.0,2021-01-23T14:20:04Z,0.9998526573181152
945.0,"During this 30 days I am practicing giving myself the time to renew. It's a time to refocus on the positive and acknowledge what I am grateful for. After a challenging year, this has been a true blessing to be able to come to the mat and focus on my breath. Thank you Adriene and Benji for all the love you put into this.",Ugx78Hv9KWL0IjPhNqB4AaABAg,0.0,4.0,2021-01-23T14:20:01Z,0.9998364448547363
946.0,"Even though I have been practicing with Adriene for a long time, today is the first day I compared 'view' counts from when I started to when I finished. In these 22 minutes, I practiced alongside 3,616 other yogis around the world. So amazing! Thank you, Adriene!",UgzbkwmfM_1WbXq_7Sd4AaABAg,0.0,0.0,2021-01-23T14:17:12Z,0.9998117089271545
947.0,This practice was so beautiful and my first emotional release of this 30 day journey. 🥲 Happy tears for sure. Thanks Adriene for making us all feel safe and loved. 🥰,UgybEatuR2yz4ej5tjN4AaABAg,0.0,0.0,2021-01-23T14:17:00Z,0.9998584985733032
948.0,Day 22 complete!,UgwI5Q9OxHVaGpYfWfh4AaABAg,0.0,0.0,2021-01-23T14:16:36Z,0.9993756413459778
949.0,Today was a good day.  you keep getting me to do the things I can (but not so well) and push me to the things I can't get to.  all good.  Thanks for your guidance!,UgxB0kZDtGAHwLLR_LR4AaABAg,0.0,1.0,2021-01-23T14:16:20Z,0.9998257756233215
950.0,"Thanks dear Adriene, once again for a heart led practice.  It is such a wonderful gift to be able to start the day with you and feel that personal touch shared by many many people.  I loved you John O'Donohue quote, being from Ireland his writings take me back to the wild and silent places.  Thanks so much for sharing and for giving so much of yourself to us all.  Just reading some of the comments gives me hope that this world can become a better place as we share the love together.",UgznPfBzZnEer-jdHUx4AaABAg,0.0,0.0,2021-01-23T14:16:12Z,0.9998661279678345
951.0,Good morning Adrienne and 🙏 My front hip flexors are very tight. What would help stretch that muscle?,Ugx7LGRddrHqbA7p-Qd4AaABAg,0.0,0.0,2021-01-23T14:14:37Z,-0.9643712043762207
952.0,Thanks!,UgyHsURTLTkHsesvNpB4AaABAg,0.0,0.0,2021-01-23T14:13:43Z,0.9998165965080261
953.0,"I've just came back on the matt and finished the last 3 videos in row!💪
Back on the track, Yay!!🥰
So much energy, thanks Adrian 😊",UgyJ56p7hIW780qy4gR4AaABAg,0.0,0.0,2021-01-23T14:13:08Z,0.9989301562309265
954.0,I notice the growth in me. :),UgzQa9OozyMEIlpJaKZ4AaABAg,0.0,2.0,2021-01-23T14:12:49Z,0.9993614554405212
955.0,Another lovely soothing practice. Its one of the best parts of the day . Thank you.,UgxaCt00slOr-XT9c6d4AaABAg,0.0,0.0,2021-01-23T14:12:35Z,0.9998772144317627
956.0,Yoga + dog = YAY!,Ugx5-85VwtoiFaohUIJ4AaABAg,0.0,0.0,2021-01-23T14:12:18Z,-0.9450051188468933
957.0,"Anyone else experience some ""wind releasing"" with these twists? Lots of love out, I guess😉",UgyLjQlt7g6kRs8bjm14AaABAg,1.0,101.0,2021-01-23T14:11:48Z,0.9892544746398926
958.0,"Felt so good to Renew today!! Loved that frogger, thread the needle into a twist, that was a new way for me to get into a twist and was fun to play!! Thank you Adriene! yay Day 22 everyone :)",Ugz91YcvcAh2XSvdoiZ4AaABAg,0.0,0.0,2021-01-23T14:11:35Z,0.9998645782470703
959.0,"In addition to this being one of my favorite practices so far (saved to Favorites so I can come back to it repeatedly), I am truly noticing increased strength, more connected flow, and deeper breaths.  Thank you Adriene and all of this community!",UgwXVvJY3dOMzrD38hd4AaABAg,0.0,0.0,2021-01-23T14:08:49Z,0.9997827410697937
960.0,"Wow, this practice was truly restorative. Feeling so light, grateful, and at peace. Hope you all have a wonderful day and feel renewed as well.",Ugy4S4BHbdd9XKfr-ZV4AaABAg,0.0,0.0,2021-01-23T14:07:15Z,0.9998849630355835
961.0,I feel renwed! <3,UgwXh6F_Sakit1gDbn14AaABAg,0.0,0.0,2021-01-23T14:03:15Z,-0.9811945557594299
962.0,"Coming to the mat everyday, to an unknown practice with the belief that I'm going to be fine, I'm going to complete the practice... All of us trust you, Adriene. It's all going to be okay. Grateful 💖",UgzIQJ1Fin-MTCS9Kgp4AaABAg,0.0,0.0,2021-01-23T14:03:05Z,0.9998071789741516
963.0,"Perfect after my muddy, icy trail run 🤗",UgxeQHPa9vTd-_B7OTx4AaABAg,0.0,0.0,2021-01-23T14:02:21Z,0.9977580904960632
964.0,"Thank you for todays session Adriene. Started the day outdoor for a couple of hours, so when I came home I was a bit cold when I started todays yoga adventure. The fantastic feeling when your body warms up and comes to life again is just great, just what was needed this lovely winter day. Looking forward to tomorrow, all the best and stay safe",UgyFm1AYQaZZLtGA4QB4AaABAg,0.0,0.0,2021-01-23T14:00:57Z,0.9998482465744019
965.0,Merci 🙏,UgyR52myhj9CbH9aWiF4AaABAg,0.0,0.0,2021-01-23T13:58:32Z,-0.9037727117538452
966.0,"That was sweet! It can be tough to get here some days, but it is always worth it!",UgwNZZKIkT19yKo1tSl4AaABAg,0.0,0.0,2021-01-23T13:57:39Z,0.9998619556427002
967.0,This was my favorite so far!! sending love to everyone <3,Ugx5xeKVP-16hEPZaHl4AaABAg,0.0,2.0,2021-01-23T13:56:14Z,0.9998431205749512
968.0,"So as I lay there feeling like a twisted Gumby, I replied to Adriene “My back is not on the floor.” 😭

On a positive note I was able to concentrate clearly and complete one full sequence without looking. Hashtag growth.

Thank you and Namaste",UgzrIcboNnRhyjH8Epl4AaABAg,6.0,14.0,2021-01-23T13:55:13Z,0.9991922974586487
969.0,I can't find the words to type this morning to express how grateful I feel for this world of technology and what we are able to do in connection. Whenever I want to disconnect to the digital world I remind myself of how connected and better I can feel if I join Adriene in a yoga session with everyone else's energy contributing too. I am so grateful for ALL of you that join in and continue to practice loving yourselves and renewing your energy daily. It is a daily struggle to be on the high tide of the mermaid ride. I keep surfing and seeing all my buddies. I love you all. Thank you for being intergalactic tidal waves of love and energy. This human experience is better with you. - KMacKMermaid Love love love love,Ugz_IpJWqf6cdLv8Jy94AaABAg,0.0,12.0,2021-01-23T13:54:43Z,0.9995228052139282
970.0,My movements felt particularly graceful this practice. It was especially nice after needing to give myself a pep talk to get on the mat this morning. ☺️,UgwF8t-R-y_b-nV81gJ4AaABAg,1.0,1.0,2021-01-23T13:51:08Z,0.9992978572845459
971.0,"Our day 22 of our yoga practice was definitely a RENEWal of energy in the mat. I felt so refreshed and relaxed whilst gaining this moment of peace and tranquility. You’re definitely right Adriene, it is powerful. Thank you as always. Keep safe all. Namaste! 😊",UgxG-jADQmYwSso1yhJ4AaABAg,0.0,0.0,2021-01-23T13:50:36Z,0.9998772144317627
972.0,That felt like a trip to the chiro this morning. Thank you. Namaste 🙏❤,UgykouX4MEeldKxprG54AaABAg,0.0,0.0,2021-01-23T13:49:53Z,0.9988927245140076
973.0,"Jan. 23rd, 2021. I feel I’ve been saying this a lot lately but I so needed this. Thank you, Adriene!",Ugw9um2L_DiMldLk3Xp4AaABAg,0.0,0.0,2021-01-23T13:49:00Z,0.99649578332901
974.0,"Here in beautiful Cornwall this afternoon , standing looking out on my garden, the birds are singing and life is good, a beautiful yoga ritual to make my day 🙏🏻❤️",UgxUiG-RKXQmyLsgYTN4AaABAg,0.0,0.0,2021-01-23T13:48:09Z,0.9998062252998352
975.0,"Shimmy on the mat is so good! Loved the ease of today! Have a lovely day! 🤗
Flowers planting..🌼🏵🌼🏵🌼",Ugz5HfkhAEu2NKu3Uv54AaABAg,0.0,0.0,2021-01-23T13:47:32Z,0.999885082244873
976.0,"Day 22 was my MOT day. Taking stock,  restore and renew my energy and commitment to my yoga journey. Very powerful day as it gave me time to pause and reflect on this journey and move on from that I could not achieve. Can't wait for the holy trifecta ❤. It was lovely to  see Benji connected on this wonderful day with Adriene and friends ❤around the world 🙏🙏🙏.",UgyGioDLHcDyFcHmTlt4AaABAg,0.0,0.0,2021-01-23T13:47:16Z,0.9997430443763733
977.0,Allow.....Release....Let go - Thanks once again YWA for my mantra/intention of the day,Ugx6kpJWzy0gsivxC_J4AaABAg,0.0,0.0,2021-01-23T13:46:32Z,0.9937132000923157
978.0,wonderful. I'll be coming back to this one whenever I feel knotted up in any way.,Ugzb6FecxuMOyItpbDZ4AaABAg,0.0,0.0,2021-01-23T13:44:52Z,0.9998188614845276
979.0,"At the end after Namaste, I get a lovely warm golden glow between my hands in prayer. Then I smush this feeling down over my face, it's delicious! Anyone else feel that?? Maybe describe it better than I can? 😂
 Loved this one today, got some nice flow, and finding new things in poses that we are revisiting often. Hello from frosty Ireland ☘️🌊🐬",UgwyeVN58R7TDXNL-IZ4AaABAg,0.0,1.0,2021-01-23T13:41:32Z,0.9998180270195007
980.0,"Ouuuh! Today was my fave practice so far. Those stretches felt sooo good, yummy is definitely THE world. Thank you 🙏🏼🤍",Ugyvc7mJikWSN25buSV4AaABAg,0.0,0.0,2021-01-23T13:40:50Z,0.9996535778045654
981.0,Gosh I really needed a renewal today 💪🏽,Ugxsk7ldZZmCJwt8c9F4AaABAg,0.0,0.0,2021-01-23T13:39:06Z,-0.7558022141456604
982.0,"Each practice is different, each one is a gift. Thanks to Adriene and the thousands of people who breathed in unison today.",UgyYU8OG_04mV4pmayZ4AaABAg,0.0,0.0,2021-01-23T13:36:08Z,0.9998400211334229
983.0,"Thank you so very much for your support in our personal grief, I am totally indebted to you for your loving caress of yoga that brings our heart, soul and body together in unity. God Bless for your Beautiful soul and sharing your Love & Peace with me and the whole world. Love ❤️ Scarlet x",UgxRDkopKDU0ZX5gs0F4AaABAg,0.0,0.0,2021-01-23T13:30:33Z,0.999842643737793
984.0,"Day 22, renew: don't cancel the subscription to your true self.",UgxA092czlEi96xtGdJ4AaABAg,0.0,0.0,2021-01-23T13:30:05Z,0.9756394028663635
985.0,"Every time i finish practicing yoga, i feel renewed. Thank you Adriene for guiding us through every breath during this journey. Happy weekend, everyone.. 🙏❤️",Ugy3EFvD081ve0SDZxp4AaABAg,0.0,1.0,2021-01-23T13:26:24Z,0.9998631477355957
986.0,"And I have caught up! Did day 21 and 22 in a row. they are perfect together. The twist on the floor did take me by surprise though ;) 
Have a wonderful day everyone!",UgxfKiQMO6uL1u3_3J14AaABAg,1.0,2.0,2021-01-23T13:25:31Z,0.9998766183853149
987.0,Loved today! Been listening to the playlist you made on Spotify a lot and really like it. I especially love the song Benji. Which I suspect was made for him? I saw his photo come up when the song plays 😍. Sending love and light out to all who need it. Have a great day/night ❤️❤️ Namaste 🙏,UgxtQFVf_eJYyC3onOJ4AaABAg,0.0,0.0,2021-01-23T13:25:23Z,0.9996864795684814
988.0,"Favorite one so far me thinks ♡  great stretch,  and so calming, much needed after these kids this morning! Lol 😆  have a great day everyone  ♡",UgzBBuN8uUrC-0LATPR4AaABAg,0.0,0.0,2021-01-23T13:25:21Z,0.9979623556137085
989.0,"Day 22 and this is the best gift yet of this particular journey. I shall return to this particular practise time and time again. I even managed to ignore my two children playing in the living room whilst I was participating in this particular session.

Thank you for renew.",UgyYCTB6JV3I1Hf35UF4AaABAg,0.0,0.0,2021-01-23T13:23:21Z,0.9993958473205566
990.0,Oh wow. Needed that release. Will be doing this one 2X today! Much love!,Ugw1SY9QGvIkpy8sh314AaABAg,0.0,0.0,2021-01-23T13:21:19Z,0.9995730519294739
991.0,Today is my birthday! Starting the day off right. This is my favorite practice so far! Good luck everyone and have a good day!😁,UgydDaG0cG_ivYB-Vbd4AaABAg,4.0,5.0,2021-01-23T13:19:01Z,0.999858021736145
992.0,"Day 22: done! Wow, lunges and forward folds are getting easier as the days go by 😍",Ugzqc-8aj2vXFmxdBsV4AaABAg,0.0,2.0,2021-01-23T13:18:04Z,-0.8495346307754517
993.0,"I felt myself leaving my thinking mind behind, just zoning out and following along, almost like on auto-pilot - that’s an happened to me in yoga before! Thank you, Adriene 😘",Ugxq5A6bPE-2KdfhWgJ4AaABAg,0.0,1.0,2021-01-23T13:16:06Z,-0.986404538154602
