,comment,comment_id,reply_count,like_count,updated_at,calificacion
330.0,"Showing up to practice is a choice. For 4 days last week I decided not to. That's what I needed. I know myself enough to know when to stop pushing. I'm listening. I'm feeling. I'm here. Trust. If I fall, I'll laugh, and the floor will catch me. I'm still 2 days behind, yet today really felt like renew.",Ugy7F_GSGR4to-O2-9x4AaABAg,0.0,0.0,2021-01-25T23:42:50Z,0.9983385801315308
331.0,"I've fallen a couple of days behind so I feel like this was the perfect practise to get back into the flow! RENEW! Renew my dedication to this journey. I am here, I have not given up! Thank you Adriene xxx",UgzMBj-IWxDL-gAl3x14AaABAg,0.0,1.0,2021-01-25T22:01:23Z,0.9991436004638672
332.0,Thank you!!,UgwbuSDwvNSKM522r0l4AaABAg,0.0,0.0,2021-01-25T21:19:45Z,0.9998660087585449
333.0,"I like that practices are not long, this motivates me to show up on a mat every day :-)",UgyJBrwTfyoZqAi9m7R4AaABAg,0.0,0.0,2021-01-25T20:57:51Z,0.996916651725769
334.0,Loving that Benji has his own mat at the beginning of this practice!!  Loving the twists at the end of this practice!,UgzYaWuioSStLTJ1Fm94AaABAg,0.0,0.0,2021-01-25T20:19:27Z,0.9998328685760498
335.0,Great lunch time practice i just fit in for myself. Great pick me up! 🙏🏻💞🙏🏻,UgzR8aPE4TslYlovwwl4AaABAg,0.0,0.0,2021-01-25T19:56:14Z,0.9997660517692566
336.0,"that was a great practice. Thank you Adriene.  Lockdown 3 in the UK is tough but feeling renewed and ready to go now, bring on home-schooling!!!",UgwaC7oes5VbPf7zlBl4AaABAg,0.0,0.0,2021-01-25T18:59:36Z,0.9993446469306946
337.0,"Wow that was fun, yummy and refreshing ❤️",UgwcDhTs7BcGg-JPpyB4AaABAg,0.0,0.0,2021-01-25T18:51:14Z,0.9998749494552612
338.0,Having a terrible day but Adriene and this community always make me feel better. Benji too.,UgynbeRmeDBk8SKl6It4AaABAg,0.0,0.0,2021-01-25T17:46:20Z,0.9975960850715637
339.0,Heartbeat at 16:20 lol,Ugxx1HcnNMiqDbnl0BB4AaABAg,0.0,0.0,2021-01-25T15:31:02Z,-0.9216609001159668
340.0,"OMG! I started this practice with a clogged left nostril and I felt so congested. Idk if it's covid but I'm getting the test today (Let's hope it's negative 🤞😔). But during the practice, I COULD BREATHE AGAIN!! It's so relieving. Tysm Adriene ꉂ(≧∇≦)",Ugy9JOXXnz1XedCht6R4AaABAg,0.0,0.0,2021-01-25T15:26:15Z,0.9732667803764343
341.0,It's like you read my mind! This is exactly the practice I needed. Also can't believe how audible this was - I think I must have cracked about 100 times hahahaha,Ugyxhbe9bibMwMc235h4AaABAg,0.0,0.0,2021-01-25T15:06:08Z,0.9923712015151978
342.0,"Rated ""E"" for Everyone 😎🧘‍♀️❤️",UgxS8gMO1zqq_-ec2et4AaABAg,0.0,0.0,2021-01-25T14:51:10Z,0.9710303544998169
343.0,Wow! Beautiful practice as all of the practices in these 30 days! Thank you!,UgwT7hmLEbwOo14UV_l4AaABAg,0.0,0.0,2021-01-25T13:53:06Z,0.9998722076416016
344.0,"I am two days behind, but wondering how I am going to continue after this series is over?",UgxM-8TytscvMPHDRat4AaABAg,0.0,0.0,2021-01-25T13:51:58Z,-0.9988929629325867
345.0,"I CANNOT believe I'm at day 22, crazy!! I've never made it this far!",UgxcpzE5DLziR1SjeOl4AaABAg,0.0,0.0,2021-01-25T12:48:18Z,0.9911850094795227
346.0,"Whoo! I loved this at the time, but did anyone else feel it in the back of their legs the next day?",UgxZzC8BIfC12vJC0-l4AaABAg,0.0,0.0,2021-01-25T12:17:27Z,-0.9684586524963379
347.0,I am a big fan from Québec.   I love your voice and the simplicity of your environment.  The yoga with you and Benji is just perfect for me.  Thank you !!!!,UgynP6gFD_69BqNYKNV4AaABAg,0.0,0.0,2021-01-25T11:59:19Z,0.9998866319656372
348.0,Thank you beautiful Adriene - I've had a few days off over the weekend and this practice was so sweet to renew the ritual xxxx,UgyINLOYEMVJtXETZnV4AaABAg,0.0,0.0,2021-01-25T11:14:30Z,0.9998100399971008
349.0,Renewing my presence to this moment. Being under lockdown with little to no interaction and wifi can make the day seem like one long out-of-body moment. Needed this practice today (and probably yesterday too)🥴,UgzYiDTGhdlogtU3CzJ4AaABAg,0.0,1.0,2021-01-25T10:56:43Z,-0.9608286619186401
350.0,Day 22 : done,UgwMb4ZyyX5bFiDOiHp4AaABAg,0.0,0.0,2021-01-25T10:12:29Z,-0.6684062480926514
351.0,Feels great to be on the mat today! Can't believe we're getting so close to the end of this journey. 😭💚,UgzKlQtnQw_tf92MTVp4AaABAg,0.0,0.0,2021-01-25T10:10:44Z,0.9993972778320312
352.0,I'm a couple of days behind but my ear is nowhere near the ground in the twist. my head was inches of the mat too.,UgzhbU9yXWzktwgb5Np4AaABAg,0.0,0.0,2021-01-25T10:07:42Z,-0.994581401348114
353.0,"I had to take 2 days breaks because I came down with a really nasty cold, but I'm really proud of myself that I made it back onto the mat to complete this journey. It's really important to listen to your body and take a break when it's needed.",UgzvdwELjoFlvt3ve254AaABAg,0.0,0.0,2021-01-25T08:13:03Z,0.9997586607933044
354.0,"Thank you for another wonderful practice!

It's not often, but sometimes (e.g. ankle rotations) you spend longer in one side than the other, so that may be something to be mindful of for future videos. But thanks again for how you help myself and others across the world 👐",Ugw_MkkaUCkbx-ueVMN4AaABAg,0.0,0.0,2021-01-25T07:32:43Z,0.9995377063751221
355.0,"My hamstrings were acting up this morning, but I still came to the mat :) this practice was really fun and inspired!
Good job, everyone! <3",UgwNC5et75fNCd5zxCV4AaABAg,0.0,0.0,2021-01-25T07:26:46Z,0.9997727274894714
356.0,"This was just what I needed today. I've attempted this 30 day challenge for the 5th year now but Ive never made it this far. I'll usually I'll miss a day or two, fall in a guilt cycle about it then give up. I'm about four weeks into almost daily practice, so surreal. What a joy it is to carry this challenge on and off the mat. Thank you Adriene!!",UgzTkSCdxMuLx3UBkPt4AaABAg,0.0,0.0,2021-01-25T04:41:13Z,0.9988621473312378
357.0,Adriene how do you always know exactly what practice I need! Thank you🤎,Ugz0RMe_N4UC3b8wYIx4AaABAg,0.0,0.0,2021-01-25T04:25:54Z,0.9991648197174072
358.0,I caught up and loved it🙏,Ugz-egAbMqxKR8XGdLh4AaABAg,0.0,0.0,2021-01-25T04:09:25Z,0.999843955039978
359.0,"Breath or Breathe with an ""e""?",UgxDAR7l44yRNcyUpLR4AaABAg,0.0,0.0,2021-01-25T03:46:23Z,0.9913434982299805
360.0,"A day late, but what a great sequence! Feeling renewed & refreshed. Thank you! 🧘🏼‍♀️",UgwTCYhYmEhM2_-NiER4AaABAg,0.0,0.0,2021-01-25T03:43:12Z,0.9998599290847778
361.0,Could.hear your heart beat in this one.,UgxW0Sf_Cpemd7FAJqp4AaABAg,0.0,0.0,2021-01-25T02:24:54Z,0.9992489218711853
362.0,I am behind a day in practices. But refreshed the page after doing this and felt relieved that a good # of people are also doing this a day late hahaha hello my late people!,UgzSBPeuHT9VALK92dx4AaABAg,0.0,2.0,2021-01-25T01:15:22Z,0.9990953207015991
363.0,🙏💓💓💓,UgxHr-EcvVXNx7Ct08V4AaABAg,0.0,0.0,2021-01-25T01:11:34Z,-0.6970567107200623
364.0,"Loved today’s practice, such a different flow! Renewed💚💚🤗",UgyAf2pktlcDOJqQ6lN4AaABAg,0.0,0.0,2021-01-25T00:58:40Z,0.9997921586036682
365.0,You are so creative Adriene! I love so much this practice. Gracias Adriene!!,UgxBSuhtPNTmPSWbkg94AaABAg,0.0,0.0,2021-01-25T00:36:40Z,0.9998365640640259
366.0,"22 Renew. Poo poo. Brand new. Off shoes. Let's do. Renew. I feel clean. 

Ps. What's with the Shakespeare references to Romeo and Juliet? Lovers palms namaste.  Thank you. I will look that up. It has been a long long time since theatre going and acting days.",Ugw8pKA52o6vrDWUKEV4AaABAg,0.0,0.0,2021-01-25T00:13:54Z,0.997148334980011
367.0,"this is the best sequence ive ever done, thank you so much",UgzgDPBQIEhnmL2eTyp4AaABAg,0.0,0.0,2021-01-25T00:03:59Z,0.9998509883880615
368.0,❤️first class I missed :( but I’m catching up and doing yesterday’s and today’s now!,UgyUQatZf-jWUsDhUUZ4AaABAg,0.0,0.0,2021-01-24T23:59:57Z,0.969193160533905
369.0,This was great! Thanks Adriene x,Ugw1-7tAzMepvUhHjDV4AaABAg,0.0,0.0,2021-01-24T23:59:30Z,0.9998542070388794
370.0,"Day 22 Renew, I'm so grateful thankyou Adriene namaste 🧘‍♀️🙏💖",UgzT32gcNMx0Kt4sdhh4AaABAg,0.0,0.0,2021-01-24T23:28:05Z,0.9996715784072876
371.0,I love when the Yogic stars align and practice matches up perfectly with how I’m feeling in the moment. An awesome Sunday practice to rejuvenate & get ready for my week! Loved the Martha Graham moment.,UgxQzO1JQzdqFBUZp9N4AaABAg,0.0,0.0,2021-01-24T23:04:05Z,0.9998738765716553
372.0,Thank you for including your sweet Benji. We LOVE our furbabies. I feel so relaxed and at PEACE after these workouts. Thank you!!:),UgyF-pY2cEVAxK5y4lt4AaABAg,0.0,0.0,2021-01-24T23:01:47Z,0.9998748302459717
373.0,"I feel refreshed and connected after today's practice. I have been having a lot of trouble connecting my with myself during this series, which is a new and strange experience with yoga for me. But today I felt connected, it reminded me of why I love yoga and made me want to renew my practice of connecting with myslef.",UgwgHJGAmY8JPfxi6o54AaABAg,0.0,0.0,2021-01-24T22:26:48Z,0.9990320205688477
374.0,"I had to take yesterday off the mat due to extreme fatigue but here I'm. Just finished this practice and heading to the next. I'm glad I came back to it, was a yummy one 😋",UgxykpBvCkCfH8dTifd4AaABAg,0.0,1.0,2021-01-24T22:04:50Z,0.9808261394500732
375.0,That practice was like a hug from a friend. Cheers..,UgwPMQTBitaBsGWRNZ14AaABAg,0.0,0.0,2021-01-24T21:38:38Z,0.9997910857200623
376.0,"Feeling powerful and strong in triangle pose for ONCE! I could have stayed there forever, I could have read a book, I could have binge watched all seasons of The Crown casually in triangle pose. I shocked myself with that one.",Ugxy05GxGa-XRjd8ZUB4AaABAg,0.0,0.0,2021-01-24T20:16:17Z,0.9984174966812134
377.0,Oh that tricky little ‘flip and twist’! Lol LOVE IT!,UgzPeYGE-txqp3mqYoN4AaABAg,0.0,0.0,2021-01-24T19:47:01Z,0.9998778104782104
378.0,Awesome❤️,Ugzo4EF4Ki4bKtkccOt4AaABAg,0.0,0.0,2021-01-24T19:35:54Z,-0.6970567107200623
379.0,"Love the 20 minute or so (short-ish) practices...just right length for me, and I get the great feeling of accomplishment for having finished...!",UgwV2GMd6OM8M6iaU_V4AaABAg,0.0,0.0,2021-01-24T19:35:23Z,0.9998443126678467
380.0,Whoaa loved it today sm!,UgwqI4eaR8FdMWhHKGV4AaABAg,0.0,0.0,2021-01-24T19:32:53Z,0.9997547268867493
381.0,"This is a great one! This month I got a day behind and almost skipped this to catch up. What a mistake that would have been. This practice is saved, it managed to stretch just about everything and in just 22 min. I feel great, thanks Adriene!",Ugzh3mGdcvQ6VdVH0V54AaABAg,0.0,0.0,2021-01-24T18:28:24Z,-0.9059535264968872
382.0,"When doubt shouts in our ears and we feel our light dim,
is this an opportunity to embrace Renewal?
so the light that is uniquely ours,
Can shine bright among any darkness that creeps upon us",UgwPCVcnhIHtP0x5IXF4AaABAg,0.0,0.0,2021-01-24T18:18:07Z,0.9970260262489319
383.0,Feeling renewed and ready ....for the remainder of this yoga challenge! Thank you Adriene!,Ugxy-R9Jzjk0kMjm2894AaABAg,0.0,0.0,2021-01-24T17:55:42Z,0.999849796295166
384.0,:heart: Bliss,Ugy5iHHnprOxJgRUs894AaABAg,0.0,0.0,2021-01-24T17:55:20Z,0.9998891353607178
385.0,"Today I was visiting a friend and I was talking about doing yoga via YouTube and she's like ""oh really? My counselor told me to do a certain yoga course online as well!"" I'm like yeah it's called 'yoga with adriene' and she says ""really??? That's the one she told me to do!"" You're famous here in the Netherlands 😊😊 Good job!",UgxO1ydPNvQ1-3_lXU14AaABAg,0.0,1.0,2021-01-24T17:52:54Z,0.9948545694351196
386.0,"Beautiful, invaluable",UgxZ8fK4R7kzQMKxkap4AaABAg,0.0,0.0,2021-01-24T17:48:48Z,0.999885082244873
387.0,"Love the reverse-entry twist! Don’t know about anyone else but I genuinely had to ask myself “why do I keep showing up?” Am i just going through the motions and box ticking? I need to be showing up for myself, to feel good, to find my breath, or I’ll lose it come February as I have every other year 🤷🏼‍♀️",UgzuAjnclMNCw72mphx4AaABAg,0.0,0.0,2021-01-24T17:48:21Z,-0.988353431224823
388.0,loved it!Thank you!,UgyZ-_aLNL2e40qZ4AJ4AaABAg,0.0,0.0,2021-01-24T17:47:30Z,0.9998815059661865
389.0,"I loved this practice! I was able to really feel my center and stay balanced today, and the mantra at the end of allow, release, and let go was just perfect. Thank you! Namaste to all!",Ugyg_r8no5J1fp14NBd4AaABAg,0.0,2.0,2021-01-24T17:34:20Z,0.9998769760131836
390.0,"Tears bubbled up again today only to complete the release, those twists always find the mark! Found myself transitioning from fast shallow breaths to long deep breaths to end there. My sinuses are singing! Thank you Adriene!",UgzyCAjYz0w2WjABrYV4AaABAg,0.0,0.0,2021-01-24T17:25:03Z,0.9989598989486694
391.0,"In a world of more than 7 billion people, we are all very blessed to have our very own earth angel, Adriene ⭐
Forever grateful 💛
Well done everyone. You're doing great 🙌
Thank you Adriene x namaste 🙏🧘‍♀️",Ugx_Gk0cXYPVJWtnW-54AaABAg,0.0,0.0,2021-01-24T17:17:17Z,0.9998526573181152
392.0,Adriene after the Shakespeare quote at the end I will now think of my hands as Romeo and Juliet kissing whenever my palms come together at the heart. Namaste! 🙏💚💏,Ugw8l2RNnpIJJcpuftB4AaABAg,0.0,0.0,2021-01-24T17:10:11Z,0.9929924011230469
393.0,Short but sweet.,Ugwca1e1mNo0o1WaPcF4AaABAg,0.0,0.0,2021-01-24T17:03:05Z,0.9997993111610413
394.0,"The concept of renewing and remembering my why comes right on time. The practice already goes by in a blink but, I find it difficult to not wonder how long I have left. Timing shouldn't matter. I need to focus.",UgyBra6exsCQbBhtqtp4AaABAg,0.0,0.0,2021-01-24T16:49:55Z,-0.9966415166854858
395.0,thanks Adriene! to help improve my breath and focus in my center and taking all the strengh from my core !!!,UgwYaxrHlTJAe5VjBm94AaABAg,0.0,0.0,2021-01-24T16:47:05Z,0.9996552467346191
396.0,Adidas KACHING,UgzeivqoJfZm96S0huV4AaABAg,0.0,0.0,2021-01-24T16:45:43Z,0.9896774291992188
397.0,"adriene I really love your fresh, loving, humble energy! coming from 0:18, haven't done the practice yet but seeing you kiss benji & your smile made me want to say it :) namaste",UgzIaC7LYp0z1CmEFNp4AaABAg,0.0,0.0,2021-01-24T16:43:52Z,0.9998503923416138
398.0,Loved that bind in the reclined twist!,UgwQHcu_vEqJaRzd5R54AaABAg,0.0,0.0,2021-01-24T16:39:10Z,0.9995561242103577
399.0,"Thanks for a beautiful practice today. I felt like it was a dance at the beginning, with arms and breath. I do feel energized and renewed. Also, really cool tank top!",UgyEQ-k2WBx02rjkKzN4AaABAg,0.0,0.0,2021-01-24T16:32:49Z,0.9998778104782104
400.0,"I didn’t get to my mat yesterday. I felt a little guilty,  but mostly cheated that I didn’t get my time.  I’m doing 2 sessions today!",Ugz7ZSKALm1liq3Qnm94AaABAg,0.0,0.0,2021-01-24T16:27:42Z,-0.988944411277771
401.0,This was so magically what I needed. I’ve recently discovered I have piriformis syndrome. I have some exercises that are helping but would love to have a yoga routine that helps with this. The Psoas video you did a while back has been really complementary to the exercises to maintain balance in these areas and it would be amazing to have something for the piriformis. Thank you 🙏,UgzoqNOWOEqpnX7fPFB4AaABAg,0.0,0.0,2021-01-24T16:17:44Z,0.999010443687439
402.0,I manage a theater at a school in MA and yesterday was my first day back to work in person since March. I woke up so sore this morning!  The star pose twist was the perfect way to get things moving and stretch out. Thanks Adriene! Namaste <3,UgyzR50_eRnkzcdwRbF4AaABAg,0.0,0.0,2021-01-24T16:01:58Z,-0.859130322933197
403.0,"When reading the next three practices were a 'trifecta' I had to come back and makeup this session.  Im SO glad did!

Doing this particular practice make me realize how far I have come on my strength and my relationship with  my breath.  It's SO exciting and empowering!  

I'm moving so much more fluid and holding positions for much longer.  I can breath deeply during twists and I  feel much more in control.  I didn't even have to move my covid belly out of the way like I did in the beginning.

This is one of my favorite practices.  So grateful for everyone and especially to Adrienne for taking the care to develop such a impactful 30 Day journey.  🙏💕💖",UgwhxdtLPWVodXBjuY54AaABAg,0.0,0.0,2021-01-24T15:25:21Z,0.9997850060462952
404.0,Romeo and Juliet reference in a yoga practice - LOVE that!,UgxCr4RRQ9aLiswQ7zB4AaABAg,0.0,0.0,2021-01-24T15:17:21Z,0.9783071279525757
405.0,"Day 22
Renew
Why am I here? I need to practice every morning for a good, healthy and peaceful day. These mornings with you give me the happiness and power to do what I have to do each day.
Thank you Adriene :)
Namaste
Dosia",Ugz3qZnOYtcT3NascDN4AaABAg,0.0,0.0,2021-01-24T15:14:45Z,0.9998461008071899
406.0,Completed day 21 and 22 together... Wonderful practice...,UgxITRlSG6adZmd47WF4AaABAg,0.0,0.0,2021-01-24T15:07:30Z,0.9998836517333984
407.0,I simply needed this practice.  I went to bed with anger and awoke the same.  I'm here because I know my yoga practice will comfort me.,UgxW5ZCAMMWmn9D9Ped4AaABAg,0.0,0.0,2021-01-24T15:04:06Z,0.9960404634475708
408.0,"I unfortunately had to take a night off yesterday after smashing my head against a side table while playing with my son... with a history of concussion I didn’t want to take any risks. However, after a good night sleep I feel better today and was glad to get this session in. 22/23 and I will catch up with 23/23 tonight after putting the kids to bed. ❤️❤️❤️❤️❤️❤️❤️❤️❤️❤️❤️❤️❤️❤️❤️❤️❤️❤️❤️❤️❤️❤️",UgxfH6EauQyFN9zUs3d4AaABAg,0.0,0.0,2021-01-24T14:59:07Z,0.9871681928634644
409.0,"I like the suggestion renew your commitment to slow, mindful breathing. I already had on my schedule to spend time on goal planning. Now I can add RENEWal-based goal planning and acting. Thanks.",UgxxoO6Vbw4FVQClt8V4AaABAg,0.0,0.0,2021-01-24T14:54:27Z,0.9895694851875305
410.0,This practice is just pure magic. Truly feel renewed 🙏,UgziHoggXF5ZEKEmix54AaABAg,0.0,0.0,2021-01-24T14:05:19Z,0.9995710253715515
411.0,Thank you.,Ugytybyq1ySSOUyynfx4AaABAg,0.0,0.0,2021-01-24T13:30:28Z,0.9998457431793213
412.0,Benjamin is the cutest little doggie I really love seeing him he's soooooo cute ❤❤❤❤❤,UgzirRJIx3qjvOkqFxB4AaABAg,0.0,1.0,2021-01-24T13:13:19Z,0.9989932179450989
413.0,Thank you. What a beautiful renewing & mindful practice today! ❤,UgxNuPvdhP0g_hEnp3h4AaABAg,0.0,0.0,2021-01-24T12:36:09Z,0.9998878240585327
414.0,"I missed yesterday as I had a very sore knee, I was nervous that this session would be too uncomfortable but it was perfect 💗.  Thank you xx",UgynD69xWgGquiEMvzN4AaABAg,0.0,1.0,2021-01-24T12:28:00Z,0.9989161491394043
415.0,"This yoga journey it's being so gentle to my body and my mind, a beautiful and perfectly built 30 day flow. Thank you Adriene :)",UgxXvrADIkWBGL8qt354AaABAg,0.0,0.0,2021-01-24T12:22:02Z,0.9998722076416016
416.0,This was incredibly nice!!!,UgyDC5X5jJoePgMPWzt4AaABAg,0.0,0.0,2021-01-24T12:18:07Z,0.999853253364563
417.0,This felt so good!,Ugx-fTwmuYy_mOI_YK54AaABAg,0.0,0.0,2021-01-24T12:15:39Z,0.9998691082000732
418.0,That was the yummiest twist I have practiced in a long time. Ugh so good! 💛 Namaste,UgzU1f0USe9zUI-IncR4AaABAg,0.0,0.0,2021-01-24T12:15:23Z,0.9996330738067627
419.0,Loved the twist!!,UgxrV75_njd69Z2xuEN4AaABAg,0.0,0.0,2021-01-24T12:00:17Z,0.9998812675476074
420.0,"Renew my commitment to myself, my son and all that I can control 😍",Ugyc2r1bMGzwv-aGoN54AaABAg,0.0,0.0,2021-01-24T11:20:45Z,0.9994767308235168
421.0,"For the algorithm 😉

Day 22: From 6:47pm to 7:12pm, Philippine time. From 245,253 to 246,156 views. 900 people doing yoga with me in real time. Namaste 😍💕",Ugyy0cx2NYy-O81wcG14AaABAg,0.0,0.0,2021-01-24T11:18:10Z,0.960458517074585
422.0,honestly this year's yoga journey hasn't been what others were for me... but I still show up as best as I can,Ugwv38qkKyRJjGHQTyZ4AaABAg,0.0,0.0,2021-01-24T10:59:01Z,0.9996310472488403
423.0,"What pulled me in..commitment to self, my future, healing my back, becoming stronger. I want to show myself that I can change and become my best self and that it will ripple out into my entire life. Thank you..those thread the needle twists are ouchy great x",UgzQTv_AL6Y5X-Vmd_Z4AaABAg,0.0,0.0,2021-01-24T10:19:06Z,0.9993792772293091
424.0,"Thank you, Adrienne!",UgxHLUWtay2XgGhA0Ax4AaABAg,0.0,0.0,2021-01-24T10:04:58Z,0.9998699426651001
425.0,I feel amazing now,UgxkyZ0ucmW_1FF8Uxl4AaABAg,0.0,0.0,2021-01-24T09:44:06Z,0.9998843669891357
426.0,Thank you so much!,UgxxFP0q-WIorkUVgVh4AaABAg,0.0,0.0,2021-01-24T09:42:41Z,0.9998546838760376
427.0,The epitome of relaxation… feels like I just went to the chiropractor. 😌,UgyhI53I2CtItRerxR54AaABAg,0.0,0.0,2021-01-24T08:28:46Z,-0.9924991726875305
428.0,Day 22 is done! I enjoyed this one a lot. Compared to my twists and lunges from Day 1 I can see and feel so much improvement.,Ugw428j9OxlMhWjU9SN4AaABAg,0.0,0.0,2021-01-24T08:19:10Z,0.9996298551559448
429.0,Day 22 - accomplished! I let go so hard I cried,Ugw48z0SkNnOgCSF-yt4AaABAg,0.0,0.0,2021-01-24T08:10:00Z,0.6564556360244751
430.0,"That twist felt amazing. Thank you, it is just what I needed.",UgzQPCMqmh9yFZSnDg94AaABAg,0.0,0.0,2021-01-24T08:00:00Z,0.9998834133148193
431.0,Day 22 ✅✨🙏,Ugw3EUh6NKYvI0xOEmN4AaABAg,0.0,0.0,2021-01-24T07:58:54Z,0.9243913888931274
432.0,This was just what I needed today! Thank you so much it was wonderful!!,UgzF_iSYRBsB4_FElQZ4AaABAg,0.0,0.0,2021-01-24T07:39:59Z,0.9998778104782104
433.0,"A perfect theme for today. I was feeling really mehhh after a relatively active morning (lots of walking in the hot sun) and just did not have the motivation to get on the mat, but as always, I'm glad I did. Just as I was hitting play, the prism window film I put up yesterday, lit up my area in rainbow of colors and I had the giddiest kid energy. I felt so goofy and giggly the whole time. Safe to say, renewed. Sending the love from the middle of the Pacific ocean XX",UgyCgFvFZF2so2vvncV4AaABAg,0.0,0.0,2021-01-24T07:27:03Z,0.9996849298477173
434.0,That twist sequence helped me discover integration I’ve never experienced before.  PG-13,UgwAIXD8eEr_jwlsY7V4AaABAg,0.0,0.0,2021-01-24T07:18:41Z,0.9994460940361023
435.0,"Bahaha That moment Adriene makes you laugh when you're in a twist.. Lol! Not cool Adriene, Not cool lol! Thank you for this series.. 😊",UgyuaJttrET-8D-j5zd4AaABAg,0.0,0.0,2021-01-24T07:17:04Z,-0.8344300389289856
436.0,"Day 22 done looking forward to seeing you tomorrow too
today felt great",UgzXUGCrKuESVH5X1GN4AaABAg,0.0,0.0,2021-01-24T07:14:42Z,0.9996217489242554
437.0,"I was really tired and completely forgot untill I saw it in my feed, but it was the exact tempo that I needed Ty♥️♥️",UgyRmEd1rKz6usnNkSx4AaABAg,0.0,0.0,2021-01-24T07:11:20Z,0.8269296884536743
438.0,Thank you.,UgyiaCBhHFimoYeyk4x4AaABAg,0.0,0.0,2021-01-24T07:05:09Z,0.9998457431793213
439.0,Thank you thank you thank you - loving the mantra : Allow Release Let go! Loving this practice as its reNEW and find joy / stillness / contend within the movements and breathe. Namaste! 22 already wow!,UgyxLLGabviMUdFiIsx4AaABAg,0.0,0.0,2021-01-24T07:01:23Z,0.9997965693473816
440.0,im 31 minutes into the next day but im here and i did it. goodnight 💜🖤🖤🖤 thank you,Ugz2PqTE61qunqgLEDN4AaABAg,0.0,0.0,2021-01-24T06:41:34Z,0.9987117052078247
441.0,"Day 22 and the commitment is showing me that it's important to give priority to myself, to care for myself with great love and compassion. How often do we truly care for ourselves, so often we leave ourselves last.
Thank-you for the renewal physically, mentally and emotionally!!!   I'm feeling more joyful and content from this practice - AND my wife thanks you too Adriene!    😊❤🙏",UgwGHdNPAaq3kYwYZ-Z4AaABAg,0.0,0.0,2021-01-24T06:35:11Z,0.9997939467430115
442.0,❤️,UgxCEqR7TqCnT6pM5GF4AaABAg,0.0,0.0,2021-01-24T06:32:09Z,-0.6970567107200623
443.0,So much stronger! There’s no way I could have done humble warrior like this 22 days ago!,Ugx89-wuPUIZFxmQ7G14AaABAg,0.0,0.0,2021-01-24T06:16:40Z,0.9443250894546509
444.0,That was a yummy practice! Namaste all the way from Kenya.,UgyGPRmVX6CA1_tgC154AaABAg,0.0,0.0,2021-01-24T06:13:29Z,0.9892026782035828
445.0,I just moved back into my dorm for my second semester of sophomore year and this is exactly what I needed to ground myself after such a long day,UgwixPUEiHCDh7fkQcV4AaABAg,0.0,0.0,2021-01-24T06:09:06Z,0.9901624917984009
446.0,"Thank you Adriene🤗💓I allow, release and let go 🙏🏻💜Namaste",Ugw9z6fkNLYVIOxTMwB4AaABAg,0.0,0.0,2021-01-24T06:06:35Z,0.9980460405349731
447.0,Was really anxious due to job hunting and felt reluctant to come to the mat today. Really glad I did and this helps a lot. Feel like a safety blanket that I could allow myself to truly feel. Not that I don’t feel anxious about getting unemployed anymore but def feel a bit better! THANK YOU!!,UgwKHRxsN9P_C1Z7SMB4AaABAg,0.0,1.0,2021-01-24T05:56:03Z,0.998860239982605
448.0,That was awesome practice 😍 Good morning everyone. From Algeria constantine 🇩🇿❤️,UgwoI5zHTPAegXoi0v94AaABAg,0.0,0.0,2021-01-24T05:45:30Z,0.9997180104255676
449.0,"A cycle of breath has within it the bravery to stand, to be filled and gather strength. It also has the humbleness to lay down, empty and begin again. To renew my soul and create a world anew.",Ugyv3O-rDF-Vd0t3dfd4AaABAg,0.0,0.0,2021-01-24T05:45:13Z,0.9996331930160522
450.0,Today’s practice was maybe my favorite of the journey so far.. shallow question...Where can we get that adidas tank?! Love it!,UgxjxzezASG4ElnxbQZ4AaABAg,0.0,0.0,2021-01-24T05:44:15Z,0.9949039220809937
