,comment,comment_id,reply_count,like_count,updated_at,calificacion
454.0,"Oh my gosh, I felt like a steely eyed missile man (to paraphrase The Martian!), strong, engaged, supple, alive!  Thank you so much Adriene!",Ugx2L4tbhRYR7ABeevV4AaABAg,0.0,0.0,2021-01-17T18:14:47Z,0.9998227953910828
455.0,I couldn’t do ten seconds of boat pose but I had fun trying 👍😭😂😂,Ugwwz3e69vswAEoCVLp4AaABAg,0.0,0.0,2021-01-17T17:39:44Z,0.9969215989112854
456.0,"wow, this practice got me feeling so good! i was struggling to get on my mat because of a headache. when i finished this practice, it was gone! thank you adriene, thank you everyone for doing you best each and everyday!! you motivate me ❤🥺",UgziwzaHgyu_WjLCpEl4AaABAg,0.0,0.0,2021-01-17T17:37:02Z,0.9989014863967896
457.0,"I'm sure that those with severe depression who are embarking on this journey can understand and sympathize with those days where even getting out of bed can be a challenge. The last two days have been exactly like that for me, and I missed both days of yoga. As I came back onto the mat today, I expected to feel shame and disappointment - and yet the moment that I sat down and took the first breath, all I felt was gratitude toward myself for choosing to come back to the journey, and gratitude toward Adrienne for creating a space that celebrates the fact that you've showed up in the first place. To my friends on this video who are dealing with feelings of shame and self doubt, who missed a day (or three), or who just struggled to show up at all - it's my wish that you can extend some love and gratitude toward yourself for choosing to show up for yourself. <3",UgwD4lnf6l--VgK-yGZ4AaABAg,21.0,854.0,2021-01-17T17:31:18Z,0.8979631066322327
458.0,"Someone made a comment during an earlier yoga practice that the sessions being shorter than they expected. I honestly love the shorter sessions because then I know I can make it to the end, I am not intimidated, and I will feel better knowing I did the practice from beginning to end.",UgwT9Yc0FPo20J4W7PZ4AaABAg,0.0,0.0,2021-01-17T17:27:18Z,0.9986617565155029
459.0,"Namaste 13 - it's been 3 days since I last came here. It took me some time, but I'm grateful for showing up again for myself ^^",UgxnjAjnhArAYG4mfSN4AaABAg,0.0,0.0,2021-01-17T17:23:17Z,0.9963415265083313
460.0,"I was feeling emotional during this practice, and then you brought up “if you’re feeling emotionally, let it out” and I totally felt like you were talking to me haha.",UgxByB-SzXhko-Cnimt4AaABAg,0.0,0.0,2021-01-17T17:21:22Z,0.9958665370941162
461.0,"Did my practice in between meetings, and even when I had to leave the last 7-8 minutes for a second attempt, it felt so good :)",Ugzsr2KCKwOs0AIDn8d4AaABAg,0.0,0.0,2021-01-17T16:50:34Z,0.9996864795684814
462.0,I am sure you made an announcement that I missed but I am really really loving your new space! The big window letting in lots of light and the beautiful deck area right outside-soooo peaceful and zen! ❤️,UgyboubdYJxr2zGzQf94AaABAg,0.0,0.0,2021-01-17T16:41:10Z,0.9998527765274048
463.0,I found the focus and pace of this particular practice to be SO helpful.  I really FEEL as if I have deepened my awareness of movement.    THANK YOU ADRIENE!,Ugxtx_7mUD4h7KfZyZV4AaABAg,0.0,0.0,2021-01-17T16:11:37Z,0.9994121789932251
464.0,my admiration for Adriene went sky high with the ‘crashed on your butt’ thing because I did crash on my butt and Adriene made it feel like such a positive opportunity ❤️ I’m definitely taking that lesson off the mat ❤️,Ugxe2Rb9DwNw0g2ue8h4AaABAg,0.0,0.0,2021-01-17T15:02:19Z,0.9993589520454407
465.0,I cried through most of today's practice. And I discovered an entirely new way to be in boat pose - focusing on the upward current of energy on the front body and anchoring with the downward current in the back body changes everything. So rewarding!,Ugy1HUyRWC1g1yRIIcR4AaABAg,0.0,0.0,2021-01-17T13:57:38Z,0.9997699856758118
466.0,"Adriene, I just want you to know that 1. I think I am in love with you. Will you please marry me? Jk Don't tell my husband. Lol 2. You have helped me find internal peace. I have had a bad relationship with exercise for a long time. You have made me find a love in that burn and pranayama. I was doing your video one day, and suddenly I realized that I LIKE doing PLANKS! How crazy is that? Anyways, thank you so much for these videos. Even through the roughest most depressing days, these videos are what I get out of bed for... What I look forward to... Sending all of my love. ❤️",UgxbwpjzMbJeCDKjXgx4AaABAg,0.0,0.0,2021-01-17T13:39:50Z,0.9964607357978821
467.0,That was beautiful Adriene. I feel so free and happy after this. My week was hard....I missed 3 days with the children back to school and a funeral I had to attend. I have been back for the last 3 days and will keep going on. I so enjoyed this morning 😊,UgzZzFL_Siv3XxHak1B4AaABAg,0.0,0.0,2021-01-17T11:20:58Z,0.9994327425956726
468.0,Thank you so much for this journey so far.,UgxnRNeXZ-3k0mXhSbR4AaABAg,0.0,0.0,2021-01-17T10:26:32Z,0.9998549222946167
469.0,"I was feeling very anxious because of a meeting that I was about to attend. Then, I grabbed my mat, and somehow, I got the boost of courage I needed. I told myself that after the meeting, I could do yoga and things are gonna be alright. The meeting turned out well and now I feel like I can do anything. Though this is a bit of a stretch *wink*, thank you for giving me comfort and courage through your videos, miss Adriene!",Ugw-wttFOmYGnvGb6sN4AaABAg,0.0,0.0,2021-01-17T10:15:58Z,0.9994909763336182
470.0,"i fell off this journey for a couple of days, but now i am finally back and stronger than ever!! I WILL finish this jounrey, no matter how long it takes<3 If you are also struggling with this, just know that i belive in you! Dont be too hard on yourself, you are doing your best.",UgzzvnJ-Qbz6oNdbVCB4AaABAg,0.0,0.0,2021-01-17T09:59:31Z,0.9990736246109009
471.0,Beautiful class thank you 🙏,UgxcCUcp7690NsCHfCB4AaABAg,0.0,0.0,2021-01-17T09:54:00Z,0.9998726844787598
472.0,"This was so funny: the moment I leaned to the left side with my right arm, where my bed is, I felt my cat's head underneath my hand. Him, taking full advantage of the moment. :-D Namasté!",UgxACD2CZQwjeVbYfEZ4AaABAg,0.0,1.0,2021-01-17T09:26:39Z,0.9949853420257568
473.0,"Best to never buy any objects from me... shaky table, rocky boat 🙃",UgybKE5HMoC2lkcy4YR4AaABAg,0.0,0.0,2021-01-17T08:40:06Z,-0.9991149306297302
474.0,Lovely feeling today Durango and after practice.,Ugz7CZtV8LbHTmQtSvp4AaABAg,0.0,0.0,2021-01-17T08:39:09Z,0.9998418092727661
475.0,I love how much Adriene cracks me up xDDD booya,Ugy5Z3PjC8eiFZnm-g54AaABAg,0.0,0.0,2021-01-17T08:38:19Z,0.9993496537208557
476.0,"Thank you, Adriene! Have been doing this since  January 5th, looking forward to the next one tomorrow. Namaste <3",UgyIOm_0fAC6LFujcYp4AaABAg,0.0,0.0,2021-01-17T08:27:24Z,0.9996786117553711
477.0,Thanks a bunch,UgxOrzozpMJRZ5cNFd54AaABAg,0.0,0.0,2021-01-17T05:36:57Z,0.9996646642684937
478.0,I simply adore that Adriene knows what day I need to cry. Forever grateful for this practice.,UgxtuDPPJZrz4FLQ2IZ4AaABAg,0.0,0.0,2021-01-17T05:01:34Z,0.999657154083252
479.0,Big fan of Adriene❤,UgwFx72VM52lEuRkdzd4AaABAg,0.0,0.0,2021-01-17T04:42:03Z,0.998870313167572
480.0,Feeling what it feels like to be alive today.🙏🏻i love you!,Ugyy8PrHQ7D_amieb4h4AaABAg,0.0,0.0,2021-01-17T04:23:07Z,0.9998605251312256
481.0,Am I the only one intentionally behind because I don't want to catch up and not have a session to look forward to? :),Ugx_AQWc6ubpRDUz9ml4AaABAg,0.0,0.0,2021-01-17T04:18:10Z,-0.9959059953689575
482.0,I think I am developing a secure attachment to Adriene.,Ugw-nK5CATuO8Xseokx4AaABAg,0.0,4.0,2021-01-17T01:00:02Z,0.9715059399604797
483.0,"Another fine video! I'm not doing this whole series consecutively, but I'm hitting some. And I'm not alone...1100+ people played while I was practicing. I learned from another commenter a while back to look. It can be fun to see how many others are doing the yoga with you WW as you may practice alone.",UgxgvbSiRaBD9Lo_PwJ4AaABAg,0.0,0.0,2021-01-16T23:40:58Z,0.9917145371437073
484.0,"Armada, Michigan here!",Ugy32LELk5T0IhtVVGx4AaABAg,0.0,0.0,2021-01-16T23:21:47Z,0.9976600408554077
485.0,"So grateful for this... It gives me purpose to my morning, sometimes it feels like the only great thing in a day, sometimes feels like biggest secret of the world... Just feeling a belonging, feeling grateful, feeling cared for. Thanks again",UgwmgzdxNYuWFXkMDo54AaABAg,0.0,0.0,2021-01-16T22:49:52Z,0.9995867609977722
486.0,Thank you,UgwreRRoWMuTT7oKzuB4AaABAg,0.0,0.0,2021-01-16T22:37:10Z,0.9998352527618408
487.0,"I didn't realise how much I needed this today! When you mentioned feeling emotional I got a bit teary and then you said ""wipe a tear"" 😢 it's like you just knew. Thank you so much for these videos, I'm really enjoying it xx",UgwLN6bXu9CF7teSg954AaABAg,0.0,0.0,2021-01-16T22:36:39Z,0.9997084736824036
488.0,"It’s like a mental health practice combined with a physical workout. LOVE you and your wisdom, Adriene!",UgxOIcFxjZ5Cvwuk8rN4AaABAg,0.0,0.0,2021-01-16T21:16:25Z,0.9998255372047424
489.0,"The mom that says ""like nobody's business."" I'm that mom!",UgwvXatN6-I3SbVeTGV4AaABAg,0.0,3.0,2021-01-16T20:55:48Z,0.9036074280738831
490.0,"So much to say about this one. I’m a couple days behind so just did Feel today. You are so funny, had me laughing during today’s practice. So fun. I love the way you fill a half hour. So balanced. I enjoyed the Strala-esque vibe, moving as I felt to. I’m really enjoying the current relevance of this 30-day program. It’s so now! Namaste, Adriene. 😘",UgyWGjqr0whmQFnKoS14AaABAg,0.0,4.0,2021-01-16T20:42:36Z,0.9998703002929688
491.0,"Thank you Adriene, thank you Benji...",Ugw57Zj2IoqUhNXSYA94AaABAg,0.0,1.0,2021-01-16T19:38:03Z,0.9997536540031433
492.0,Thank you so much!!,Ugz5RR_wgPuvtyS4_uF4AaABAg,0.0,0.0,2021-01-16T19:04:43Z,0.9998571872711182
493.0,"thank you, i dont know much but i have seen very dangerous situations on IG of people posing their yoga like on edges of mountains. or other poses that ive had to stop following because of the vulgar content. i respect your words. and thank you for being our teacher.",UgxT5kzrrcCAaUpaZVp4AaABAg,0.0,0.0,2021-01-16T18:54:58Z,0.9929633736610413
494.0,"Playing catch up today and decided to end with this one. I'm amazed at how quickly these practices go by when you really get into it. 

Keep pressing on. It does get a bit easier.",Ugxx4-5l37upz7RMb_h4AaABAg,0.0,1.0,2021-01-16T18:43:20Z,0.9955434203147888
495.0,I am just late by a few days (now day 10) but I want to say thank you.,UgztyLCcNUzv_-sdWgR4AaABAg,0.0,1.0,2021-01-16T18:34:58Z,0.999620795249939
496.0,❤️❤️❤️,Ugwa-Uqcrcig55OAR854AaABAg,0.0,0.0,2021-01-16T17:39:19Z,-0.6970567107200623
497.0,I follow you every day.... thank you so much... less pain.... more love...,UgxRqPkFEH-VglCVzjp4AaABAg,0.0,0.0,2021-01-16T17:25:35Z,0.999790608882904
498.0,"Ok, running a little behind, not much, but it's ok, it's not a challenge, it's not a race, it's a journey... And I love being on it.. Thanks you all!",UgyLamy_10orp03plrN4AaABAg,1.0,3.0,2021-01-16T17:16:22Z,0.9981533885002136
499.0,"This was suuuuuuch a good practice. I fell two days behind and was feeling guilty, and today's practice made me feel more accepting of this slip up. Thank you <3",UgxWNUnhaHeXMy_0D9t4AaABAg,1.0,3.0,2021-01-16T15:39:20Z,0.9560715556144714
500.0,Simple and wonderful.,Ugyhjv5wPxFRDpdczN54AaABAg,0.0,1.0,2021-01-16T14:59:50Z,0.9998763799667358
501.0,"Hello fellow yoga friends, I need some advice. I have arthritis in both knees and have had surgery on both.  Those deep, sitting squats she has done the last 2 practices are nearly impossible for me to do and cause me a lot of pain in both knees.  I was hoping she would provide a modification other than lifting heels ( as if my heels have ever touched the ground in  that pose before lol).  Can anyone suggest an alternative to that squat?   I hate to just go back to childs pose where i feel like i lose my momentum and flow.   Thank you!  Namaste!",UgzaFmA-qqtag6mNGR14AaABAg,1.0,0.0,2021-01-16T14:39:09Z,-0.999091386795044
502.0,I did it!! 21:45 My legs kept trying g to escape. Thku!,UgxVVdoh6mYWfRnUQnp4AaABAg,0.0,0.0,2021-01-16T14:22:30Z,-0.951911985874176
503.0,"Was not a great day on the mat for me today, found myself getting easily distracted and irritated. But at least I made it to practice, and I can choose to let go of these emotions thanks to it and continue with my day. Thank you addrien!",UgwIs6phy_i4QsZj6yt4AaABAg,0.0,0.0,2021-01-16T14:20:36Z,0.9989219903945923
504.0,"Adriene, I find myself sobbing with love and gratitude for you at the end of every practice. I love you so much. Thank you so much for everything.",Ugwt1FJyDPRUv8aOrjl4AaABAg,0.0,0.0,2021-01-16T13:33:53Z,0.9998403787612915
505.0,Today's practice felt much shorter than it actually was. When I started I was pretty low energy but as it kept going I feel like I could do backflips and splits now! 😉,UgwN9llKbNBzCxmsa6d4AaABAg,0.0,0.0,2021-01-16T12:34:09Z,-0.9980985522270203
506.0,"So happy, my Breath tshirt arrived yesterday and local from the UK! :-)  Lovely idea making a pop up shop for the merchandise - Breath is amazing - This 30 days feels particularly poignant, due to what the world is enduring at them moment.  We will get through this - with Adriene and Benji! :-)  Namaste x",UgyhvSCfnQ3FHWEeMzZ4AaABAg,0.0,0.0,2021-01-16T12:29:52Z,0.9997462630271912
507.0,Thank You YWA community  :) :) Inhale Lots of love ;exhale : lots of love  :) :),UgxLeLGdQYVgH3WVk_F4AaABAg,0.0,1.0,2021-01-16T11:35:53Z,0.9998461008071899
508.0,Thank you so much for taking me on this journey! I'm new to yoga and this feels so good!,UgyZ6VlyKVgSX76IBip4AaABAg,0.0,1.0,2021-01-16T10:28:29Z,0.9998785257339478
509.0,Life isn't easy for so many people right now. Yoga helps. Imagine if everybody did it!? Light and love from Scotland.,UgzWlW5ZvMeJmBWOs-B4AaABAg,0.0,2.0,2021-01-16T10:26:23Z,0.998654842376709
510.0,"Fell behind, but picking it back up again. That feels so good <3",UgxgZMK_QkpQpLaX3qN4AaABAg,0.0,0.0,2021-01-16T09:31:24Z,0.9997430443763733
511.0,So much gratitude Adriene ❤️❤️❤️❤️❤️❤️❤️❤️,UgwoH_EWyTBkU2pR-ex4AaABAg,0.0,0.0,2021-01-16T08:33:19Z,0.9996180534362793
512.0,"Nice, please less talking it messes up my balance",UgwHmvoN2tnuh5mzfkZ4AaABAg,0.0,0.0,2021-01-16T08:24:12Z,0.6768723726272583
513.0,"Adriene: exhale with a sigh
Me: oh no I missed the sigh breath 
Adriene: let’s do it again in case you missed it 🥰
She really is a mind reader it’s incredible",UgwPmOnSpPwJzkJKax14AaABAg,1.0,399.0,2021-01-16T08:13:20Z,0.9950300455093384
514.0,"Great, I enjoy low to the ground practices :) Thank you 🙏",UgxSggUxZHDISXi42nd4AaABAg,0.0,0.0,2021-01-16T06:29:28Z,0.9998056292533875
515.0,"At 6:00 we can hear your heart beating :) Made me smile. Thank you for your wonderful work, and warm greetings from Finland.",UgxsaVN5GnFh9SzmKw14AaABAg,0.0,0.0,2021-01-16T06:12:00Z,0.9998712539672852
516.0,Accountability check: I finished Day 13! It took me way too long to show up...but I finally did. It is exactly what my body needed.,Ugzq4m8_IXjFywbyOs14AaABAg,0.0,1.0,2021-01-16T05:48:33Z,0.9991156458854675
517.0,Thank you Adriene 🙏,UgwL3rxhSXlYnPavncV4AaABAg,0.0,0.0,2021-01-16T04:51:16Z,0.9997859597206116
518.0,"This is having such a positive affect on my life! I’m feeling stronger in body and spirit! Also remembering that showing up is all it takes,  and a little often definitely does go a long way! Thank you so much Adrienne  in providing this series, many people will go on to pass your  generosity  forward in various ways.",Ugx4FClH8ihec--d7U54AaABAg,0.0,0.0,2021-01-16T04:37:04Z,0.9998623132705688
519.0,o wat the fuc,UgzPdNEibgQsmOWUhd54AaABAg,0.0,0.0,2021-01-16T04:00:31Z,-0.9809427261352539
520.0,"I love that Benji seems to enjoy 'his' new house so much. The way he gazes out the window, calmly observing. Such a good boy! :)",Ugwf36dmMxdLOpc9Dbd4AaABAg,0.0,0.0,2021-01-16T03:16:57Z,0.9997090697288513
521.0,"Adrienne, I am deeply grateful to you for your generosity of spirit and the 30 days invitation. It has changed my demeanor and overall sense of well being and I finally feel like I am turning toward more self care in the midst of so much work going on. Namaste'",Ugx8WxK8hFcu-kv5INV4AaABAg,0.0,0.0,2021-01-16T03:04:12Z,0.9981217980384827
522.0,I loved this practice. Opportunity for me to let go some important things xxx,UgyjTkbKKFod8_vy2Bh4AaABAg,0.0,0.0,2021-01-16T02:05:26Z,0.9997767806053162
523.0,"I missed this one yesterday because of craziness with work all evening and by the time I was done I was too tired to think... but here I am, carving out time today and planning on catching up tomorrow, Saturday. That was a good practice, I am pretty good at listening to my body already, but I liked being able to spend a bit more time in the poses to find the little stretches within. Thank you!",UgwfpzDIIdq0n0Uubl14AaABAg,0.0,0.0,2021-01-16T01:58:25Z,0.9968560934066772
524.0,Day 13 : Done,UgxRBtJ0xy0xk5viyXV4AaABAg,0.0,0.0,2021-01-15T23:21:25Z,-0.5979313850402832
525.0,"My sister knocked on my door right before the last sigh, so I had to pause the video and missed it. As soon as I hit play, Adriene said, ""Let's do that one more time in case you missed it."" She really is an omniscient being.",UgxaIqOSLKEgsNeejOd4AaABAg,0.0,0.0,2021-01-15T22:41:55Z,-0.5754593014717102
526.0,“Thread thy needle.” 🪡 Hard to hold a pose when you’re cracking up. 😂😉,Ugx6fG0EdgfN6HBTu-d4AaABAg,0.0,14.0,2021-01-15T22:41:13Z,-0.9986366629600525
527.0,Feeling lighter. Thank you!,Ugz5Q1Z7I6VQu3tchMp4AaABAg,0.0,0.0,2021-01-15T21:47:39Z,0.9998689889907837
528.0,when you avoided practice yesterday and it turns out you were avoiding feeling!,Ugwpn0s0Rz7KXNiYomp4AaABAg,0.0,0.0,2021-01-15T21:41:48Z,-0.9986079335212708
529.0,Thank you again Adriene!,UgwenXGYDIK5AOkZ-RB4AaABAg,0.0,0.0,2021-01-15T21:23:52Z,0.9998311996459961
530.0,"I fought myself pretty hard to get on the mat today, but as soon as I started it was done in the blink of an eye. Love when that happens!",UgyK7NF4HPFCaOxmXvN4AaABAg,0.0,0.0,2021-01-15T21:15:08Z,0.9998036026954651
531.0,"SOOOOOO GOOOOOD!  Love the pace, love the little challenges with soft edges.    I am feeling it!",UgxnmU06AmbVwR1wCPt4AaABAg,0.0,0.0,2021-01-15T20:47:17Z,0.9998472929000854
532.0,"I am thankful Adrienne is inviting us to delve into a fuller appreciation of what yoga can do not only for our bodies, but mind, soul and spirit",UgxETD6U8D7pBIQeQ6R4AaABAg,0.0,0.0,2021-01-15T20:30:02Z,0.9996293783187866
533.0,❤❤🙏,Ugxa06yVRTmrhnL7HYh4AaABAg,0.0,0.0,2021-01-15T19:52:52Z,-0.6970567107200623
534.0,"Day 13: Aw heck, youtube just ate my comment.  Oh well.  Suffice to day: it was hard to get to the mat this morning!  I didn't want to!  So I did other things until I did want to, because I just could not force myself to come to practice today, and it ended up for the best because in the end I got to sit down to practice when I wanted to be here instead of because I had to be here.

Good practice today, and I didn't hate boat pose.  A win.",Ugx17DONGngs62lFZ0d4AaABAg,0.0,0.0,2021-01-15T19:50:37Z,0.991374671459198
535.0,thank you beautiful people and benji! yesterday my boss invited me to end a presentation with a breathing exercise with our audience...  i'd never done anything like that before so thank you for your encouragement to snuggle with our breath! now i'm sharing this gift with my community!,UgzVP_WxEhUb7XuGs8F4AaABAg,0.0,0.0,2021-01-15T19:33:48Z,0.999863862991333
536.0,"I feel so much better after this video! I'm still a day behind. Maybe I will catch up, maybe I won't. It doesn't matter. All I know is that I'm gonna finish this challege and that is enough. Even it takes me more then 30 days. It is the journey that counts. Stop being so hard on yourself girl! Note to self :)",UgwiJ35oeqlPyLJkMdx4AaABAg,0.0,1.0,2021-01-15T19:12:37Z,0.9954720735549927
537.0,"each day i come to the mat, i leave in a much more mentally calm and settled state. loved the talk today about humility :). sending love and positivity to you and benji. you're changing lives",UgxvDRz_vPzdrmM9UuF4AaABAg,0.0,1.0,2021-01-15T19:07:05Z,0.999351441860199
538.0,Im so exited for this when i start my online classes again in march!,UgwZNV5sbBFO_Q1rXNx4AaABAg,0.0,0.0,2021-01-15T19:02:32Z,-0.9937884211540222
539.0,Loving your work! You've got me back into Yoga and I can once again put my socks on and get in and out of the car without having to make a noise. :),UgzXuudwTPzoUHCZu8J4AaABAg,0.0,0.0,2021-01-15T18:19:23Z,0.9997443556785583
540.0,Initially I felt quite stiff after shovelling snow today  ... then my back started to feel much better ... all was flowing beautifully ... then my cat closed like a Venus Fly Trap around my ankle 👹,UgzJ5E81RNi5hhmVhnJ4AaABAg,0.0,0.0,2021-01-15T18:15:21Z,0.8436344265937805
541.0,This was wonderful! I FELT a lot 😚,Ugxz2s43yX7uG-zRdZV4AaABAg,0.0,0.0,2021-01-15T18:11:44Z,0.9998661279678345
542.0,"Breath
At 75, I feel grateful that through your generous expertise  I am connecting with my breath in a way I’ve never known. :-)
Breath
I know I have so far to go 
But how much fun it is to know  I have a new toy and also
A new start every time, and so,
A gift that gives without a wish,
Is game for anything I dish, 
Is at my beck and call and is 
What keeps me living,
how delish!",UgwqDyF9l7SyepM5nI54AaABAg,0.0,0.0,2021-01-15T17:42:46Z,0.9997400641441345
543.0,"I savour and enjoy every second on my yoga mat. Feeling as though I'm synchronising with fellow yogis, breathing in lots of love and sending it out to those who need it ⭐
Thank you Adriene x namaste 🙏💛",UgxsXk99I-IBwB9MpQd4AaABAg,0.0,0.0,2021-01-15T17:37:39Z,0.9998226761817932
544.0,Namaste,Ugx4stvJBQh1rdpduA54AaABAg,0.0,0.0,2021-01-15T17:23:45Z,0.7529826164245605
545.0,"Thank you, lovely feeling on my mat today!",Ugzvjpt-ReRzg6HRVO14AaABAg,0.0,0.0,2021-01-15T17:23:22Z,0.9998718500137329
546.0,"I FEEL better after that thank you 
Xx my dog Guapo also sits with me now .Xx 🧘‍♀️🙏🐶",UgzieN5Hs-Ba6dpzCVt4AaABAg,0.0,0.0,2021-01-15T17:19:37Z,0.9993739724159241
547.0,"I'm a day behind, but thank you so much for this practice! I cried, quite a lot actually but really needed it. Thank you for giving me the space to cry and be ok with it! This is what yoga is all about to me, a place of healing, self care and love. Thank you once again for helping me heal x",UgxVPuHDNmfe0hP0Mtx4AaABAg,0.0,0.0,2021-01-15T17:15:07Z,0.9996021389961243
548.0,"Thank you, old friend!🙏",Ugx6oabAL_jdlKZofed4AaABAg,0.0,0.0,2021-01-15T17:04:40Z,0.9998410940170288
549.0,This is the first time anyone has ever suggested I feel thankful about tumbling onto my backside. Wonderful lesson :-),Ugxv40A9hxY_YNydRgp4AaABAg,0.0,0.0,2021-01-15T16:44:40Z,0.9991797804832458
550.0,"Cannot thank you enough for the genuine gift you provide through this channel, such a powerful message to be able to nourish our inner resources to the huge benefit of our wellbeing as a whole. You are wonderful, much love and stay safe xxx",Ugxv-RGEzdjKZ5zjZTJ4AaABAg,0.0,0.0,2021-01-15T16:27:28Z,0.9998323917388916
551.0,"From the begining of this journey, I was so worried about the first day of my period since it's so painful and I can barely sit. So yes, sadly I missed BREATH for a day, but now I'm back. Super happy to be here with you all. Thank you, Adriene!",Ugx6zMsxZrLjdmQrEkR4AaABAg,2.0,1.0,2021-01-15T16:24:48Z,0.9995259046554565
552.0,Thank you for feel today love your practices 🧘‍♀️🥰❤️,UgzivKvW8R_I-Zi7JW54AaABAg,0.0,0.0,2021-01-15T15:59:17Z,0.9998152852058411
553.0,"Running 1-day behind, still going through it.
FEEL - listen to the conversation your body is speaking as you go through the process. Are you listening for it???",UgwTu5RN72qspJ1CQH94AaABAg,0.0,2.0,2021-01-15T15:53:02Z,-0.790011465549469
554.0,Many thanks for the reminder on how IMPORTANT  it IS ...just to show up for ourselves!,UgwEGKSquwYA8N36qEF4AaABAg,0.0,1.0,2021-01-15T15:32:12Z,0.9995636343955994
555.0,"I have started noticing my strength building up, I could not hold the Naukasana/Navasana without my ahnds supporting the legs but today the boat just floated with breath! I am starting to fall in love with myself! Thank you Adrienne!",Ugzc8PUNkguKsFKtUpZ4AaABAg,0.0,0.0,2021-01-15T15:11:22Z,0.9995266199111938
556.0,"Feels AMAZING. Loved this practice. So much Love in, so much Love out to everyone practicing, and of course to our loving teacher, Adriene and her sidekick, Guru Benji! 🥰",UgzfQUAGAFU0hR3lUUt4AaABAg,0.0,0.0,2021-01-15T14:26:07Z,0.999875545501709
557.0,Thank you for practicing with us! :) you make us all feel so worthy and accepted just as we are ❤️,Ugy3ZsuXXnm2xdF1rNN4AaABAg,0.0,0.0,2021-01-15T14:14:42Z,0.9998267292976379
558.0,It's great to reconnect with my feelings. Thank you! 😊,Ugx-6UOZEX0Iid4NnlZ4AaABAg,0.0,0.0,2021-01-15T13:58:17Z,0.9998840093612671
559.0,"Feeling grateful for this journey. Can't believe we are almost halfway. So glad to be here. 

Does anyone else feel pain (like a stretching pain but still quite sharp) in the rest pose during the boat session? I'm just curious what that's all about... tension in the back of the neck I suppose.",UgyfpRh6akmvjHDa4uR4AaABAg,0.0,0.0,2021-01-15T13:54:50Z,0.9407674670219421
