,comment,comment_id,reply_count,like_count,updated_at,calificacion
1255.0,I am really enjoying your 30-day yoga practice. I have been doing yoga for many years but learning new things every day in this practice. Lots of bad stuff coming out of the USA these days but Adriene makes up for a lot of that with her warm and empathetic approach.,UgwyqjsOoOKk29G2xnN4AaABAg,0.0,0.0,2021-01-14T15:03:45Z,0.9996167421340942
1256.0,"I felt so much joy doing boat pose today! I couldn't help but have a big smile during the whole portion! After the last hold in boat, I felt such a surge of joy that I started laughing! I can't believe I held the last post for all 10 seconds AND I can't believe how happy it made me! How cool is that. Yay, day 13!!! Thank you, Adriene and thank you everyone on this journey together!!!",Ugx5NAfwP1B69R8i6hh4AaABAg,0.0,0.0,2021-01-14T15:02:52Z,0.9998008608818054
1257.0,We did it! Rounding the corner into week 3 ... let's go!!,UgzKqcs4o7EAiIh3VB54AaABAg,0.0,0.0,2021-01-14T15:02:19Z,0.9665833711624146
1258.0,I feel so clear after Day 13. Bye brain fog!,UgwCZ7E_8i3reKbWsIF4AaABAg,0.0,0.0,2021-01-14T15:00:36Z,-0.6304218173027039
1259.0,"I loved it!  As always your cues, comments and guidance are spot on for me!  I began this practice furious because things weren’t going as I had expected this morning.  But as soon as I settled on the mat I was able to breathe it all away.  Thank you Adriene Namaste 🙏",Ugz0-b-YxRpwbwVSDIB4AaABAg,0.0,0.0,2021-01-14T15:00:31Z,0.9996798038482666
1260.0,"It was pretty cool that my boat pose did not turn into the Titanic today.  I think it's because I ""felt"" the pose.  But, like you said, a little (or even a lot of) humility is Just Fine!",UgzXEe6K6NBDSFLa5zd4AaABAg,0.0,0.0,2021-01-14T14:59:33Z,0.9998032450675964
1261.0,"Yesterday my family asked me to guide them through a short stretching/yoga practice. I was so honoured when they told me I was a good guide. They asked me where I learned to do it and I said I didn't, but Adriene is my inspiration! ❤️ I even struggled to find the Portuguese or Italian terms (we were born in Brazil but live in Italy) while practicing as I'm so used to Adriene's phrases 🤣 it was a great experience though! 
And thank you for today's practice! It felt amazing! ❤️",UgwAqnB4lcEYVD8xi_B4AaABAg,0.0,0.0,2021-01-14T14:58:14Z,0.999758780002594
1262.0,Gratitude 🌻🇧🇷,UgxUuZ-unO4w17ObPa54AaABAg,0.0,0.0,2021-01-14T14:56:12Z,0.9997124075889587
1263.0,"HI there and greetings from freezing Norway. I just wondered if you could give an alternative to the yoga squat. My knees just won't let me do it. I manage to sit on an upturned block, just about, but that doesn't seem to do what it is supposed to do. Is there a better alternative?",Ugw76320fj3hFyItULd4AaABAg,0.0,0.0,2021-01-14T14:54:46Z,-0.9976886510848999
1264.0,"I'm a bit tired today, I couldn't stop yawning. I couldn't even focus properly but that's okay, I'll be back tomorrow, hopefully feeling better.
I found the whole practice a bit challenging. But I won't feel bad for not being able to stay in the poses, it's also a part of the journey. I'm patient.
Thank you for today!",Ugx72z_YXc_cR4HJnUN4AaABAg,0.0,0.0,2021-01-14T14:54:13Z,0.9996069073677063
1265.0,Anyone else feel like today was particularly hard? Proud of us for practicing!!!,UgzKDpYyC536eVh2NX94AaABAg,0.0,0.0,2021-01-14T14:53:54Z,0.997376561164856
1266.0,Where are these amazing fuchsia colored tights from?!,Ugyk3aP_M3I-XCuD-IN4AaABAg,1.0,2.0,2021-01-14T14:51:37Z,-0.8775738477706909
1267.0,"I don't know what the pose is called, but I woke up this morning thinking 'I need that pose where we thread the needle and stretch our necks' and what do you know 😜
Great practice! Thank you Adriene 💓",UgyrOcAF5FdsSwZ5st54AaABAg,0.0,0.0,2021-01-14T14:50:46Z,0.5932420492172241
1268.0,"Loved what Adriene had to say about humility. <3 The ability to kind of chuckle at ourselves, and to not take things too seriously is a beautiful gift. :) That was helpful to remember that. Sometimes things go silly with my body during yoga, and that reminder was wonderful.  Love to you all! See you tomorrow!",Ugw8c17ks3xLLsWiDSx4AaABAg,0.0,0.0,2021-01-14T14:49:43Z,0.9998623132705688
1269.0,i think i need a thiccer ass cause my tail bone hurts when i do the last one,UgxFpnDTsQOmZvvv-wJ4AaABAg,0.0,0.0,2021-01-14T14:49:40Z,-0.9992457628250122
1270.0,Thank you again for another beautiful practice. I feel inspired♥️,UgzMSEanyHn6kah3PON4AaABAg,0.0,0.0,2021-01-14T14:42:16Z,0.9998458623886108
1271.0,Feeling great today! Thanks Adriene 💕,UgwB-OXbLdgrbOTnBmh4AaABAg,0.0,0.0,2021-01-14T14:41:37Z,0.9998725652694702
1272.0,Thank you.,Ugz1VBSmRCPbZeynTDV4AaABAg,0.0,0.0,2021-01-14T14:40:46Z,0.9998457431793213
1273.0,I am saving this video to return to and share not just for the physical practice but for the words she says throughout it. It is everything I have come to realize and love about the benefits of doing yoga without pretense and with conscious awareness and appreciation of self. Adriene has changed the way I (and obviously millions of others) see my own capabilities and how I carry myself in my life off the mat too. So thankful.,UgzdSjLNohG6GDlDfkp4AaABAg,0.0,1.0,2021-01-14T14:39:57Z,0.9995874762535095
1274.0,"Giggles and grace are a playful way to find humility and acceptance for ourselves, just as we are.  Thank you for this offering.",UgxR-KHcJB7CHY2ftfx4AaABAg,0.0,0.0,2021-01-14T14:39:47Z,0.9998751878738403
1275.0,"Came to the mat with a lot of anger, frustration, and a lack of self-love today, but at least I made it to the mat. While I still don't feel great, thank you, Adriene, for grounding me and helping me take a moment outside of myself. Sending love to anyone else feeling somewhat heavy today <3",UgyLiZl84gtOT8CG3nB4AaABAg,0.0,0.0,2021-01-14T14:39:38Z,0.9861636757850647
1276.0,"on this 13th day of BREATH yoga, thank you for sharing your thoughts  aloud on what it means to practice yoga. It helps me focus on what this practice is all about. Namaste.",UgyAxK1sGjN_XhDcy3V4AaABAg,0.0,0.0,2021-01-14T14:39:32Z,0.999639630317688
1277.0,"This was such a great way to start the day. So glad I showed up for myself . Even if these are short, they make such an impact !",UgzDfDjS4upkVqtz_nV4AaABAg,0.0,0.0,2021-01-14T14:39:25Z,0.9997840523719788
1278.0,"Adriene....getting me a second day in a row with that yogic squat!! As we transitioned into that pose I was like ""Oh, oh it is happening again. Okay good."" But it is alright, I made it through feeling strong than yesterday so that is a win in my book! Also, when we were doing the twist on our knees and you mentioned the arm not being able to get all the way up, I have never felt more seen. Thank you for recognizing that wherever you and your body are at in this journey is totally okay. Thank you for practice today Adriene, see you tomorrow! 💙",UgwWRG6xB152ybFisiN4AaABAg,0.0,0.0,2021-01-14T14:39:00Z,0.9997479319572449
1279.0,"I missed yesterday’s video due to a depressive episode. I had to take care of myself and mend. Back at it today with a fresh perspective and outlook. Feeling a little down that I missed a day but that’s not what this is totally about. I had to show up for myself in the way I needed to heal yesterday ... paving the way to show up and continue on for myself today. Anyway, thank you for this beautiful series. 🙏🏻❤️✨",Ugwy7iam9dLXgMg_9cB4AaABAg,0.0,0.0,2021-01-14T14:37:20Z,-0.896324634552002
1280.0,"thank you for this practice Adrienne, I was feeling pretty emotional and lost today and when you simply said 'have a little cry' I just let it out and it felt so good. I'm so grateful I can come to this practice everyday, no matter what, and tune in to my body and feel present :) sending love & light to all <3",UgxlXdNX55eYQ7TsVdF4AaABAg,0.0,1.0,2021-01-14T14:37:14Z,0.9998053908348083
1281.0,Thanks hi from Miami 💜,UgyhEMv0uxY2W__J1OZ4AaABAg,0.0,0.0,2021-01-14T14:36:42Z,0.9993855953216553
1282.0,That was beautiful! Thank you.,UgybMN_yozEOHYBoz3J4AaABAg,0.0,0.0,2021-01-14T14:35:24Z,0.9998766183853149
1283.0,"Day 13,  and the day after January 13th! Two 13s in a row - let that rock! Feel ... your soul's journey ; I do Adriene : ) Namaste to all !",Ugy03LuHGj0dJ6_Yz1Z4AaABAg,0.0,0.0,2021-01-14T14:36:01Z,0.9959940910339355
1284.0,This practice absolutely flew by! I'm so glad I have taken the time the past 13 days to commit to this yoga journey - it's been such a good start to the year!,UgxaNx0Cbnn21sPm0_R4AaABAg,0.0,0.0,2021-01-14T14:34:45Z,0.9996615648269653
1285.0,"AWESOME practice today! Thankyou Adrienne for continuing to share this yoga journey, Love your yoga journeys & all the tips and mantras 7 suggestions you give to continue being the best version of ourselves!",Ugzi8hzDdsFO8eS3T0Z4AaABAg,0.0,0.0,2021-01-14T14:32:58Z,0.9998750686645508
1286.0,"Circumstances made me miss the practice in the morning but I managed to squeeze it in later on. Phew. Still going strong, so proud of myself. 
And of everybody else still showing up. We can do this and we are all amazing! 
Every practice is wonderful, can't wait for tomorrow.
I ordered the most amazing t-shirt from the pop up shop and am so excited! 
Have a wonderful day everyone!",UgwR77fKLFoC-DxoKFx4AaABAg,0.0,0.0,2021-01-14T14:32:05Z,0.9998863935470581
1287.0,"Well if that wasn’t the loveliest thing! Today is my day off from work, and it always feels good but this was just special. I burst out laughing after that hovering table because I kept wanting to give up, but then Adriene would keep us there a moment longer, and then another moment longer, and I was just so delighted to have been able to do it all! Every day we learn how strong we actually are, even when we don’t always feel it!",UgyETO2JioJjoQq_Bdl4AaABAg,0.0,0.0,2021-01-14T14:30:40Z,0.99974125623703
1288.0,"I feel lovely, thank you 😊🙏❤️",UgwrFmvTj5uo-rRL5jl4AaABAg,2.0,1.0,2021-01-14T14:30:27Z,0.9998457431793213
1289.0,"In the middle of this session I found myself saying ""this feels good"" as I breathe out..... Mission accomplished😁",UgwegCDPVbJDHEHMRop4AaABAg,1.0,2.0,2021-01-14T14:29:41Z,0.9997647404670715
1290.0,"Day 13 done! See you next time :)

I feel great after today's practice :D",Ugx94OeskRKQw4hKZIF4AaABAg,0.0,1.0,2021-01-14T14:29:41Z,0.9997759461402893
1291.0,"Our youngest grandson has a blanket that looks like a tortilla and he loves us to wrap him up in it and he will say he is a “BOYritto”!, so your Burrito line made me laugh!!",UgwOkYmHIhKdBch_qXd4AaABAg,1.0,1.0,2021-02-03T02:23:17Z,0.9984148740768433
1292.0,"6,866 other people doing/watching this at the same time as me! <3",UgxJO00IKIW0v7ozXGd4AaABAg,1.0,1.0,2021-01-14T14:27:13Z,-0.9839916825294495
1293.0,What a beautiful flow today......the boat pose with arms outstretched was simply joyful.  I’m still smiling ☺️,Ugx8iBYRGf2z6qiCahJ4AaABAg,0.0,1.0,2021-01-14T14:27:03Z,0.9998685121536255
1294.0,"Just wanted to share the gratitude I'm feeling for my first 30 day yoga journey that I'm doing in real time!

PS - Could anyone else hear Adriene's heart beat during mediation at the end? I think the mic picked it up! It was very peaceful :)",UgygaEvOZtRInbQeTzZ4AaABAg,0.0,1.0,2021-01-14T14:25:49Z,0.9995417594909668
1295.0,Day 263 as I finish Day 13 Breath. I honestly don’t know how I lived my life before my daily practice with Adriene. Thank you to my best friend Diane for sharing this amazing journey with me. And thank you  Adriene for sharing your passion with the world. Namaste 🙏🏻 from Ontario Canada 🇨🇦,Ugxb1psGtgBPlKqXA0V4AaABAg,0.0,0.0,2021-01-14T14:24:07Z,0.9997557997703552
1296.0,"This will sound strange, but I love being able to hear your heart beat through your mic during our sessions. I feel closer and more a part of the practice. The rhythm helps to center me. Thank you. Today’s session found my mind drifting to the security guard at my local small grocery store & how appreciative I was of her for helping me with the breads. I have seen her forever but never had a reason to speak to her. She offered to assist me. She didn’t know why the bread hadn’t been available for weeks. She liked it too (whole wheat 30 calories per slice) and noticed it hadn’t been stocked lately, but we connected in such a warm & genuine way that made me feel good. 💗 I’m empathic so this must mean I need to go check on her.",Ugww7WLo4nL4gXSbByx4AaABAg,0.0,1.0,2021-01-14T14:23:16Z,0.999697208404541
1297.0,Have a wonderful day everyone! Breathe lots of love in... and lots of love out ❣️,Ugxc6bJ7M8mNtO7dgRB4AaABAg,0.0,0.0,2021-01-14T14:22:32Z,0.9998867511749268
1298.0,"Had some tough news at work today and I'm really sad and feeling sorry for myself. This was the perfect mix of meditative and powerful practice to help soothe the worst. Really starting to feel the mental benefits of the daily practice, even if my body Did Not Want squats today. Did mountain pose instead because it felt right ♥️",UgxK58XdGij8OshlLiB4AaABAg,2.0,1.0,2021-01-14T14:22:25Z,0.9872732162475586
1299.0,"Adriene, you are so kind. Thank you.🌈",Ugy51MUfP4i3qzTNRMZ4AaABAg,0.0,1.0,2021-01-14T14:18:17Z,0.9998416900634766
1300.0,I can FEEL all the energy and love you put into these practices every day. I FEEL amazing on day 13. Namaste lovely humans 💚🙏🏻✨,UgzS6XNhXglZWBpOTt14AaABAg,0.0,1.0,2021-01-14T14:17:50Z,0.9998050332069397
1301.0,"I wake up every morning feeling excited to have a new YWA video. Sometimes i cannot do it right away, but knowing it's there makes my day! Te quiero mucho Adriana ❤️🙏 thank you for making a difference. Lots of love in and lots of love out from Argentina.",Ugxl5MoXRpQS-9_7dNF4AaABAg,0.0,1.0,2021-01-14T14:15:57Z,0.9998137354850769
1302.0,fe fi fo fum    are u a giant>?,UgwUzIEyMMhNpmoGZtZ4AaABAg,0.0,0.0,2021-01-14T14:15:44Z,-0.9903873801231384
1303.0,Anyone else giggle and instantly collapse on to the mat when Adriene said to hold boat pose for even just one second and then started to count down from ten?! 😆,UgzWlTCO5P-OMCiQvw94AaABAg,1.0,1.0,2021-01-14T14:13:41Z,-0.9986870884895325
1304.0,This practice is what I need after a busy day... Feeling so good.. I'm so greatful to you Adriene for such a wonderful blessing... My heart is swelling with gratitude to you... Thanks Adriene...,UgzzpAMO5Zl9Ur1PW7d4AaABAg,0.0,1.0,2021-01-14T14:13:06Z,0.9998735189437866
1305.0,I FEEL wonderful 🙏🏻!,UgwWvJ7D5IAd_QVXERl4AaABAg,0.0,2.0,2021-01-14T14:12:54Z,0.9998854398727417
1306.0,💜,UgyzKtm5S6pkviSxpVp4AaABAg,0.0,1.0,2021-01-14T14:11:05Z,-0.6970567107200623
1307.0,"""If you crash on your butt...it's a win"" -Adriene M",Ugz7P2adhVtVaZ7uv0l4AaABAg,5.0,111.0,2021-01-14T14:10:26Z,0.9605798125267029
1308.0,"so valuable, this mindfulness. Thank-you",UgzFoAYlrZwHDdgb7jl4AaABAg,0.0,1.0,2021-01-14T14:07:07Z,0.9998735189437866
1309.0,I woke up crampy and sore today. I wasn't feeling very inspired. This was the most beneficial practice so far for me. It's just what I needed to feel relief. Loved it. 💜,Ugz0jnM7iuybNHRLX6t4AaABAg,1.0,2.0,2021-01-14T14:04:50Z,0.9987841248512268
1310.0,I cried and stopped and cried some more. Today was bad. But i made it to the mat. Thanks Adriene.,Ugx4sDNEUMvct1zyqXl4AaABAg,2.0,1.0,2021-01-14T14:02:50Z,0.9992200136184692
1311.0,Every day!...This is wonderful!,UgxJnnceSb-5g_evenN4AaABAg,0.0,2.0,2021-01-14T14:02:44Z,0.9998863935470581
1312.0,BURRITO POSE. Thank you <3,Ugyyd4GSCnzW0uvtZAN4AaABAg,0.0,1.0,2021-01-14T14:00:15Z,0.9993784427642822
1313.0,Thank you for this wonderful start to my day. I'm grateful for you.,UgxGIyqJAKKMUm-gWbx4AaABAg,0.0,1.0,2021-01-14T13:59:47Z,0.9998654127120972
1314.0,"At the end of this practice I was amazed to realize that even sitting feels easier!! Namaste, happy day 13 <3",Ugx17E37Uw0z1iqu77R4AaABAg,1.0,2.0,2021-01-14T13:59:24Z,0.9960993528366089
1315.0,first 60k club!!,UgxW21c2WdiqahfZJ5x4AaABAg,0.0,1.0,2021-01-14T13:58:39Z,0.9984764456748962
1316.0,“Thread thy needle”... favorite part hahah. Thank you for an amazing morning.,UgzHN8xCBwOY-61SqNJ4AaABAg,0.0,1.0,2021-01-14T13:55:58Z,0.9997830986976624
1317.0,Didn't think I would make it today - but the gentle start was so helpful in letting me work out my discomfort so I could continue the rest of the practice. Thank you Adriene - and we're nearly halfway! x,UgymSbASTQS7aY2DtXd4AaABAg,0.0,1.0,2021-01-14T13:56:12Z,0.9995928406715393
1318.0,"Wonderful Day 13. Feel. It might be my favorite. I love when Adriene said '""Thank you for giving me this chance to know what humility feels like...and to be good at that, too."" What a wise, beautiful awareness that is, and said like only Adriene can, with vulnerable truth and joy right there, side by side. So glad to be on this journey. Big love to all. xoxo",UgzvTWM05TVbQ9EqqPh4AaABAg,0.0,2.0,2021-01-14T13:52:54Z,0.9998605251312256
1319.0,One of my favorites this month. Getting to explore something new and let go of my expectations. Thank you <3,UgwpEiqQdthrTXwWW-14AaABAg,0.0,0.0,2021-01-14T13:52:30Z,0.9996646642684937
1320.0,🙏💝✨,UgwXVw-GEIax718llD54AaABAg,0.0,0.0,2021-01-14T13:52:30Z,-0.6970567107200623
1321.0,My family crashed my practice this morning so I retreated to my twins room. Just practiced in between some cribs and so happy I made the time. Bring on January 14,UgzQYfu9d0jJqNsMmaN4AaABAg,0.0,0.0,2021-01-14T13:52:23Z,0.999606192111969
1322.0,Well isn't this fantastic! My first time with Adriene as the cheerleader in my life and in 13 days I feel so much better! In tune with my body and mind and also giving myself a little bit of love each day. Simple and quite obvious in many ways but so worth the effort. I often visualise all of us on our mats all around the world and it makes me smile x,Ugww5mTyv14bOjKBdbx4AaABAg,0.0,0.0,2021-01-14T13:52:20Z,0.9998297691345215
1323.0,"the framerate has dropped harshly in your past videos. don't know whether that's a recording, or editing fault. not a nice smooth watching experience.",UgzRXXaLLQSh7wAS0O14AaABAg,0.0,0.0,2021-01-14T13:49:58Z,-0.9996577501296997
1324.0,Thank you Adriene.  I’m getting stronger.  I’m 77 and was able to hold the hovering table and the balanced squat.  Quite an accomplishment for me!,UgzjeSnQJchz2Sd7Eet4AaABAg,1.0,0.0,2021-01-14T13:49:56Z,0.9998574256896973
1325.0,"~Day 13~ I can't help but laugh when in froggy/gargoyle (?) pose. I accidentally saw my reflection - not so graceful. Love love love boat pose. Have a fantastic day, everyone!",Ugw_kAZW2QjkiO9IJgZ4AaABAg,0.0,0.0,2021-01-14T13:50:57Z,0.9992861151695251
1326.0,Day 13 and still going strong! I started this 30 day journey as a way of letting go of a miscarriage my husband and I suffered back in December. This journey has helped me through a tough time and I hope will prepare me to try again in the near future. Thank you Adrienne for sharing these videos with the world and guiding us in finding what feels good!,UgxLZeFgaqxCdaCxPAp4AaABAg,1.0,0.0,2021-01-14T13:48:34Z,0.9997549653053284
1327.0,"Adrien: if you need to cry, go ahead and let it out. 
Me: 😭😭😭 needed that cry 🙏🏼🙏🏼",UgwdyjRTR5YjAm8Dbp94AaABAg,0.0,0.0,2021-01-14T13:48:13Z,-0.7488250732421875
1328.0,13 days of yoga thankyou from my heart xx,UgwP1eGLALsy8MRuaPV4AaABAg,0.0,0.0,2021-01-14T13:48:04Z,0.9993746876716614
1329.0,Thank you for this 😊,UgwZ7CtZ-7poc2ncEpl4AaABAg,0.0,0.0,2021-01-14T13:48:03Z,0.9998134970664978
1330.0,One inspirational special woman you are Adriene! If only more people where as kind as you in this world. Much love. You are my happy place! ❤️,UgwdfGO19_yI3MxXgwx4AaABAg,0.0,0.0,2021-01-14T13:47:10Z,0.9998745918273926
1331.0,"Thank You Adriene. Three months ago, I never tried yoga in my life. My daughter recommended Adrienne for some back pain I was struggling with. I tried a couple of videos. Two months later I haven’t missed a day and enjoying my second 30 day commitment. You are amazing at what you do. I feel extremely lucky to have been introduced to your videos. 45/y/M from Queens new to the community.",UgwO3EGHmdc8ILTpTXN4AaABAg,0.0,0.0,2021-01-14T13:45:42Z,0.9998421669006348
1332.0,Thank you for this beautiful lucky 13th day of practice around the world!,UgxJr4E3rmFv39jxhIp4AaABAg,0.0,0.0,2021-01-14T13:45:39Z,0.9998733997344971
1333.0,"I woke up with soo much tightness in my thoracic spine today and I can't believe today's practice included so many looseners for that area! I feel like it's fate right now. I'm feeling much better now, thank you Adriene!",UgzcIZiCAqvyU5QjEeh4AaABAg,0.0,1.0,2021-01-14T13:41:54Z,0.9947309494018555
1334.0,"I can't believe the difference from yesterday to today. I feel so much more balanced. 
 I am so grateful for you being there for me everyday, for a little while of peace, before having to deal with life. I am going to try and feel my way through today for sure 👍",UgwvH_aBzFnjxU-kyMp4AaABAg,0.0,1.0,2021-01-14T13:41:47Z,0.9994156360626221
1335.0,"Bit late coming into this...been ill, will I b able to start from day 1 next monday",UgwuODSUoVnV-RQoNkJ4AaABAg,0.0,0.0,2021-01-14T13:41:28Z,-0.9990059733390808
1336.0,Super yummy practice today!,UgyoJ7CqcHz5o7sY8IB4AaABAg,0.0,0.0,2021-01-14T13:39:43Z,0.9991750121116638
1337.0,haven't practiced in a couple days and this was perfect to get back into it,UgwPgZ45co2Tn4nPWcB4AaABAg,0.0,1.0,2021-01-14T13:39:40Z,0.9994152784347534
1338.0,Thank you for giving us a safe space (and reminding us that it's ok) to feel how we feel in the moment. When I got on the mat today my thoughts were swimming but when you said it was ok to cry I realized that was exactly what I needed. I feel so much better now! I hope you and your family are well. Sending all my love! <3,UgxDtfs_raMgoW3YW_14AaABAg,0.0,0.0,2021-01-14T13:39:02Z,0.9998158812522888
1339.0,Another beautiful practice . Lovely to see all the positivity in this community . Thank you Adriene for creating this.,UgwtoLrEGlXxNcNcaZ14AaABAg,0.0,0.0,2021-01-14T13:38:21Z,0.9998676776885986
1340.0,"My full boat pose may have looked like I was directing an airplane into the destination gate with my flailing arms, but by heavens, I DID IT! <3",Ugy03tfbHcx6lH1Xkhh4AaABAg,5.0,188.0,2021-01-14T13:37:31Z,0.9749837517738342
1341.0,FEELing blessed to have the opportunity to learn from you Adrienne.,Ugx_kNmfQ7CUUDdGKix4AaABAg,0.0,0.0,2021-01-14T13:37:01Z,0.999855637550354
1342.0,Finding what feels good is the best feeling ever...,UgweFs-k_SWizSVQaxN4AaABAg,0.0,1.0,2021-01-14T13:36:32Z,0.9998774528503418
1343.0,"I knew that getting on my mat today would be a challenge as we packed up our camper and drove home from our holiday with a 10 hr journey with just toilet breaks along the way.  But I did it,! I got on my mat and did day 13 , it may have been 11:30pm and  temptation to go straight to bed was overwhelming but  my achy sitting in a car body really did Feel the need to do it and I Feel so much better for doing it, although I nearly fell asleep in chavasana😴🤣Namaste everyone🙏",UgxWYCa3OMwvp1uZwpZ4AaABAg,0.0,0.0,2021-01-14T13:34:42Z,-0.9528765678405762
1344.0,"After finishing today's session and not missing a day yet despite being rocked off my scheduled times, I decided to buy myself some new pretty yoga pantses cause literally all of mine have holes in them 😂 and I also rewarded myself with a new pretty yoga mat that I need to remember to roll up or my cat will destroy 😊
I know it's not about the stuff but I deserve some things that aren't full of holes :p and that'll make me go OO PRETTY every day when I hop on the mat :)",UgwrZp99Xj_5bt0QWmV4AaABAg,0.0,0.0,2021-01-14T13:32:59Z,0.906480610370636
1345.0,"Adriene: “Notice what it feels like to be alive today here. You might just smile or laugh a little here or if you need to cry just let it out.” 
Me: Already crying. 

Thank you Adriene. 💛",UgxXCY2m7owf8OCCkwp4AaABAg,12.0,234.0,2021-01-14T13:29:44Z,0.998856782913208
1346.0,"So amazing to do some yoga today! 5,000 people did it with me, and I am really feeling the practice after. Thank you Adriene! Sending love to anyone who needs it right now❤",UgxV0FjholL4IWkI9i54AaABAg,0.0,0.0,2021-01-14T13:29:37Z,0.9998030066490173
1347.0,I'm loving my core results from being consistent with yoga. 🧘Thank you Adriene!,UgyXM1fuW9XYzABSthF4AaABAg,0.0,0.0,2021-01-14T13:28:10Z,0.9996868371963501
1348.0,Namaste 🙏🌱🐾,UgzeA1NT6PedfheDf454AaABAg,0.0,0.0,2021-01-14T13:26:59Z,-0.8081023097038269
1349.0,I really didn't want to get out of bed this morning! But I didn't want to miss my yoga time with all of you so I made it. I was a little low energy at first but Adriene's encouragement to go with how you feel today was just what I needed.,UgwwwtypI25W1mpkNtR4AaABAg,0.0,0.0,2021-01-14T13:26:34Z,0.9989644289016724
1350.0,"In our warm-up, we ""veer of the rails"" every now and then.  Reminds me of a yoga teacher I used to have who called that the ""yummy pose.""  Thanks Adriene!",UgwXV4Oa96_9gLQSh2B4AaABAg,0.0,0.0,2021-01-14T13:26:07Z,0.9992558360099792
1351.0,Beautiful. These are my favorite kind of practices. Thank you so much. Namaste 🙏❤,Ugy9Pg0T19b7y_c5xut4AaABAg,0.0,0.0,2021-01-14T13:25:25Z,0.9998675584793091
