,comment,comment_id,reply_count,like_count,updated_at,calificacion
859.0,"I’ve been practicing yoga for about 7 years now on and off, and for several years following some of Adriene’s videos. Today was a challenge getting to the mat. I was a bit low energy and had already went for a jog today so I wasn’t very motivated. This was the perfect practice that I needed. I don’t think I’ve ever felt so deeply rooted in either boat pose or the yogic squat. I’m not naturally very flexible and always struggle with core-centered poses, so both of these have come such a long way in my time doing yoga. I used to have to hold on to my legs for dear life in boat and couldn’t even come close to a low squat (it looked more like a high squat with heels raised). Now I can fully extend my boat pose with relative ease and come down completely in the squat with heels down and no support from my hands. Yoga is all about the small moments that make you feel connected and accomplished. Thanks for another great 30 day journey, Adriene! Namaste, y’all!",UgxugqDgam2qU_EaM1N4AaABAg,0.0,0.0,2021-01-14T22:31:54Z,0.891154944896698
860.0,Love this practice and these magenta yoga pants! Do you have a link to get them?,UgxTSDrQ9L3eOHf8zxJ4AaABAg,0.0,0.0,2021-01-14T22:28:28Z,0.9997474551200867
861.0,So yummy!,UgwS_EL-A8EI0eFPFHx4AaABAg,0.0,0.0,2021-01-14T22:26:07Z,0.9991692304611206
862.0,This went so fast..,UgzCTBhGAlKyJoUm6v54AaABAg,0.0,0.0,2021-01-14T22:25:18Z,0.9790194630622864
863.0,"At my age of 65 doing regular physical activity is very important to me, because that forward energy becomes its own motivation.  Thank you for this series as it has helped me to stay with my yoga daily and get my new year started right!  Namaste.",UgygkbqiwDWhd0jg-6R4AaABAg,0.0,1.0,2021-01-14T22:24:45Z,0.9996449947357178
864.0,Wow! I really feel like I was able to let go and clear my mind today! Thank you Adriene! 🙏🏻,UgyjK7bwzXnmbNYuBs94AaABAg,0.0,0.0,2021-01-14T22:22:10Z,0.9998356103897095
865.0,Today's practice felt awesome :D,UgxSfFHnX33moehQR054AaABAg,0.0,0.0,2021-01-14T22:20:16Z,0.9998133778572083
866.0,"""tHrEaD tHe nEeDlE....... that was creepy"". Adrien, i love you omg",Ugy_zaNNRLQnd1Ve_P54AaABAg,0.0,1.0,2021-01-14T22:20:08Z,0.999495267868042
867.0,"Day 13, everyone. We made it. This is sooooo good. Thank you so much.",UgxG0NY_UjBQM6QIlmd4AaABAg,0.0,1.0,2021-01-14T22:19:02Z,0.9998633861541748
868.0,thank you coach!,UgwTzS1ChwtviU4d7lR4AaABAg,0.0,0.0,2021-01-14T22:16:32Z,0.9998565912246704
869.0,🙏👍💕,UgyJ8OJVeoIq71AqgLZ4AaABAg,0.0,0.0,2021-01-14T22:11:40Z,-0.6970567107200623
870.0,"At the end i burst into tears when I bowed to myself. At that moment I felt so proud of everything that I am doing and have done and how strong I am for making it through a very tough last year and starting a new year with open arms and an open heart. I really felt so much love towards myself and I cried because I felt proud for the very first time in a long time! I always underestimated and doubted myself and that seemed to pull me back from a lot of opportunities and challenges. Now I am able to embrace and welcome what is and let it go. When I cried i felt so relieved because i know I've been holding back my tears. It's this time that I begin to accept, embrace and welcome (with love ofc). Sending so much love to everyone. Namaste <3",UgxHZfq15qaP6Nrvc594AaABAg,4.0,79.0,2021-01-14T22:12:57Z,0.9998053908348083
871.0,Easy to follow,UgyiJu33CTV-W1ak4UJ4AaABAg,0.0,0.0,2021-01-14T22:10:03Z,0.9993771910667419
872.0,Thank you for this beautiful practice <3,UgyBPBHAIhQJL8oAlkx4AaABAg,0.0,0.0,2021-01-14T22:09:48Z,0.9998551607131958
873.0,"I got tired  last days and my back aches. Still i come to the mat and it is like a magic. the month challenge, the good energy from all over, and your sweet sweet spirit, Adrienne - well it is great.",Ugx0YmzJVkj5Hh0be8h4AaABAg,0.0,1.0,2021-01-14T22:09:02Z,0.9998722076416016
874.0,Thank you Andriene!,UgzlxkdEbsjgtI2SQZx4AaABAg,0.0,0.0,2021-01-14T22:07:03Z,0.9998517036437988
875.0,"I loved this one!  Well, I love them all but this one a little more.....and I'm gaining strength as well.  And then this afternoon I took a long walk thru the park.  It was beautiful...",UgzxxEBGigZgr68svFJ4AaABAg,0.0,0.0,2021-01-14T22:04:12Z,0.9998445510864258
876.0,"This 30 day yoga journey really came at the right time for me. There is so much stress and anxiety in my life right now with the new covid mutation, online school and just feeling lonely and ristrickted in everything I do. It's just such a relief comming  to the mat and taking some time to just breath and be mindful of me and my health, and just get my body moving a little bit, and then feel like i am communicating with lovely people when reading the comments. Hope that you are all doing well.:)

- All the love <3",UgylbApFVxIcRP4JxrZ4AaABAg,0.0,0.0,2021-01-14T22:03:54Z,0.9993773102760315
877.0,"Sometimes I feel like my anxiety is slowly killing me, but these practices bring me peace. Even if it's just for the 25 minutes that i'm on the mat. Thank you Adriene and good job everyone for making it to day 13. Remember you are loved. Namaste!",Ugx2vPG6a9tmiG9lVIR4AaABAg,0.0,0.0,2021-01-14T22:03:45Z,0.9997870326042175
878.0,"Day 13 was great, thank you 😊",UgzW0f9D_ar_NLrBo9d4AaABAg,0.0,0.0,2021-01-14T22:02:26Z,0.9998676776885986
879.0,Decided to ring in my birthday today by catching up on the last few days of practice and oohh am I feeling it. Humility is as dope a gift as any! Oceanic love to all of you from Toronto.,UgwPl-Jde9i-l2txaJd4AaABAg,0.0,0.0,2021-01-14T22:00:41Z,0.9996776580810547
880.0,"This practice flew by, might be my favorite so far! And Adriene, the lip color with matching leggings was 🔥 , think I’m going to have to try it myself!",UgzCUS7x3tTThWoIRCp4AaABAg,0.0,0.0,2021-01-14T21:58:45Z,0.6273036599159241
881.0,"Thankyou so much. I am a 3rd year uni student from the UK suffering from a case burn out from over stressing myself. I get through everyday peaceful with your words and the upcoming yoga session of that evening. You’ve made fall in love with yoga, and fall out of a stress induced, toxic routine. And I can’t thankyou enough.",UgxWjVG7KwNhNhBI9jt4AaABAg,0.0,0.0,2021-01-14T21:58:01Z,0.9933449029922485
882.0,Thank you Adrienne. Loving this yourney everyday more.,UgwjdDShrru_4omV3-54AaABAg,0.0,0.0,2021-01-14T21:57:01Z,0.9998761415481567
883.0,"This has been my favorite practice of this journey so far. Usually, I do my practices as soon as I wake up, but today I ended up finding the time in the afternoon because of my college classes. I feel like today's practice really changed my perspective on what my body can do and what it's capable of learning to do. The newfound strength in my core is so encouraging. No more do I feel lanky and awkward in my limbs-- instead I'm feeling present and aware and capable. :) Thank you for today Adriene <3",UgzC2dndJhwZarr03Y94AaABAg,0.0,0.0,2021-01-14T21:53:29Z,0.9994592070579529
884.0,"Kinda really upset this is ending. Also made a new record today,did yoga at like 11 30pm😂",Ugxh3eaX7U7VF7ObX6d4AaABAg,0.0,0.0,2021-01-14T21:53:07Z,-0.9927200078964233
885.0,Hari Om,UgyBIT3njKp7ORwpV2F4AaABAg,0.0,0.0,2021-01-14T21:52:22Z,-0.6709297895431519
886.0,Feeling great after day lucky day 13! Love the spinal twists!Much needed core strength too!  and seeing my favorite yoga pup! xo,UgyhvtJNywYhlVfLdKt4AaABAg,0.0,0.0,2021-01-14T21:52:00Z,0.9997090697288513
887.0,"I love reading the comments after, also!  Namaste everyone!",UgyL-2EtMPTMqjCz1kF4AaABAg,0.0,0.0,2021-01-14T21:51:47Z,0.9964402318000793
888.0,"Loving this series, I am amazed at how doing a little every day is making a difference in what I can do! Thank you Adriene",UgyMH0wbIwxkKkf8lJB4AaABAg,0.0,0.0,2021-01-14T21:50:19Z,0.9998743534088135
889.0,Thank you Adriene!,UgzFWnpl7oulnTzo5iB4AaABAg,0.0,0.0,2021-01-14T21:49:53Z,0.9998526573181152
890.0,"I'm surprised to discover that daily yoga was thé missing to my ""good mental health"" puzzle. Sleeping is better, anxiety is smaller, just feel more present to everything. Yesterday, my husband told me that he never sees me so calm and happy. For helping me, us, to discover our True self, thank you Adriene !!!!! Send some love from France ❤️",UgziCya2LjOzdg_GFRF4AaABAg,0.0,0.0,2021-01-14T21:47:22Z,0.9588485956192017
891.0,"senior citizen check in: I wore socks during todays practice, and a wool cap...namaste",UgxSNGCojpEEC3I2y6F4AaABAg,0.0,53.0,2021-01-14T21:46:46Z,-0.979846179485321
892.0,Love that “goofy warmup”!,UgxMA9QlHQL1kP_H-NB4AaABAg,0.0,0.0,2021-01-14T21:44:25Z,0.9998505115509033
893.0,Thank you Adriene for this practice and everything you do for us & for yoga 🙏 ....does anyone know where the blanket with the coloured lines comes from? Would love to buy one for my fiancé,UgyPFhquB-fCtUfZOdx4AaABAg,1.0,0.0,2021-01-14T21:43:59Z,0.535625696182251
894.0,"I feel like crap, but I'll be damned if I'm missing a day after doing every day up until now. Let's go!",UgzEO6kqWGpC918USI54AaABAg,3.0,204.0,2021-01-14T21:42:08Z,-0.9995654225349426
895.0,"me: hmmm... I wonder if I'm doing this right? 
Adriene: GORGEOUS!     
makes me smile EVERY TIME! xo",UgxUusJGPPzIMQ6uvVh4AaABAg,0.0,0.0,2021-01-14T21:40:44Z,0.9997983574867249
896.0,"My body had a lot of aches and pains today :( I thought I would need to do additional yoga after today's video but the freedom to move and create our own routine helped a lot today. Adriene is a mind-reader. The practices are always exactly what I need on that particular day. I can also see a huge difference in my mentality since starting my personal YWA journey during the 1st lockdown. I would beat myself up for not being able to have perfect posture in a position or for falling out of a position. Today, I fell out of the yogi squat (despite being able to do it during yesterday's practice) and, instead of taking it as a failure, I rolled on my back and laughed because today is a different day. I shouldn't beat myself up about such small things.",UgzXLITq_2fpF8L7CT54AaABAg,0.0,0.0,2021-01-14T21:40:26Z,0.9952901601791382
897.0,After a stressful exam day feeling the most tired physically and mentally this is all I need it. So much to feel today. You always know how to make me feel good Adrienne thats unreal. Thank you for being there for all of us. ❤,Ugwsm5bewbvVbC9HtEp4AaABAg,0.0,0.0,2021-01-14T21:38:57Z,0.9979774355888367
898.0,I got on the mat with little time and a bit of sinus attack but by the time I was finished my sinus felt better and I still had time to get done what u had to do all that to say yoga never fails to serve me in my daily life so thank u Adriene for this lovely practice much love Namaste 💞❤🙏🙏,UgwX9RUFJpYT0kARaTZ4AaABAg,0.0,0.0,2021-01-14T21:38:12Z,0.9945694804191589
899.0,Did anyone else hear Adriene's heart beating at the end? That was pretty awesome! Loved today's practice!,Ugwb_iNpZsENHhPBIUt4AaABAg,0.0,0.0,2021-01-14T21:37:48Z,0.9998308420181274
900.0,"Day 13: 5:06am to 5:33am. Philippine time. From 175,462 views to 183,721 views. Hi to 8k people doing yoga with me. 😊😍 Namaste!",Ugxr3dS-3ejidRIk0lh4AaABAg,0.0,0.0,2021-01-14T21:37:38Z,0.9161032438278198
901.0,"I've been so freaking tired today and my depression has hit really hard because of my exhaustion and I really really really didn't want to do this practice. I wanted to quit several times throughout the practice. But I showed up. I made it to the end. Thank you, thank you, thank you!",Ugwahwku-k653-j-D-x4AaABAg,0.0,0.0,2021-01-14T21:37:33Z,0.9974451065063477
902.0,Love your classes Adriene ... this one was excellent.  Thanks so much,UgwcBlRipkJg3l0cx-B4AaABAg,0.0,0.0,2021-01-14T21:34:03Z,0.9998633861541748
903.0,So the past couple days have been really difficult for me mentally and I felt like I lost all hope. The only thing that kept me connected to this world and reminded me that positivity exists was my determination to make it to the mat every day. I am proud of me that I haven't missed a day!,UgxIp2_Pb7fIfH3yKYJ4AaABAg,0.0,0.0,2021-01-14T21:33:48Z,-0.9961814880371094
904.0,"Still here on day 13, so happy! It was hard not to judge myself on whether I was doing the poses ""correctly"" - I wasn't, but Adriene kept reminding that that's not what was important at juuust the right times. It does feel weird having to discover what feels nice without being told exactly what pose I should do... I would like to do more of that.
Great job everyone!",Ugw5spxRwYVTTG3Dbsd4AaABAg,0.0,0.0,2021-01-14T21:33:33Z,0.9235002398490906
905.0,Thank you so much Adriene for this 30 day journey. I love doing yoga with you. You make me laugh and I feel wonderful afterwards.,UgzGl0PFxvRwg3F4uch4AaABAg,0.0,0.0,2021-01-14T21:32:54Z,0.9998784065246582
906.0,"I definitely had a win as Adriene said... I felt so elegant with the penultimate balancing pose (I can't remember the technical names yet!), then my butt crashed to the ground as soon as I brought my fingers behind me! 🙈🤭😂",Ugz9sLwo3SjYX9LFr3J4AaABAg,0.0,0.0,2021-01-14T21:31:35Z,0.9958139061927795
907.0,"I,5 h left of this day in Sweden, and I made it to the mat, thank God <3 Proud of myself for accomplishing at least one good thing today :-D Lovely practice!",Ugz6LkRnxQgw63iNC-V4AaABAg,0.0,0.0,2021-01-14T21:28:52Z,0.9998281002044678
908.0,"I love how no matter how ""easy"" or ""difficult"" ( I use quotes because difficulty is a spectrum that is different for everyone), Adriene always makes everything so inclusive and calming. After doing this for thirteen days so far I feel much more flexible but also very in tune with my own body and how it moves through the world. She's truly a gem.",UgzEZyjTSevT1WcmInd4AaABAg,0.0,0.0,2021-01-14T21:28:37Z,0.9998387098312378
909.0,I've done yoga with my sister almost every day  since the first lockdown (in March in Paris!) and it's become our little ritual. Thank you for everything you do and for being so soothing Adriene 💛💛,UgxfbQWeWLIsr8k8A8x4AaABAg,0.0,1.0,2021-01-14T21:26:52Z,0.9995537400245667
910.0,"Does anyone else experience pain in the elbow whenever we lower down? Or have a suggestion of what it could be? I've had others check my form and it's good so it's not that. It started as just a little twinge but now it really hurts, but it's only when lowering, or sometimes it starts to ache when it's been bent for too long. Any suggestions?
Thanks in advance. Namaste (:",UgzQzs-YaqVp2HbLg_R4AaABAg,0.0,0.0,2021-01-14T21:26:32Z,-0.9926530122756958
911.0,"I wasn’t feeling well today - sore throat and headache - and I admit I wanted to skip today’s session. But, I kept my promise to myself and showed up anyway. So glad I did! I “found what felt good” and didn’t push myself into the positions. I know the mat is there for me, and so is Adriene and all you other beautiful yogis! ~Namaste~ ❤️",UgzrcWEhk-q5O0jv2zR4AaABAg,2.0,2.0,2021-01-14T21:22:34Z,0.9996383190155029
912.0,"I think this was my favourite yet :) thank you Adriene, I hope everyone is having a better day x",UgxG-2W3hoWg-YKlhwJ4AaABAg,0.0,0.0,2021-01-14T21:21:16Z,0.9991996884346008
913.0,I always feel so calm after these sessions 🌾💫🌬✨,Ugy38rOoJ8Akq_j56ZV4AaABAg,0.0,0.0,2021-01-14T21:20:34Z,-0.7298268675804138
914.0,Day 13 ✅,UgwF9gvC3pH25WtJgEt4AaABAg,0.0,0.0,2021-01-14T21:18:38Z,0.9300407767295837
915.0,"Thank you for sharing so much wisdom and beautiful words ♥️ exhaling lots of love to this beautiful community. Have a beautiful day, everyone!",UgyURgBAfCSCJNt4cWN4AaABAg,0.0,1.0,2021-01-14T21:16:03Z,0.9998823404312134
916.0,"Thank you for all the beautiful work you do for us!  

I am just going to put this out there... I loved the homey feel of your old apartment as well as the lack of clothing brands on your old videos. 

 It was easier to relax and connect without the fancy spa atmosphere and reminders of the world of advertising and social media influencers trying to warp our perspectives of ourselves.

I want you do ""do what feels good"" for yourself and your employees, but if the new set up does not feel good for you either, know that you have at least one person happy to have you simplify again.",UgycAfIDFoMEYkbuWOx4AaABAg,0.0,1.0,2021-01-14T21:15:38Z,0.9992092251777649
917.0,"Cannot express how much love and gratitude I have for Adriene and her practices! Thank you a bajillion times! The lovely community practicing along with me is so encouraging. I am sending my love and good energy to everyone, even if they feel they don’t need it. I hope everyone who stumbles onto these videos can find peace as well!",UgzVD_qkwmcbiLCjdEd4AaABAg,0.0,0.0,2021-01-14T21:15:25Z,0.9998292922973633
918.0,"Feeling grounded, renewed, hopeful.  Thank you so much.  The motivation you inspire for self care applies beyond physically to psychologically and energetically! ♥️",UgzxvyguodJaL2pOoux4AaABAg,0.0,0.0,2021-01-14T21:15:18Z,0.9998774528503418
919.0,"Feeling good! Normally do your practice in the morning, but had to do this afternoon, feels good!! My little dog does shavasna when I am doing your practice! Love Benji! Thank you!!",UgxBgjWb8X5eGLLFVE14AaABAg,0.0,0.0,2021-01-14T21:11:49Z,0.9998051524162292
920.0,"When I first started a home practice of yoga, via video cassettes/dvds and eventually YouTube, I was always just trying to “hit that pose” every time. Practicing with Adrienne for the past few years has broken me of that habit. And I’m so, so grateful. Your gentle and playful vibe is such a boost to every practice, and your encouragement to improvise and make each practice my own speaks to my musician brain and soul. Thank you, thank you, thank you.",Ugxaim1c5hAEmBfiR4t4AaABAg,0.0,0.0,2021-01-14T21:09:53Z,0.9997913241386414
921.0,Beautiful 🌸 thank you so much,Ugwczkv4QK3hXp5m2_N4AaABAg,0.0,0.0,2021-01-14T21:09:52Z,0.9998737573623657
922.0,"""Smile, cry, wipe a tear if you need to ..."" I sure did. Thank you for the invitation to feel all the feels (on the mat, in my body and in my heart). Loving this 30-day journey with all of you!",UgwM2Qn1-H4EY68VaaZ4AaABAg,0.0,0.0,2021-01-14T21:07:51Z,0.9998596906661987
923.0,"Getting back to working at a computer all day, so this is exactly what I needed! Thank you everyone!",UgxvBE6cWxdLyzyIXP54AaABAg,0.0,0.0,2021-01-14T21:07:41Z,0.9997515082359314
924.0,"thank you Adriene.. another great practice🥰🥰🥰...after the practice I had a thought; how awesome would it be if we had huge gatherings where we would practice yoga, like they have the big sport events... some meditation before ...aww how awesome that would be.. you should work on organizing that as soon as all this craziness ends ... ❤️",UgzmVmjNb-dUxeFhcsF4AaABAg,0.0,0.0,2021-01-14T21:06:27Z,0.9985263347625732
925.0,"The past couple nights, I've had some less than great sleep. Compiled with the current events in the US (and too much screen time absorbing those events), I had a bad headache and some major body aches when I woke up. This practice included a lot of my favorite yummy stretches and I loved having the opportunity to do a little ""freestyle"" yoga on the mat. So thankful to be a part of this wonderful YWA community. Thank you, Adriene! <3",UgxzPhKfInAoKfR5KCh4AaABAg,0.0,0.0,2021-01-14T21:05:04Z,0.9942512512207031
926.0,"How do you find that balance with using technology in the day? You mentioned at the end that sense of yoga helping you become more centred, able to feel and notice. How can this help with the overuse of technology? A problem a lot of us have especially with being stuck in during lockdown! Thanks :)",UgxfKafFi9EkEK0sH0R4AaABAg,0.0,0.0,2021-01-14T21:01:22Z,0.5627638101577759
927.0,"This couldn't have come at a better time, currently going through fertility treatment and this has been my saviour so grounding and relaxing. Thank you Adrienne",UgyPt4GRLWQwOEkvUDx4AaABAg,0.0,3.0,2021-01-14T21:00:09Z,0.9997443556785583
928.0,Knowing more than 8 thousand people practiced with me today is so comforting!,Ugxs7xdnwmnrcnCQXfx4AaABAg,0.0,4.0,2021-01-14T20:57:42Z,0.9994860887527466
929.0,"You really deserve all the love in the universe for sharing your videos, your words and your time with us ❣️",Ugx_bxL2CVmRjDQl7v54AaABAg,0.0,0.0,2021-01-14T20:56:12Z,0.9986569881439209
930.0,"Yesterday was one of those very rare days where yoga did not make me feel getter, but I stuck to it and today's yoga made me feel AMAZING.  So on days when I do not ""feel"" it, I have to remember to just be patient.  🙏🏽🕊💜",UgxTvNzSZY1GlU8ZSh54AaABAg,0.0,0.0,2021-01-14T20:54:41Z,0.9992296695709229
931.0,"Does anyone have any recommendations for yoga videos for absolute beginners, people who might feel embarrassed or uncomfortable doing yoga, or might find it really difficult? My mum really wants to start and I showed her one of the videos I started with on YWA, and I’m not sure if she did it but I’m thinking of approaching the subject again and I would really love anyone’s input,😘",Ugy12DlBSYDMM6xHHPB4AaABAg,2.0,1.0,2021-01-14T20:52:24Z,0.6133418679237366
932.0,Today it was quite difficult to find the time to make it to the mat but just before bed time (here in Spain hahah) finally made it and I feel so full in all the posible ways I can imagine. I'm so gratefull for being able to experience this journey. Thank you Adriene and all the people that we don't see that much but make all of this possible.,UgwC8PkcyycWxGrH-xN4AaABAg,0.0,1.0,2021-01-14T20:50:23Z,0.999752938747406
933.0,"Feeling so good after another evening with Adriene. I have not felt well this month, yet each night I come to the mat and each night I leave feeling better. Even when my intention is just to sit there and breathe - each night I move and feel better. I am so grateful for this series, for my friends who told me to start my yoga journey with Adriene, and for my commitment to this series.",UgznaZqcjf2QLq-Y3g14AaABAg,0.0,1.0,2021-01-14T20:48:58Z,0.9997479319572449
934.0,Thank you Adriene for this wonderful practice! I feel so much stronger in my body and my mind already :),UgxkVOfQLdiu824UVld4AaABAg,0.0,1.0,2021-01-14T20:46:44Z,0.9998549222946167
935.0,"I almost didn’t make it to today’s practice, anxiety had taken over and I simply thought “nah, I’ll do two tomorrow”..
Somehow, I found myself on my mat and within seconds heard Adriene tell me that the hardest part is showing up. That quote motivates me every time and reminds me how much I’m loving my new yoga journey!",UgymSLMUTFwv2akmwxR4AaABAg,1.0,37.0,2021-01-14T20:45:18Z,0.9988141059875488
936.0,"Feeling so grateful for this journey so far! Never felt that replenished and filled with love and energy, especially in that time of the year! Definitely feeling the stress, anxiety and a heavy weight going away, while being lifted by love with you kind words! I can't believe how peaceful I leave the mat each day, and that is a blessing knowing the negative energies surrounding me lately! Thank you for every single video! And thank you for that moment you mentioned humility : It touched me so deeply and brought peace to my insecure heart that I know I will cary it with me from now on! 

Lots of love! Namaste!",UgwnFG-IO7bUECICzOZ4AaABAg,0.0,1.0,2021-01-14T20:44:55Z,0.9997673630714417
937.0,"Today is my 24th birthday : ) I wish I could feel happy but all I can feel is an overwhelming sadness - at being quarantined, about dropping out of school, and being helpless to ease my sister's chemo sickness. But Adrienne gave me permission to be sad today, to feel my heartache and cry a little during yoga. I accept my sadness today and look forward to a day in future that I can celebrate becoming a year older. Sending love to everyone from California. Hugs and kisses.",UgzBaJS2hBnJBmphaJp4AaABAg,1.0,0.0,2021-01-14T20:44:21Z,0.9982439279556274
938.0,Ahhh i love reading these comments seeing so much love is so lovely!💕,UgxnZDFML3-xDB-tZgB4AaABAg,0.0,1.0,2021-01-14T20:44:19Z,0.999835729598999
939.0,I kept my heels to the ground for the first time in the squatting pose!,UgxRhGV540w_LsSjVhh4AaABAg,0.0,1.0,2021-01-14T20:42:41Z,0.942435622215271
940.0,"I had lots of fun today, especially with the free choreography at the start! 25 minutes has never gone so fast!! Thank you Adriene ❤️❤️",UgyaESzJd3RNjX_QZiJ4AaABAg,0.0,5.0,2021-01-14T20:40:41Z,0.9998189806938171
941.0,I feel grateful today....✅,UgxztH7rSmrsa5l8cMh4AaABAg,0.0,2.0,2021-01-14T20:38:18Z,0.9997853636741638
942.0,Thank you. Just perfect feel!,UgxQqXSHOrL9LGefJpB4AaABAg,0.0,2.0,2021-01-14T20:37:28Z,0.999879002571106
943.0,I loved today’s practice! What a beautiful way to start the day. 🥰,UgxljXuEQ2oJwQ4a3Ah4AaABAg,0.0,2.0,2021-01-14T20:37:20Z,0.9998718500137329
944.0,"""You´re here, that´s A+!"" :)))",UgxneHw5Scr7sQQyEtZ4AaABAg,0.0,8.0,2021-01-14T20:36:50Z,0.866008996963501
945.0,"I had so much fun today! Thank you, thank you, thank you for this awesome journey!",Ugw5CuewUXooqYwmbFZ4AaABAg,0.0,2.0,2021-01-14T20:36:48Z,0.9998794794082642
946.0,I feel great!! Namaste,UgxV5b8yPkJKcik0JNh4AaABAg,0.0,3.0,2021-01-14T20:33:50Z,0.9998689889907837
947.0,Today's practice felt incredible. Thank you 🤍🙏🏼,UgzNVJ9tsryUzqzHNaR4AaABAg,0.0,2.0,2021-01-14T20:33:02Z,0.9998705387115479
948.0,Day 13 in the books...and I FEEL great!!  😊,Ugxh4rvpA4ocpEUE3zt4AaABAg,0.0,2.0,2021-01-14T20:33:17Z,0.9998444318771362
949.0,"Not gonna lie, during that boat pose, by the time Adriene counted 8 I was already in savasana hahahaha
Still, loved the practice",UgzU5HB-d7bpdJEwv254AaABAg,0.0,25.0,2021-01-14T20:31:45Z,0.9981970191001892
950.0,"This was one of my favourite pracises to date. I just loved how validating and reassuring you were!😄 I was having so much fun, and what is even better is that I know many other people were having fun with me. Thank you all and namaste❤️🙏🏻",UgyCZYx-iwsR9D2gJN94AaABAg,0.0,10.0,2021-01-14T20:30:04Z,0.9998286962509155
