,comment,comment_id,reply_count,like_count,updated_at,calificacion
404.0,"Thank you so much for this, Adriene! This is my first attempt (ever) at Yoga and I'm already noticing both mental changes and improved mobility. The Sockets in my shoulders do no longer snap when I do push-ups or perform similar movements. I'm so glad that I have discovered your channel and yoga at this time in my life. I'm fairly certain that a younger version of me instantly would have discarded Yoga due to pride. Perhaps the biggest achievement is that I now allowing myself to fail and still keep going, knowing that me falling short in the present doesn't mean that I will fall short in the future. I feel blessed that I through your work have found a way to improve flexibility and my the overall health, because for the longest time I have been embarrassed about my stiff joints and limited movement. And also.. Whenever I get confused, insecure or doubtful you somehow miraculously manage to address those exact matters only a couple of minutes later through encouragement, or simply by recognising the problems we beginners might have with the training. Those moments have been truly valuable to me. There are a lot of new sensations I have discovered by following your lessons. For example: This whole day have been really emotional to me. My thighs feel beat up and I've been on the verge of crying multiple times. It's been quite confusing to say the least. I know you mentioned that this could happen in the video, but could you give an explanation to why it does?  These lessons have so far also helped me be more present and loving towards myself. This Mindfulness I'm experience through your lessons is something I have experienced previously and also lost track of multiple times in my life. But I think that I finally have reached a level where I'm ready to start establishing routines that will help me stay on this right track and not fall back into my old self-destructive ways of thinking. I rambling now. However, the real reason for me writing is that I wonder how you suggest us to continue when these 31 days are over? I prefer to do the yoga in the morning when I wake up and quite frankly I prefer watching somebody instruct me what to do than making up my own exercises. Much love from Sweden.",Ugg3sSCYQ0e7-XgCoAEC,0.0,0.0,2017-04-17T16:45:04Z,0.9793990850448608
405.0,Thank you! Very loving practice,UghOrUsj6-6zu3gCoAEC,0.0,0.0,2017-04-15T01:47:38Z,0.9998840093612671
406.0,"I have to say that I have done about 48 days of yoga and have not skipped a day! I love adrienne! She's real, funny, and really makes you not only enjoy yoga but look forward to it everyday! I teach multiple lesmills fitness classes and my body is always hurting, since I started with adrienne, my body has never felt better. Honestly she cracks me up! It's like she's in the same room!",Ugiflb8H4SG22HgCoAEC,0.0,0.0,2017-04-13T01:35:18Z,0.9935258626937866
407.0,Love your videos . When breathing in does your belly come out or in . I'm just not quite sure I'm breathing correct. . I'm wanting to be toned am I using correct videos revolution 31,UgixSUroc0MoQHgCoAEC,0.0,0.0,2017-04-12T19:41:02Z,0.8430337309837341
408.0,this practise made me smile so much <3,UgjNOkNo61y1fXgCoAEC,0.0,0.0,2017-04-11T22:17:06Z,0.9996581077575684
409.0,Perfect timing for a serenity day. Thank you!,UgiSfy3ZkGcS03gCoAEC,0.0,0.0,2017-04-11T13:06:57Z,0.9998856782913208
410.0,Self love - perfect way to start out this Monday!!,UgjPC8jVqn40QHgCoAEC,0.0,0.0,2017-04-10T15:45:34Z,0.9992604851722717
411.0,"I have tried to do yoga several times in my life, but every time I felt, that ""Oh my gosh, I can not put myself in those positions"" It did not feel good, it hurt, I thought it was not for me. Adriene, yout progressive teaching, with giving options really make it easier for me to learn, to feel taht I am finally be able to join yoga. I am not doing it every day, I practice yoga twice a week, but slowly I get there. Yoga not only helps me to have a healthy body, but it helps me have a healthy mind, it  teaches me to live! Thank you! <3",UggYrowFZ9hCU3gCoAEC,0.0,2.0,2017-04-05T07:35:45Z,0.9852573275566101
412.0,How do you get the e mails she keeps referencing?? :),Ugi_qhm4k7N3FXgCoAEC,2.0,0.0,2017-04-01T16:21:41Z,-0.9988693594932556
413.0,"Is it just me or is the 'cheerleader' pose around the 10 minute mark actually impossible, I know i'm super unflexible especially in my legs, but my right arse cheek is several inches off the ground when I put my right leg behind me, meaning my body is completely off to the side, sorry Adrine really struggled with that one",Ugztoy-oDLV5Lkg4b614AaABAg,0.0,0.0,2017-03-29T17:51:54Z,-0.995411217212677
414.0,that was so beautiful. thank you so much for today's practice!,UgxICjnCoV5x1xen-ip4AaABAg,0.0,0.0,2017-03-28T15:58:49Z,0.9998733997344971
415.0,Best day so far :-),Ugybh_CU3-l8rsv7tIZ4AaABAg,0.0,0.0,2017-03-28T02:57:33Z,0.9994280934333801
416.0,started my day with this practice feels good.. I feel more calm.. I am going to be in charge of my own inner peace,UgxWmOY6fXNsC5vcjoZ4AaABAg,0.0,0.0,2017-03-27T22:11:11Z,0.999758780002594
417.0,"I love adriene and her practice!  She is so light and fun and quirky!! I am loving the revolution thus far.  I know I am late on the yoga bandwagon, beginner here, but each practice has been much needed.  I look forward to my time everyday now!",Ugybw1YWBErVRxvUbvJ4AaABAg,0.0,0.0,2017-03-27T20:57:45Z,0.9998325109481812
418.0,Namaste and thank you.,UgydILH0nhKCFiHx1RF4AaABAg,0.0,0.0,2017-03-26T10:50:20Z,0.9998626708984375
419.0,Is there a way I can get the emails you're talking about?,UgwQIKvGfS8ITlcedBN4AaABAg,0.0,0.0,2017-03-24T21:32:15Z,-0.9990511536598206
420.0,"I put off doing this 31 day revolution until just a week ago but glad to be in it now. I also know you get a zillion comments and can't possibly read them all, but if you happen to stumble upon this one,  I just want to tell you that you are the first teacher I have worked with since my great friend and brilliant teacher, Pedro Franco left San Francisco 3 years ago. As a professional musician, your attention to detail is just what I need and your silliness is the perfect antidote to my sometimes too serious approach to just about everything. I laughed out loud more than a few times during day 8. Thank you for bringing yoga to the world. You are Bhakti-yoga personified and a true Bodhisattva given to a crying planet. Blessings.",Ugz16jhiM8TFa5oH8YZ4AaABAg,0.0,0.0,2017-03-24T08:54:21Z,0.9954534769058228
421.0,"Love the yoga practice that is demonstrated, however I would recommend keeping talking to a minimum and focus on moves and breathing.",UghSKyn9AOo1xHgCoAEC,0.0,0.0,2017-03-22T19:33:55Z,0.9972902536392212
422.0,"I struggle with depression and almost didn't show up today,but now I'm so glad I did! This is exactly what I needed <3 thank you so much for inspiring me adriene, namaste!!",UgizQGqg_tKAh3gCoAEC,0.0,0.0,2017-03-22T01:06:44Z,0.9997482895851135
423.0,I really really really LOVE this! I am taking more time for my revolution with you because I love also the mental challenge you are giving me with every session! I think I just received the 22th email from you but I love the freedom that I can take with this medium and adriene I love the effect on my life that this revolution has on me. You are one reason why I feel so enormously wonderful! Thank you for that I send you all the universe's love!,UghTQ1T8kZLnpXgCoAEC,0.0,0.0,2017-03-19T09:16:48Z,0.9998736381530762
424.0,I am grateful for the gift that my shoulder pain is gone after this session. Thank you!,UgiXRU0JRa1-8XgCoAEC,0.0,0.0,2017-03-18T16:55:11Z,0.9996439218521118
425.0,How do you sign up for the emails? I couldn't find it on her website,UgiHo_nt2OWXuXgCoAEC,0.0,0.0,2017-03-15T02:11:20Z,-0.9993288516998291
426.0,"Adrien, I just wanted to say that I've been suffering (I wouldn't say it was incredibly painful but it was inconveniencing) from a very sore spot on my back for the last few weeks.  I thought it was sciatica but the stretches I would try would work.  So I pushed through a lot of my workouts.  Then I got to day eight and in the middle of the first of the leg twists, I felt a small pop in my back and the pain started easing.  It's by no means gone and I'm going back to my chiropractor but it is definitely a first step to finding out what was wrong.  Thank you very much for your yoga series.  I've been practicing with you for about two years and it has helped me exponentially.  Thank you so much and keep up the great work!",UggLvqWtb0oHP3gCoAEC,0.0,0.0,2017-03-10T14:07:43Z,0.9970976114273071
427.0,"Day 8 Check.

Ok I'll admit, this one was kind of nice and relaxing. I just only wished that my forms could be perfect as well as my balance. I really push myself in yoga, even if it means taking the most difficult forms and I get mad at myself for not getting forms that are good as Adriene. I know that I shouldn't compare to others, but I honestly don't care. I barely have time for yoga and it actually becomes more difficult for me to find time to actually commit to these videos. That's why i push myself so hard to actually being perfect. I don't care if it's realistic. Not one excellent prize was ever earned by traveling an easy road. If I must go through pain to get to my goal, then so be it. If it means pushing myself to get those perfect forms, fine. I just only wish that Yoga was meant for me. I'd be happy if it was just easy for me AND relaxing (which I honestly don't think it is), like this training session.

Thanks anyways, Adriene. I only wish that I could be just as good as you and many other individuals or better. But I'm not.",UggNb99klZqPLXgCoAEC,0.0,0.0,2017-03-10T11:12:35Z,-0.956031084060669
428.0,"I'm so happy right now. I missed the last two days and I felt terrible all together. Today I decided to continue the practice and I'm so glad I did. I just feel so full of peace and positive about the mistakes I made the last couple of days. This doesn't feel like a chore, is something I want to do. Thank you for this! Love from Chile.",UggTI5ReL7oDPHgCoAEC,0.0,0.0,2017-03-09T01:49:41Z,0.9997792840003967
429.0,"As a new mum, one of my go-to self-care things is a foot massage when I get into bed. I keep a really nice moisturiser in my drawer and it's awesome just to take five or ten minutes to myself at the end of a long day. Thank you for another amazing practice!",UggC3TQPyeJUCHgCoAEC,0.0,0.0,2017-03-08T21:55:09Z,0.9996076226234436
430.0,"great , I so needed that , thank you again 👍✌️",UgjAJJGAg2eSZHgCoAEC,0.0,0.0,2017-03-08T20:34:23Z,0.9997426867485046
431.0,Day 8 was just what I needed today :),UgjougQtLq5cRXgCoAEC,0.0,1.0,2017-03-08T18:28:54Z,0.9816510677337646
432.0,Oh goodness what a great practice this is. Totally needed. Thank you Adriene!,UghwZbglr8NBIXgCoAEC,0.0,0.0,2017-03-08T11:46:26Z,0.9998379945755005
433.0,"Hi Adriene. I have never commented on any YouTube videos before but felt I had to share with you.... I was recently on work leave for burn out / depression. I was off for 3 months. I started doing your 30 days of yoga and 3 weeks in I was back at work. I finished that 30 day challenge and am now on day 8 of revolution. I was never able or had the right mind set to do yoga before I found you. I absolutely love the way tou teach / explain everything... and your quirky personality is a plus! I see myself ;) Thank you so much for introducing me to this wonderful time I finally take for myself. I feel great and even when Im tired and have just put my kids to bed at 8pm after work I still want to get my yoga on before a little TV instead of grabbing a glass of wine and vedging out. You changed the way I feel about myself. Thanks again and I can't wait to see what's on the ""menu"" tomorrow!! Have a good night :)",UgiCF1mxAF26hngCoAEC,0.0,31.0,2017-03-08T02:22:57Z,0.9990121126174927
434.0,"Hey, I cried, too.  This feels like a really special practice. Sooo grateful to Adriene for all the videos. Intend on buying some feel good t-shirts as a thank you xxx",UghbMLpEikkoDngCoAEC,0.0,0.0,2017-03-07T13:49:15Z,0.9987670183181763
435.0,Hello! I followed your videos for a long time but missed revolution in January as I am travelling and have only just got internet to stream it :) how can I sign up for the accompanying emails for revolution? I went all through the website and can't find the option? Thank you in advance to anyone that can help :D x ❤,UgjJeuF53NUKZXgCoAEC,0.0,0.0,2017-03-07T05:08:02Z,-0.9985982775688171
436.0,the human body is amazing. what this practice can open up is so powerful. thank you for this practice today.,Ugg4_Giv_U5nTHgCoAEC,0.0,0.0,2017-03-06T20:22:39Z,0.9998874664306641
437.0,Love love love this....thank you!!! Mahalo from Hawaii!!,UgiQa7esmKGpWXgCoAEC,0.0,0.0,2017-03-05T19:32:20Z,0.999875545501709
438.0,Thanks so much for the videos. They have been great working my way back from injury,Ugh3H-AiqvcINHgCoAEC,0.0,0.0,2017-03-05T14:35:12Z,0.9995844960212708
439.0,2:40 minutes in and I'm crying....wtf....thank you Adriene I needed this.,UghIvTfybsfo5HgCoAEC,0.0,1.0,2017-03-05T10:43:33Z,0.9369427561759949
440.0,I feel so alive! Thanks!,Ugij9410FNiTbngCoAEC,0.0,0.0,2017-03-04T05:25:17Z,0.999871015548706
441.0,Love the practice Adrienne! U r fabulous and funny. I am on day 8 and my wrists are really sore any suggestions? Should I take a day or two off?,UghBIduo4aao3HgCoAEC,0.0,0.0,2017-03-04T00:32:54Z,0.9989405274391174
442.0,"I love doing yoga with you, Adriene. Today I laughed so hard after you said Serenity now, Seinfeld is one of my favorite shows. You are such a great, supporting, humorous teacher. Thank you. :)",UggkO6HtcXOIfngCoAEC,0.0,0.0,2017-03-03T12:17:06Z,0.9997990727424622
443.0,"I hate meditation/calm down/ serenity yoga. however, I absolutely didn't run away from this one and it felt really good, and I learned that I need to approach the things I'm uncomfortable with and sit with it. thanks adriene! this is amazing!",UgiVj6eh6vnntXgCoAEC,0.0,0.0,2017-03-02T06:52:27Z,0.999792754650116
444.0,"While I was doing yoga,i realized that how today's world's ""consuming culture"" affected my behaviours.I am impatient ,acting like I'm in a hurry.I'm doing this and 5 min. later i'm doing that,consuming the moments. Hope yoga will change me.I really want to be calm and want to move with awareness.And in this journey,you're leading me Adriene.Thank you <3",UgjOaU3_AVg0kHgCoAEC,0.0,0.0,2017-02-28T19:05:04Z,0.9749773740768433
445.0,"Loved the practice- felt so good! I love your playfulness! Little too much language for me today, though. xo",UgjvYXgly8njxXgCoAEC,0.0,0.0,2017-02-28T15:55:58Z,0.999778687953949
446.0,"I love your videos Adrienne. thanks a lot. I'm progressing getting more flexibility, but today was special I felt like massaging my soul, was a very special feeling.  Amazing!",UggaSs5qvXwlSHgCoAEC,0.0,0.0,2017-02-28T14:52:00Z,0.9997584223747253
447.0,when she said pillow....I grabbed mine...buckwheat and weighs over 5 lbs...you should have seen me go from comfy to lifting and squeezing during the abdominal part haha a sight to see. I'm not getting the daily emails.....=(,UgiPIhBvQTcM4XgCoAEC,0.0,0.0,2017-02-24T13:24:23Z,-0.9968628883361816
448.0,"After a crazy busy start to the year, I am slowly catching up.  Loving every day <3 Thank you sooooooooo much Adriene, soft and sweet serenity :D xxx",UghFxMoQ1U_3tngCoAEC,0.0,0.0,2017-02-22T21:36:43Z,0.999853253364563
449.0,Thanks for the jokes and the mindful practice today here in Belgium.,Ugh3Volca_4YoXgCoAEC,0.0,0.0,2017-02-21T09:12:55Z,0.9998019337654114
450.0,"At the end of the video I felt so happy, thank you so much for this practice Adrienne. Love from Poland!",Ugg1i45mp8QkJ3gCoAEC,0.0,0.0,2017-02-20T18:34:45Z,0.9998435974121094
451.0,I don't manage to do the videos every day but I am doing them in order.  Today was just a perfect one for me and what I needed on a slow moving Sunday morning.,UggKnkDT6OM3_HgCoAEC,0.0,0.0,2017-02-19T17:02:47Z,0.9989339709281921
452.0,"Love that you want to learn reflexology! I'm a Reflexologist and your yoga classes have changed my life! I'm full of energy and serenity at the same time, Thank you!!",UgirD3q58Ia7nHgCoAEC,0.0,0.0,2017-02-19T06:57:25Z,0.9998544454574585
453.0,"Today I decided to try doing this with my own music quietly in the background, IT WAS SO COOL!  Those of you who love music I would recommend it.  Adriene, it's perfect that your videos don't have music in the workout, because I can add in my own.  Today it was Coldplay's Ghost Stories, and right when you said ""What image comes to your mind?"" coldplay said ""I think of youuuu."" and I laughed out loud.  Music helps me groove and boosts my mood, and it gives me something to focus on when we're holding a pose that's hard.  Fun new mix of my favorite things!!  <3",UggG8vGnQ74v_HgCoAEC,0.0,0.0,2017-02-18T20:47:48Z,0.999778687953949
454.0,I could like these classes but the jokes always brake my concentration,UgjBTiHhKcyPaHgCoAEC,0.0,0.0,2017-02-18T20:20:10Z,-0.9970447421073914
455.0,"This has become my favorite part of the day, thank you!",UggTsO2spGLW3HgCoAEC,0.0,0.0,2017-02-17T11:52:40Z,0.9998681545257568
456.0,I'm new to yoga and love Yoga with Adriene. I did the 31 days of Revolution but missed a few. So I am doing them over again. Just wanted to say that I am getting so much more out of them the second time around. Thank you for coming into my life. I am very grateful to you for your YouTube videos and sharing yoga with the world. I personally want to continue to grow my practice and learn more through yoga. To find a better me -- more peaceful and balance me. And learn the power of my breathe and how to use it. And I now believe this is possible. Thank you.,UgioPXdaER4dPngCoAEC,0.0,0.0,2017-02-16T03:58:40Z,0.9997881054878235
457.0,"I almost decided to go grocery shopping before practice but there was a Divine force that shifted my mind to this instead and I am so ready to brave the storm with a smile and some major serenity. I will also be singing ""shake it like a Polaroid picture"" all day. Yessssssssssss!!! 🙌💃",Ugij-XVRHIKY93gCoAEC,0.0,0.0,2017-02-15T17:36:36Z,0.9995734095573425
458.0,Cant recall if it was Day 8 or 7 you mentioned your Chiropractor.  I confess this surprised me since I have not had the same need to visit Chiropractor since practicing more regularly.  Should I revisit that decision?,UgieAUfGEQbVCngCoAEC,0.0,0.0,2017-02-15T04:49:23Z,0.9160516858100891
459.0,"Hi Adriane.  For the first time in 3 years I didn't do January yoga with you.  Tough year.  I started 31 Days in February, and Day 8 just happened to fall on Valentine's day. What better way to love myself?- blanket myself in love with yoga.  THANK YOU!",UgiVrkaiTLf1pngCoAEC,0.0,1.0,2017-02-14T15:54:36Z,0.9981086254119873
460.0,love her sessions! I wish there was less talking though. Thanks,UgidpaCu9wrfYngCoAEC,0.0,0.0,2017-02-13T22:45:24Z,0.9992637038230896
461.0,I am late to Day 8 but WOW! what a powerful practice! I am floating and Adriene doing yoga with you is so joyous ❤️,UgiFuNS6g7vr6XgCoAEC,0.0,0.0,2017-02-13T05:16:01Z,0.9998151659965515
462.0,"Thanks for the video, Adriene. Being called ""party people"" is OK, but I think I prefer when you call us  your ""sweet friends"" :)",UggaCGN64FcstngCoAEC,0.0,0.0,2017-02-12T14:28:17Z,0.9994279742240906
463.0,Lovely but a little bit too much of talking for me. It makes difficult to actually be in the practice and meditate on it for me.,UghkteEldkO4x3gCoAEC,0.0,0.0,2017-02-12T07:46:53Z,-0.9994231462478638
464.0,"Today was WOW. Just WOW! Total serenity. Have a great day good people of the world. Namaste. 
P.S. Adriene how do I sign up to your email list? Many thanks.",UgjSGNaOLbMLNXgCoAEC,0.0,0.0,2017-02-09T21:53:21Z,0.9998455047607422
465.0,Hoochie Mama !,Ugjc8PrZkMiJg3gCoAEC,0.0,0.0,2017-02-09T14:58:44Z,0.988940417766571
466.0,Thank you so much Adriene. Since i'm doing yoga with you i feel so much better. Love from Portugal :D,UggO_ClIykS5CngCoAEC,0.0,0.0,2017-02-09T09:53:14Z,0.9997236132621765
467.0,I love this session. I literally used it 3 or 4 times and cannot go further. It really brings me back to center. Thanks Adriene & I promise to keep on showing up,UggDZzChprUZhngCoAEC,0.0,0.0,2017-02-09T02:08:31Z,0.9997585415840149
468.0,"Can i just say, i have been doing now yoga with Adriene for a year and i love every single routine she introduces. Thanks Adriene",UgjeWfi-76EiuHgCoAEC,0.0,0.0,2017-02-08T21:18:47Z,0.9997661709785461
469.0,Round 2 Day 8 complete. What a yummy practice for a rainy day! Learning to love myself. Thank you Adriene. Namaste everyone.,Ugj9C-dZ4eWhfHgCoAEC,0.0,1.0,2017-02-08T16:41:11Z,0.9995433688163757
470.0,What a beautiful yoga practice today Adriene... I am marking it so if I need it again I will have it ready to go. Serenity.. everything is as it should be.,Ugjv1sqNERcvTHgCoAEC,0.0,0.0,2017-02-08T14:47:33Z,0.9995998740196228
471.0,restart day 8 I needed this a lot I have been beating up my body lately and I just needed a easy practice I'm glad this came around today.,UggVgPgq0VmtxHgCoAEC,0.0,0.0,2017-02-08T10:37:08Z,0.9929482936859131
472.0,I love love this one. That squeeze at the end gave me a cramp.,UgiTPiHIsyycu3gCoAEC,0.0,0.0,2017-02-08T05:01:40Z,0.9996682405471802
473.0,This was just what I needed today. Thank you!,UgiDkuSSWSKonHgCoAEC,0.0,0.0,2017-02-07T04:10:03Z,0.9998577833175659
474.0,So. Much. Joy. I felt so much joy in this practice that I laughed out loud when Adriene talked about shaking it like a Polaroid picture. And now I'm crying because I'm so thankful for that joy.,Uggxe3n0zZ-d33gCoAEC,0.0,9.0,2017-02-06T16:59:17Z,0.999713122844696
475.0,I forgot to breathe! But today was amazing - timing was bang on for a blanket of self love <3,Ugiw5qA1snWcu3gCoAEC,0.0,0.0,2017-02-06T12:42:37Z,0.9975336790084839
476.0,My cat's expression during the shaky-shaky hands moment: priceless!,UgjmAzvMT1DrXngCoAEC,0.0,0.0,2017-02-06T06:52:51Z,0.9992725253105164
477.0,"I was introduced to you by a friend and absolutely LOVE your style and energy. Thanks for being you.  Any suggestions on how to help release hip flexors? They tighten up when I am in cross legged and take over when I do abs. Also, how do I get on your emailing list? Namaste",Ugiz5y6jzQO5cXgCoAEC,0.0,0.0,2017-02-06T00:01:26Z,0.9995898604393005
478.0,"Just when I finished this, still lying on my back, my cat literally climbed on top of me and started massaging my tummy... gotta love cats! <3",UgiV1Jzo--urX3gCoAEC,0.0,0.0,2017-02-05T16:56:54Z,0.9864907264709473
479.0,I didn't want this one to end! Namaste <3,Ugi4j8puXKhM93gCoAEC,0.0,1.0,2017-02-04T22:47:08Z,-0.9895946979522705
480.0,"Hi Adriene!!  I am so grateful I have found you!  You have brought me back into a normal routine with my practice, so thank you so much!  I have really needed this, my life is improving everyday. :) :) :)   Can you please tell me how I subscribe to the accompanying emails that go along with revolution?  I know you said it's important to use them together.",UgiQRq9n0JOhSXgCoAEC,0.0,0.0,2017-02-04T17:17:10Z,0.9993718266487122
481.0,Thank you for a great practice.  I haven't done Yoga for a while and this is easing me back in to stretching.  I feel great afterwards.,UgheGA03DlPzi3gCoAEC,0.0,0.0,2017-02-04T16:52:03Z,0.9997919201850891
482.0,"i found these videos when the series was almost done, but i decided to do it and stick with it everyday and i'm so happy that i did. i've been having quite a difficult time in my life lately and i cried several times during this video, but it ended with me feeling relieved and at peace which is exactly what i needed. thank you so much for these videos and life lessons.",UghsolHlyTql5HgCoAEC,0.0,0.0,2017-02-04T04:56:37Z,0.9997114539146423
483.0,"I was crying at the end of this. I feel so tense all the time. It's like I never let go or relax my mind. Handling being a SAHM with an almost 3 yo is really putting a toll on me. Feels like my cup is constantly empty.
Thank you for helping me a little every day. I used to do yoga in high school just in my bedroom. I was always relaxed and my daily movements were with intention and care.
Once I became a mom it was rushing and being upset and frustrated and mad about things that would have never made mad before.
This is helping me go back to how I was before. Thank you Adriene. ❤️",Ugj05m56Vag6VngCoAEC,0.0,0.0,2017-02-03T22:18:26Z,0.992234468460083
484.0,So I've finally done all of the days! I missed two and this was my final one. What a treat to finish with. I'm sure I will come back to this one. That killer pillow abs sequence in the middle took me by surprise haha! Thankfully it wasn't too long. Many thanks for this generous gift Adriene & for sharing your wisdom and love. You are a beautiful soul 💖 xxx,Ugg2HeyP0hed4HgCoAEC,0.0,1.0,2017-02-03T19:22:23Z,0.9996423721313477
485.0,"I'm recovering from my breast cancer treatment and find this Yoga amazing! My neuropathy is improving and the stretching in the shoulders and feeling every part of my body strengthen is just what I needed. Already send it to my other buddies who had to go through chemos, operations and radiotherapy and recommended my oncologist to promote it.",UgjO9NmjO0fn9HgCoAEC,0.0,1.0,2017-02-03T09:08:50Z,0.9996685981750488
486.0,"Started my revolution late this year, so I'm way behind...better late than never!  You are the reason I've stuck with yoga for the last 3 years, your approach, humour and mindfulness make my practice that much juicier!  I loved Day 8...I have been very tough on myself lately so this was just what I needed.  I also love that you brought Reflexology into it...I'm a Reflexologist and agree wholeheartedly that our feet are an overlooked integral part of our well being!  YAY for Reflexology!",UggQ0e39wdpAUngCoAEC,0.0,1.0,2017-02-02T22:28:53Z,0.9989621639251709
