,comment,comment_id,reply_count,like_count,updated_at,calificacion
596.0,"I am a 64-year-old woman with serious back issues including stenosis sciatica and arthritis. I was told in 2001 I would be back for a second operation. But yoga has kept me away I just discovered Adrien's yoga  and I love these videos they are sensible, healthy, and kindly entertaining. Thank you for saving my back!",UggIN0z9-1j1jHgCoAEC,0.0,0.0,2017-01-11T19:17:25Z,0.9997218251228333
597.0,I liked when Adriene was discussing the foot massage with a partner....or by ourself.....NO TOXIC THOUGHTS!  She hasn't said that phrase in a long time!😊😊🙏,UgguJB7dWjsv4HgCoAEC,0.0,0.0,2017-01-11T19:06:46Z,0.9912795424461365
598.0,I signed up for your emails but I'm not getting any :( I saw where you said they sometimes end up in another folder but it's not appearing in any of mine. I'd love to receive them!,UgiXlIaiU013mXgCoAEC,0.0,1.0,2017-01-11T17:29:09Z,0.9974143505096436
599.0,"I watch the videos on my tv, so I wanted to come back to comment on the videos that really helped me. Wow, the ""blanket of love"" was so moving and exactly what I needed to hear. I loved this practice! So, so fitting when I needed something to relieve a bit of nerves starting back in an improv class. Grateful for this experience...namaste. ❤",UggGNNZOvjEVWngCoAEC,0.0,0.0,2017-01-11T17:14:21Z,0.9996143579483032
600.0,"I didn't have time to comment when I did this video, but first I hated you when you sneaked in the ab work in a day 8 video, only to love you more for knowing what I need lol <3 loving this revolution, even if I can't do all the videos on the exact day, I will finish in my own time :)",Ugg4PkMhxiBPkXgCoAEC,0.0,1.0,2017-01-11T17:06:13Z,0.9877620935440063
601.0,anyone else fall asleep at the end??? hahah,Ugh-uKPfUp9QzHgCoAEC,0.0,0.0,2017-01-11T17:02:18Z,-0.9988332390785217
602.0,beautiful <3 exactly what i needed today,UghKGwbepF16lHgCoAEC,0.0,0.0,2017-01-11T16:11:43Z,0.9998592138290405
603.0,Got very emotional and experienced a cathartic release. What a gift. Thank you.,Ugh66dJMRBkzxXgCoAEC,0.0,0.0,2017-01-11T15:21:46Z,0.9998412132263184
604.0,I'm a guy - not sure if its the same for girls too but that last practice of tensing everything and releasing felt orgasmic. Amazing practice today. Thank you Adriene!,Ugg7wrA5luxGqXgCoAEC,0.0,0.0,2017-01-11T12:06:44Z,0.9996285438537598
605.0,"The foot massage part made me cry, it was a pleasant and peaceful release. 

Speaking of the foot work, there are acupuncture charts that reveal what parts of the feet are connected to different organs, if you believe in acupuncture. Just to throw an idea out there - maybe you could have some videos that concentrate on the inner organs through those feet acupuncture charts. I shall looks for a link and share it. Thanks for all of your hard work to keep yourself and all of us healthy.",UghI77b08JG8_ngCoAEC,0.0,0.0,2017-01-11T09:57:47Z,0.9983487129211426
606.0,YO-Gees ARE EVOLUTION #YOGAREVOLUTION,UghMfEas75913ngCoAEC,0.0,1.0,2017-01-11T05:19:31Z,-0.9043160080909729
607.0,I was surprised there was no Taylor Swift reference lol,UghRFKcY1XtsOHgCoAEC,0.0,0.0,2017-01-11T02:29:37Z,-0.9953036308288574
608.0,"I have been bottling a lot of emotion and hadn't found a productive way to acknowledge it, but when you said to blanket myself in love, I started weeping and didn't stop for the whole practice.  Thank you for the emotional release.",UggLu-Dx3klE5XgCoAEC,0.0,0.0,2017-01-11T02:04:23Z,0.998997151851654
609.0,"I love you! Thanks for all, you help me a lot. I'm from Brazil. oxoxoxoxoxoxox",UghAHJsFbgoHy3gCoAEC,0.0,0.0,2017-01-11T00:39:53Z,0.9997988343238831
610.0,Some days you just need practices like this one..,UgiY-m1VP8jfT3gCoAEC,0.0,1.0,2017-01-11T00:04:15Z,-0.942503035068512
611.0,❤,UgixLhpsCLHuf3gCoAEC,0.0,0.0,2017-01-10T23:05:13Z,-0.6970567107200623
612.0,How do I get the emails!? :(,UggFD05TiQ2ACXgCoAEC,0.0,0.0,2017-01-10T22:01:04Z,-0.9979960918426514
613.0,"Nearly didn't join in today as I was feeling so tired and bloated. Glad I did, it was the perfect relaxing yoga and I even feel less bloated now! Thanks adriene!",UggWX-zvOhc4q3gCoAEC,0.0,0.0,2017-01-10T21:05:34Z,0.9988712668418884
614.0,loved it! thankyou,Ugggyp080XPEUngCoAEC,0.0,0.0,2017-01-10T19:22:47Z,0.999884843826294
615.0,"Honestly.... My neck thanks you, my back thanks you, my hips thank you, my trapezius muscles are BEYOND grateful to you! Oh my goodness, words cant describe how awesome Day 8 was!",UghyjUa3nXXZIXgCoAEC,0.0,0.0,2017-01-10T17:55:39Z,0.9997333884239197
616.0,"Just wanna thank you for these thoughtful practices. My husband and I were both feeling overwhelmed by big challenges yesterday, and the Stability practice plus Serenity really helped us both regroup and feel good. And he doesn't usually do yoga, but he's been seeing how much I've taken to it through your videos. Thank you!",UgiwepNaVVbasHgCoAEC,0.0,0.0,2017-01-10T17:29:42Z,0.9998377561569214
617.0,"Adriene, I'm continually amazed that you always seem to know exactly when I'm unconsciously tightening my shoulders or my forehead or whatever it is I hadn't realized was getting tense in spite of me trying to be aware. It's one of many reasons I've been able to stick to this commitment so far, and in just 8 days I feel SO much better, and better about myself. Thank you so much for these videos, you're awesome.",Ughl0kPPZRl373gCoAEC,0.0,0.0,2017-01-10T16:08:43Z,0.99967360496521
618.0,"Reflexology is not the way to go. It is not science, and should never be treated as such. Learn the tendons and bones of the feet. Reflexology is NOT the way to go. Yes, yoga may not be entirely scientific but the health and mind benefits are definitely recognised by science. Reflexology is little more than a hoax.  ---- just got to the part where you said you have a chiropractor.... ok... well, my advice will probably be lost.

I wish you the best, and hope you find truth whatever that means to you. <3",UggtUtL0egCVxngCoAEC,0.0,0.0,2017-01-10T14:36:32Z,0.9905812740325928
619.0,love it very much today!!! with love .,UgiLftNik_jKfXgCoAEC,0.0,0.0,2017-01-10T13:06:58Z,0.9998886585235596
620.0,Thank you Adriene!!,UgiBvS4TKVq1ungCoAEC,0.0,0.0,2017-01-10T13:06:20Z,0.9998539686203003
621.0,Such a yummmmmmyyyy practice!!!!loved every bit of it!!!,Ugj1_HhOWzI4BHgCoAEC,0.0,0.0,2017-01-10T11:46:41Z,0.9983829259872437
622.0,I really enjoyed this!,Ugje36AF-jYlLHgCoAEC,0.0,0.0,2017-01-10T10:05:20Z,0.9998751878738403
623.0,Loving all of these videos so much and these are perfect for a beginner like me! It's really creating such a love and passion for Yoga. Thank you. I was wondering if you might consider doing a preflight yoga session. I know you have yoga while on the plane which is so nice. I often take some pretty long (13-14hr) flights and always end up so tight and sore.,UgiMaP58dzIAEXgCoAEC,0.0,0.0,2017-01-10T09:00:58Z,0.999652624130249
624.0,❤️🙏🏾,Ugi4bbBhUwhmaHgCoAEC,0.0,0.0,2017-01-10T04:08:35Z,-0.6970567107200623
625.0,wonderful <3 tks,UgjA39rsmZs6vXgCoAEC,0.0,0.0,2017-01-10T03:34:47Z,0.9998726844787598
626.0,Your hair looks good down.,UggnjLzU2y_KYXgCoAEC,0.0,0.0,2017-01-10T02:46:42Z,0.9972848892211914
627.0,hi Adriene i would like to subscribe for the emails but i dont know how can someone explain me please?,UggXZGJJss4dPngCoAEC,2.0,0.0,2017-01-10T02:44:15Z,-0.9992726445198059
628.0,"Adriene...just because you have us hold a pillow doesn't mean we don't recognize a crunch! Also, we love you! Hollie, Diane & Jamie!",UgjYYK0IRKk17HgCoAEC,0.0,0.0,2017-01-10T02:03:09Z,0.999506950378418
629.0,"This might be my favorite practice ever. I did it yesterday, and I felt amazing all day today. And I have a terrible cold! But I was just so happy and light. So I did it again tonight. I can truly relax, but that little burst of core work is awesome!",UgiodB7XA4cnw3gCoAEC,0.0,0.0,2017-01-10T01:49:32Z,0.999866247177124
630.0,"I had the most stressful commute home from work (got stuck behind 2 people with some serious road rage--obviously they need yoga/meditation in their lives) and it put me in the worst mood. Couldn't stop thinking about what could've happened. But after doing this, I feel better already :)",UghRkjWbRGSeb3gCoAEC,0.0,0.0,2017-01-10T01:06:08Z,-0.9930092096328735
631.0,So I'm trying to get into the moment and 4 minutes in you haven't stopped talking. How can I focus and get serene if you're talking the entire time? I really love practicing with you but a few moments of silence when we're trying to get into it wouldn't hurt ...,UggMZl8Llx80eXgCoAEC,0.0,0.0,2017-01-10T01:00:39Z,0.9859943389892578
632.0,"So needed this today, heading back to work from a vacation...thank you so much for offering this amazing series! You are my jam!! Love and light to all of you on this cosmic journey to becoming one with ourselves and one with each other.",UggnHqVXGllf4XgCoAEC,0.0,0.0,2017-01-09T21:59:16Z,0.9998539686203003
633.0,I'm a podiatrist what do you want to know?,UggaYUWNPql0hXgCoAEC,1.0,0.0,2017-01-09T21:24:35Z,-0.9834850430488586
634.0,"I was feeling a little down and annoyed today and honestly didn't feel like showing up on my mat at all. So glad I decided to take this moment for myself, to stick to my commitment of 31 days of yoga. Today's practice was exactly what I needed and I look forward to tomorrow's practice!",UgiwfPqZS3otLXgCoAEC,0.0,0.0,2017-01-09T21:22:38Z,0.996052622795105
635.0,"I am thankful for you, Adriene!  For taking the time to share your practice (and your corny jokes!) with us! This serenity practice felt absolutely sublime. I am on vacation right now and this really set the mood for a peaceful and relaxing week away.  I am definitely bookmarking this for ""one of those days"" in the future when I just need to chill.  I can't thank you enough for sharing this with us!  :-)",UgheCiCh2-yUrHgCoAEC,0.0,0.0,2017-01-09T20:57:57Z,0.9997910857200623
636.0,"thank you, needed this today, brilliant... serenity💛",UgjO9dcbCIj1xXgCoAEC,0.0,0.0,2017-01-09T20:10:54Z,0.9996801614761353
637.0,i laughed when you threw outkast in the mix!,Uggls-FhhtQpK3gCoAEC,0.0,0.0,2017-01-09T20:06:59Z,0.9695227146148682
638.0,"Since Adrienne invited us to share reflexology tips, just wanted to add a few more about the feet. There are also great meridian points in between your toes (especially between big toe and second toe) and also massaging the outside of your big toe is good for pain release (as well as the fatty part of your palm where thumb meets the wrist). I'm not a reflexologist but my yoga teacher is also a massage therapist so she always passes on great tips about reflexology in class. Also, make sure to drink lots of water after massaging the points (to help with detox/energy release with chakras--water is always a good idea in general after yoga practices, especially after this one today since we were massaging reflex points). Thanks, Adrienne. Another wonderful and mindful practice today. Namaste and hugs from NorCal! :)",UghKXvR1YBV-F3gCoAEC,0.0,0.0,2017-01-09T19:05:48Z,0.9994837045669556
639.0,"Checkout this yoga burn exercise. Expires in 2 days get it while you can!
http://tinyurl.com/h7cwncw",UghuxpLGlbaX-HgCoAEC,0.0,0.0,2017-01-09T18:28:36Z,-0.9900688529014587
640.0,"Chakras are interdimensional implants that can be removed or dissolved with inner work. Had mine removed last month, amazing how many negative thought forms immediately disappeared and have stayed away. Chakras are unnecessary control systems, keeping us constantly needing to cleanse & clear",UgixDZdEykWI2XgCoAEC,0.0,0.0,2017-01-09T18:17:33Z,-0.9949612617492676
641.0,and now I have the Serenity theme in my head :D,UghSHHhu2j0FcngCoAEC,0.0,0.0,2017-01-09T18:16:38Z,0.9977299571037292
642.0,How do I get the emails?,Ugi8MYEBXC3O8HgCoAEC,2.0,1.0,2017-01-09T18:10:21Z,-0.9988911747932434
643.0,"Hello :)
After this practice I feel like I finally have to write something. I've been doing yoga with you for some time now. I've done 30days of yoga and other stuff. Though I'm just a teen, my life isn't in balance at all. School, friends and family issues make me cry a lot and I'm sad, confused and scared very often. Also my body isn't perfect. Ever since I can remember I'm overweight and it doesn't matter how much I try to change it, I can't. Thanks to you, lot of things in my life have changed. I don't hate myself as much as I used to, and now I know that everything important is in my head. This practice was one of the best I've done with you, and I'm so thankful for it. It is everything I need after a day with just few hours of sleep, and lot of stress in school. Well I really hope that I'll stick with this beautiful Yoga Revolution, because as many others I need a Revolution in my life in order to find balance, peace, happiness and beauty in myself and in the world. I'll try at least. Love you :)",Ugj-rpQ0yhjhHXgCoAEC,0.0,13.0,2017-01-09T16:36:52Z,0.997882068157196
644.0,This was a much needed practice after feeling quite unwell for the past couple of days. Thank you!,UghlFD_ZCOSgs3gCoAEC,0.0,0.0,2017-01-09T15:17:41Z,0.996637225151062
645.0,Something I have discovered after practicing with Adriene for the past few years is that I love rubbing my own feet! It's one of the best things ever! I had some beautiful moments of complete serenity today!,UggVsv3hsuLp5HgCoAEC,0.0,0.0,2017-01-09T14:44:14Z,0.9998781681060791
646.0,"Adriene, I""m curious...why always left hand to heart?",UggqcJ43rQvZ0ngCoAEC,0.0,0.0,2017-01-09T14:32:10Z,0.7902518510818481
647.0,"I was in such a foul mood, being hard on myself, on everything around. Was planning to lower the volume and just 'finish' this video but then i sat through it, heard it, soften myself and even laughed at one point of time. Thank you. This really needs to be bookmarked for one of those days. :)",UghnL8n7AQtioXgCoAEC,0.0,0.0,2017-01-09T13:11:54Z,-0.9770644307136536
648.0,"Hi Adriene, thank you so much for this practice ❤️ I really love the scrunching up the face and releasing it. Maybe we'll have face yoga practice in the future so we can be all youthful and maybe age gracefully? 😌 Much love from Indonesia 💞",UggtwR2ZQTKXCHgCoAEC,0.0,0.0,2017-01-09T12:51:04Z,0.999438464641571
649.0,"One way that I show love to myself is at the very end of my practice, after the video. While I am getting up, I roll to either side and put myself in a slightly modified HAINES position. Anyone who has been a lifeguard will know this. You put the arm that is on the ground straight out and rest your head on it. Both legs, or at least the top one, are bent for stability and balance, and your top arm is lightly resting on the ground. Taking this time in this pose helps me remember that I am getting up, but that I can take this love for myself into my day. It's just a nice step and stops myself from wrenching myself off the floor. Thanks for this day's practice, Adriene!",UgjaWI7kec2_0ngCoAEC,0.0,0.0,2017-01-09T12:40:00Z,0.992522656917572
650.0,"My favourite day thus far! The 30 minutes flew by and I feel like a whole new person. 2016 broke me down in so many ways, but this Yoga Revolution is the perfect way for me to begin my self-healing process, and after today's practice I really truly felt it. Thank you. <3",Ugg19N4WdHIt4HgCoAEC,0.0,0.0,2017-01-09T11:20:45Z,0.999761164188385
651.0,"i have been keeping a journal of sorts to follow this yoga revolution, and today i wrote ""yummy practice""! you're getting to me adriene!",UgghEdh1kltIFXgCoAEC,0.0,0.0,2017-01-09T11:09:30Z,0.9992239475250244
652.0,Yummy. I like that you do a little ab work each time.,Ugh8lBv_id8xV3gCoAEC,0.0,0.0,2017-01-10T09:37:22Z,0.9996236562728882
653.0,super !!!! j'ai adoré !!!,UghmwPBpDyPAZXgCoAEC,0.0,0.0,2017-01-09T09:34:47Z,0.9997472167015076
654.0,I was feeling very anxious for a few hours and i didnt think i was gonna be able to do my yoga today but i knew it would make me feel better and it did! Especially with todays focus being on serenity,UghFmHa80sK72HgCoAEC,0.0,0.0,2017-01-09T08:44:17Z,0.998046875
655.0,Hey I am a reflexologist. Did you know the curve on the medial side of the foot matches the curvature of the spine .,UghtuXvyfxHmyXgCoAEC,0.0,1.0,2017-01-09T08:13:34Z,-0.7774669528007507
656.0,"I'm loving the lengths of these classes. Everyday I know how much time I have to reserve to this, so thanks. For the consistence and for everything you do. I actually feel like a better version of myself already :)",Ugjb3YEUHtpuzXgCoAEC,0.0,0.0,2017-01-09T08:04:33Z,0.9996950626373291
657.0,"Loving Revolution so much! Every day so far seems to be exactly what I needed. Makes it so much easier to show up on my mat knowing I will get just what I need not only for my body, but for the day a head of me. I look forward to waking up and working on a new practice, and these sessions are easily one of the highlights of my days <3 thank you so much for providing us with such a great experience!",Ugh8ztJZR-a2mXgCoAEC,0.0,0.0,2017-01-09T07:57:21Z,0.9997569918632507
658.0,":~) if i, with dirty brown barefoot gardening feet, can still go to foot massage town...then everyone can ! thank you for another nurture practice adriene you are appreciated and adored x",UgiIDAnDvwQaOngCoAEC,0.0,0.0,2017-01-09T07:56:46Z,0.9992451667785645
659.0,"I don't know if I'm just really tight in the hips and shoulders or if I was doing the poses wrong but this one left me a bit sorer than the others. Still glad I showed up for Day 8!

I especially appreciated the foot massage part. Wearing combat boots day in and day out can really start to hurt!",Ugh92qOdXmWY6XgCoAEC,0.0,0.0,2017-01-09T07:45:04Z,0.7356917858123779
660.0,Hi! I have very bad flexibility in my back. I can't reach my foot in that tree pose on the mat. What can I do for that?,UgijJShx5Oi9XXgCoAEC,0.0,0.0,2017-01-09T07:29:46Z,-0.9992594122886658
661.0,"This morning I am thankful for you, Adriene, for somehow finding your channel and everything you have given me. If I'm honest I found this a little hard at the beginning, particularly after the memory of SIX-PACK-ABS (:P) but you're there to calm me down and remind me to be gentle. I got into the right flow, and the ending was emotional. Thank you.

You said to read the email you sent, but I don't get the email until the following day - is there anything you can do about it?

Namaste.

PS When you said wow, you've managed to get to day 8, I laughed. I'd never quit one of your programmes party through :)",Ugjq2-BNVySR-XgCoAEC,0.0,0.0,2017-01-09T07:07:01Z,0.9996076226234436
662.0,Great practice today! That foot rub was amazing. Didn't realize how much I needed that.,UgjSq1UnhdhovHgCoAEC,0.0,0.0,2017-01-09T06:45:54Z,0.9727110862731934
663.0,"I looked forward to this all day and all of the heaviness and anxiety and sadness rolled away in this practice, and I am so grateful.",UggKN-rBwBHOmXgCoAEC,0.0,0.0,2017-01-09T06:09:30Z,0.9993466734886169
664.0,"What a beautiful practice. Thank you for inviting me to blanket myself in love, will be returning to this constantly. Much love ❤️",UgjiWrNCAFE6sXgCoAEC,0.0,0.0,2017-01-09T05:46:56Z,0.999832272529602
665.0,Thanks for always making me laugh out loud during yoga! Always such a fun practice of self-love with you <3 namaste from CA!,Uggx-P33hRV5WngCoAEC,0.0,0.0,2017-01-09T05:43:23Z,0.999527096748352
666.0,"I've taken a little journey each day of doing Yoga Revolution. I have been loving myself, appreciating the body God gave me, and I definitely feel more connected. By loving myself, I can love others. :) On a side note, please do work on gaining knowledge of the feet. I have plantar Fasciitis and it sticks around due to a lot of tightness around my legs and hips. :(",UgjeAo0v84oDCngCoAEC,0.0,0.0,2017-01-09T05:27:25Z,0.9991225600242615
667.0,"Today's practice brought me to tears several times. I ended up practicing very late and crossed midnight into day 9 in a side twist. Day 9 happens to be my birthday and I hope that during this year of my life I'm able to find that love blanket you kept asking us to use! Thank you so much Adrienne, for being just as effective as my therapist but without the copay 😁👌🏻 you da best.",UgijF87HCIXzH3gCoAEC,0.0,0.0,2017-01-09T05:19:59Z,0.9991242289543152
668.0,"Ahhhhh, that was so great and perfect for a Sunday evening! I got home late and the last thing I felt like doing was exercising but I forced myself to themat and what a perfect relaxing treat. Really enjoying this :)",UgjKDn7xPPgesngCoAEC,0.0,0.0,2017-01-09T05:09:29Z,0.9995077848434448
669.0,"Restorative practices are my favorite and I get the most benefits from them personally versus faster pace workout style yoga. Thank you for this beautiful practice today, it came just in time. Namaste 🙏🏼",Ugh-Bw7OT5jl_ngCoAEC,0.0,0.0,2017-01-09T04:51:45Z,0.9995362758636475
670.0,"As of this moment, 44,506 of us were out here with you today. <3 <3 <3",UghgcWhRMQ7Y4HgCoAEC,1.0,63.0,2017-01-09T04:47:17Z,0.9972055554389954
671.0,Thank you! This was exactly what I was craving.,UgikOjmZl_aVN3gCoAEC,0.0,0.0,2017-01-09T04:44:50Z,0.9998302459716797
672.0,"I don't know what happened during this practice, but I became angry and couldn't shake it off. I wanted to shove your Namaste right back into the speakers so I didn't have to hear it, because it felt like a lie. Extremely odd, because I always enjoy saying Namaste to you and the kula to end my yoga time. I feel very unsettled, but also curious about why this particular video stirred such a strong reaction. Has anybody else had a similar experience during yoga?",UggErMhanp9NQ3gCoAEC,0.0,0.0,2017-01-09T04:39:08Z,-0.9964159727096558
673.0,"If you haven't already, check out a book called Better Health with Foot Reflexology ""The Ingham Method"" by Dwight C Byers. They should have a copy at Half Priced Books on South Lamar lol. They usually have a few available whenever I go.   Hope that helps!",UgjjtaH4H_Q-h3gCoAEC,0.0,0.0,2017-01-09T04:32:38Z,-0.9610077738761902
674.0,"<3 yay, one week complete.",UgiArLFaTkkMTHgCoAEC,0.0,0.0,2017-01-09T04:18:58Z,-0.9875885844230652
675.0,"""Did your glute get heavy today?"" ""Yeah, I did yoga."" Haha! Made me laugh out loud! Thanks as always.",UggB6WJfcE-HMXgCoAEC,0.0,4.0,2017-01-09T04:09:51Z,0.9995166063308716
676.0,"Thanks, I needed this today!",UggOdPkH2yYXSngCoAEC,0.0,0.0,2017-01-09T03:59:48Z,0.9986661672592163
677.0,"This was a perfect yoga session for what I needed today, this week and for this year. I also cried to ""blanket yourself in love"". In just a few days (I started the revolutions a few days late), I have improved my movement, strength, posture and now love for myself!! I learned just today that people with autoimmune disorders have a lack of self love. This yoga will cure my autoimmune disorders, my issues in life and relationships.  Powerful stuff.",UgjmgB5vr4aV9XgCoAEC,0.0,0.0,2017-01-09T03:58:49Z,0.9988942742347717
678.0,Random question: where did you get the yoga pants that you have on in this video? Btw- love these videos. They really help me to find time for M-E,UgjIj0WKVuH92XgCoAEC,0.0,0.0,2017-01-09T03:42:13Z,0.9970996379852295
679.0,"That was so refreshing! I love the cheerleader pose twist. so good.  Was waiting for you to say ""shake it like Polaroid picture."" Made me laugh when you did!",UgjZibuSWXScPngCoAEC,0.0,0.0,2017-01-09T03:31:48Z,0.9998774528503418
680.0,"Did this practice before bed and my puppy joined me on my pillow. Definitely put us both in a softer, more relaxed mood. Thank you, Adriene!",UghHIO0JVAhh_ngCoAEC,0.0,0.0,2017-01-09T03:18:32Z,0.9998205304145813
681.0,"""It's day 8, you better just smile"" was a highlight for me!",UgiarKc4nkMeLXgCoAEC,0.0,5.0,2017-01-09T03:14:17Z,0.9992778897285461
682.0,Perfect.,UgiTDlXgF2DQFHgCoAEC,0.0,0.0,2017-01-09T03:12:21Z,0.99985671043396
683.0,"Best day thus far... I feel like I've had the warmest, sweetest, realest hug. :)",UghkZ_Zd5G-zeXgCoAEC,1.0,62.0,2017-01-09T03:07:22Z,0.9998663663864136
684.0,Thank you! Me and my partner have loved doing yoga with you this new year! Thanks for shining your love and passion onto the world!,Ugg7Mf1q2Pxg-3gCoAEC,0.0,0.0,2017-01-09T02:58:39Z,0.9998794794082642
685.0,"I felt good!  Thank you, Adriene :)",UgjkdqIKiAeuLngCoAEC,0.0,0.0,2017-01-09T02:37:22Z,0.9998445510864258
686.0,"This was a perfect end to my day today! This week has been amazing so far and this is my first time practicing yoga at all, and i thought it would be hard for me, but I have to say, in just a week I'm already starting to feel like a new woman. I have really surprised myself with what I've been able to do, with my commitment, and with the fact that I've been able to forgive my own shortcomings. I'm usually such a perfectionist and SO hard on myself, but Adriene makes it easier to appreciate your humanness somehow and I feel like because of that, I've been able to overcome so much already. I've been working my first full time job as a first time manager the past two months and losing myself in my desire to be perfect, and while I have achieved some great things, I never give myself enough credit. Following this practice has already given me an inner strength to be proud of what i have accomplished and a solid foundation for personal improvement and I'm so happy about it. I can't wait to see how I feel at the end of the month and sign myself up for more yoga revolutions! <3",Ugj-V8OsxDGxWXgCoAEC,0.0,0.0,2017-01-09T02:31:11Z,0.9994332194328308
687.0,Almost didn't make it to my yoga mat today after finding out about the passing of a friend. I was in a state of shock and knew that the practice would bring me face to face with the present. It was emotional and difficult but I was also able to tap in to serenity and find some peace. This practice ended up being exactly what I needed today... Thank you.,UgglwcMjmhGPOHgCoAEC,0.0,0.0,2017-01-09T02:30:56Z,0.999420166015625
