,comment,comment_id,reply_count,like_count,updated_at,calificacion
320.0,"I'm behind but still powering through! Thanks for hosting this amazing challenge, Adriene!",UgilMoi--EYTEngCoAEC,0.0,1.0,2017-01-26T16:34:03Z,0.9998278617858887
321.0,"it's unfortunately so hard for me to follow the breathing pattern, cause I have allergic rhinitis and cant breathe through my right nostrils right now, but I really love the practice today ^^",UghyZLK_fKyF3XgCoAEC,0.0,0.0,2017-01-26T09:42:25Z,0.998772919178009
322.0,This practice let me realize that I can't breathe out of my left nostril at all today haha!,UgjNoIOlMssSc3gCoAEC,0.0,0.0,2017-01-25T00:41:42Z,-0.9778944253921509
323.0,"This practice was physically, mentally and emotionally challenging! I came back to it two days in a row and it had a different affect on my state of being each day. Thank you for this practice, I will be coming back to this one many, many more times!",Ugg9M0H_9q8yE3gCoAEC,0.0,0.0,2017-01-24T18:10:09Z,0.9995259046554565
324.0,This was sooo awesome Adrienne! It was exactly what I needed. Thank you!,Ugh8ALNIsefsgHgCoAEC,0.0,0.0,2017-01-24T18:08:52Z,0.9998724460601807
325.0,"I absolutely loved this practice. I feel so  at peace with myself after it. When I looked st the thumbnail earlier I thought"" oh no, not THAT pose ! I can't lift my bum that far !""  and before I knew it I was there ! I couldn't believe how easy it was ! I've been doing yoga with you Adriene since last August ( I was a complete beginner) and I feel so different in my body ( and mind too !) now. Thank you so much ! I still can't do the crow pose though. Well,  one thing at a time ! Namaste",Ugi_RsunCK1B93gCoAEC,0.0,0.0,2017-01-24T13:19:16Z,0.9995548129081726
326.0,This practise is a true gift. I lost my beloved cat today and the stillness helped a lot to move from grief to a place of gratitude. Thanks adrienne!,Ugi2bCBVAzFY8ngCoAEC,0.0,0.0,2017-01-22T20:38:32Z,0.9998362064361572
327.0,"I have been practicing yoga for about 7 months, and this program has been a little more challenging than what I started with, mentally as much as physically. But I have been having some issues lately with my abdominal muscles. I don't understand what the problem is and it is very frustrating to me. It's as if there is a catch in my upper left abdominal muscle around my rib cage. I feel a discomfort/pressure there when I breathe and when I do poses.It goes from my rib cage area  and a little to my hip, like there is an air pocket in there or something. My right side is fine and can contract the way it is supposed to no problem, but my left side struggles to connect almost it feels like, and I have to focus a lot to keep it the way it is supposed to be, sometimes the muscle will jump/catch/move and that causes discomfort but then it feels like it is where it is supposed to be. I don't know what the problem is but it is causing me so much frustration. This practice means so much to me and I feel like I am not able to perform at my best because I am held back by this discomfort. It is something I have noticed my whole life but is just subtle, but since the last like 4 practices it has become a lot more noticeable, I think maybe because my abdominal muscles are becoming stronger than they've ever been and are working harder and I am more aware of them. It is making me very upset and discouraged. At the beginning of the program I was working out my abs and I felt very strong and stable, now because of this I feel weak there and not supported and very frustrated and discouraged. Could I maybe have injured myself or something? Maybe I just need some tips on what I should conceptualize regarding my abs. I know squeezing lower ribs in and belly button to spine. But maybe I need to reevaluate how I work with my abs, I might be causing the discomfort through errors in working them out. Any help appreciated, thank you.",UgirFqGFAR02m3gCoAEC,0.0,0.0,2017-01-22T18:41:51Z,-0.9963172674179077
328.0,needed this big time today! too much stress in life. love the alternate nostril breathing <3,UgjkXsDXy2vWtHgCoAEC,0.0,0.0,2017-01-22T16:18:50Z,-0.9774247407913208
329.0,"hey adrienne ! 
Just a small comment to say that i find you repeat yourself way to much through out the videos. Starting to find it slow and borring.
I find that the basics are understood after a while and we dont necessarely need repeating. Let's move on ^^
But other than that great videos.",Ugjs9LWbrKJL5ngCoAEC,1.0,0.0,2017-01-22T10:51:34Z,-0.7125862836837769
330.0,"I just did yesterday's and today's practices in succession and man, my thighs are feeling it now!",UghKTiBPui-7d3gCoAEC,0.0,0.0,2017-01-21T17:09:16Z,0.9859634041786194
331.0,Loved this. Just what I needed.  :),UghP2JS_VjlFzXgCoAEC,0.0,0.0,2017-01-21T15:41:15Z,0.9998688697814941
332.0,"I had my headphones on through this practice, I swear I could hear your heartbeat Adriene 💗 it added a little extra to today's practice😁Loved it as always, thank you",UghPYSRxDAvOTXgCoAEC,0.0,0.0,2017-01-21T01:08:28Z,0.9952684044837952
333.0,"i love your outfit in this episode, any chance you'll reveal what you wear in each practice anytime soon?",Ugg_DVrKSqLMaHgCoAEC,0.0,0.0,2017-01-21T00:51:55Z,0.9997320771217346
334.0,Wow that was sooo goood...,Ugjcj2DijaiAGXgCoAEC,0.0,0.0,2017-01-20T21:35:11Z,0.7434036135673523
335.0,"In the beginning of this practice you talk a little about the history of yoga, what books would you advise us to read to deepen a little more our understanding of this ancient practice with an extra layer of knowledge?
thank you for yet another awesome practice =)",Ugiv8qFCR8Ztw3gCoAEC,0.0,0.0,2017-01-20T19:47:51Z,0.9995675683021545
336.0,Favorite day so far!!,Ugjl4XFEhhgYz3gCoAEC,0.0,0.0,2017-01-20T19:06:54Z,0.9996496438980103
337.0,❤️,UggKax_88omVAngCoAEC,0.0,0.0,2017-01-20T15:57:08Z,-0.6970567107200623
338.0,"I'm a couple of days behind, and didn't think this one would appeal to me (I was concerned about being too still!), but really loved it.  Finished with the plough option and was amazed to find my toes touching the carpet behind me without really trying.  #opening",UghPWGsu1iVCu3gCoAEC,0.0,0.0,2017-01-20T11:09:38Z,0.9957554340362549
339.0,Namaste stay still :),UgjYcMCm7l8nTXgCoAEC,0.0,0.0,2017-01-20T03:38:10Z,-0.8794572353363037
340.0,"Does anyone else get bad lower back pain after doing plow pose??? I've only ever had that kind of back pain during yoga from doing that pose, and after doing some back stretches and twists it goes away. I do have scoliosis, not sure if that's related to it?",Ughj-BIS79qnI3gCoAEC,0.0,0.0,2017-01-19T23:43:34Z,-0.9977748990058899
341.0,My dog was heavily involved in practicing doga stillness with me today! 🐾😋,UggvDri2XtFxKngCoAEC,0.0,15.0,2017-01-19T23:08:12Z,-0.5271063446998596
342.0,Thank you Adriene <3,UgiONVXtKD6U33gCoAEC,0.0,0.0,2017-01-19T18:22:06Z,0.9997593760490417
343.0,I didn't realize just how much I fidget during yoga! Needed this stillness today more than anything- and now to do day 18 and get back on track with day 19 later tonight! Playing catch up. :) :) :),UgiaURw5W5AT23gCoAEC,0.0,12.0,2017-01-19T17:15:15Z,0.8438807725906372
344.0,I loved the shoulder part. That was amazing!,Ugjmnmjn_7GiiHgCoAEC,0.0,0.0,2017-01-19T15:10:11Z,0.9998778104782104
345.0,"Adriene your practice is magical💖 On the previous day of the challenge I must have overdone a backbend or something because the following day I have been feeling a huge discomfort in my lower back. So in the end I didn't do today's practice because I didn't want to risk it. But I missed the challenge so much that despite the pain last night (the discomfort had turned into pain when I tried to straighten up standing) I decided to step on the mat for this practice but be as gentle with myself as I can and use my breath for help as you had suggested. And guess what, this morning I woke up completely pain-free 🙆 and it's all thanks to you🙏 I may be a day behind but I'm sticking with this miraculous challenge. 
Namaste my gorgeous friend, 
Joanna",Ugj72LN0TItLjHgCoAEC,0.0,0.0,2017-01-19T07:34:50Z,-0.9855377078056335
346.0,"I was super impressed with myself today. I've never been able to pull off plow pose before but as soon as she said it I was able to easily flip into the position and shockingly, stay there! I love how much this revolution has broadened my yoga practice.",Ugg0iHTIsyz7qngCoAEC,0.0,0.0,2017-01-19T07:22:59Z,0.9997144341468811
347.0,thank you!!! that was amazing!! I've NEVER experienced plow pose like I did today! or fish!!! it was fantastically yummy!!!!,UgjzaTGyXr-Bu3gCoAEC,0.0,0.0,2017-01-19T04:47:51Z,0.9998527765274048
348.0,"I had to pause the video just to say how incredibly jealous I am of all of your super cute yogi clothes!! Where do you get them?? Also, I am absolutely loving these videos and I am walking away actually feeling sore! Awesome job! Keep going with you bad self!",Ugi72qoDOwPTqXgCoAEC,0.0,0.0,2017-01-19T03:46:20Z,0.7226821184158325
349.0,fabulous :*,Ugga22h-Gtfwp3gCoAEC,0.0,0.0,2017-01-18T21:56:07Z,0.999881386756897
350.0,Could someone please direct me to the Yoga with Adriene book club she mentions in this video? I'd love to see a list of recommended reading from Adriene. Namaste,Ugj55-rJXvX3-3gCoAEC,1.0,0.0,2017-01-18T21:03:01Z,0.9980189800262451
351.0,Perfect as always) especially after a long working day) thank you so much for your energy ;-),Ugj1WcMcxldNAHgCoAEC,0.0,1.0,2017-01-18T17:58:53Z,0.9998769760131836
352.0,Adriene singing always makes my day pretty good :) Loving this revolution!,UggPvw5iZYmEfXgCoAEC,0.0,4.0,2017-01-18T16:37:26Z,0.9998751878738403
353.0,this was so much harder than all the other more dynamic poses .keeping my hands still and up in half warrior  literally made me feel sick in the stomach for a second there...,Ugi8sq9TaSxN63gCoAEC,0.0,0.0,2017-01-18T14:58:46Z,-0.99481600522995
354.0,"Yoga Revolution Day 17  : : : : :  80.4 kg
Got a bad cold today. Woke up with a headache, totally stuffed. Snot and tears all over the place, but I did it, and I feel much better.",UggTUJZ5ZWyOK3gCoAEC,1.0,2.0,2017-01-18T13:19:32Z,0.710969865322113
355.0,Thank you Adriene for Dy 16 of this lovely practice! This is my first time practicing with you (I joined your yoga revolution this year!) and appreciate all your cue's and especially the mention of trembling legs! This happens to me in certain poses and am unsure if it's a sign that my body is working towards improvement or a sign to soften the pose and not push as hard. Can you provide some feedback on that? Thank you!!,Ugi5McXHyOEwM3gCoAEC,2.0,1.0,2017-01-18T11:49:32Z,0.9996589422225952
356.0,17/365,Ugj4d2iYFsQPZHgCoAEC,0.0,8.0,2017-01-18T11:47:49Z,0.959970235824585
357.0,Hi there. Thank you for another great video! I was just wondering about the emails you keep mentioning. I have registered on your website but haven't received any emails so far. Is there somewhere else I need to register?,UgijRoL2H7TffngCoAEC,2.0,0.0,2017-01-18T10:13:34Z,-0.9235587120056152
358.0,"Thank you, Adriene! I am sending you some love from Sofia, Bulgaria. 
Today I will be travelling to Berlin for work and I hope I find time and peace to continue the chanllenge without a break.",UgjB8X1ksVUTNHgCoAEC,0.0,1.0,2017-01-18T09:56:28Z,0.999811589717865
359.0,This practice felt GREAT for my body and my mind after my first day of classes. It's going to be more tough to fit the practice in but I'm looking forward to feeling better and better :),UgiDfOiX29yyvXgCoAEC,0.0,1.0,2017-01-18T09:36:05Z,0.9967735409736633
360.0,didn't know how much i needed this,UgioTZ2pJmm2t3gCoAEC,0.0,1.0,2017-01-18T09:16:53Z,-0.9995028972625732
361.0,"any tips for someone who suffers with allergies and has difficulty breathing in certain positions ): ?? also i loved how in the beginning of this practice, Adriene addressed how some of us may not have wanted to come on the mat and that was 100% me. I almost skipped today's practice (mostly because my cat was sleeping on my mat and anyone with pets knows its a sin to move the sleeping fur baby). but i managed to get on and finish :)",UgjiYiT536gvr3gCoAEC,0.0,0.0,2017-01-18T07:56:05Z,0.6963816285133362
362.0,"I'm thoroughly enjoying this series as I enjoy all your videos. I have noticed my quadriceps are tight, can you suggest what I can do to loosen them up?",UghBwMBgEnCWKXgCoAEC,0.0,0.0,2017-01-18T07:22:38Z,0.9997720122337341
363.0,"Namaste, Adriene! This one was challenging for sure!",UggzGAGTGCBPG3gCoAEC,0.0,1.0,2017-01-18T06:31:46Z,0.9990379810333252
364.0,Can any age do this,UgiqF0NEtxz-rngCoAEC,0.0,0.0,2017-01-18T06:01:39Z,0.9978095889091492
365.0,"This practice today was so great, very calming for sure! I was so excited to start this yoga revolution! This is the first time I'm  participating as they are uploaded day by day! Last week I caught a cold & had to miss a few days but was able to catch up over the weekend. Still not completely over the cold yet, but I believe the yoga is helping for sure. & today's practice was so lovely! Great part of my evening! Thanks Adriene for this 31 day videos & the daily e-mails!",Ugita2eQlYF0HXgCoAEC,1.0,1.0,2017-01-18T05:21:10Z,0.9996920824050903
366.0,I think finding stillness is my favorite thing about yoga. Loved today's practice.,UghACaRw896uIXgCoAEC,0.0,8.0,2017-01-18T05:11:03Z,0.9993084669113159
367.0,Lovely! Thank you :),UgjpuUdKwqLdcHgCoAEC,0.0,1.0,2017-01-18T05:04:33Z,0.9998384714126587
368.0,I am a big mascular guy. I really struggled with this one 😂but i will get there,Ugi-Nc40F79ZlHgCoAEC,0.0,2.0,2017-01-18T05:02:34Z,0.9170894622802734
369.0,Book Club??? Please someone tell me where I can find out more info! I wold love to catch up as I am new here :) Thank you in advance!,UghTCc0qNxDpp3gCoAEC,2.0,1.0,2017-01-18T04:58:11Z,0.9978229999542236
370.0,"Adriene! Today was the first day I could notice that I was putting my weight on my thumb and index finger instead of my palms while in down dog and all fours, it made me pretty excited and happy during today practice",Ugi3D_Hn3r2oV3gCoAEC,1.0,2.0,2017-01-18T04:42:08Z,0.9995929598808289
371.0,"I am sooo in love with your YogaRevolution. It has helped my mental clarity tremendously on and off my matt and I just wanted to say Thank You for all that you do Adriene. Tonight's savasana was truly a recharge/refuel/spiritual moment for me and I'm so glad I am doing this 31 day yoga challenge with you and all of your community. I would love to read that book you mentioned about Asana? Can you tell me the title? Thanks a million. Sincerely, Jen",UggrGi0NukgBQHgCoAEC,0.0,2.0,2017-01-18T04:27:26Z,0.9997465014457703
372.0,Hi Adrienne - I LOVING Yoga Revolution. Totally random Q: where are the gray comfy-looking pants you're wearing in this video from?,UggFy0pfYcUYangCoAEC,0.0,0.0,2017-01-18T03:43:32Z,-0.9149115681648254
373.0,"This was the best practice I've had in a while! I needed this restoration. Thank you so much, much love. Namaste💛",UgitRkFCo0G6-XgCoAEC,0.0,0.0,2017-01-18T03:37:17Z,0.9990063309669495
374.0,"I actually hadn't ever done a proper plow pose but decided to go for it today and was pleasantly surprised by how well I did! As others have mentioned, practicing stillness can be a whole lot more difficult than a swift vinyasa flow!",UgggW-qsLada03gCoAEC,0.0,2.0,2017-01-22T21:28:07Z,0.9978033900260925
375.0,"I was having trouble getting to the mat today because of this new medication im on, but i smiled when you said you heard an airplane overhead because an airplane flew over me at the same time! I know you prerecorded, but it still made me smile and helped me get into practice for some reason! Thank you! Feeling aligned with you every day I get on the mat!",UggFsDaxXsBFYngCoAEC,0.0,0.0,2017-01-18T03:09:31Z,0.9996069073677063
376.0,I needed this practice today!,UghxG432cJuAGHgCoAEC,0.0,0.0,2017-01-18T03:05:47Z,-0.9863254427909851
377.0,🐠💖👏👏👏🙏✊️,Ugin1lM8605f9XgCoAEC,0.0,0.0,2017-01-18T02:57:26Z,-0.6970567107200623
378.0,Adriene I'd like to receive the daily e-mails you mention during your videos. I just went to your website and entered my name and e-mail under a 'weekly newsletter' section on your website. Is this how to do it? :) Thank you.,UgjIR-q5-HM1BXgCoAEC,0.0,0.0,2017-01-18T02:47:31Z,0.9906399250030518
379.0,"Why does every day's practice seem tailor made for what I need most?? 💜💜
Love love LOVED plow today I was smiling so big in savasana",UggOAMtpQa48V3gCoAEC,0.0,2.0,2017-01-18T02:44:48Z,0.9924821257591248
380.0,I want to hear more about YWA Book Club!,Ugia3qrtpVgueHgCoAEC,1.0,0.0,2017-01-18T02:37:00Z,0.9976947903633118
381.0,"I thought whoa this is going to be really tough, but I have stretched in the last 2.5 weeks, I could actually do a one legged ""happy baby"" when last week I couldn't. I'm so happy 😊 I could cry!  I know some may not understand, but it's the little things week by week. 🙏🏼",UghnLVc4K1VhWXgCoAEC,4.0,204.0,2017-01-18T02:35:11Z,0.9414928555488586
382.0,"Ok Adriene, the only reason I showed up on my mat today is because you say we can show up and honor how we feel...and I felt too hyper from my good day and glass of wine...but I showed up and honored where I am today. Thank heavens I did as you've always got what I need. Imagine my defiant eye roll when you said we would honor stillness! 🙄😂. But I did!...and my practice was half assed today. But better than no practice and as always, you rock and I benefited from it!  Thank u for allowing me to join in no matter what I bring to the table. #plowthat ☮️💜🤗",Ugjbh8BooRqPp3gCoAEC,0.0,0.0,2017-01-18T02:26:07Z,0.9953796863555908
383.0,Thank you!!!,Ughw-xR0vkAHrXgCoAEC,0.0,0.0,2017-01-18T02:21:11Z,0.9998666048049927
384.0,what is the book that she is referring to in the beginning?,UghU1T3pU65_lngCoAEC,0.0,1.0,2017-01-18T02:19:27Z,-0.9929764866828918
385.0,Thank you Adriene. Have sweet dreams.,UgiIlKesuIkWXngCoAEC,0.0,0.0,2017-01-18T02:05:46Z,0.9998440742492676
386.0,"I needed this after a long day. Thank you as always, Adriene!",UgiwO-oLVkah73gCoAEC,0.0,0.0,2017-01-18T01:47:08Z,0.9995197057723999
387.0,"That was exactly what I needed. I feel completely refreshed inside and out, thank you!! Perfect practice for ""one of dem days""!",UgglYurIjoVGlXgCoAEC,0.0,0.0,2017-01-18T01:17:53Z,0.9998546838760376
388.0,Yesterday's practice was what I needed.  Today's was a total unexpected gift.  This sequence really showed me the strengths of my own body.  I am saving it for when I need a reminder of that.  Thank you.,Ugh1SBciXAwpMXgCoAEC,0.0,1.0,2017-01-18T01:13:12Z,0.9998722076416016
389.0,"yes indeed, these practices are always time well spent",UghyF0iCE3NVnngCoAEC,0.0,0.0,2017-01-18T01:03:14Z,0.9994499087333679
390.0,"There are some things I enjoy doing but always regret, like videogames and stuff. 
I started making a list of things that I never regret doing, and yoga with Adriene is at the top of the list.",UggecUDqF0-jqHgCoAEC,0.0,0.0,2017-01-18T00:59:30Z,0.9991924166679382
391.0,"Amazing <3 stillness is the aspect of yoga I struggle with most and I expected to find today's extremely challenging, but actually it came naturally as if I'd been building up the skill over the past practices and it was there just waiting to be used.",UghND7fazSR9JXgCoAEC,0.0,0.0,2017-01-18T00:49:25Z,0.9941662549972534
392.0,"Wow! When I was doing the hip stretch where we extend our leg up to the sky with the other foot crossed over the thigh, the energies in each of my legs were SO different. My left leg was SHAKING. In a good way. But the right leg only had a very slight shake. Very cool to observe how the energy differs. Another amazing practice! Can't wait for tomorrow.",Ugjts4drVtsh6HgCoAEC,0.0,0.0,2017-01-18T00:46:38Z,0.9986392855644226
393.0,"Tue. Jan. 17, 2017",Ugho4QlX4a5nnHgCoAEC,0.0,0.0,2017-01-18T00:45:00Z,0.6355980634689331
394.0,Geez Adriene its like you know what's exactly on my mind each day. Are you a jedi knight?,UgjTLlS8VlD1NngCoAEC,0.0,38.0,2017-01-18T00:32:08Z,0.9990010857582092
395.0,My favorite so far!  Thank you!  I needed this. ❤,UggViW-CA7Hrp3gCoAEC,0.0,0.0,2017-01-18T00:29:29Z,0.9996774196624756
396.0,Do you have a self love book or ebook? If not you should write one :),UggLYxvWgiLDtHgCoAEC,0.0,0.0,2017-01-18T00:25:07Z,-0.9886170029640198
397.0,Amazing,UggQtzJ_ue_N5XgCoAEC,0.0,0.0,2017-01-17T23:57:48Z,0.999875545501709
398.0,"What a beautiful beautiful practice today, Adrienne. Wow! Namaste!",Ugi13RHu7Dyn6ngCoAEC,0.0,0.0,2017-01-17T23:40:25Z,0.9998661279678345
399.0,"Awesome! Feeling the burn AND the breath : ) Thanks, Adriene!",Ugg3s0peV2j2x3gCoAEC,0.0,0.0,2017-01-17T23:39:49Z,0.999836802482605
400.0,"Wow.  Today was probably the biggest challenge and gift. Some unexpected community news had me wandering the house sending emails and muttering mf-ers. Thank you.  Also, frequently, my practice happens with family life going on around me.  Tonight, I knew I needed to do this alone.",UgiZtPRNoQW5ongCoAEC,0.0,0.0,2017-01-17T23:29:03Z,0.9993463158607483
401.0,"I totally zenned out a couple of times during this practice! I can't put into words how much I loved it from that first savasana to those warrior variations, wow! As always I swapped the alternate nostril breathing for ujjayi as I can't really breathe through my nose on the best on the best of days and it was beautiful. Thank you so much Adriene!",UggyB0bf6TGGrXgCoAEC,0.0,0.0,2017-01-17T23:18:06Z,0.9997645020484924
402.0,"Plow is an amazing pose. Upper back, neck, headaches, etc...it's an incredible stretch, a substantial pose that depending on the time of day will indicate where I'm at with flexibility, breathing, digestion, and tension. Adriene makes that look so fluid but really take your time as you begin bringing your legs up and then over. It might take a while. And as she so calmly expressed, breathe...release an auditory breath and continue slowly, breathing deeply. Lovely to watch as always. One thought: it would take some extra post time but maybe in a future video lay some text over each pose as you move through them so it can be read on the screen and noted.",UgjPXT5abC-mYHgCoAEC,0.0,0.0,2017-01-17T23:16:10Z,0.9987331032752991
403.0,"Hey Adriene! This yoga revolution has been my favorite brand of strawberry jam, so thanks for putting this on! I wanted to ask you where you got your tank top that you're wearing in this video. Love it!",Ugj1-rQUZkomsXgCoAEC,0.0,0.0,2017-01-17T23:13:21Z,0.9996517896652222
404.0,"I started today thinking I was going to have a rest because my wrists were really sore but instead I clicked on the practice. What a perfect practice for how I was feeling. I finished the practice feeling looking after, by who? I don't know. I'm a full time carer for my twin sister which is a fantastic but challenging job and sometimes feels you feeling a little left behind. In an odd way this yoga is the person who is looking after me and its such a comforting feeling",Ughzgnc9Gla7JngCoAEC,0.0,1.0,2017-01-17T23:04:32Z,0.9951480031013489
405.0,"it was hard at the start of the practice today, as i was getting frustrated in being in sukasana for a long while, as it is hard to be in stillness while giving a thinking mind a break, as the thinking mind often starts pumping up loads of negative thoughts when you are just there in stillness, but as the practice was going, I was tuning into it and it left me feeling great at the end!",UgiJqPMi_l2cC3gCoAEC,0.0,0.0,2017-01-17T22:48:59Z,0.984567403793335
406.0,Hey Adriene! I've seen you mention in some of your videos that you're based out of LA now?? (And saw you do a video at the park in Silver Lake ;) If so I'd love to join you for a class IRL! Sorry not sorry if I fangirl over you hahaha,UghhE64hhkCXsXgCoAEC,0.0,0.0,2017-01-17T22:47:18Z,0.8080567121505737
407.0,loveeeed today's practice. thank you,UgjT4gZKXPaAP3gCoAEC,0.0,0.0,2017-01-17T22:40:35Z,0.999840259552002
408.0,I was really close not going on the mat today. Had a shit day. But I did it! And now I feel a lot better. Thanks Adriene :),UgjjCReWHvPTnngCoAEC,0.0,1.0,2017-01-17T22:31:43Z,0.9993067979812622
409.0,"Did anyone else smile at the word ""Stillness"" after a rough day at work?",UggqMQM93HDZ53gCoAEC,1.0,39.0,2017-01-17T22:30:55Z,-0.9954583644866943
410.0,❤️,UgiqTURu2RjGCHgCoAEC,0.0,0.0,2017-01-17T22:25:15Z,-0.6970567107200623
411.0,"Amazing, i do these practices always before bedtime and i sleep so much better! The peace, the stillness, the ease (see what i did there) ... Love it. Goodnight everyone, and namaste!",UgjRx76yO5Q0hHgCoAEC,0.0,0.0,2017-01-17T22:15:52Z,0.9997718930244446
412.0,"I'm feeling stronger every day, yay!",Ugi35kc44jCBKXgCoAEC,1.0,2.0,2017-01-17T22:09:13Z,0.9997166991233826
413.0,Thank you. Namaste.,Ugjii90L3StOGHgCoAEC,0.0,0.0,2017-01-17T22:08:17Z,0.9998477697372437
414.0,who has done all 17 days of yoga for now?,UggVzcdCGBiofHgCoAEC,0.0,1.0,2017-01-17T21:31:58Z,-0.9911250472068787
415.0,Arm strength...yeah yeah but wait guys...I s-p-r-e-a-d my friggin toes for the very first time!!!!! 👌🏼🙌🏼,UggrXpDUIf-4gXgCoAEC,0.0,3.0,2017-01-17T21:23:43Z,0.7792574167251587
416.0,"I think you are the most inspirational and beautiful (inside and out) person I know! Thank you so so much for having created this yoga revolution! And it's so amazing that people all over the world are doing this! You have helped me so much, both to get me trough hard times, to learn to listen to my body and to see things in a different perspective :) 
Big hug from Norway! You rock <3",Ugihmta9iizL13gCoAEC,0.0,0.0,2017-01-17T21:11:53Z,0.9998693466186523
417.0,Loved this practice❤🙏🏼,Ugh_y92cUDWU2ngCoAEC,0.0,0.0,2017-01-17T20:57:17Z,0.9998321533203125
418.0,Falling in love with yoga all over again with every sweet practice we do every day :) Thank you Adriene :) Namaste,UgiCSFoc_S5lNXgCoAEC,0.0,0.0,2017-01-17T20:21:04Z,0.9995573163032532
419.0,Great!!!!Feels so good 😊,UgjtxHfQShUQhngCoAEC,0.0,0.0,2017-01-17T20:13:25Z,0.9998877048492432
