,comment,comment_id,reply_count,like_count,updated_at,calificacion
339.0,"I loved today's practice, it flew by! I loved this flow the first time I did it with you during 30 Days of Yoga and I enjoyed it even more today. Just what I needed, had a very stressful day yesterday and it felt so good to check in and take some time for myself. As always, thank you! :)",Ugj96FaNTl3zT3gCoAEC,0.0,0.0,2016-01-19T15:19:31Z,0.9998748302459717
340.0,✌😴😁,UgjG53CRTIeFxngCoAEC,0.0,0.0,2016-01-19T12:34:07Z,-0.6970567107200623
341.0,"This practice was particularly magic for me. It just flew by, I thought we were halfway through and it was finishing, I was so into it! I'd had a particularly bad 15th day practice (had to interrupt it all the time, was clumsy, couldn't find the time to redo it, my daughter was ill, etc, etc) and was feeling so-so yesterday (I am 1 day behind due to time difference and only being able to do it early morning), today I feel redeemed and focused again :) It was beautiful, Adriene, this that you do is beautiful. Namaste :) Daniela",UghDMA8zSDA2FngCoAEC,0.0,0.0,2016-01-19T12:18:38Z,0.9911434650421143
342.0,Woohoo this was so refreshing and I really was able to focus mostly just on my breath and movement and FEEL IT! :) Still pumped. xo,UghOgWbdIwuDP3gCoAEC,0.0,0.0,2016-01-19T11:55:49Z,0.999782145023346
343.0,"thank´s, the #Yogacamp is helping me Focus on life and it feels good.",UgjXkIvc7aP5T3gCoAEC,0.0,0.0,2016-01-19T11:27:33Z,0.9998431205749512
344.0,Now I have every kind of Lion King song in my head whilst doing that twist - thanks Adrienne lol,Ugho9ialZzFpA3gCoAEC,0.0,0.0,2016-01-19T10:33:53Z,0.9997708201408386
345.0,"Bardzo przydatny poradnik. Daję łapke w gure. 
Pozdrawiam cieplutko :)))))",UgiPxca9pzSslngCoAEC,0.0,0.0,2016-01-19T10:29:14Z,-0.988088071346283
346.0,portuguese subtitles please,UggTSi9Kr2IOcHgCoAEC,0.0,0.0,2016-01-19T10:11:09Z,0.9985665678977966
347.0,"Whats up party people ^^
Two Swiss dudes and dudettes here just saying that this camp is awesome. This community is awesome. Thanks to our lovely teacher ADRIENNE.
Good day to all and NAMASTE",Ugild-kLEU81EXgCoAEC,0.0,0.0,2016-01-19T09:29:56Z,0.9998624324798584
348.0,This one felt like it was only 5 mins! I had to check the video to make sure I didn't accidently skip something. Cannot believe that was nearly a half hour. Wow. #whenyoudowhatyoulove,UgjsPIXQ5tGc1XgCoAEC,0.0,0.0,2016-01-19T09:27:16Z,-0.9943305253982544
349.0,Ahhhh.... Love this. Forgot how much I love the practices with pranayama. I feel much more focused and relaxed.,UghnK4y_t7fw0HgCoAEC,0.0,0.0,2016-01-19T08:56:50Z,0.9996585845947266
350.0,"If you want to know the TRUTH about how the standard western diet is DESTROYING the planet please see the playlist on my channel and find out what you can do to help save the environment, the animals and your health.",UgiWwWVq9BquZ3gCoAEC,0.0,0.0,2016-01-19T08:51:01Z,-0.8466660380363464
351.0,"Mahalo for such a great experience thus far. I have to share that while doing today's practice with my eyes closed in a super focused moment I heard a sound that caused me to look down only to find one of my ""tiny tigers"" doing downward dog on my yoga mat before sharpening his claws. He then went over to the computer and started pawing at you on the screen. He too feels your loving vibes. Needless to say I lost my focus for a bit laughing hysterically but it was a welcomed moment of joy. Even my animals enjoy your company <3",UgiZHOEDQE6e5HgCoAEC,0.0,0.0,2016-01-19T06:01:24Z,0.9992851614952087
352.0,"Wow, wow, wow.  realy loved today's session.  Really enjoyed the session and feel excited about the next wave of practice.
May the focus be with you!",UgjN5VC82jM2CngCoAEC,0.0,0.0,2016-01-19T05:51:48Z,0.9998743534088135
353.0,LOVE!,Ugjqhj5SdyG59ngCoAEC,0.0,0.0,2016-01-19T04:23:28Z,0.999883770942688
354.0,This was a beautiful practice. Uplifting and grounding at the same time. Thank you for sharing your talent and passion with me and the entire YWA community.,Uggrtd5WvghYF3gCoAEC,0.0,0.0,2016-01-19T03:25:19Z,0.9998782873153687
355.0,"I am focused! I really enjoyed the warrior 1 sequence! Focusing on breath while exercising and doing yoga has been something I struggle with. You have helped me! Loved today's practice, the time flew by! Namaste :) xx Adriane",Ugj5b4R2DXoDYXgCoAEC,0.0,0.0,2016-01-19T03:09:48Z,0.9998352527618408
356.0,That's such an awesome practice!  I will keep this one on hand and in memory when I need to focus or calm down.  Thank you: ) Namaste,UgiqTzFp0rghEXgCoAEC,0.0,1.0,2016-01-19T03:02:41Z,0.9998388290405273
357.0,Another great yoga camp day. I love your camp!! It has inspired to want more yoga classes. I feel stronger already and look forward to each new day of your instructions! Thanks for the inspirations and great direction.,UggRNMFnKOacJngCoAEC,0.0,0.0,2016-01-19T02:36:21Z,0.9998584985733032
358.0,"Oh wow! So wonderful! I really needed to focus today and this practice helped with my anxiety so much! Instant favourite that I'm going to come back to when I need to take my focus off my anxiety and onto relaxation. Amazing Adriene, thank you SO much! Namaste <3",UghYHNkyxahB3ngCoAEC,0.0,1.0,2016-01-19T02:25:17Z,0.9997797608375549
359.0,love these videos - haven't done every single one but am benefiting from and enjoying those that i have been able to do. thank you!,UggDPTbXllQ3pXgCoAEC,0.0,0.0,2016-01-19T02:09:51Z,0.9998843669891357
360.0,Today is the first time I felt genuinely strong enough in my core to do the bicycle poses. I'm amazed by how much daily yoga has changed my life in just 17 short days! Yay! I loved this practice!,UgircEigon7kQngCoAEC,0.0,0.0,2016-01-19T02:00:45Z,0.999757707118988
361.0,"You always wear the cutest little yoga outfits! I just adore them (and your videos, of course) Is there a particular store/website you buy your pants usually from? I'm so sorry if this has already been addressed in one of your vlogs and I missed it!",UggHB8g0Sy81xngCoAEC,0.0,0.0,2016-01-19T01:37:34Z,-0.9954710006713867
362.0,"I am so loving this Yoga Camp!! It's been the perfect way to start off the New Year especially with these daily mantras! After a long 8 hour day sitting at a desk, coming home to do yoga and restructure my mindset with the mantras is perfect unwinding time! :)",UgiPPhHyolvJ0XgCoAEC,0.0,0.0,2016-01-19T01:37:19Z,0.9989117383956909
363.0,"Yoga camp is were I told myself I was going to focus on breathing (more then stretching) because as an asthmatic I have always found the inhale really challenging. I couldn't ""stretch"" it out I would just inhale really short and fast. Todays practise was the first time I was inhaling for the same amount of time you were! It felt amazing. Thankyou so much Adriene. Xx",Ugj9E395c9lFnngCoAEC,0.0,0.0,2016-01-19T01:19:51Z,0.9987651109695435
364.0,I think I might have done something wrong yesterday. My mid back is sore. Any ideas Adriene or anyone else? Thanks!,UgghDxJJ_M6EzHgCoAEC,0.0,0.0,2016-01-19T01:16:34Z,-0.9975337982177734
365.0,This was lovely! Thank you for incorporating pranayama into this. It's potent stuff along with the mantra! Lots of love to you!,UgibySeJ1Nt4pngCoAEC,0.0,1.0,2016-01-19T01:03:46Z,0.9998868703842163
366.0,I had a headache brewing before I started. The focused breathing helped quite a bit with getting rid of the headache.,UgiF65-PhmRsPHgCoAEC,0.0,0.0,2016-01-19T00:51:38Z,0.9681747555732727
367.0,"Now that I am focused, I can start my study session.",Ughlz46Me8kdingCoAEC,0.0,0.0,2016-01-19T00:44:07Z,0.6341369152069092
368.0,I'm leaving this practice today with a wonderfully clear mind. It's like all the cobwebs have been blown away. Yay!,Ugi2zTk0Ez8iqngCoAEC,0.0,0.0,2016-01-19T00:32:53Z,0.9902136921882629
369.0,"I found myself really looking forward to today's video. Usually I have to give myself a little push, and some days it's harder than others, but today it was all I wanted to do once I got home from work. And exactly what I needed :) Thanks Adriene, you da best!",UgjUrqaAWMBC6ngCoAEC,0.0,0.0,2016-01-19T00:28:45Z,0.9992644190788269
370.0,Mm... Loved this! :D,UghyvrWa28mT13gCoAEC,0.0,0.0,2016-01-19T00:02:41Z,0.9998527765274048
371.0,"Adrienne I've just started Yoga about 10 days ago, and I stumbled on your videos while looking for some instruction.  I have seen quite a few different instructors and I really appreciate your kindness and encouragement, you so obviously live the life.  I have already been finding a LOT of my strength and agility returning .  I am extremely encouraged in the progress I have made in such a short time, and I was seriously feeling down about aging and the injuries I have in my back and knee.  This is the perfect exercise and way of life for me!  1000 Thank yous!",UgiRvL3TEXI4yngCoAEC,0.0,0.0,2016-01-18T23:24:02Z,0.9996516704559326
372.0,the flow felt magnetic.,UgjyZFP1Pn-dlXgCoAEC,0.0,6.0,2016-01-18T23:13:42Z,0.9996432065963745
373.0,"Namaste from Indiana! Cold, but connected 😑☃",UghIrXbekLz-DHgCoAEC,0.0,0.0,2016-01-18T23:07:15Z,-0.9914829134941101
374.0,"Those eagle wraps really are my favorites. 1 year of yoga today btw for me, woohoo!",UgihDci2Vmo1tngCoAEC,1.0,66.0,2016-01-18T20:51:34Z,0.9981843829154968
375.0,Wow! I feel warm and focussed!,Ugjkfb2N3sw6XXgCoAEC,0.0,0.0,2016-01-18T20:48:17Z,0.9998836517333984
376.0,"I had quite a hard day with my baby boy having surgery (everything's fine now), so this was amazing. And the little Simba analogy really rang a bell because I always pretend he's Simba and I'm showing him the world. 
It was nice to focus because naturally my thoughts have been all over the place today.",UghoAYKhfbzNw3gCoAEC,0.0,2.0,2016-01-18T20:40:23Z,0.9994449019432068
377.0,"Loved this one, A!! ❤️",UghM7phIWUXpA3gCoAEC,0.0,0.0,2016-01-18T20:33:33Z,0.9998565912246704
378.0,"wow; feel so focused; amazing.....I had an idea....what about t-shirts for yoga camp???? I would totally purchased one; maybe the other campers would too?? with your cool postcard on it??? just a thought...thanks for today....see what happens when you focus, ideas come....",UghRXHsmwdLPQ3gCoAEC,2.0,54.0,2016-01-18T20:33:00Z,0.9995085000991821
379.0,"This was one of my favorite videos so far which is saying something because I've loved them all! I did 30 days last year, but I think the addition of these affirmations was really awesome!",UghXiTkbFtvtQ3gCoAEC,0.0,0.0,2016-01-18T20:23:19Z,0.9997963309288025
380.0,Ian so enjoying the ride! Thank you! You have changed my life!,Ugi9zFC6ejqTw3gCoAEC,0.0,0.0,2016-01-18T20:16:28Z,0.9998766183853149
381.0,This one was difficult for me. Note to myself: Work on my breathing. That´s definitely something I can work on in my everyday life :),UggsI26fVzvj-XgCoAEC,0.0,0.0,2016-01-18T20:09:45Z,0.9970093965530396
382.0,"Wow, just wow. I am learning so much from you. I'll give you an example, I go to 2 yoga classes each week, plus Im doing yoga camp every day. Well in those 2 classes the teachers move so fast, I see people around me hurting themselves or competing with others. I'm trying to be a good example, so I slow it down...way down so I can connect. Yesterday I didn't do that and tried to move with everyone else and wow, it hurt this morning. Thank you so much for taking the time to show us what yoga is really about. Thank you for being yourself and loving what you do. It really shows! You have taught me more about yoga and myself than any of those other teachers. Sending you and all yoga campers love. Namaste",UggGmGq5U15fiHgCoAEC,5.0,173.0,2016-01-18T20:04:57Z,0.9979864358901978
383.0,"Hi, 
I am also doing and enjoying yoga camp. Trying to loose some weight :p Thank you so much Adriene for making such a great effort. I want to know can we do yoga during periods?",UggWfDp50GRMBngCoAEC,0.0,0.0,2016-01-18T20:04:40Z,0.999366819858551
384.0,This is exactly what I needed after going to a weightlifting class earlier today :) Thanks Adriene!,UgjtI8CNGaaQdngCoAEC,0.0,0.0,2016-01-18T19:52:11Z,0.9996899366378784
385.0,You're so cute.,UgjP-4mw6ldJQXgCoAEC,0.0,0.0,2016-01-18T19:47:10Z,0.9998703002929688
386.0,; -),Ugis4POb4dz_YXgCoAEC,0.0,0.0,2016-01-18T19:42:23Z,0.8685899376869202
387.0,lovely lovely lovely!!!!,UgjLB65ML48l-XgCoAEC,0.0,0.0,2016-01-18T19:25:16Z,0.9998700618743896
388.0,"j'adore le yogacamp, merci Adriene",UgjHUk7rLOUR5ngCoAEC,1.0,3.0,2016-01-18T18:40:36Z,0.9907763600349426
389.0,"I am focussed on loving myself! I definitely felt that I could go deeper with those flows, but today it wasn't happening so I focussed (see what I did there) on enjoying the practice from where I'm at today. Stretching my hands and arms felt amazing after a day at my desk at work!",Ugj7A4SLG5HR4XgCoAEC,1.0,41.0,2016-01-18T18:40:36Z,0.9996300935745239
390.0,"Yoga Camp, and you Adriene have made such a difference in my life. Thank you. Thank you for helping me focus. I am focused. I also loved today's practice so much!",UggsPeSA7lVKfHgCoAEC,2.0,0.0,2016-01-18T18:38:28Z,0.999861478805542
391.0,"Okay definitely my favorite video thus far and yes, I keep saying that. I have to tell you Adriene, you are helping me to kick January's ass! I do a daily practice on my own and have for a while now, but it was gettin' stale and my body was hurting something wicked. Flash forward to day 17 and I feel awesome! So, my back and my little self thanks you. You. are. great. :)",UgjykMKRxdxbJngCoAEC,0.0,0.0,2016-01-18T18:29:59Z,0.9953576922416687
392.0,"I loved today's practice, even though my stuffy nose made the breathing exercises kind of hard.
Thanks for all your love & hard work, Adriene!",UgjGnsY_0Dq0B3gCoAEC,1.0,0.0,2016-01-18T18:12:52Z,0.9997090697288513
393.0,"I have done the first 30 day challenge and because I loved it,I decided to do this one. And from all the other  days, from both the challanges, this is my favourite day yet. 
I do it evey day and have never felt better, so thank you Adriene for the great videos and for getting me interested in yoga.
Keep being awsome :)",UghdsAUo_QA2iHgCoAEC,1.0,0.0,2016-01-18T18:12:26Z,0.9971484541893005
394.0,"I have done the first 30 day challenge and because I loved it,I decided to do this one. And from all the other  days, from both the challanges, this is my favourite day yet. 
I do it evey day and have never felt better, so thank you Adriene for the great videos and for getting me interested in yoga.
Keep being awsome :)",UghngcAm3QXupngCoAEC,0.0,1.0,2016-01-18T18:12:23Z,0.9971484541893005
395.0,Great practice! It worked I stayed focused during the whole practice.,UghaFtGGMFEPeXgCoAEC,1.0,0.0,2016-01-18T18:03:39Z,0.9992081522941589
396.0,Another great video!  I am focused.,Uggu151YyCZimHgCoAEC,0.0,2.0,2016-01-18T17:46:41Z,0.9998143315315247
397.0,absolutely love yoga camp! became very disheartened with excersise after suffering from panic attacks but these videos have changed that and I'm loving the challenge!,UghXpyJnErQdsHgCoAEC,5.0,46.0,2016-01-18T17:36:22Z,0.9993390440940857
398.0,I definitely feel more focused. Moving with my breath is something I find myself having to work on and this practice definitely helped me connect. :),UgjBPWnF1PkHQngCoAEC,1.0,5.0,2016-01-18T17:33:00Z,0.9997848868370056
399.0,Love the videos! Especially loved this rotation. It felt very relaxing and strengthening at the same time!,UggCNdBqKpitr3gCoAEC,0.0,2.0,2016-01-18T17:27:23Z,0.9998722076416016
400.0,"Sorry Adriene....I need to move...after four years of being restricted either by the wrist and knee injuries, 5 surgeries, or strict rehab protocols - now that I can move I Need to move....I will file this one to come back to but I did day 15 and day 6 again instead.....",UgjOFgwzlH9ZjXgCoAEC,0.0,0.0,2016-01-18T17:07:02Z,-0.9995627999305725
401.0,Focus on meeeee,Ughk5w7lhjB5uXgCoAEC,0.0,1.0,2016-01-18T16:59:00Z,0.9937066435813904
402.0,Really felt the hand chakras when bringing the hands to chest before uddiyana bandha.,UgjY5HXQ934w_HgCoAEC,2.0,1.0,2016-01-18T16:29:53Z,0.9887723326683044
403.0,Today's practice was a goodie wrapped in a yoga-blanket. Loved it!,UghencDtCIjQ8XgCoAEC,1.0,1.0,2016-01-18T15:57:30Z,0.9996401071548462
404.0,"Today was a morning with so many things running throughout my brain. It was hard, but I choose to focus on my practice to help me prepare for the exhorbetant amount of work I have to do. The bicycle moves always makes me nervous bec I always have clicking sounds with my hips. Not painful but I'm scared to hear the sound. Thank you for today's practice to keep me centered. Namaste.",UggQBcPBfqsei3gCoAEC,2.0,1.0,2016-01-18T15:49:23Z,0.9955537915229797
405.0,"I am contemplating what areas of my life need refocusing, and I am definitely sure I could use more focus in all areas. As I go into work today, I plan to continually bring focus and awareness to my breath and posture.",UggDV5WWxY4jfXgCoAEC,2.0,1.0,2016-01-18T15:46:28Z,0.9996354579925537
406.0,"This was definitely a turning point for me with these practices, I finally feel I have accessed from within what yoga camp is all about. Thank you Adriene!",UghSMSyAa428DngCoAEC,1.0,32.0,2016-01-18T15:42:17Z,0.9992353916168213
407.0,love the pranayma*  Really a lovely class* Thank you,UgjkHeX8dFsuJHgCoAEC,1.0,1.0,2016-01-18T14:26:16Z,0.9998650550842285
408.0,"Really enjoyed today's practice. Thanks, Adriene!",UggVPO3Dmrivq3gCoAEC,1.0,0.0,2016-01-18T14:20:30Z,0.9998747110366821
409.0,Perfect.,UghaihBAkHY_sngCoAEC,1.0,0.0,2016-01-18T14:16:28Z,0.99985671043396
410.0,Thanks for sharing your time and support with these awesome videos.,Uggqd0SoFC2r5HgCoAEC,1.0,1.0,2016-01-18T14:14:24Z,0.9998294115066528
411.0,This was very beautiful. I think this day resonated most with me up to this point. Thank you so much Adriene.,UggyTYJjE9f-e3gCoAEC,1.0,1.0,2016-01-18T13:37:08Z,0.9998769760131836
412.0,"A hard part for me in this series is not knowing what is next and how much time I need to dedicate each day to the practice. Yes, she could release the times in advance, but in life, you don't know what is next. It is a challenge and I need to embrace it.",UggfJIlDf7e3p3gCoAEC,7.0,6.0,2016-01-18T12:57:33Z,0.9888132214546204
413.0,"I got a bad flu when i was on day 5, and i was sick until yesterday. I feel like i should start from day 1 instead continuing to day 6. But i will catch up, and finish this camp! Thank you so much Adriene.",UgjT9ZYALerYZngCoAEC,1.0,0.0,2016-01-18T12:52:31Z,0.9970661997795105
414.0,Day 17 a good one. I had an unrelated injury to my hand yesterday and was hoping that the lesson would not require me to use my hands a lot. Somehow Adriene knew!  Good work out.,UgjQ8LzA2AsDoHgCoAEC,2.0,3.0,2016-01-18T12:41:58Z,0.9966807961463928
415.0,"Love this video! :). My mantra for today is, ""I am focused on my wellbeing"" <3",UgjFvW06B6HW0XgCoAEC,1.0,19.0,2016-01-18T12:30:41Z,0.9997614026069641
416.0,sup.,Ugi8pF_iOZDxoHgCoAEC,1.0,0.0,2016-01-18T12:11:48Z,-0.9797805547714233
417.0,"I love this video series!! I've started talking regular yoga classes every Monday and this helps me get the poses a lot easier and ""find my happy place""!!  Keep up the good work Adriene!!",Ugi5V689BxeSUngCoAEC,1.0,2.0,2016-01-18T12:05:52Z,0.9998244643211365
418.0,whoopie first comment.... these videos are really changing my life,UghqktibxPK44ngCoAEC,1.0,37.0,2016-01-18T12:05:26Z,0.9990422129631042
