,comment,comment_id,reply_count,like_count,updated_at,calificacion
576.0,Loving this video!,Ugi37THvFw58BHgCoAEC,0.0,1.0,2017-02-21T12:35:57Z,0.9998756647109985
577.0,Than you!,UggKirHcuCcsWHgCoAEC,0.0,0.0,2017-02-20T22:14:11Z,0.9985777139663696
578.0,Hoooooly smokes! Today's lesson taught me that my shoulders are basically immobile! :( I couldn't even clasp my hands together for humble warrior. Looks like I need some extra shoulder stretches before I do these,UgjjGscqBaZ-SXgCoAEC,0.0,1.0,2017-02-13T10:34:10Z,-0.9916579127311707
579.0,Thank you Adrienne!I can already feel the difference in my body💕,UgidVRWXpc3A8ngCoAEC,0.0,1.0,2017-02-09T11:16:04Z,0.9997269511222839
580.0,"thanks, Adriene :)",UgiWUZYfYUfPH3gCoAEC,0.0,0.0,2017-02-08T20:43:30Z,0.9997531771659851
581.0,this legit felt like the shortest practice ever soo good ....,UggojYXtOa0kzngCoAEC,0.0,0.0,2017-02-02T05:51:56Z,-0.9973847270011902
582.0,we love you too girl,UghojgmmqqJYXngCoAEC,0.0,0.0,2017-01-27T02:44:02Z,0.9996472597122192
583.0,"Thought 13 is the unlucky one 
Namaste and wish you luck Adriene",Uggmxxt3ySh_aXgCoAEC,0.0,0.0,2017-01-24T14:56:20Z,-0.5324157476425171
584.0,"Day 13 complete :) I must confess it's taken me longer than 13 days to get here, but I made it! I really enjoy this thank you thank you thank you for these wonderful videos I can't thank you enough",UghfJtuzMZeDT3gCoAEC,1.0,1.0,2017-01-19T05:12:15Z,0.9998371601104736
585.0,"Like many of the other commenters, I would like to say thank you for these videos.  I'm almost half way through your 30 Days of Yoga and loving every day of it.  I look forward to doing many other of your videos in the future.  Thanks again.",UgiD6DA_N6tHvngCoAEC,0.0,0.0,2017-01-15T02:27:52Z,0.9996461868286133
586.0,"Learning to let yoga not be a tool to tone, but a tool to cultivate positivity- Usually I push myself to do what is most challenging or more like a workout. I'm realizing how distorted that idea is. It contradicts the grounding intention of yoga, and man is it a relief to be letting that go. I love finding what feels good and in turn makes me feel good about myself inside and out, rather than doing what I think is best or ""right"" to look good or be better.",UgjLMbCwvML1-3gCoAEC,0.0,0.0,2017-01-14T15:30:14Z,0.7714821100234985
587.0,"Each day I spend with you, Adriene, is easier and more calming than the day before. I am a beginner for yoga, and you have helped me through every step of the way, even if it's virtually. I have tried so many yoga teachers on YouTube and none of them have known how to make variations for everyone. Even 13 days in, I have noticed I am stronger and a lot more flexible. I can't thank you enough for everything you have done for me. 

             Namaste",UgjKKm3yI_OHXHgCoAEC,0.0,3.0,2017-01-14T04:17:15Z,0.9991476535797119
588.0,you are awesome thank you for inspiring me to do yoga it has changed my life,UggbTwWfBuKJ0ngCoAEC,0.0,0.0,2017-01-10T12:41:33Z,0.9998557567596436
589.0,thank you for your program. I love you too :),UgiZOMmIvwAdangCoAEC,0.0,0.0,2017-01-03T16:28:42Z,0.9998584985733032
590.0,I LOVE YOUR PROGRAM !!!,UggftmtIg_uL-ngCoAEC,0.0,0.0,2016-12-25T16:11:23Z,0.9998749494552612
591.0,I love you :),UggHV_W6kw27RXgCoAEC,0.0,0.0,2016-12-20T15:39:25Z,0.9998350143432617
592.0,"tue. dec. 13, 2016",UghTPOXlo9IIAXgCoAEC,1.0,0.0,2016-12-13T21:01:28Z,-0.7680231332778931
593.0,"Thank you so much for this series. I live aboard a sailboat (3 years now) and haven't worked out for that long. I decided that I would get back into it, so I found this series that inspires me every day. Today I felt groggy and a little cranky but pulled out my mat anyways. I now feel so happy and light. This is the best mood changing exercise and I recommend it anyone wanting to get back into a workout routine. January will consist of 3 days of yoga with 2 days of light weight training. Adriene, looking forward to mixing it up with more of your great videos!! Merry Christmas everyone and keep on keeping on!",UgiZtt6jICsReHgCoAEC,0.0,0.0,2016-12-13T17:32:35Z,0.9996302127838135
594.0,"Awww...she said ""I love you"", sweet.",Ughi7efV7kKBNXgCoAEC,0.0,3.0,2016-12-10T14:51:18Z,0.9992085099220276
595.0,"Hi Adriene:) I love your video's I just found out I am pregnant:) Are these 30 days video's safe to do during pregnancy? Thanks in advamve, Peta x",UgigYwa7Mm0kzXgCoAEC,0.0,0.0,2016-12-09T05:00:38Z,0.961036205291748
596.0,Es increible como se va rápido este delicioso instante. Maybe because I have enjoyed each and every movement. Muchas gracias amiga Adriane!,Ugjp0Ltf_0gOo3gCoAEC,0.0,0.0,2016-12-03T16:22:24Z,0.9959808588027954
597.0,This was perfect for me today!! Thanks!,Ugg36nCD5jzkengCoAEC,0.0,0.0,2016-11-28T22:13:53Z,0.9998587369918823
598.0,Thank you.,Ugh58pdcVxSDWXgCoAEC,0.0,0.0,2016-11-24T15:00:45Z,0.9998457431793213
599.0,"loved the practice today. great way to start the day, reminding myself why i started doing the challenge.",UggzX8AdWmWS5ngCoAEC,0.0,1.0,2016-11-21T09:35:11Z,0.9998435974121094
600.0,We have a Smoke Alarm that beeps every 5 minutes because the battery is low so It was hard to concentrate on the Yoga without being annoyed sadly.,UgivmbwR9tOAx3gCoAEC,0.0,0.0,2016-11-17T03:47:14Z,-0.9973805546760559
601.0,"Love you too, you have really helped me get into a more positive mind set ❤️😊",UgjmSOoBk7-0g3gCoAEC,0.0,0.0,2016-11-14T08:48:32Z,0.9998295307159424
602.0,done,UghMKWCHHBOlnngCoAEC,0.0,0.0,2016-11-12T21:24:24Z,0.985146701335907
603.0,"Ah one again, feels so good. And I can now actually ""send it into downward facing dog"" almost smoothly!  Oh, and my husband is on board now too!",UggPEQtLsvRQX3gCoAEC,0.0,1.0,2016-11-12T18:47:04Z,0.9997876286506653
604.0,my 3th day! ♥♥♥♥ AMAZINGGGGGG!,UggkB78HVaAAf3gCoAEC,0.0,0.0,2016-11-05T15:09:54Z,0.9949931502342224
605.0,Awesome!  Love these videos & love you too!!!!!!  Thanks,UggZO452iHsrgngCoAEC,0.0,0.0,2016-10-29T17:21:17Z,0.9998828172683716
606.0,I loved this practice  it just had me smiling from start to finish ❤️,Ugjb5nPZ4Ur28HgCoAEC,0.0,0.0,2016-10-01T17:11:36Z,0.999729573726654
607.0,Thank you so much for the last 13 days.  I love your calmness and quirkiness.  My body is feeling so good thanks to you,Ugh_c_lHhT5-e3gCoAEC,0.0,0.0,2016-09-27T19:23:07Z,0.999874472618103
608.0,Love you too Adriene :),UggkN2RSq1RYmXgCoAEC,0.0,0.0,2016-09-26T08:37:50Z,0.9994646906852722
609.0,"Eagle arms are hard for me because of my right shoulder, so adding the balance part was awesome because it took my mind off my wonky arms.  Thank you, Adriene! You rock!",UggNXrJOstnGR3gCoAEC,0.0,0.0,2016-09-18T16:35:13Z,0.9998200535774231
610.0,I've recently started watching your videos and I love them! Thank youu,Ugitt8rBJH3N4HgCoAEC,0.0,0.0,2016-09-14T01:32:38Z,0.999870777130127
611.0,Day 13 doneee! love the way I'm feeling and love youuuu Adriene! thank you for sharing these videos :*,UgjWV55Z5qDoangCoAEC,0.0,2.0,2016-09-09T15:02:36Z,0.999756395816803
612.0,"As a former kickboxer and cyclist i never expected Yoga would be this empowering and give meaning to connect to myself both emotional,  and  physical. And this all the way at the other side of your llivingroom, in The Netherlands.  Your kindness en freshness comes right in , me and my partner stay connected. Thank you for giving, learing and sharing.",UgjHx1q4ZR0wfHgCoAEC,0.0,0.0,2016-09-07T08:15:58Z,0.9998288154602051
613.0,"I don't know if I was extra tired today or what, but those eagles and warrior 3s kicked my ass so hard. Dying...in a good way ;)",UgjumZeMAL-loHgCoAEC,0.0,0.0,2016-09-05T14:17:55Z,0.9734449982643127
614.0,"As a guy that never even thought about doing yoga, I found this on YouTube and decided to try it... Don't tell my friends or co-workers :) well, I ended up liking it and now I completed my 13 day of yoga and I actually feel more flexible already. Thanks Adriene for the videos and your once in a while jokes.",UgiZTLA0dNDs6XgCoAEC,1.0,49.0,2016-09-03T23:57:03Z,0.9982113838195801
615.0,"Ahh, love this routine.  My go to for a headache.",UggWwQtbTAJsPXgCoAEC,0.0,0.0,2016-08-26T22:28:09Z,0.9993939399719238
616.0,I struggle a lot with the three legged dog poses. I think it's because I don't have much arm/core strength.,Ugh1xNj7rL2xAXgCoAEC,1.0,3.0,2016-08-21T19:41:43Z,-0.9994261264801025
617.0,Wow! Great video. Thank you!,UgjbQAA5Z0JBGngCoAEC,0.0,0.0,2016-08-15T13:14:20Z,0.9998788833618164
618.0,"Today on day 13, I finally felt like I was falling into rhythm with my breath and my body. I started these yoga videos because of an anxiety disorder. I often stop breathing without noticing when I'm worrying. These videos have helped my calm, my breath, and my flexibility. Thank you for what you do! <3",Ugh1kNX58dnO8ngCoAEC,0.0,0.0,2016-08-11T15:59:03Z,0.9990098476409912
619.0,Now I actually want to wake up early to do yoga and then start my day feeling fine and refreshed :D,Ugj9HOKPwIP4tngCoAEC,0.0,55.0,2016-08-09T19:01:46Z,0.9996439218521118
620.0,"Love you too Adriene :) 
Thank you so much for your Yoga. I choose your practice every day now. Amazing how great you teach!",UgjuZWsm1JHar3gCoAEC,1.0,0.0,2016-07-30T22:50:40Z,0.999862790107727
621.0,"Wow, I burped a lot during this one XD Glad I'm doing these at home. Squeezing out that air XD",Ugh_2BBpgYIxmHgCoAEC,0.0,1.0,2016-07-27T00:58:29Z,-0.9533167481422424
622.0,"I look forward to these everyday! almost half way done, thank you so much be-you-tiful Adriene!",Ugj7GDG3c8LRh3gCoAEC,0.0,0.0,2016-07-24T16:31:46Z,0.9998148083686829
623.0,"I love you too, Adriene!",UggKrW2dCDvfYXgCoAEC,0.0,0.0,2016-07-18T17:58:01Z,0.9998531341552734
624.0,amazing. I'm so happy I started this :) Thank you Adriene!,UggIsmwsZT8N83gCoAEC,0.0,1.0,2016-07-17T07:43:59Z,0.9998699426651001
625.0,Thanks again for doing these videos.  You are awesome!!,UghWXH5Kw4nTv3gCoAEC,0.0,0.0,2016-07-15T17:19:11Z,0.9998681545257568
626.0,Almost halfway there! Thanks for taking us on this journey to wholeness.,Ugi4yF0b0ZEI13gCoAEC,0.0,5.0,2016-07-12T20:34:15Z,0.9997056126594543
627.0,Day 13! done! :),Ugj8elwO_UbDRngCoAEC,0.0,0.0,2016-07-09T17:40:47Z,-0.9445144534111023
628.0,Thank you soo so soo much adriene. Your yoga practise makes my days!  got a lot of strengh and a different view over my body out of it.,UgiWxxTlxuzlmngCoAEC,0.0,0.0,2016-07-05T19:35:36Z,0.9978246688842773
629.0,"Seriously, these videos have changed my world. Mornings have never been so good.",UgiDi9mQJx3PwXgCoAEC,0.0,5.0,2016-06-19T16:00:06Z,0.9989691972732544
630.0,"Hi Adriene! I've signed up on YouTube solely for the purpose of letting you know how much I love your Yoga videos and how unexpectedly you managed to improve my inner and outer existence! I've first started with some little random videos of yours, then got hooked on Yoga Camp and now going through the 30 Days of Yoga challenge. I've been through some extremely difficult years emotionally speaking and there were times when I considered not being part of this world anymore. I somehow pulled through this very deep depression but struggled to find joy in life. Your videos help me so much on this journey of re-discovering myself and the world, I'm taking baby steps to re-learn hope and shed crusty thick layer of cynicism. I recently began doing yoga also in the morning, along with pranayama and meditation. I am excited to see where this journey leads. I think you are an absolute gift to this world and the internetz!",UgikxWfnLhbj93gCoAEC,0.0,1.0,2016-06-17T21:54:30Z,0.998665452003479
631.0,"Nice practice, balance poses are always challenging, my left side is better than right, thanks for sharing, namaste.",UghK_Lg9AkpiOngCoAEC,0.0,0.0,2016-06-14T12:00:59Z,0.9998074173927307
632.0,"Awww I love you too :) But seriously you are amazing, a born healer. Thank you for being my teacher. 

Namaste",UgjMnQenhsX2k3gCoAEC,0.0,1.0,2016-06-07T18:49:14Z,0.9998438358306885
633.0,omg i did it! my heel touched the ground while doing downward dog omg omg! And i loved the humble warrior pose.,UgiPofKqVwgiL3gCoAEC,4.0,171.0,2016-06-05T13:47:08Z,0.9994933605194092
634.0,"Fantastic practice! My Yoga With Adriene-sessions have become sacred to me, as they are often the highlight of my day, during a bit of a rough patch in life, and I am ever so thankful for all the strength and peace of mind they lead me to. Namaste!",UggtZH1KzOaRaHgCoAEC,0.0,1.0,2016-05-28T12:18:39Z,0.9997727274894714
635.0,"Adriene you are so wonderful, thank you for your beautiful yoga and sharing your kindness with the world x",Ugi_Dgv70ezHqngCoAEC,0.0,0.0,2016-05-21T05:56:44Z,0.9998819828033447
636.0,Favorite day thus far,UggeV1sMO81jKHgCoAEC,0.0,2.0,2016-05-20T16:30:34Z,0.9996179342269897
637.0,I'm feeling better and better each day!,UggxvVrUprlLMngCoAEC,0.0,0.0,2016-05-15T12:03:05Z,0.99959796667099
638.0,"Day 13 done! I liked today's practice, especially the eagle pose! This was actually the first balancing exercise that I struggled a little with, but I'm sure I'll get there in time. Thank you again for all these great moments that really make my day right after getting out of bed",Ugh9RoKiaVl_W3gCoAEC,0.0,0.0,2016-05-15T08:08:52Z,0.9998151659965515
639.0,This was my favorite practice/day so far!,UggJpvHcDuCnWHgCoAEC,0.0,0.0,2016-05-14T13:17:32Z,0.9989180564880371
640.0,"Adriene!! when i went into forward fold sitting down today i could almost grab my feet! i was like ??? bc I've never been a super flexible person, but i guess all those forward folds are paying off!! Thank you!!",Ugiu8gj7ZnqWAHgCoAEC,0.0,0.0,2016-05-03T05:01:37Z,0.9971876740455627
641.0,"""One more, inhale, you got it!"" *Falls over*",UgjT7zBWhtvGqngCoAEC,8.0,828.0,2016-04-24T19:31:02Z,-0.6043712496757507
642.0,"I am back after a week of sickness and vacation. Felt a bit off on the matt today (glad I repeated day 13 as it is a lucky number for me as well), but so good to be back!",Ughu4S86dJ8J53gCoAEC,0.0,2.0,2016-04-19T14:26:32Z,0.9996981620788574
643.0,"Thank you for getting me into yoga! I always loved sports but I never treated my body well. I was pushing it to do better faster, but now I know that everything takes time and I became more patient. I can finally do crow pose with no struggle! 🎉 thank YOU again! 💚",UggmkhuKwqmkf3gCoAEC,0.0,2.0,2016-04-17T08:59:05Z,0.9307368993759155
644.0,Love this one!!,UggOvoMVSrxt4ngCoAEC,0.0,0.0,2016-04-06T16:44:37Z,0.9998776912689209
645.0,"I almost touched my toes omg!!! soooooo happy Thx Adriene :)
Day13----> Done^^",UgjfbZm5R8NPoHgCoAEC,0.0,1.0,2016-04-06T05:07:06Z,-0.7962197065353394
646.0,I really love these 30 days.,UgivKelOs7kDNHgCoAEC,0.0,0.0,2016-04-03T14:51:17Z,0.9998717308044434
647.0,"i took a few days off after day 12 because i was busy and i was worried about getting back into it... but now i feel so strong and refreshed! thank you, adriene. really. even as i struggle with many of these poses, i have never felt as strong and in control of my body in my life!",Ugjy-KsoFO-wMHgCoAEC,0.0,0.0,2016-03-21T02:16:26Z,0.9997456669807434
648.0,Question: what to do if I missed a day or two and messed up the sequnce of the chalange??,UghecOofcL2LUHgCoAEC,0.0,0.0,2016-03-14T18:00:31Z,-0.9995288848876953
649.0,"Adrienne, VERY nice, and the yoga is cool too..not tryin to be worldly, but yeah, if you want to tone your (anyone)body to a certain ""image""u set in your mind (within reason,of course) u can , so im told, attain that form here on the physical plane, maybe kind of a hoo-doo way of saying ""mind over matter"", but any way, I'll keep watching u, u seem 2have a way with your public here, so kudos and I'll watch the commercials all the way thru by your site, dont know if that helps without YouTube or / not but oh well...",UgjtKxhkOGziA3gCoAEC,0.0,0.0,2016-03-14T01:45:03Z,-0.5652234554290771
650.0,"I have been trying to get ""hooked"" on yoga for years, often giving up and not sticking with it.  All of that has changed with your channel.  I get excited everyday when I carve out this yoga time just for me.  I feel incredible and my anxiety and back pain have virtually disappeared.  And thanks for the humour, it just makes my day! :)",UgjtczOgEbBnungCoAEC,0.0,2.0,2016-03-09T04:53:54Z,0.9987063407897949
651.0,"Adriene, I'm not even halfway through this challenge and I already feel so much more toned and stronger, not only physically, but mentally.  I can't thank you enough, I look forward to doing yoga with you every single and and I've even been doing more than one video a day because I can't get enough, which I didn't expect.  Thank you so much for this!",Uggf5PdcyXGDWXgCoAEC,1.0,571.0,2016-03-06T18:42:14Z,0.9996724128723145
652.0,great way to start a day! ! :),Ugh5S7VyBexY5XgCoAEC,0.0,0.0,2016-03-04T20:46:53Z,0.9998148083686829
653.0,"I'm feeling great! Since I started Yoga Camp and then the 30-Day-Challenge, I've been noticing major changes in my body. I mean, now I can do some Asanas that I couldn't have dreamed of. When I first started, my body was so stiff and somewhat ill that it was hard and sometimes a bit frustrating. I realize now that Yoga has become a huge part of my life because it's a moment just for myself, where I get to learn more about my connection to everything that is. I feel so fortunate to have  ""bumped into"" these videos. Great practice! Just loved it. Namaste :D",UghxtOJtNFi2TngCoAEC,0.0,0.0,2016-02-29T14:11:02Z,0.9918398857116699
654.0,"thank you. as beginner need to focus and copy movement, would be better if joke/useless movement a bit less and help us with breezing . i will follow through knowing your style and do not copy movement as to clear dust on mat or pick things up",UgiwdyyO3jv7jXgCoAEC,0.0,0.0,2016-02-27T09:37:22Z,0.7320384979248047
655.0,"What is this thing you speak of.... ""Balance""?",Ugh94Ktrz9YqT3gCoAEC,3.0,425.0,2016-02-23T23:59:56Z,-0.9275692701339722
656.0,The I love you felt sincere. I love you too Adrienne. We need more love in this world. Thanks for passing it on.,UgitgYWc99xRM3gCoAEC,1.0,5.0,2016-02-23T15:15:50Z,0.9997841715812683
657.0,I love you too Adrienne. You have given me motivation to get up in the morning and do something for me. Thanks for merging me into yoga practice. I am worth it!!,UghqagLLDsHPOXgCoAEC,0.0,0.0,2016-02-23T15:14:44Z,0.9998657703399658
658.0,"I have been following your programme on YouTube for 13 days and am really feeling the benefits! I have now purchased your programme so that I can take it with me when I travel. I really hope this is the beginning of my life enhanced by yoga. Love it., thanks you so much for the inspiration and motivation A : )",UgiPchkPi7Q1cXgCoAEC,0.0,0.0,2016-02-20T12:19:48Z,0.9997803568840027
659.0,"I have been doing yoga for years but started rushing through my practice. My body began dreading coming to my mat. Adriene, I found this 30 day challenge and finally am connecting to my breath again. Thank you for your lovely spirit and videos :) <3",UggT67Ic_L5jOHgCoAEC,0.0,0.0,2016-01-16T17:01:20Z,0.9993686079978943
660.0,doing this a year after it came out. lol. my new years resolution. love your vids adriene!!!! xoxoxo,UgjSbBRK8-6dmngCoAEC,0.0,0.0,2016-01-14T02:31:25Z,0.9996771812438965
661.0,"Loved that tonight , Thanks ,",UgjjZaqscY8GW3gCoAEC,0.0,0.0,2016-01-12T00:10:57Z,0.9998703002929688
662.0,Going from downward facing dog to warrior position reminds me of Link from The Legend of Zelda Twilight Princess transforming from wolf back to Link again.,Ugh3ObXWtN_ZVHgCoAEC,0.0,36.0,2016-01-11T19:35:09Z,0.9986610412597656
663.0,You are truly heaven-sent. Thank you x,UgjhhRARecT7n3gCoAEC,0.0,1.0,2016-01-09T20:38:42Z,0.9998623132705688
664.0,"""crack an egg on your leg, let the yolk run down.."" 😂😂😂",UgjkVlc45vjCdXgCoAEC,0.0,231.0,2016-01-08T03:11:52Z,-0.9957410097122192
665.0,"i'm sooooo grateful i found your channel, adriene. i'm so thankful that i'm commiting to this challenge. it feels great to notice those small, tiny changes in both my body and mind during and after every practice. lots of love.",Ugg525Azrutba3gCoAEC,0.0,0.0,2016-01-06T17:30:37Z,0.999854564666748
666.0,"Hello Adriene! Today my friend joined me on the mat and he thoroughly enjoyed it, and 'found new peace' as he put it. I think I have you a new yoga convert-ee! Thank you for inspiring all the people you do every day.",UggXGk0287p20XgCoAEC,0.0,0.0,2016-01-05T13:55:04Z,0.999862551689148
667.0,"It's crazy, as I was moving onto the floor at the end of the video, I realized there was also a ladybug in my room on the ceiling directly above me! And then it fell on my head! x",UgiwHyzOPwXjkXgCoAEC,0.0,20.0,2016-01-04T13:15:03Z,-0.9974856376647949
668.0,i really enjoyed todays practice! thank you adriene!,UggRAyMeDM33hHgCoAEC,0.0,0.0,2015-12-31T00:35:53Z,0.999876856803894
669.0,"Hey Adriene, Day 13 is complete. Why is 13 important in your family? Just curious :)",UgjlwpKxaoLZjngCoAEC,0.0,0.0,2015-12-30T12:02:14Z,0.9923791885375977
670.0,"Feeling discouraged today as I have successfully and consecutively been following this practice,  but am dealing with some wrist pain today. Did a quick google search and found this website, which I think will really help: 

http://www.yogajournal.com/article/practice-section/bearing-up-under-pressure/

Other than that, really loving this practice so far. So happy with my mind and body!",UggveJnWJ8QG_3gCoAEC,0.0,0.0,2015-12-26T05:46:38Z,0.9987260699272156
671.0,Great day for some christmas yoga! Thank you for these videos to help me get back on track with my health so I can better help others. 13 is a lucky number for my family too.,UghjOdoJwMEEUXgCoAEC,0.0,0.0,2015-12-25T22:04:20Z,0.9997677206993103
672.0,"As soon as you said,  ""think about energy, don't think about the pose"" I nailed that warrior 3 posture like a pro and let out a great woohoo. lol. Thanks so much Adriene!",UgiA_gELr6Wf8HgCoAEC,0.0,0.0,2015-12-16T06:13:55Z,0.9783340692520142
673.0,"I can definitely feel myself getting stronger, more flexible and connected with my breath! This stuff does work. :) Thank you, Adriene, for making yoga accesible to everyone.",UghUw1qsrVFRpngCoAEC,0.0,21.0,2015-12-15T15:15:10Z,0.9998313188552856
674.0,One of my favorites....yummy,UggKnBSVrI_1U3gCoAEC,0.0,0.0,2015-12-13T14:26:07Z,0.9995515942573547
675.0,"Thank you so much for today Adriene. Had a terrible day at work and was feeling a mix of sad, angry and betrayed. I did your yoga when you're angry vid then day 13 and I feel soooo much better it's incredible. I'm smiling again ... You are amazing. Namaste xxxx",UgimLH98zS-6cngCoAEC,0.0,0.0,2015-12-11T22:29:24Z,0.9998107552528381
676.0,Beautiful sign off. Love you too. Love you all :-),UghMeWxD9YR7MngCoAEC,0.0,0.0,2015-12-10T21:16:55Z,0.9998749494552612
677.0,"Love the Eagle pose made me sweat as well! hahaha Thank you for all these videos, I always laugh in the middle of this practice because you are so light and fun <3",UgioUKTCEHO6p3gCoAEC,0.0,13.0,2015-12-08T10:18:59Z,0.9998493194580078
678.0,"Thanks Adrian! It has been hard staying motivated to do yoga everyday, going to classes can be such a hassle. But now I look forward everyday to doing yoga with you! I don't know what I am Gina do when the thirty days is over :(",UgiDxUcs2oMdzHgCoAEC,0.0,0.0,2015-12-07T16:28:11Z,0.997205913066864
679.0,"The best day! I love you Adriene, your yoga makes me haapy!",UgiO9-2rTryDKXgCoAEC,0.0,0.0,2015-12-06T19:49:29Z,0.9998418092727661
680.0,Love you mamas! Thank you and ever so grateful,UgjmWChBB-biFXgCoAEC,0.0,0.0,2015-12-06T16:20:32Z,0.9998680353164673
681.0,I stopped yoga for two weeks and pulled a muscle at 11:41.  Should've been more careful ='[,UgiEY4rqEW5VKXgCoAEC,0.0,0.0,2015-12-02T04:39:55Z,-0.9981672763824463
682.0,"""or creeping up, with my bad..... jokes"" hahaha =)",UgjxX_bnLqXa23gCoAEC,0.0,1.0,2015-12-02T03:55:50Z,-0.9996055960655212
683.0,"Love you too Adriene ! This is changing my life... opening up my heart, little by little. Coming back to life.",UghY0Y6hrNth3ngCoAEC,0.0,1.0,2015-11-23T18:05:57Z,0.9997573494911194
684.0,Thank you very much Adriene,UgipH6jhav0tWngCoAEC,0.0,0.0,2015-11-21T21:31:48Z,0.9998124241828918
685.0,I was emotional when she said I love you very nostalgic,UggMkyYQBkZBSXgCoAEC,6.0,272.0,2015-11-21T16:33:37Z,0.999413013458252
686.0,Day 13 done on Friday the 13th. Feeling lucky! :),UgiAURP_t0V13ngCoAEC,0.0,0.0,2015-11-13T21:15:49Z,0.9995759129524231
687.0,"Thanks, Adriene! It's very hard to make me wish to exercise and I look forward the practice with you everyday.",Ugif-F3sk3GcOngCoAEC,0.0,0.0,2015-11-12T09:41:07Z,0.9987921118736267
688.0,"Thank you for sharing these lessons, Adriene! Never thought yoga is for me, but I enjoy it so much! I disliked the downward facing dog first, because it hurt my wrists so much, but it is getting better. Do you think the dizziness during mountain pose after forward fold will go away too? Greetings from Austria!",UggI2kHFvFutKHgCoAEC,0.0,0.0,2015-11-05T20:13:42Z,0.9468811750411987
689.0,since i knew the yoga bridge and eagle poses my fav !! what aday !! thanx adriene !!,UgiYX37e_zCmvXgCoAEC,0.0,1.0,2015-11-01T18:20:50Z,0.9969906806945801
690.0,"Totally loving this 30 days of yoga!  Even on the days when I get home from work tired I look forward to not knowing what's going in to be in my practice that day.  This is so great, thanks Adriene.",UgjQfK1W_2pOWXgCoAEC,0.0,1.0,2015-10-31T17:35:40Z,0.9998505115509033
691.0,"If you had a headset on, the voice would be a more consistent level and would not sometimes blast me out of the room and other times make me think I have gone deaf. I do LOVE your sessions.  Thanks for being there and listening.",UgjzVd0TikZmMXgCoAEC,0.0,0.0,2015-10-25T11:08:03Z,0.9989593029022217
692.0,for some reason im not sweating am i doing something wrong or what,Ugg_KauVJ3OCwHgCoAEC,0.0,0.0,2015-10-23T02:19:50Z,-0.8923464417457581
693.0,"yeihhh! day 13. thanks Adriene for these, 30 days of Yoga.",Ugj8RQtRhFPquHgCoAEC,0.0,0.0,2015-10-21T21:33:27Z,0.9981412887573242
694.0,tellement bon . merci adrienne,UgiKkomzgv-AQngCoAEC,0.0,0.0,2015-10-07T21:35:52Z,0.9793736934661865
