,comment,comment_id,reply_count,like_count,updated_at,calificacion
1124.0,"""We'll start on our back"": hell, yes! Hell, yes!!!!
I'm doing day 4 a day later since I didn't have the energy to do it yesterday, health-wise. I love energy flows a bit more every time that I do them. My energy is awakening and it feels crazy, freakin' good!!!! (Especially today, I must say) It might sound silly but it's like something inside of me is getting activated and it makes me feel like I can do anything, like I can go on without feeling the need to stop! Breathing is even more important during these flows, it truly helps you move in a much easier way. Focusing on my breath tremendously helps me not focusing on my weaknesses and struggles. I might need to work on the ""upward-downward energy"", though, as I'm not sure I really felt them; maybe because it's 2 contradictory things so my brain can't focus on both of them...


(today, i activated my strength. + the joy and pleasure of getting on the mat - which i think is a very necessary ""notion"" in yoga)",UgzMdy6pA3d-e2DUoQF4AaABAg,0.0,2.0,2020-01-06T21:07:00Z,0.9978038668632507
1125.0,"""Like you love yourself"" ❤️",Ugwqv2NJN2By8ls_fxt4AaABAg,0.0,0.0,2020-01-06T20:58:53Z,0.9988127946853638
1126.0,Thank you Adriene! You are bringing love and joy into the homes of millions.,UgwjACKCBTyV_OExa0t4AaABAg,1.0,0.0,2020-01-06T20:46:50Z,0.9998819828033447
1127.0,Namaste 🏡🙏,UgzXhEyRdWO2Zb4eR9t4AaABAg,0.0,0.0,2020-01-06T20:45:44Z,-0.8081023097038269
1128.0,"I don’t know why, but this practice really spoke to me. Sometimes doing yoga I feel a little lost or unsure – not during this one! I had a feeling of ease, freedom. It’s wonderful.
“You have all you need.” Damn yeah! We all do. Sending love to anyone reading this. <3",UgyMFJsEXovx539ecPx4AaABAg,0.0,0.0,2020-01-06T20:43:32Z,0.999836802482605
1129.0,I love how I start your practice with jumper and end up with t-shirt 😂😂 always!!,Ugw8EE-Ou9QXy0zi_Tp4AaABAg,0.0,0.0,2020-01-06T20:24:35Z,0.9984007477760315
1130.0,I felt a flow of energy running up and down my body! I am activating my body but at the same time reconnecting with my inner center.   Thank you! you are amazing!,UgxqrTqfaojfuAOClD54AaABAg,0.0,0.0,2020-01-06T20:19:18Z,0.9998579025268555
1131.0,That had me sweating! Love this community ❤️,UgyfCKcW_75Sb5Yuzlp4AaABAg,0.0,0.0,2020-01-06T20:15:09Z,0.9994946718215942
1132.0,"I'm only on day 4 and its seriously changing my life. I'm noticing g a physical change already and so are other people. I have more mental clarity and confidence. I'm healing and releasing trauma that I've carried my whole life. I love the theme of this challenge! I've often explained yoga as ""coming home to yourself"" . I am so grateful  to be on this journey with all of you!",Ugw-kKpq3OVNJ-Kzsqp4AaABAg,0.0,0.0,2020-01-06T20:13:04Z,0.9997813105583191
1133.0,Namaste.,UgyvhePDDcf5t8TvEml4AaABAg,0.0,0.0,2020-01-06T19:23:33Z,-0.7076319456100464
1134.0,so happy right now right here. lots of love from Romania.  Namaste!,Ugw8ppsOH0NcNx2RzDp4AaABAg,0.0,0.0,2020-01-06T19:18:49Z,0.9998819828033447
1135.0,Thank you ❤️,UgwEB5lXPvNQ0woDHL14AaABAg,0.0,0.0,2020-01-06T19:01:13Z,0.9998127818107605
1136.0,Do you have a video featuring modifications with people with various physical disabilities? I think this might help me figure out ways to stay in the practice with y'all.,UgxgMgSDA070InK4m9h4AaABAg,0.0,0.0,2020-01-06T18:42:01Z,-0.9983310103416443
1137.0,Gentle way of activation. Joining you guys from London however location disappears during this practice.,Ugzw-0o5RxxGOnnTT054AaABAg,0.0,0.0,2020-01-06T18:13:01Z,-0.9985652565956116
1138.0,"My hamstrings hurt so so bad after my other activities so forward fold today was extremely painful, but instead of pushing myself to straighten my legs all the way I kept a nice bend. Time to activate self awareness and self care",UgxSbX_iDwPP9lsEXdl4AaABAg,0.0,0.0,2020-01-06T18:05:28Z,-0.9854221343994141
1139.0,"I am dying with the flu but I AM DOING MY BEST to keep up and you know, it's not about doing it perfectly, it's about showing up. THANK YOU Adriene. X",UgynZD_4MEUwKwTt0l54AaABAg,0.0,0.0,2020-01-06T17:53:26Z,0.9976805448532104
1140.0,I’m an opera singer and something tells me I’ll be coming back to this video often...,UgzQSu-wVLXnzMU9u7V4AaABAg,0.0,0.0,2020-01-06T17:35:41Z,0.9967257976531982
1141.0,is it acceptable to use a yoga block for lunge poses? my breasts kinda get in the way when i do them and using a block makes it way less of an annoyance.,Ugz7gPcAUTXYoKBxzWp4AaABAg,0.0,0.0,2020-01-06T17:28:19Z,-0.9963020086288452
1142.0,What a joy it is to be on this HOME journey.  A year is too long since I participated in DEDICATE!  It is wonderful to be guided in the new videos...unsure of what to expect...staying OPEN!  Thanks Adrienne. Greetings to all HOME yogis..haha I just thought of my HOMIES...lol. Peace to all ❤️🙏,UgwnoaC3nBN8ihl4qgF4AaABAg,0.0,0.0,2020-01-06T17:24:41Z,0.999607503414154
1143.0,"I love practicing YWA at home. It makes my life easier and certainly I get a benefit for my body, mind, heart, and soul. 
I never thought I would be able to practice yoga like this. I enjoy it and I can see improvement in every practice.
Thank you so much for giving the best of you to others.
Namaste",Ugyfih5uWtU1bidMJxR4AaABAg,0.0,0.0,2020-01-06T17:13:10Z,0.9998043179512024
1144.0,Adrienne could u please tell the link to the music that is being played behind in the beginning,UgwqGKPsW9pqLqGFQCR4AaABAg,0.0,0.0,2020-01-06T16:46:37Z,0.9388352036476135
1145.0,Thank you for this beautiful flow Adriene ❤ I  absoltely love it how you remind us that we are sharing the energy with people from all over the world; because after all we are all part of one great love 🥰❤,Ugx3QuFS--iZna9AS_R4AaABAg,0.0,0.0,2020-01-06T16:37:21Z,0.9998792409896851
1146.0,A fun practice that was pushed me but not to the point of discouragement.,Ugy36TmO6gNBbsEGvEl4AaABAg,0.0,1.0,2020-01-06T16:31:16Z,0.9979265928268433
1147.0,Thank you! Wonderful practice ❤,UgxUHPPgzoC5OkrzZRN4AaABAg,1.0,0.0,2020-01-06T16:30:57Z,0.9998807907104492
1148.0,Thank you so much for your time and consideration in making theses videos ❤️✨,Ugy9TOA8RSf9xmOtVVN4AaABAg,0.0,0.0,2020-01-06T16:28:00Z,0.9996974468231201
1149.0,Awesome Practice Adriene!!  So far #3 and #4 are my favs.  You never disappoint.  Namaste,UgwhXa49xhhPK93V6qV4AaABAg,0.0,0.0,2020-01-06T15:47:16Z,0.9997637867927551
1150.0,"omg I love Benji so much, it makes me cry. (and Adriene, of course) <3",UgxYCVXTtj-SlNhLwgl4AaABAg,0.0,0.0,2020-01-11T00:59:25Z,0.9603769183158875
1151.0,"It be nice if you could define what you mean by ""energy"", as the whole let energy go up and down thing flew right over my head. That's not to say I didn't enjoy day 4 😀",UgxdGlsFWQpCBnDqFwB4AaABAg,0.0,0.0,2020-01-06T15:25:15Z,-0.990517795085907
1152.0,All this time I thought I hated yoga.  I guess I just hadn’t found the right guide.  This is amazing! Thanks so much Adriene!,UgyJ2i-373Zr9JLEUEB4AaABAg,0.0,0.0,2020-01-06T15:23:18Z,0.999566376209259
1153.0,Did day 4 and 5 back to back. Missed my mat but I'm back now. Lovely positive sessions that make you feel very happy and alive thanks Adriene :-) x,Ugz3v-bhGGo5Ak6W7154AaABAg,0.0,0.0,2020-01-06T15:03:51Z,0.9998695850372314
1154.0,".my dog unlike Benji is not great at sitting quietly in the corner and believes forward folds equal belly rubs, and yoga mats are for sharing.

My New Years resolution was to finally complete a 30 days of yoga series in the 30 days, previous attempts have seen me make it 17 days or completed the 30 sessions in 46 days, however this time I’m making time to do yoga, remembering each day is one day, allowing myself to do what I can and just be.",UgzjWFlX3jWJGU7RlBt4AaABAg,0.0,0.0,2020-01-06T14:54:51Z,0.9339455366134644
1155.0,"Wow that was quite a bit more energetic, wonderful thank you so much Adriene 😍🙏🏻😍🙏🏻",Ugw9Rr_AJU9e5yg6GJd4AaABAg,0.0,0.0,2020-01-06T14:40:53Z,0.9998763799667358
1156.0,Danke!,UgxS39bXT7iseW43BFR4AaABAg,0.0,0.0,2020-01-06T14:28:06Z,-0.5558063983917236
1157.0,Today was the first time I practiced yoga with my newly adopted puppy next to me! I am so grateful for him and hope I can give him such a great life as you do for Benji! (I also hope he'll be as well behaved as Benji soon lol),UgzVKrviDJVulvZK1lJ4AaABAg,0.0,0.0,2020-01-06T14:25:58Z,0.9997827410697937
1158.0,One day late but... We got this! Thank you Adriene!❤️,UgxS4lgICwEpSo3RSft4AaABAg,0.0,0.0,2020-01-06T14:15:18Z,0.999498724937439
1159.0,Namaste xxxxxxxx,UgwP9CfmFI_F5XrFMPB4AaABAg,0.0,0.0,2020-01-06T14:12:27Z,-0.8915504217147827
1160.0,Only women here. Wow I feel lonely.,UgyBEoqUMh2CiVNsUT54AaABAg,1.0,0.0,2020-01-06T13:57:04Z,-0.9603202939033508
1161.0,Namaste :),UgzMxlpRiuMIqEXtG6t4AaABAg,0.0,0.0,2020-01-06T13:53:04Z,-0.5511691570281982
1162.0,"Day 4 for me in Norwich, Vermont, USA. Today I was able to wake up without hitting the snooze button 500 times, and feel energized for the day after this practice. Thank you! <3 Valerie",Ugw52ZnAUBPuTTm0iEt4AaABAg,0.0,0.0,2020-01-06T13:45:28Z,0.9997170567512512
1163.0,"Thanks Adriene.❤😊 you are so motivating 
I love all your videos.
Namaste🙏",Ugw46n4oETsZmnQb8gd4AaABAg,0.0,1.0,2020-01-06T13:28:09Z,0.9998563528060913
1164.0,"I feel activated and ready for anything! I usually do my practice at night, but today I did morning and it was lovely to start my day this way! Good morning from Charleston, SC.",Ugxe2mgL7SFP_8cnxop4AaABAg,0.0,0.0,2020-01-06T13:15:36Z,0.9998026490211487
1165.0,"Good morning!  Day #5 in the books,. My body was trembling, I was sweating and needed to modify my moves on the mat. My breathing is getting better with each day I show up. Feeling accomplished.  Have a great day, and be awesome:))",UgzE4USx6Vfhf2wI0Q54AaABAg,0.0,0.0,2020-01-06T13:09:16Z,0.9990410208702087
1166.0,"Oh, this was yummy. Perfect start to a Monday. I was a bit salty a cold got me a day behind until I remembered what day 6 is and now I'm grateful it bought me some time. Ha! Here for it.",UgwYmVgIVXMHRyvxTe94AaABAg,0.0,0.0,2020-01-06T13:01:36Z,0.9948716163635254
1167.0,Thank you youtube for recommending this to me now,UgxBdnJDfD21hLvV_xd4AaABAg,0.0,0.0,2020-01-06T12:56:29Z,0.9996157884597778
1168.0,"Adriene, thank you for this beautiful yoga practice, every morning I’m doing one of your classes. 
🙏🏼 namaste",UgykEfgmJ5J-ow_c57h4AaABAg,0.0,0.0,2020-01-06T12:49:03Z,0.999680757522583
1169.0,Really enjoyed this yesterday with my dude. We had coffee outside and played with our pup after. It was a beautiful start to another beautiful TX day,Ugw-X8cu-ML_-7TYymN4AaABAg,0.0,0.0,2020-01-06T12:43:00Z,0.9997676014900208
1170.0,"Last night while doing this video, my yogi doggie buddy was also laying@ the head of my mat. While you were laughing@ Benjis face in yours, i was laughing@ Buddys butt in mine! Cutest dogs ever! #ywahome",Ugx_wsokILKE17VPTw54AaABAg,0.0,0.0,2020-01-06T12:39:01Z,0.8583574295043945
1171.0,"Brilliant! WONDER TWIN POWERS ( who remembers them), FORM OF MYSELF,.... ACTIVATE!!",UgzzZOdIKG1BfWcqkDB4AaABAg,0.0,0.0,2020-01-06T12:33:15Z,0.9998533725738525
1172.0,Still a day behind but WOW I guess the world pushed me a day behind so I could do this day today! I have two herniated discs in my back and today I woke up with my back really acting up and this practice really helped! By the end of the practice I had a full on emotional release because I felt so strong (even with the modifications I made). Thank you for taking me home today x,UgzNx0Giqt5YvSAdcql4AaABAg,0.0,0.0,2020-01-06T12:30:55Z,0.9991474151611328
1173.0,"Day 4 complete! I’m so happy I’ve even got this far! I have postural orthostatic tachycardia Syndrome and haven’t had a consistent practice for so long. I’m finding these practices challenging, but not impossible. I’m already feeling a change. Thank you so much for the work you do ❤️",UgyFB6rJnWhu1ds6IvN4AaABAg,0.0,0.0,2020-01-06T12:30:38Z,0.9994457364082336
1174.0,my heart was really racing after this practice! so strange because i wasnt even out of breath or anything..maybe a release of anxiety of some sort? always amazed at the body & mind's reactions yoga practice,UgxotojqSlYflY8gQ0B4AaABAg,0.0,0.0,2020-01-06T12:19:21Z,0.9765397310256958
1175.0,My triceps and shoulders are still so sore from the last couple days' chaturangas! 😆 But I am ready for Day 4!,UgzwuBryHEyWNtGs0Q94AaABAg,0.0,0.0,2020-01-06T12:17:27Z,0.9172293543815613
1176.0,"I am two days behind on this 30 day journey however, today is perfect on my journey.  Thank you for today's awakening!",UgzKyeKcQhIfOnR3Tp54AaABAg,0.0,2.0,2020-01-06T12:05:31Z,0.999860405921936
1177.0,I love them of 'Home'.,UgxANYQUciiFIybq5hB4AaABAg,0.0,0.0,2020-01-06T11:56:53Z,0.999864935874939
1178.0,good afterwards. Thank you so much for making these videos.,UgwVLCEyRxRONEErCG14AaABAg,0.0,0.0,2020-01-06T11:50:57Z,0.9998539686203003
1179.0,Best day ever!,Ugwf1olMLfgVrCXGn3V4AaABAg,0.0,0.0,2020-01-06T11:41:30Z,0.9998675584793091
1180.0,"This felt SO GOOOOOOD! I was so scared that this was the dreaded core video that I struggle with so much each year but NO: this was activation. I feel warm, and tired, and so so so good. Thank you Adriene! I am loving this journey so much!",UgxfUyhgsf7EeYgYTbd4AaABAg,1.0,0.0,2020-01-06T11:38:17Z,0.999815046787262
1181.0,"lovin' it, lovin' it, lovin' it!",Ugwd3K5qLKuIvVHWFtl4AaABAg,0.0,0.0,2020-01-06T11:34:15Z,0.9994327425956726
1182.0,My best day so far. Loving it and what a way to start the new year.,UgwPXoANIbLsHMr1zzd4AaABAg,0.0,0.0,2020-01-06T11:29:14Z,0.999876856803894
1183.0,"Ahhhh so beautiful! You look lovely Adriene! I like what you said at the end, I felt very peaceful after a busy day!",Ugzwb2EEhX7yVqe7WRx4AaABAg,0.0,0.0,2020-01-06T10:58:02Z,0.9998660087585449
1184.0,"It's about to be a stressful year for me as our duo is starting to record our first ever album, plus shooting a music video, which I have no idea how to do... yet. So the stress levels are immense, but oh heavens, didn't HOME arrive at the perfect time!!! And ""Activate""?! PERFECT for the beginning of the year. The whole channel makes me feel like there isn't anything I wouldn't overcome and achieve. It's the best physical and mental support and for this, I am beyond grateful! <3",Ugwr8j79ZmCfBIUta614AaABAg,0.0,0.0,2020-01-06T10:44:50Z,0.997761607170105
1185.0,"this is pretty physically challenging for me (the high lunges made me tremble a lot) because since the age of 13 or so I've gotten far less active, but i decided seeming I'm still pretty young (nearly 16) it'd be a good time to start looking out for my future self by taking care of my body and mind as an act of self-love, and mentally it's already helping! 


P.S as a Christian i like to say little prayers while doing prayer hands, so i'm already learning how to make these practices work for me and personalize them a tiny bit!",UgwkLVIauZ3yqCdGxPJ4AaABAg,0.0,0.0,2020-01-06T10:41:50Z,0.995317816734314
1186.0,Namaste <3,UgxUgCfCZFczUo2ZB8J4AaABAg,0.0,0.0,2020-01-06T10:26:24Z,0.6768577694892883
1187.0,"Exactly what I need,thank you Adrienne 💜 I'm looking forward to many more sessions with you, Benji and our yoga community 💜
Love and light, always,  Ally",Ugw7fKp2TeLvN6O6-RZ4AaABAg,0.0,0.0,2020-01-06T10:20:43Z,0.999818742275238
1188.0,Namaste 🙏🏾,UgwMwLIXPyWuq6M8UV54AaABAg,0.0,0.0,2020-01-06T10:00:21Z,-0.8081023097038269
1189.0,"Thank you, it is really beautiful start of the day 🌞",Ugwmp0MPG4wWxZ-nOVl4AaABAg,0.0,0.0,2020-01-06T09:50:59Z,0.9998840093612671
1190.0,"Adriene, I had a kind of spiritual experience in today's practice, something I have never ever encountered before. When you said to imagine a current or flow going up front body and down the back body, I immediately pictured white balls of light moving in a current around and around my body in an endless flow, almost protecting me. I immediately started grinning to myself and closed my eyes. I don't know how I knew but I knew the white balls of light were spirits, I don't know what kind of spirits, just that I know that's what they were and they were protecting me and it made me smile through the whole practice.

At the end of the practice in mountain pose, I was smiling and crying and had this overwhelming sense of happiness and joy. I've never experienced anything like this before and I'm not a particularly spiritual person so it was a little overwhelming. I had a sense of nothing else being present in the room except me and the white lights protecting me, guiding me, looking over me. It was a serene and profound experience. I'm fairly new to yoga and this is my first YWA 30 day journey and I am thoroughly enjoying it.

Have you, Adriene, or anyone else ever experienced anything like this while doing yoga (or at any other time)? I'd be very curious to know.

Thank you for your videos, Adriene, and all your words of support and kindness and wisdom. I love your videos, they are becoming the highlight of my day. Thank you <3 

Bridie",UgxNJ1JBXIdiV3yOl994AaABAg,0.0,0.0,2020-01-06T09:43:07Z,0.9995483756065369
1191.0,Didn’t get much sleep yesterday. Was in two minds if should do today’s yoga or skip. I choose to do it and in the end I was glad I did. 30 days no excuses :-),UgzabvHv-9252XDi5lB4AaABAg,0.0,0.0,2020-01-06T09:29:48Z,0.77679044008255
1192.0,"S U P P O R T
- namaste",UgzufqcqKilPm2VgmRZ4AaABAg,0.0,0.0,2020-01-06T08:24:13Z,-0.9806604981422424
1193.0,When I hear that end music I just want to burst into tears with the overwhelming feeling of love and support that comes from YWA ❣️,Ugz0ZGnnExv704LRZbt4AaABAg,0.0,15.0,2020-01-06T08:22:19Z,0.9996399879455566
1194.0,"Beautiful practice as always! I did Days 3 and 4 back to back to catch up and man I was a bit out of breath by the end. Beautiful practice as always. My hip flexors are so tight, I feel them with ever lunge/crescent/warrior pose. Honestly, I'm really seeing why I've been in so much pain, lately. Weak/tight areas cause so much discomfort! Thank you so much for the beautiful work you do <3",UgyNCQbsvPMpfr9iMI14AaABAg,0.0,0.0,2020-01-06T08:15:41Z,0.9993382096290588
1195.0,"Hi Adriene, thank you for this journey. I'm struggling a little with my inner pressure but love this theme.",UgwHxJTIEfFHMaMLmiF4AaABAg,0.0,0.0,2020-01-06T08:04:50Z,0.9998434782028198
1196.0,"I did NOT want to practice today. There's a relationship tugging at my heart strings, and other life transitions. Taking me away, from me, home. It's a lesson in standing in my own power. I didn't want to activate today, at all. Lol. By the end, I was in tears. I'm complete as I am.  I am supported as I am. Activating heart space, for me. 💕💕 Thank you for taking us on this journey home. See everyone on the mat tomorrow. Namaste. 🙏🙏🙏🙏",UgyAoRN8lkX8wztFP5Z4AaABAg,1.0,0.0,2020-01-06T07:55:43Z,0.9986962676048279
1197.0,Yes!! Keep it going guys!! We got this 💪,UgyzHI2aFNysE92-4BN4AaABAg,0.0,0.0,2020-01-06T07:47:36Z,0.9991834759712219
1198.0,"Great video to start the week, especially on this clouded and dark and Monday morning. Thanks, Adriene! Greets from The Netherlands, Mirjam",Ugx4_LuO9ICMVpQtlR54AaABAg,0.0,0.0,2020-01-06T07:32:56Z,0.999664306640625
1199.0,"The biggest shift for me mentally was from a very small physical movement. When Adriene says ""relax your shoulders"" on the last mountain pose i felt myself unclench.",Ugxi4_8aYAH3cQTrIVd4AaABAg,0.0,0.0,2020-01-06T07:24:11Z,-0.9786478281021118
1200.0,Today was a bit of a struggle as I was admittedly a tad hungover after going out with friends last night.. but I am proud that I showed up and did it no matter how I was feeling. And it helped bring me back to myself as I was experiencing guilt from drinking. I remind myself today is a new day filled with new more healthy decisions!,Ugxd51y4ehVysgPHHoN4AaABAg,0.0,1.0,2020-01-06T07:17:59Z,0.999363362789154
1201.0,Thank you :),UgxIJ3khhqnZx2Rzp1J4AaABAg,0.0,0.0,2020-01-06T07:12:50Z,0.9997853636741638
1202.0,I didn't do this practice yesterday as I knew my body needed sleep. I ended up having the best sleep I've ever had according to my smartwatch and I feel SO energized today. I've been busy with work and chores all day but I'm glad I scheduled this video in when I did. It's the perfect break. I'll do day 5 tonight before bed :) <3,UgxFrcO1865LcDRr_f14AaABAg,2.0,3.0,2020-01-06T07:00:33Z,0.9974530339241028
1203.0,"It was really hard for me to get myself to the mat today, but I am so glad I did. I dont know why this practice made me feel really close and grateful to my body, more willingly to love myself. Thank you for the practice, I am loving this journey so far",UgzlUkr52jXvgrtVNqt4AaABAg,0.0,1.0,2020-01-06T06:50:33Z,0.9998185038566589
1204.0,Who dislike high Lunge as much as I do?,UgyATk8QKyeIAp31nw14AaABAg,0.0,1.0,2020-01-06T06:46:26Z,-0.996250331401825
1205.0,Challenging practice but so rewarding!,Ugx0GkRg5-xtdQc0K994AaABAg,0.0,0.0,2020-01-06T06:46:11Z,0.9998766183853149
1206.0,"Boy was today a difficult one, so grateful for you Adriene. Happy to say I'm still going at it, discipline is the name of the game friends.",UgzmcNYjL-38gFiErUJ4AaABAg,0.0,1.0,2020-01-06T06:38:56Z,0.9997829794883728
1207.0,Thanks a lot and greetings from Germany.,UgyhVQRbukB9PrV4DP14AaABAg,0.0,0.0,2020-01-06T06:32:49Z,0.9997618794441223
1208.0,"Day 4 down, looking forward to Day 5! Felt a little nauseous today thanks to “Mother Nature”, but otherwise very little stiffness. I was also very “daydreamy” throughout the entire session, I was completely lost in my thoughts so much so that I have no memory of what I was even thinking about. Must have a lot on my mind!",Ugwv_RHgH5vgOtoWI6p4AaABAg,0.0,0.0,2020-01-06T06:22:38Z,-0.9986794590950012
1209.0,"You always seem to have the right words Adrienne. When it is a struggle, and I am distracted and sore (and feeling a little sorry for myself) your words motivate me.  Activate will be my new mantra when I'm telling myself I can't do this.",UgygcMZ0dt2vvepMffB4AaABAg,0.0,0.0,2020-01-06T06:16:29Z,0.983737587928772
1210.0,Today was a rough day. So I'm glad I saved my practice for the end of it!! Only negative: my dollar store yoga mat I purchased in June now has a hole in it :(. Hoping it will survive to the end of these 30 days!!! Namaste!!!,UgyCvtTn28ZzUSugzAp4AaABAg,0.0,0.0,2020-01-06T06:04:38Z,-0.9986107349395752
1211.0,wish u would release these earlier😭 it’s 11am in pakistan by the time they come out and i can’t do them first thing in the morning like i would like to 😔,UgyJfrhsj8A1uS1U-lx4AaABAg,2.0,0.0,2020-01-06T05:57:03Z,-0.9962659478187561
1212.0,"Thank you for today's practice Adriene. I woke up this morning, my mind swirling with ideas and things to do. So grateful that I took a moment to press pause and bring the chaos in my mind to the mat. Discipline....",Ugwnx8-AzmpzWmmBLxl4AaABAg,0.0,0.0,2020-01-06T05:56:38Z,0.999643087387085
1213.0,"Love that notion of the breath always comes first, what a great session❤️ hope everyone else enjoyed the yoga together today - we really do have everything we need..that was perfect timing at the end to stick with me throughout the rest of the day xx",UgxV-rDsYaVJArhrStl4AaABAg,0.0,0.0,2020-01-06T05:50:32Z,0.9996618032455444
1214.0,"Texas ""T"" Amazing! Couldn't ask for a better yoga instructor and mentor. Discovering YWA 2 years ago, 2 weeks before my wedding day, has been a lifestyle change. Thank you 🙏🧘‍♀️",UgxfI7iDOD6E4JoaXI54AaABAg,0.0,0.0,2020-01-06T05:49:43Z,0.9976796507835388
1215.0,"Just woke up at 5.15am in the morning (running on 5 hours sleep and trying to get back into a work/sleep routine after Christmas) and just completed Day 4! So worth it. Woke up feeling groggy, moody, not looking forward to my first Monday back since I stopped for Christmas break. Now I feel refreshed and ready to take on the day and everything in it. My mantra for today will be 'I have everything I need'... Thank you, Adriene. :)",UgzirZLGQ5LLjg2okiV4AaABAg,0.0,0.0,2020-01-06T05:49:36Z,0.9993332028388977
1216.0,"Day One I was creaky and stiff. Day Four and I feel already more able, stronger, and encouraged. Your wording is so allowing, so affirming. Thank you. I love the acceptance. All the beautiful life lessons and self-care make me so happy!! I do experience some left knee pain with some positions so I adjust as I need to. I also have a torn hip labrum and would love some modifications of some asanas (outward rotation is a challenge for instance). Namaste.",UgxxMyMeZuQLly148et4AaABAg,0.0,0.0,2020-01-06T05:48:28Z,0.9996614456176758
1217.0,Sry to report late but I did day 4 also Namastey 🙏🏻,UgyTpaVV9QWPRO5DvzN4AaABAg,0.0,0.0,2020-01-06T05:48:27Z,-0.9611968398094177
1218.0,"I was so sad this morning when I woke up feeling tremendously sick. Towards the end of the day, I attempted the video with all the modifications but will sadly have to leave the rest to tomorrow. All part of the journey 🙏",UgyfWrz8-ur27xewruB4AaABAg,0.0,0.0,2020-01-06T05:46:22Z,-0.9990561604499817
1219.0,"“Stand up tall, like you love yourself” ❤️❤️❤️",Ugwmt7QKWzN59fIwSsJ4AaABAg,0.0,2.0,2020-01-06T05:44:30Z,0.999677300453186
1220.0,We got this! :-),Ugxg-Nk-QTMNoJDW8fZ4AaABAg,0.0,0.0,2020-01-06T05:42:23Z,0.9967064261436462
1221.0,Namaste. ✨🧘🏻‍♀️🥰,UgxBdgwIh7a72ja4Glh4AaABAg,0.0,0.0,2020-01-06T05:41:25Z,-0.901008129119873
1222.0,"The views went up 4K while I practiced today, namaste my friends ❤️",Ugzhm87O5Cz-ZTgdsMp4AaABAg,0.0,1.0,2020-01-06T05:40:39Z,0.9022541642189026
1223.0,i cant do the lungs on my right leg cuz putting alot of weight on my knee hurts it. i have patellofemoral syndrome so i have to modify,Ugz6BnKZ-IZ9HXq0y9x4AaABAg,0.0,0.0,2020-01-06T05:34:27Z,-0.9994704127311707
