,comment,comment_id,reply_count,like_count,updated_at,calificacion
1591.0,Starting this a couple days late. I won't be doing it every day but will do it in between days when I run or do weight lifting to stretch myself out. Yoga is about what works for you!,UgwoG7LSQx9ESSK8W-54AaABAg,0.0,0.0,2020-01-05T18:02:55Z,0.9346073865890503
1592.0,"I have never focussed so much while doing a lunge! Wonderful! I echo Andrea...""I have everything I need."" Excellent mantra.",Ugy8TD-0Sp3TNiCWc_d4AaABAg,0.0,0.0,2020-01-05T18:01:08Z,0.9998140931129456
1593.0,I loved the rock n'roll bit so much! Thx Adriene!,Ugzs8CWseAYN9vjf_pp4AaABAg,0.0,0.0,2020-01-05T18:00:40Z,0.9997759461402893
1594.0,Wonderful.,UgzLdRKjTZ7DNPNM-JJ4AaABAg,0.0,0.0,2020-01-05T18:00:35Z,0.9998692274093628
1595.0,"I love the pep talks you give. I often modify to make things simpler the first time through a practice, but today I did the full standing lunge when you suggested it! It gives me a deep sense of pride and satisfaction. This is the first year I've joined the journey and I'm so glad I have. :)",Ugzqajlj6qB-Cdo2GBF4AaABAg,0.0,0.0,2020-01-05T17:58:50Z,0.9997896552085876
1596.0,"Rock and roll was apparently an invitation to play for my puppo! 🐶 Love it when she gets involved. Great practice today, loving this journey home. 💜",Ugy6EH4VIOxkqAwcIZF4AaABAg,0.0,0.0,2020-01-05T17:58:34Z,0.9998055100440979
1597.0,"Hi everyone, hope you're well! Wanted to share something quickly please... I've just finished a workout DVD which I've not done in months. Regular YWA has not only built a surprising amount of strength & stamina while said DVD gathered dust but even better, Adriene's supportive words rang clear in my mind throughout, 'soften the skin of the face; focus on the breath; lift the corners of the mouth.... just a little; how you move is important; what signals are you sending if you jerk yourself around'.
It was immensely encouraging & humbling to notice simultaneously the mental & physical benefits of just a few months of practicing YWA & how these things are manifesting off the mat. 
Have a great practice everyone! 💖 #holdinghandssavasana",UgyOAbypaqi3hgPJwNB4AaABAg,0.0,0.0,2020-01-05T17:58:02Z,0.9992576241493225
1598.0,Crazy as it seems I already feel like I’ve progressed. Thank you so much x,UgxgYgAJiy3V6xEApAd4AaABAg,0.0,0.0,2020-01-05T17:57:53Z,0.9996999502182007
1599.0,"Well done, Adriene, you've just moved me to tears, just doing what you always do, with so much love and compassion and understanding. Heaven must be missing one angel...... All my love and very, very much respect. Gina",UgxaqlXFfXg5Aqv43yh4AaABAg,0.0,0.0,2020-01-05T17:57:30Z,0.9996758699417114
1600.0,"My mind was super distracted today! I may not have been able to hit that zone or focus today, but I am glad that I showed up!",Ugz4O4zG3BASli9-Pk94AaABAg,0.0,0.0,2020-01-05T17:55:37Z,0.999045193195343
1601.0,"""There will be bumps on the journey home."" ❤️ I've done all your previous 30 days, but this one really strikes a cord with where I'm at right now. After a bumpy decade, with four children born in six years, full-time job, a near-divorce, and so, so many inner demons, I am truly trying to find where my home is now.  This is such a wonderful help! Thank you for helping me overcoming the bumps on my journey. ❤️",Ugwe5DrNRR6FQCw_kM54AaABAg,0.0,0.0,2020-01-05T17:53:25Z,0.9996182918548584
1602.0,"""I have everything I need"".  Thank you for a wonderful Day 4.  The awesomeness just continues each day!",UgwiM4a8V2yM-1ig_uF4AaABAg,0.0,0.0,2020-01-05T17:46:46Z,0.9998860359191895
1603.0,"Thank you, thank you so much Adriene for your light and love.  MARY OLIVER is one of my dearest poets and guides.  
With deep gratitude from Comox, Vancouver Island, BC, Canada


""Every day, 
I see or hear
 something 
that more or less
 
kills me
 with delight,
that leaves me 
like a needle


in the haystack
of light.
It is what I was born for--
to look, to listen,


to lose myself
inside this soft world--
to instruct myself
over and over 


in joy,
and acclamation.
Nor am I talking
about the exceptional,


the fearful, the dreadful,
the very extravagant--
but of the ordinary,
the common, the very drab


the daily presentations.
Oh, good scholar,
I say to myself,
how can you help


but grow wise
with such teachings
as these--
the untrimmable light


of the world,
the ocean's shine,
the prayers that are made
out of grass?


Mary Oliver""",Ugxf0k0pA4eEzMRL6Gp4AaABAg,0.0,0.0,2020-01-05T17:41:52Z,0.9931479096412659
1604.0,I put this off until late in the afternoon as I felt really tired but yoga magic did it’s thing and I felt lifted after the practice-even my hands were tingling. Thank you x,Ugz9g4AlwH3Ki346MwB4AaABAg,0.0,0.0,2020-01-05T17:40:32Z,0.9990535378456116
1605.0,short and sweet and verry effective. Thanks,Ugz9MlhgGqxZG3Uhpo14AaABAg,0.0,0.0,2020-01-05T17:39:43Z,0.9998658895492554
1606.0,Sweet and short but verry effective. Thanks,UgzkTcY_n9q_jidEADp4AaABAg,0.0,0.0,2020-01-05T17:38:58Z,0.9998431205749512
1607.0,"come around, Rosi Golan...",Ugzxmtk-0_WfBcub_LZ4AaABAg,0.0,0.0,2020-01-05T17:37:57Z,0.9979164004325867
1608.0,With each day my back feels better and better!,UgyPli-3bJ7sRmNW0XF4AaABAg,0.0,0.0,2020-01-05T17:35:07Z,0.9975324869155884
1609.0,i was sweating today.....felt sooo good!!,UgwbJvz2Zilbo4235C14AaABAg,0.0,0.0,2020-01-05T17:34:20Z,0.9994480013847351
1610.0,🙏🏼Yoga is life altering,UgxqBgBjUU2lfaKd_SV4AaABAg,0.0,0.0,2020-01-05T17:34:12Z,0.998439610004425
1611.0,"This was lovely. Broke a sweat on that last semi chair posture (I love chairs), and the words of encouragement at the end really resonated. Thank you for sharing your gift.",UgwjNMIuCGqshKsjFiR4AaABAg,0.0,0.0,2020-01-05T17:33:42Z,0.9998760223388672
1612.0,Day 4 done 🌱 Day 66 of daily practice,UgwtgbZSL8mOZg2LqCx4AaABAg,0.0,0.0,2020-01-05T17:32:40Z,-0.7603718042373657
1613.0,This was the hardest one to show up for so far. But also the one that went by the fastest once I was on the mat.,UgwoVJsdXQHhjirnVV14AaABAg,0.0,0.0,2020-01-05T17:32:37Z,0.9947172999382019
1614.0,LOVED IT!!,UgxMZSVC4DEKiP0v_ex4AaABAg,0.0,0.0,2020-01-05T17:32:32Z,0.999885082244873
1615.0,Namaste To all! Question Adriene... did you film this before Ram Das passed? ❤️,UgzJFj5XPMRVFej6dQ14AaABAg,0.0,0.0,2020-01-05T17:32:15Z,-0.9896932244300842
1616.0,Finally up to date with this !! And already starting to hum the theme song at the beginning !,UgwBijc5JbHOcV9dl514AaABAg,0.0,0.0,2020-01-05T17:31:52Z,0.9991798996925354
1617.0,"We Got This! You have everything you need, as do I. XO Thank you so much!",Ugw6KSADn4c2Y6vrfrF4AaABAg,0.0,0.0,2020-01-05T17:31:25Z,0.9998373985290527
1618.0,I feel very refreshed and ACTIVATED after this practice. There was a lot of pride for me in how strong I felt in some of these poses and how mindfully I moved. Namaste everyone!,Ugz_x4EQx7sQpC4N_4p4AaABAg,0.0,0.0,2020-01-05T17:31:23Z,0.9997966885566711
1619.0,"I had the opportunity to take a nap this Sunday afternoon, but instead I clicked your link and I 'activated' my body! You mentioned in the workout that we 'have the tools'. It has always been my motto, my mantra, in whatever I do, that its all about having the right tools to get the job done. My passion is baking and I always find that having the right tools is priceless. I'm so happy that you used this phrase today, as I truly connected. It IS always about the right tools. Thank you for the metaphor. Your video's are the tools that I need to help me on my journey HOME! Namaste. Have an awesome Sunday Adrienne! :)",UgzcNyub3fAQob4sk0R4AaABAg,0.0,0.0,2020-01-05T17:26:41Z,0.9997490048408508
1620.0,Today's was lush for me. thank you.,Ugx1jtC08flvJB7ehF54AaABAg,0.0,0.0,2020-01-05T17:24:56Z,0.9998760223388672
1621.0,I love so much this journey! but I am a beginner and my body is so sore already...,UgyqCjCCNMiYskvZM6l4AaABAg,0.0,0.0,2020-01-05T17:23:27Z,-0.9980536699295044
1622.0,"Thank you for today’s practice. I’m feeling so grounded and strong, we are all so lucky to have you Adriene. ❤️",UgyP2ucdm3IYgxM7ehZ4AaABAg,0.0,0.0,2020-01-05T17:22:22Z,0.9998762607574463
1623.0,Such a nice one today! Thank you 🙏❤️,UgwY_-Tp3mE2kh_ozJF4AaABAg,0.0,0.0,2020-01-05T17:22:21Z,0.9998698234558105
1624.0,Beautiful practice. Thank you for this gift. Love to you and Benji! 🙏,UgwrZ697_Mx0jlus0-t4AaABAg,0.0,0.0,2020-01-05T17:22:02Z,0.9998844861984253
1625.0,When you said activate you weren't kidding! This is a great short practice to activate your muscles! I'm enjoying learning to slow down.,UgwxA2gW8CAVS7TB6BJ4AaABAg,0.0,0.0,2020-01-05T17:21:56Z,0.9985451698303223
1626.0,"You’ve changed my life, thank you for doing every video with so much love and care. Every morning I spend an hour with your videos and it fills the rest of my day with joy.",UgyINIAjHGXgaFLNMLp4AaABAg,0.0,0.0,2020-01-05T17:20:41Z,0.9998582601547241
1627.0,"Awesome practice! I love the slowing down and the increase in my focus. I am enjoying the journey home. Does any one out there remember Kenny Loggins song "" Celebrate me home"" Super song in my opinion!",Ugy_XqWJLOVONehcvfB4AaABAg,0.0,0.0,2020-01-05T17:18:39Z,0.9998549222946167
1628.0,I love how you describe the energy movement in our body.   It is soothing and very helpful in improving my practice.   Thanks for the gift of you.   Namaste,Ugzg3hVGRwhTbKpiaOl4AaABAg,0.0,0.0,2020-01-05T17:18:00Z,0.9998526573181152
1629.0,🎵Activated and it FEELS so GOOD! 😁,UgyrGZh2v7NHlS3lqOB4AaABAg,0.0,0.0,2020-01-05T17:17:33Z,0.9998863935470581
1630.0,Today really touched my heart and soul 💕,UgznRDn7q3lOLXtC5C14AaABAg,0.0,0.0,2020-01-05T17:14:47Z,0.9997633099555969
1631.0,Yum. It's a beautiful sunny morning here in Northern CA. The Mary Oliver poem brought tears to my eyes  This practice has set a wonderful tone for my day and for supporting my intention. Thank you Adriene. Namaste to all of you.,UgxtQ8w3vUET9FDsUy54AaABAg,0.0,0.0,2020-01-05T17:13:19Z,0.9998712539672852
1632.0,"Activate our bodies, activate our minds, activate our actions to do good and beautiful things....",UgwXFV2bOloTTt_AfIJ4AaABAg,0.0,0.0,2020-01-05T17:13:04Z,0.99982088804245
1633.0,Oh my precious feet. Thank you! <3,UgwsnGCwKRYAXwgq2XJ4AaABAg,0.0,0.0,2020-01-05T17:11:56Z,0.9998418092727661
1634.0,"when i found out today was ""ignite"" i wasnt that excited hahah i was scared i was going to be trembling and cursing you the whole time ahhaha well to my surprise it wasnt like that at all... it was actually lovely and felt like i needed to hear some of that stuff ..like about discipline and action.. i'am thankful you do this so that i can challenge my self but also help me achieve the things i've always wanted for my self.. like daily yoga practice <3",Ugzn-jDtDdoTsGJtjmx4AaABAg,0.0,0.0,2020-01-05T17:09:39Z,0.999329686164856
1635.0,"This was perfect for a Sunday!!!  This is my first time following in real time and I feel already it is so different then doing it on my own time, if that makes sense...if I did this on a Monday I would of felt like I needed more for the beginning of the week BUT Sunday..oh yes ma'am!!!  Thank you again for this great class!!",UgyMir6topndXjvY2qV4AaABAg,0.0,0.0,2020-01-05T17:09:26Z,0.9994112253189087
1636.0,Everything hurts! I definitely am awakening. :),UgzkT8mnUvKLCFTvnAJ4AaABAg,0.0,0.0,2020-01-05T17:07:38Z,-0.9963642954826355
1637.0,"Blown away about how much stronger I already feel, loved this practice! Thank you :D",UgyLAgEHZKNsIxWe1o54AaABAg,0.0,0.0,2020-01-05T17:06:23Z,0.9987133741378784
1638.0,Today my thigh muscles were still really tired and sore from the previous days. I stuck with it as much as I could but had to take child's pose a few times in between.,UgxDcTRLRfZkAefdLwh4AaABAg,0.0,0.0,2020-01-05T17:05:27Z,-0.9978349804878235
1639.0,"Thank you Adriene, really, really a big thank you!",Ugz5qQS0lnJYK0KLWKp4AaABAg,0.0,0.0,2020-01-05T17:02:55Z,0.9998582601547241
1640.0,"It was a great practice! I feel so energized now, it feels good. I wish I was more determined to do it in the morning but afternoon is great as well. 
Rock'n'roll part made me smile so hard. It's been a while since I've done this. 
There was something about the breathing at the very beginning that got me a bit emotional. I wasn't crying, I was just... moved. But I don't mind, maybe it was needed.
Thank you so so much for today's practice, it put me in a great mood (it already was really good)!",UgyyJOaK_bhic88pdcZ4AaABAg,0.0,0.0,2020-01-05T17:02:21Z,0.9997643828392029
1641.0,"This has been such a lovely progression each day, so far. Thank you for this!",UgxepSQuuqx5tQKt9yl4AaABAg,0.0,0.0,2020-01-05T17:02:07Z,0.9998675584793091
1642.0,"When we were activating the abs, I was surprised that I was still sore from yesterday. Did we even do anything with abs yesterday lol? It's like you always say, a little goes a long way. Broke a sweat and feeling accomplished in how I'm starting my busy Sunday. Thank you all!",Ugw_HgpjaZWNiFjevmZ4AaABAg,0.0,0.0,2020-01-05T17:01:47Z,0.9979737401008606
1643.0,🙏❤,Ugy7F6AHNWL1Tj3KkF14AaABAg,0.0,0.0,2020-01-05T17:01:23Z,-0.6970567107200623
1644.0,"Step by step thanks to ur free yoga am making it to home and heading towards myself  
Thank you",Ugy90l6QY92vRQ2bpPR4AaABAg,0.0,0.0,2020-01-05T17:00:48Z,0.9995467066764832
1645.0,I'm so loving this!!!  This is my third 30-day journey.  I'm never disappointed.,UgxEaJ-O1YiejQrzgCF4AaABAg,0.0,0.0,2020-01-05T17:00:39Z,0.9998877048492432
1646.0,Thank you,UgxosSwlYpOTGANC8GB4AaABAg,0.0,0.0,2020-01-05T17:00:38Z,0.9998352527618408
1647.0,I always look forward to our practices.  Your love and espies de coir inspires me on my journey.  Today's activation has pulled me up from my depression and noticeably helped my ulcerative colitis.  Namaste!,UgxYmHfsCGqF471TyHt4AaABAg,0.0,0.0,2020-01-05T16:56:45Z,0.9994025230407715
1648.0,"Ahh!! I love this! One of my goals doing this 30 day yoga journey was to create happy, warm, positive energy to carry with me through my days. And to just be proud of myself....and today at the end of this practice I just smiled at how I am feeling and how I feel happy, and I have myself a hug. So I know this journey is powerful and worth every second! I hope all of you feel the same! Thank you Adriene! 💕",Ugz94riVwnQnGM56Ncx4AaABAg,0.0,0.0,2020-01-05T16:55:34Z,0.9998812675476074
1649.0,That was incredible!,UgwuB-Bn73wC6xb2Iwp4AaABAg,0.0,0.0,2020-01-05T16:55:06Z,0.9998778104782104
1650.0,"Today I stepped back into plank for the first time! My knees are definitely my weak spot, and I tend to always say “oh no I can’t do that cause of my knees” but today I let go of that and just tried...and I did it! If that’s not proof that our thoughts limit us, I don’t know what is. 
Thank you Adriene. Can’t wait till tomorrow 💕 namaste",Ugx1Um5fQEfAs0tZHlR4AaABAg,0.0,0.0,2020-01-05T16:54:16Z,-0.8108133673667908
1651.0,"BY the Namaste, I was in tears of joy - of release - of activation of getting back to me and celebrating our oneness. Thank you much Adriene. You have changed my life,",Ugx4iHIUm9fqvr0iGIx4AaABAg,0.0,0.0,2020-01-05T16:53:37Z,0.9996935129165649
1652.0,"This practice helped activate the soreness from the practices the last few days. I also got to pay attention to how activating poses like lunge are. I sometimes just fly into these poses but when you pay attention to the energy going up from the front, and down to the back, from ground to up, there is this expansion I feel when tuning into that flow. There is also a transformation in my energetic body that I get to take with me when I step off the mat.",UgyEGl4-XRXz1Acq0ld4AaABAg,0.0,0.0,2020-01-05T16:50:58Z,0.9981687068939209
1653.0,"I am a very shallow breather, this practice made me focus on that and breath more deeply...I hope to keep this deeper breathing strong throughout the rest of the day!  Namaste!",Ugw9s3FJ6WaAj6hF_xh4AaABAg,0.0,0.0,2020-01-05T16:45:01Z,0.9982296824455261
1654.0,"Hey Adriene!  Great video, can you make a pregnancy related yoga video series please? I love your work so much!",Ugz14hA1zlsbquJa0Z94AaABAg,0.0,0.0,2020-01-05T16:42:51Z,0.9997193217277527
1655.0,"Adriene, this community has become such a refuge for me, during a time when it feels like the whole world is burning and fighting. It means so much to have a place of love and peace...a place I can just be me. The stronger and calmer I am, the more I can help others. 🌞",UgxK8LW5t0TvalPDv_B4AaABAg,1.0,28.0,2020-01-05T16:42:41Z,0.9990849494934082
1656.0,"WOW!! Today was awesome! To some extent, even just in these past few days, I've really been felt like I'm just going through the motions because I've had to make myself do it! I've really been struggling with motivation in pretty much every aspect of my life recently. I've been procrastinating everything and yoga has been one of those things but today, even though I wouldn't say I've achieved a lot today, I really really enjoyed this yoga practice! To be honest, these last twenty minutes have been the first time I've felt properly happy about something I've done with my time! Thank you so much Adriene! I really hope I can keep feeling like this throughout this series!",UgwN-ERCzZBfOxxeA3R4AaABAg,0.0,0.0,2020-01-05T16:41:06Z,0.9997535347938538
1657.0,", another on in the books!!!!  Thanks to ALL of you who note comments in the morning!! It's so encouraging to see you guys and your journey first thing when I get up in the morning ❤️...I love seeing where you all are from and feel lucky to see you here - namaste! 🙏",UgyC3fRJ_dpVf330-4h4AaABAg,0.0,0.0,2020-01-05T16:39:52Z,0.9998345375061035
1658.0,"I was diagnosed with Diabetes in November. I am doing well, but have higher blood sugar readings in the morning. My morning blood sugar readings have been lower since doing Yoga with you every morning in this New Year. I am grateful to you as always. Namaste",Ugxc4aDsicDDWI32vdZ4AaABAg,0.0,0.0,2020-01-05T16:37:41Z,0.9993305206298828
1659.0,"So glad you explained the purpose of forward fold, my least favorite. Thanks Adriene, this is my 3rd 30 days with you! Also love the plants and planters.",Ugwh-Qqa41kzeQAdQ854AaABAg,0.0,0.0,2020-01-05T16:41:41Z,0.9997356534004211
1660.0,At the end of the practice today I realised that my journey 'home' is a life free of anxiety again. That's my final destination!,Ugw-o1j-gaogHGP6hiZ4AaABAg,2.0,3.0,2020-01-05T16:34:35Z,0.9991928935050964
1661.0,I love how my body feels after activating the muscles like that. I just feel the prana flowing. ❤️ Thank you for another great practice Adriene!,UgyZ1sW9RRHh4mpoNgd4AaABAg,0.0,0.0,2020-01-05T16:34:26Z,0.9998069405555725
1662.0,Thank you!,UgyBDdX_QA-4aYc2zNB4AaABAg,0.0,0.0,2020-01-05T16:33:44Z,0.9998581409454346
1663.0,"Day 4 Done 😍 it was interesting to activate the breath with a partly stuffy nose 😋 but it was manageable. I particularly loved the high lunges today and the circular flow of energy 😍
Thank you Adriene, thank you every one 😊
Ah yes, on a side note, my furchild cat Coco seems to enjoy our practice. He forgets that he wants to go out and sits right next to the mat ❤",UgxUeG35oEqnC4dqMU54AaABAg,0.0,0.0,2020-01-05T16:33:06Z,0.9992499947547913
1664.0,"I have everything you need , as do you",Ugys07FPBrx_RQyZZsV4AaABAg,0.0,0.0,2020-01-05T16:32:57Z,0.9997237324714661
1665.0,my favorite so far! and my dog Theo joined me today!,Ugyown7yZGYcYQrykb54AaABAg,0.0,0.0,2020-01-05T16:32:41Z,0.9996309280395508
1666.0,"Love it adrian, thank you so much for sharing. Feeling great today :)",UgxvkEex9ndxyySnP4F4AaABAg,0.0,0.0,2020-01-05T16:30:33Z,0.9998588562011719
1667.0,"I don’t know what, but it’s totally active now hahaha
To think I didn’t really feel like coming to the mat today... Adriene just keeps doing more awesome series. How, I ask? This is just awesome.
Thank you again :)",UgyDVjbzGU34bQKVv5p4AaABAg,0.0,0.0,2020-01-05T16:29:25Z,0.9996558427810669
1668.0,"Day 4 is done and my head cold is clearing up! I really loved today's practice. I started yoga about 3 years ago with a trauma-sensitive class specific to survivors of sexual assault. I was very uncomfortable at first, but the class was so compassionate and kind (the teacher reminds me of you, Adriene!) that I stuck through the discomfort. I remember the first pose I really, really connected with was Warrior 2. It was the first time I felt powerful and safe in my body. Can't wait for day 5!",UgxPXlhF1Hky3seI8Wp4AaABAg,0.0,0.0,2020-01-05T16:29:02Z,0.9993478655815125
1669.0,"I might be over 60 years old, bu I often forget that there will be bumps in the road. Fortunately, after the bumps comes knowledge, experience, and good delicious yoga with Adriene!",UgyOfMWAYW1wywlqvJp4AaABAg,0.0,0.0,2020-01-05T16:28:08Z,0.9992857575416565
1670.0,"I wasn’t planning on doing this 30 day yoga journey, but every day so far I have found myself waking up excited to see what the next practice has in store for me that day",UgyaaOof58HNZ-DFPjR4AaABAg,0.0,0.0,2020-01-05T16:28:04Z,0.9988658428192139
1671.0,Namaste on Day 4. Going happy and strong 💪😘,UgyG3oc41H3XI9bfGNx4AaABAg,0.0,0.0,2020-01-05T16:26:30Z,0.999572217464447
1672.0,"We love you Adriene, Benji, and team ❤️",UgxYK1JE22Fiu0TemEt4AaABAg,0.0,0.0,2020-01-05T16:26:25Z,0.9998024106025696
1673.0,Awesome thank you so much! Blessings to you! Namaste 🙏,UgxVZuFX2SZycVI4X6R4AaABAg,0.0,0.0,2020-01-05T16:25:17Z,0.9998693466186523
1674.0,"I feel renewed energy and hope throughout my whole body, mind and spirit. Thank you Adriene. 🤎",UgyzELytgEBeVqoitwt4AaABAg,0.0,0.0,2020-01-05T16:24:43Z,0.9998737573623657
1675.0,"Something curious happened in the last standing pose.   Normally I'm very conscious of my breath when breathing deeply.  My mind says ""breath in, breath out, breath in, breath out.""  But when I arrived at the last standing pose, I noticed my body was breathing beautifully, deeply, and richly all on its own.  My mind was just observing, not directing.  It was such a magical moment as though my body was waking up after a long slumber.  Thank you.",UgzqxSR4KyJD2ZS6ynR4AaABAg,0.0,0.0,2020-01-05T16:19:47Z,0.9995410442352295
1676.0,“I have everything I need.” Damn that’s a mantra.,UgzUeUkEUXnforbFfWp4AaABAg,7.0,1058.0,2020-01-05T16:19:18Z,-0.9864502549171448
1677.0,"I really felt the shake in my legs today, but I found myself very grateful to build on yesterday's awakening of acceptance. I'm trying to meet myself where I am on the mat and welcome the shaking with kindness and excitement.",Ugzce1N1cEsm6LVcy1V4AaABAg,0.0,0.0,2020-01-05T16:18:29Z,0.9997652173042297
1678.0,Feel sooo good,UgxtApkImnSQIykq4Gh4AaABAg,0.0,0.0,2020-01-05T16:17:24Z,0.9998798370361328
1679.0,Feeel soooo good 💦,Ugyhb6RqT2T0c9nDckZ4AaABAg,0.0,0.0,2020-01-05T16:17:04Z,0.9987310767173767
1680.0,What is your intro song?,UgxR9OEm-IicZ5QmnJZ4AaABAg,0.0,0.0,2020-01-05T16:16:44Z,-0.9968781471252441
1681.0,From Iraq .love you sooo much Adriene ❤️❤️,Ugy2kbO_BKYNBWTBkbF4AaABAg,0.0,1.0,2020-01-05T16:15:07Z,0.9983587861061096
1682.0,"When I did the 30 Day Yoga Challenge last year I didn't notice I was building strength until way later in the challenge. Now, it's Day 4 and I already noticed that I'm getting stronger!",Ugz4Mm9ZEI5fMOcFmAp4AaABAg,0.0,0.0,2020-01-05T16:14:53Z,0.9982649683952332
1683.0,"When I did the 30 Day Yoga Challenge last year I didn't notice I was building strength until way later in the challenge. Now, it's Day 4 and I already noticed that I'm getting stronger!",UgxG1DQg1UVpdI2yVzd4AaABAg,0.0,0.0,2020-01-05T16:14:50Z,0.9982649683952332
1684.0,I managed to find a great connection to my breath in today’s practice ✨ Lots of love to everyone 🙏🏼,Ugztj-JutyD228vkR-F4AaABAg,0.0,0.0,2020-01-05T16:14:08Z,0.9998138546943665
1685.0,"Wonder twins power activate! Thank you, Adriene, this one is really invigorating.",UgyhzB50Y8QNxr4as4l4AaABAg,0.0,0.0,2020-01-05T16:13:10Z,0.999869704246521
1686.0,Best part of the morning. :),UgxFvYyElSy7uAN1kWd4AaABAg,0.0,0.0,2020-01-05T16:08:23Z,0.9941237568855286
1687.0,"I woke up sick on day 1, but I was so excited for HOME that I decided to take a shot at it anyway. Each day I feel like the practices have been reminding me of my strength when I feel like I have none, and I feel like it's helping me heal. I'm nearing the end of this cold and I can't wait to see how much more I can get from the videos when I'm back to my normal.",UgwG3-Cip0-NcaOefyZ4AaABAg,0.0,0.0,2020-01-05T16:07:30Z,0.9911777377128601
1688.0,"Returning to yoga, so it is a bit painful. So nice and gentle. Thank you, Adriene!",UgySrpeaDlz7wUtmV754AaABAg,0.0,0.0,2020-01-05T16:07:29Z,0.9997532963752747
1689.0,"I felt absolutely awake at 4PM, should've done it this morning. :"")",Ugz6dALoJlYhSoFiSyN4AaABAg,0.0,0.0,2020-01-05T16:06:50Z,-0.8659102916717529
1690.0,"Oh my! Yes my body has been activated.  😂
But I did it!! Woooo!",UgxDsO3IDzejm_rFdgB4AaABAg,0.0,0.0,2020-01-05T16:06:47Z,0.926401674747467
1691.0,"I simply love your January videos. Thank you. 🙏🏼😘 In the FWFG app I can see Day 5, 6 and 7 🤔 Is it a mistake? 🇩🇰",Ugx33-1jvxry5Si-sy94AaABAg,1.0,0.0,2020-01-05T16:06:12Z,-0.8948392868041992
1692.0,Another great practice!  I have been a loyal yogi of #ywa for 9 months. These is something different about the Home series... is it additional direction I am applying to my practice or is it my outlook on the new series?  It is probably both!,UgzuKl6y_orsXLPrkSx4AaABAg,0.0,0.0,2020-01-05T16:05:38Z,0.9985876083374023
