,comment,comment_id,reply_count,like_count,updated_at,calificacion
216.0,this is honestly the yummiest practice of this whole challenge so far,UgyP-PTaOk7lD70ldmZ4AaABAg,0.0,0.0,2018-03-18T03:35:12Z,0.9599476456642151
217.0,This is the best practice I had so far. Brought me up from my dark place today ❤️,UgxccEmkfM0Hb8UV-V54AaABAg,0.0,0.0,2018-03-17T21:00:32Z,0.9991148114204407
218.0,I must have spent a full 5 minutes trying to stretch my legs the length of the yoga mat because I thought that's what you meant by width since you were facing us sideways *facepalm*,Ugz3RyYywDp0cyocksh4AaABAg,0.0,0.0,2018-03-17T11:25:21Z,-0.9978049397468567
219.0,I love you.,UgykxPoRxNnPw6WnkBZ4AaABAg,0.0,0.0,2018-03-15T15:42:16Z,0.9998705387115479
220.0,"done for day 19, being too lazy for the spring break, need to get back on track :)",Ugz2KmdFDf1L-QxRZJx4AaABAg,0.0,0.0,2018-03-15T04:46:46Z,-0.9966452717781067
221.0,"Balancing poses are so difficult on my left side because of a birth injury to my ankle, so it can be very discouraging. My body just isn't built for balance on that side. But when we switched to the right side, oh I felt like I was flying. Thanks, Adrienne :)",UgxlpoC36Suxm1EpJu54AaABAg,0.0,0.0,2018-03-15T01:18:36Z,0.9902101755142212
222.0,"Sank into a full yogic squat without lifting my heels for the first time today!! Such an amazing ""go me"" moment!! Thank you so much for this wonderful practice Adriene 😊",UgyYl40cyHIjqxELE2Z4AaABAg,0.0,0.0,2018-03-13T17:57:02Z,0.9986999034881592
223.0,"Thank you Adriene, I really appreciate your videos.",UgyqKl7u8GapztbiNS94AaABAg,0.0,2.0,2018-03-12T09:04:37Z,0.9998449087142944
224.0,"Feeling so strong now in these practices , so happy 🙏❤️",UgyUOtVRO7yd-slfYGV4AaABAg,0.0,2.0,2018-03-11T23:52:39Z,0.9998661279678345
225.0,"Gosh Adriene, you are so beautiful in a non-threatening and making-other-people-wanna-better-themselves kinda way. Would luuuuv to hear how you got the this calming and loving place",UgwuCDC1Q3p8XhEytDx4AaABAg,0.0,22.0,2018-03-09T23:06:20Z,0.9998177886009216
226.0,I just moved from Cali to Arizona. Biggest move of my life! I’m so grateful that I could bring you (Adriene) with me! And Julia Roberts is Queen!,UgxVgayr-qgSisppq4p4AaABAg,0.0,0.0,2018-03-09T17:24:18Z,0.9998569488525391
227.0,"My thoughts came from uncomfortable ones to soft and easy at the end to the practice, thanks for sharing. Namaste.",UgynPVv0XrlIDf7hlkZ4AaABAg,0.0,1.0,2018-03-09T13:02:02Z,0.997798502445221
228.0,i was already wearing a ninja outfit 0__0,Ugwh7lpYLSOUUTlPWC94AaABAg,0.0,0.0,2018-03-08T16:20:25Z,-0.967789888381958
229.0,"I'm about a month or so behind on this true yoga journey, but I love doing yoga with your instruction, Adriene! Everyday I'm doing this I listen to your advice about self care and I'm just like man, this girl speaks right to me! Plus you made me laugh everyday which I love too lol you're great Adriene! Never stop doing what you're doing and putting that love out into the world! ✌️💜😊",UgyPsb4UFLkNPdaB35V4AaABAg,0.0,2.0,2018-03-07T19:02:10Z,0.9995651841163635
230.0,Thank you,Ugz8QLILNc3i6FA2GBV4AaABAg,0.0,0.0,2018-03-06T19:08:04Z,0.9998352527618408
231.0,Such a beautiful and positive practise. Thank you! :),Ugx9hY6aVrFDShmvwMJ4AaABAg,0.0,2.0,2018-03-05T07:36:33Z,0.9998898506164551
232.0,Such a good energy flow for such a 'young lady' very profound honest thoughts...thanks for sharing x,UgzFOX-GNUrwfvzP3IZ4AaABAg,0.0,1.0,2018-03-04T13:39:09Z,0.9998643398284912
233.0,"I just managed eagle! It was definitely not elegant, and slightly wobbly, but the focus and the breath felt amazing. Learning so much from you Adriene <3",UgwoF5Woi4ybIJ_ZXDR4AaABAg,0.0,1.0,2018-03-02T22:18:07Z,0.999805748462677
234.0,thank you,Ugxs77o3zjqKk36Tf1F4AaABAg,0.0,0.0,2018-02-28T11:31:33Z,0.9998352527618408
235.0,I am loving this series!,UgxqzU-zgoYGEiZGw6d4AaABAg,0.0,0.0,2018-02-27T21:40:03Z,0.9998854398727417
236.0,I have been consistent for the last 19 days and I am seeing results. The discomforts and pain is down to almost nothing and I am getting my flexibility back. I am grateful to be able to wake up each morning to getting yoga done with you Adrienne. Thank you! 🧘🏽‍♀️🙏🏽,UgwajWX3TeWvSQg3ryp4AaABAg,0.0,6.0,2018-02-27T15:56:59Z,0.9956969022750854
237.0,"That was amazing 💕
Im feel so gratefull. 

Thank you, Andriene.",Ugxl-vR3Vm7PsM7XoNt4AaABAg,0.0,0.0,2018-02-27T09:48:02Z,0.9998586177825928
238.0,I m not feel after the yoga now. I feel after the massage 💆💆💆❤ it was perfect back massage 😊,Ugwil6yQ1XaqEmKN-qN4AaABAg,0.0,0.0,2018-02-24T21:50:40Z,-0.6132890582084656
239.0,Thank you for creating this journey!,UgwwOJ7-9F0_2AHjIzF4AaABAg,0.0,0.0,2018-02-22T02:42:58Z,0.999863862991333
240.0,"An absolutely beautiful tutorial, loved that (and needed that!) thank you.",Ugypxu1FWob7YfnaAKJ4AaABAg,0.0,0.0,2018-02-20T20:43:25Z,0.9998693466186523
241.0,"DAY 18, left leg pain is gone, need to regain strength on the left leg, thank you Adriene",UgyJLGt1_UsDv-8f0FR4AaABAg,0.0,0.0,2018-02-19T08:31:45Z,0.7554693818092346
242.0,"Holy standing position, Adriene! That was way more of a workout than I expected! I feel good :)",Ugzgp_-AMtwmDY2JsEV4AaABAg,0.0,0.0,2018-02-17T13:58:33Z,0.99969482421875
243.0,"I let myself spiral in negative thoughts this past two days but then I thought how I couldn't let myself down and run away, I deserved to be there for myself, so today I got back on my yoga mat and I felt incredibly grateful for today's practice :) Thank you so much <3",UgyrDPbrGsi_deYGPx94AaABAg,0.0,0.0,2018-02-16T14:52:06Z,0.9994303584098816
244.0,❤,UgysRyt_f6aO_RLhZ2V4AaABAg,0.0,0.0,2018-02-15T19:24:56Z,-0.6970567107200623
245.0,"I just returned to this practice because my thoughts were not as positive as it should be and guys I have to tell u all u need to return or try this practice,  I feel better cause not I can see what's troubling me and I can fix it, thank u Adriene once again, love u all, Namaste 🙏💛💛💛💛💛🙏",UgzUO6Dq9qbnPs4UJiN4AaABAg,0.0,0.0,2018-02-15T19:17:35Z,-0.9990440011024475
246.0,Happy valentines day to everyone practicing with me!! Late start but still going strong 👍  🙏,UgwBcqNTjy8uPMa3lSt4AaABAg,0.0,1.0,2018-02-15T01:24:09Z,0.9995920062065125
247.0,"Today's message was perfect. I have been dedicating myself to this practice to give myself this gift of time alone. Without even realizing it, I AM more toned, more centered, more everything. Working out always meant sweating my butt off or burning X amount of calories. I know it does not have to be that way now. This is just working my body for me. Let go and the yoga will do the rest :)",UgzVwJY2rSCwT2FvWq14AaABAg,1.0,4.0,2018-02-14T11:46:33Z,0.9964195489883423
248.0,Thank you Adriene!,UgxLNksQebm4S13qopt4AaABAg,0.0,1.0,2018-02-14T00:12:41Z,0.9998526573181152
249.0,"I loved today's practice, although it was very challenging it made me feel really proud of myself when I actually managed to do eagle pose (even if only on one side!) Plus it gave me the perfect amount of time to pop brownies in the oven and be done with my practice on time for them to be ready. Thank you Adriene!",UgyHyxJx3jhh9mfniwx4AaABAg,0.0,0.0,2018-02-13T03:21:55Z,0.99978107213974
250.0,Missed a few days but glad to be back on it!,Ugy7ImamTW9j9AvJsuR4AaABAg,0.0,0.0,2018-02-09T22:41:37Z,0.9957210421562195
251.0,Another life changing practice. Thank you!,Ugzd0M69EqQV-yYRDVZ4AaABAg,0.0,0.0,2018-02-09T22:09:20Z,0.9998725652694702
252.0,"I am really grateful for this beautiful and mindfulness practice. I needed it and it just came at the very perfect time of my journey. Thank you Adriene, your existence means the world to me.
Love",UgxYiPhcmojYhBKPHrB4AaABAg,0.0,0.0,2018-02-09T19:17:53Z,0.9998471736907959
253.0,oh Wow! I am totally enjoying myself. Thank you Adriene X,Ugzd9rXu31VVIv40b8R4AaABAg,0.0,0.0,2018-02-09T15:25:41Z,0.9998823404312134
254.0,Each practice keeps getting better. This one was perfect cause I needed these great reminders about self talk. I'm grateful for this practice and you.,Ugw_DXHh3IjYbjqm8Gt4AaABAg,0.0,0.0,2018-02-09T12:59:41Z,0.9996384382247925
255.0,My favorite one so far😊,Ugw33KokP5xWbcQZ-o94AaABAg,0.0,1.0,2018-02-08T10:11:01Z,0.9767351746559143
256.0,Mmmm,UgwO4X2ubxCwVXr-n254AaABAg,0.0,0.0,2018-02-08T02:01:29Z,0.8169686794281006
257.0,I am way behind but still going! This practice really helped clear my head. Thank you!,UgyLCxXGuxEXsyP8cWZ4AaABAg,0.0,1.0,2018-02-07T16:26:34Z,0.9998281002044678
258.0,It ended too soon. It felt like I just started and poof it's done,UgwLGjf_iGAjtUhDB294AaABAg,0.0,3.0,2018-02-07T16:00:30Z,-0.9996562004089355
259.0,"Before beginning this session, a post-it note fell off my wall and onto my mat that said ""KNOW YOUR WORTH"" and that was a really beautiful message/intention heading into this practice :) Thanks for doing what you do <3",UgwYvDl0mHStTkUdkd14AaABAg,0.0,0.0,2018-02-07T06:03:52Z,0.9961891770362854
260.0,"This was a beautiful practice, esp since my legs were tired. Thank you Adriene. Namaste.",UgzUR_yq0xyRBTvo7n94AaABAg,0.0,0.0,2018-02-07T02:24:38Z,0.9996260404586792
261.0,"Whoa, this time I felt 100% balanced and steady. I even caught myself smiling a few times! I'm spending the rest of my evening thinking about how I can feel that confident off the mat more often. Thanks for this simple-but-deep routine.",Ugwjhaq39Ps5mYYwCbp4AaABAg,0.0,0.0,2018-02-07T02:03:19Z,0.9995508790016174
262.0,I so much paused and put on a ninja outfit. Awesome!!,UgxeWkHcstIGwYC3Qu14AaABAg,0.0,1.0,2018-02-06T12:16:35Z,0.9996080994606018
263.0,"Thank you Adriene <3 
I want to quote you every time I watch a video!!
First time getting the full eagle  with left leg on top. Yeyy to progress :) :). 
(My fist comment after many years of watching!)",Ugwo-7t7xGroY88z4cR4AaABAg,0.0,0.0,2018-02-06T08:38:29Z,0.8768123984336853
264.0,I channeled my inner yoga Jedi with my star wars leggings :-),Ugz8kI9CkI_e13-Biw14AaABAg,0.0,0.0,2018-02-06T03:15:06Z,0.6167870759963989
265.0,"this is so strange... even though I haven't been able to do TRUE every single day, it seems that when I pick back up again a day or two later, the practice always syncs up with exactly what i didn't know i needed. I hope that makes sense??? Thank you so much Adriene, this is truly helping me open and grow <3",UgxEODlF6cKoT58YW9Z4AaABAg,0.0,0.0,2018-02-05T20:10:55Z,0.999656081199646
266.0,"I have raced bicycles since I  was 22..during the off season I lifted weights as everybody does...I started practicing yoga ..then I found Adrienne' channel by accident!...now I can testify, YOGA BY ADRIENNE HAS DONE WHAT WEIGHTS DID NOT DO FOR ME... YOGA has gotten me STRONGER than EVER!...not only physically but MENTALLY as well...Thank You Adrienne!...what you stated today has a very profound meaning!..",UgxnsI-7obE-0cP6SF54AaABAg,0.0,0.0,2018-02-05T19:13:53Z,0.998595654964447
267.0,"Hello! Greetings from Chile.
I love your channel and this true yoga's has been amazing for me. The flow of energy feels so great and my cat also do yoga with me. She hears your voice on the TV and knows that is yoga time.
Thank u!",UgxPf1W9a8d3Bt-Sspx4AaABAg,0.0,0.0,2018-02-05T14:37:44Z,0.999840497970581
268.0,"Hi Adriene! I feel ""zingy"" made up word for great because of you! I feel like I am on a real healthy revolution of yoga and excercise in body and mind! I love your saying of ""where your attention goes your energy flows""! Already posted on my calendar. Thanks again for leading me(us) through a terrific session!!Nameste",UgyRfkVcaFZ7tw8e5DB4AaABAg,0.0,0.0,2018-02-05T11:51:52Z,0.9998376369476318
269.0,"It’s wonderful how things sometimes work out: I’m „slightly“ behind with this year‘s start of the year yoga journey - so I got Thought today - just when I’m really nervous about giving a talk on When Ideas Matter... 😊 Thank you, Adrienne!",Ugy-JjzbG0Mr0pwMfKl4AaABAg,0.0,0.0,2018-02-05T07:24:56Z,0.9998533725738525
270.0,"Today, is a good day. :) Thank you Universe, for letting me stumble upon your channel. And thank you Adriene, for inviting us into the practices of body, mind, and soul. I have a strong feeling that yoga would be included in my morning routine right after this TRUE challenge! Yoga is just, lovely. So much time for self-love, reflection, and I couldn't have had a better yoga experience without your guidance Adriene! Thank you.",Ugwtq53Y5mce4jSxOE94AaABAg,0.0,0.0,2018-02-04T01:14:58Z,0.9998254179954529
271.0,Absolutely loved it today I did everything lol 🎉,Ugy6F9dRSmfc2dyA9yt4AaABAg,0.0,0.0,2018-02-03T21:16:51Z,0.9998553991317749
272.0,Today I was really amazed by how much I've improved on this TRUE journey - in moves that before we nice but not incredible I can now feel my energy and strength in every mouvement.  Thank you as always Adriene!,UgyoGEhLM97QNLkhZdF4AaABAg,0.0,0.0,2018-02-03T21:11:53Z,0.9992917776107788
273.0,Thought this one was going to be easy ....but hey loved it even though it was mindful it was still challenging 💖,UgxXTQdeql28ltateJ14AaABAg,0.0,0.0,2018-02-03T09:10:55Z,0.9995484948158264
274.0,"Why was I so angry during this practice? I felt tension and frustration throughout. Thoughts on this? Adrienne, I’d appreciate your input :)",UgyqiGO9O7KXO2BxuYp4AaABAg,0.0,1.0,2018-02-03T08:10:08Z,0.9850876927375793
275.0,♡,Ugw7C4LqQ99dR7QH3ll4AaABAg,0.0,0.0,2018-02-02T23:08:26Z,-0.6970567107200623
276.0,"Another one of my favourite sessions. I really needed everything about this one (the breathing, the mind, the postures) after a personally challenging week 🙏",UgybysfmD-XToe660BN4AaABAg,0.0,0.0,2018-02-02T21:34:34Z,-0.7645502686500549
277.0,I am so grateful to have found your channel Adriene! How do I go about getting on your email list? Thank you!! Namaste!! <3,UgznLVRbTU4LQP6XQ3J4AaABAg,0.0,0.0,2018-02-02T20:24:27Z,0.9990079998970032
278.0,"I realized something about my thought. And I'm so glad because now I can correct it, I put a lot of limits on what I think I can have or do in my life. I was looking at houses in Colorado and thought, ""oh well, I'll never be able to afford that."" And I'm right, thinking like that? I won't. DOP!
Brings to mind a famous quote I've heard many times:
 ""Wether you think you can, or wether you think you can't, YOU'RE RIGHT."" - Henry Ford 🙏🏻 Thank you Adriene for the reminder 🙏🏻 I am so honored to have you in my life 💕",Ugzyf6X69mgddqYk8w94AaABAg,0.0,0.0,2018-02-02T15:21:21Z,0.9985914826393127
279.0,love D19,UgxvgB0OKa1sJ4rOcdp4AaABAg,0.0,0.0,2018-02-02T14:44:20Z,0.999647855758667
280.0,Today's practice was lovely...and it made me burp. Talk about a release! hahaha,Ugx7GQezsfIxQgtLzRp4AaABAg,0.0,0.0,2018-02-02T13:58:32Z,0.9995679259300232
281.0,"I really love e new intro and outro music. I've done at least 150 of your classes so far the music is like a pavlonian bell for me and makes me excited, relieved and happy, I know my needs for relaxation, play, movement are either met or soon to be met :].

Thanks Adriene :]",UgwoFDpF68Izbh_DczF4AaABAg,0.0,0.0,2018-02-02T12:39:21Z,0.9997467398643494
282.0,Julia Roberts rocks and so do you Adriene :),Ugwd3axK5Vp6z9t7M2x4AaABAg,0.0,0.0,2018-02-02T02:48:39Z,0.9992406368255615
283.0,"I love standing workouts! There are so many possibilities. Great practice, thank you!",UgwjIWBid5gf4JAirkl4AaABAg,0.0,0.0,2018-02-01T21:18:35Z,0.9998637437820435
284.0,"Yet another great yoga day. Thank you!! Also, thought I'd let you know that there is an ad that plays at the end of this video that is  pretty much dissing your youtube videos and telling people to go to them instead. It also kinda sucks that ads play in the middle of your videos. really like your videos but need to share this with you xoxo",UgwbwKaVBRMejANfepV4AaABAg,0.0,0.0,2018-02-01T17:26:32Z,-0.996806263923645
285.0,Thank you Adriene for another opportunity to drop in.,UgyMpwQhXUxQ2VNl5cd4AaABAg,0.0,0.0,2018-02-01T14:41:52Z,0.99978107213974
286.0,"That was amazing.  I love that -- where attention goes, energy flows.   So true.  Thank you for this reminder.  Loving this practice.",UgwjHbQSs1lroDE-1ox4AaABAg,0.0,0.0,2018-02-01T12:04:10Z,0.9998893737792969
287.0,A great way to get out of our mind and into our bodies. Thank u! 💟,UgxZ_RZqlbnF5VvCkK54AaABAg,0.0,1.0,2018-02-01T08:27:06Z,0.9998030066490173
288.0,got in two days of practice today because i was that motivated. exercise doesn't need to be work!,UgwxUPv8-KIqhOyFTrt4AaABAg,0.0,1.0,2018-02-01T04:05:23Z,0.8734261393547058
289.0,Magical. Namaste. <3,Ugw6ZyqaCPEkn89XNuR4AaABAg,0.0,0.0,2018-02-01T00:28:34Z,0.9986547231674194
290.0,"Hey Adriene, 

You probably already know this but your classes mean a lot! I mean, a lot! For me they're lot of emotions i usually don't deal with....

With your classes i learn to exercise and to face my emotions! Thank you for that! I'm from the Netherlands but if i am ever in the US, i wil be sure to visit you in austin! Thank you, girl! Thank you a lot!!!",Ugw0E6eQ_Bt3u5P6Nr94AaABAg,0.0,0.0,2018-01-31T22:50:22Z,0.9996310472488403
291.0,Thank you for being here for us. Namaste :),UgyQw9bMtkaipBlzxY14AaABAg,0.0,0.0,2018-01-31T18:42:44Z,0.9996988773345947
292.0,"When I was in eagle arms, my mind wanted to give up, my body was just doing what I told it to do, and it was feeling challenged, but it was my mind that wanted me to collapse. But I didn't, I kept repeating ""I am strong."", and I held it the whole time. Thank you for being such an encouragement as I find my way to true strength. I love you, Adriene.",UgxVBRRxcB-DjHejBMJ4AaABAg,0.0,1.0,2018-01-31T14:51:20Z,0.9996579885482788
293.0,TY!,Ugz5TqbL0k1u0eyOhqN4AaABAg,0.0,0.0,2018-01-31T13:18:20Z,0.9984229803085327
294.0,"I am loving this series! I have missed a few days, but always just pick back up where I left off. I'm already starting to think about what happens when I finish this series. I know there are other videos, but is this something I could just start over and do again?",Ugzt1yD-vagMr87Da0l4AaABAg,1.0,0.0,2018-01-31T11:34:07Z,0.9412009716033936
295.0,"I don't know if it's my mindset that's more open to embrace the benefits of yoga or what, but, dear Adriene, you've really outdone yourself with this serie. The workouts which don't feel so hard but then you're sore af and you're like ""whaaat? how?!"", AND THE MIND CLUES! Really, I'm reborning.
Thank you from the bottom of my heart, I wouldn't be who and where I am today without your videos. <3",UgzG0CYQ-DRr7wRqVNJ4AaABAg,0.0,1.0,2018-01-31T07:27:09Z,0.9734111428260803
296.0,"I could barely make it on the mat today. But self love talk motivated me to just show up and do my best. It was hard, I was very distracted and could only do what I could do, but I showed up and I feel good about that.!",UgyI9_yAqihxhWgFbuZ4AaABAg,0.0,0.0,2018-01-31T03:15:10Z,0.9993385672569275
297.0,That was awesome.  Thank you ❤,UgwFUQtNVbSWrNcrpqh4AaABAg,0.0,0.0,2018-01-31T00:44:18Z,0.9998716115951538
298.0,That was so good. Deeply balancing and empowering ❤️ thanks you so much Adrienne,UgzpTnYCIjRQRkGMZ0N4AaABAg,0.0,0.0,2018-01-30T12:24:55Z,0.9998784065246582
299.0,"I am a little behind with the true program, but I had the exact ninja outfit today as Adriene :)) Nice training, thank you!",UgyvGPc1eNJXrpeAa-F4AaABAg,0.0,0.0,2018-01-30T06:10:55Z,0.9994068145751953
300.0,"Life happened .. Blah I got sick for the first time in 5 years knocking me right on my bum and making me fall behind during this journey, picked right up from where I left off lol :) This practice was AMAZING and PERFECT for a return and how I was feeling. Thank you so much for creating this beautiful class <3",UgxkpE4w9o7aGCEhqLp4AaABAg,0.0,2.0,2018-01-29T17:13:56Z,0.9992818236351013
301.0,Very relaxing for a rainy Sunday like today!!!,Ugw9XU_gfRfOs0s9UTt4AaABAg,0.0,0.0,2018-01-29T01:26:56Z,0.9994014501571655
302.0,I was so disappointed when this practice came to an end... soooo short :)),UgwV_OhRdD-4E60pRX94AaABAg,0.0,0.0,2018-01-28T20:09:23Z,-0.9995954632759094
303.0,Brilliant! Brilliant! I just did Surrender & Thoughts back to back 🙏😘,UgyAqV7Pyyy_rJspNkl4AaABAg,0.0,0.0,2018-01-28T19:10:56Z,0.997073769569397
304.0,"Heehee when you told us to really dig into what we were feeling in eagle pose, I realized I was MAD! I hate the feeling of being restrained. But once I actually realized that for the first time, it let me actually loosen up and appreciate the pose for how it was teaching me to manage feelings of stress and discomfort.",UgxHoUuGxu0TUVJ7gcp4AaABAg,0.0,0.0,2018-01-28T18:33:23Z,0.9968299269676208
305.0,Loved the balancing moves....,UgyedZHGhAcN4zQ8qbN4AaABAg,0.0,0.0,2018-01-28T17:59:07Z,0.9998600482940674
306.0,"Love this practice as usual ~
Though the soles of my feet reaaaally hurt during this practice, especially the outter edge and the heels. Any pieces of advice to tend to those sweet feet which support me all day ? c:",UgzFDQtlmmxUOf6ZrAp4AaABAg,1.0,0.0,2018-01-28T11:08:25Z,0.9995372295379639
307.0,Thanks for this video. :),UgzdjusSvMiVAWoWWqp4AaABAg,0.0,0.0,2018-01-28T07:03:54Z,0.9994279742240906
308.0,"Missed yesterday because I fell asleep, and mind raced through this entire practice. Was being hard on myself for missing this practice yesterday and just had a difficult time focusing. I got through it, but it was not my best. 😞",UgzfsfWllo8_N5xuzmt4AaABAg,1.0,0.0,2018-01-28T00:10:48Z,-0.9989606142044067
309.0,"Day 19 .  As always, better late then never.  Namaste.",Ugwt-Ro-CsSY1qezZKp4AaABAg,0.0,0.0,2018-01-27T23:40:54Z,-0.988985538482666
310.0,"I couldn't have asked for a better practice today. I was working on my Feb. budget this morning, and it wasn't looking so great, so I was having anxious/worried thoughts. This practice helped me to focus on today, and how I can make an impact, turn that frown upside down, and let the future come when it is here instead of losing today over what has not come to pass. Namaste, Adriene!",UgyD9-jN8miqQ1R7c4h4AaABAg,0.0,0.0,2018-01-27T15:19:17Z,0.9869835376739502
311.0,Thank you Adriene 🙏🏼💕,UgxPeh0bgAMuD2NobDx4AaABAg,0.0,0.0,2018-01-27T14:03:40Z,0.9997859597206116
312.0,Ok so I totally paused the video and put on my TRUE ninja outfit!  LOL,Ugx5HvGU3eLDZQEwXhx4AaABAg,0.0,0.0,2018-01-27T02:58:48Z,0.9635262489318848
313.0,"Well, umm, eagle arms? Yep. Physical impossibility for me. haha I'll work on it, I reckon. I did really enjoy the rest though.",UgwRABW7_xWrBJEXmv94AaABAg,0.0,0.0,2018-01-26T22:53:58Z,0.9984270334243774
314.0,Beautiful way to start the day and set the tone. Thank you Adriene.,Ugxs_MwT_Awfj-A15ZZ4AaABAg,0.0,3.0,2018-01-26T16:31:40Z,0.9998738765716553
315.0,♡♡♡♡♡,UgyBb2SBF9x-rgiyCz14AaABAg,0.0,0.0,2018-01-26T12:07:02Z,-0.6970567107200623
316.0,"I got sick last weekend and have basically spent the last week trodding through life with a head too heavy to lift and snot streaming out of every hole in my face (yes, nice visual I know), so I haven't really been doing the yoga. I just felt too weak (and a downward dog with stuffed sinuses HURTS). Today I'm getting back in to it and feeling much better. So excited!",UgyWqm71kU-Pc0UHuP94AaABAg,0.0,1.0,2018-01-26T08:04:56Z,-0.9718019366264343
317.0,Challenging! I love it!,UgyU5DjdJr3flQpW6294AaABAg,0.0,0.0,2018-01-26T03:03:23Z,0.9998886585235596
318.0,amazing 💞💞,UgwxBVwhoyPa6MH8wYt4AaABAg,0.0,0.0,2018-01-26T00:07:01Z,0.9998632669448853
319.0,"This hit the spot, thanks!",UgyWOEt3UQide2BA_Gl4AaABAg,0.0,2.0,2018-01-25T22:03:25Z,0.9997887015342712
320.0,I was pleasantly surprised at my balance today. It so often fluctuates. It felt so good to be still. I needed some thought control today :)    Thank you! Namaste,UgwjXMXjDnwuTUBfXFd4AaABAg,0.0,3.0,2018-01-25T20:55:23Z,0.9997726082801819
321.0,"""Where attention goes, energy flows"" I need to write that down and put it somewhere so that I can see it all the time. Is that a YWA original or did it come from some where else?",Ugz4KkV7FSqUQ0hd5yN4AaABAg,2.0,1.0,2018-01-25T16:39:32Z,-0.9973477125167847
322.0,"Hi Adriene! Today I'm getting good vibes :) And I realise just how important it is to surround oneself with positive energies and people, and to stop directing our own energy towards what is negative. Thank you <3",UgylMC9dui0qzsceDxt4AaABAg,0.0,0.0,2018-01-25T15:40:15Z,0.9982328414916992
323.0,"Namaste, Adrien. Thanks for being here for me today.",Ugy6NZHjYZXNdKVizYN4AaABAg,0.0,0.0,2018-01-25T14:09:17Z,0.9995619654655457
324.0,Great practice today Adriene. Very powerful.  Great conversation with my body this morning. Thank you 🙏,UgwMC_HfLcoogm082594AaABAg,0.0,1.0,2018-01-25T07:21:26Z,0.999876856803894
325.0,The beauty about your teaching is that it's not about pushing yourself to achieve but to be true to yourself and enjoy the journey.  I'm learning a lot from that.  I'm not beating myself up that I'm four days behind because I was sick or grabbed a luxurious rare lie in with my husband.  Finding what feels good ❤️🙏,UgwS0cfn6_LoS1hIYiF4AaABAg,0.0,0.0,2018-01-25T06:16:08Z,0.9996552467346191
326.0,"dear Adriene, as always each yoga practice matches what I need desperately on that day, even if it doesn't seem so at first. Yesterday was a terrible day but thank to surrender practice I was able to get back to myself, today's Thought practice stabilized my balance even more. Thank you so much! Lots of love and gratefulness!",UgxE1uDwEPxyJzbU9qF4AaABAg,0.0,1.0,2018-01-25T01:35:19Z,0.999617338180542
327.0,since i missed yesterday i did 18 & 19 today and OH MAN that was a workout XD,UgxlmgzdQi9SKmSbbip4AaABAg,0.0,0.0,2018-01-25T01:05:03Z,-0.9769446849822998
