,comment,comment_id,reply_count,like_count,updated_at,calificacion
328.0,"hey Adriene, the TRUE journey has been like a daily super powerful psychotherapy session for me :D There are so many insights in true every day that I find it almost too hard to catch up! The questions you ask pop up in my head during the whole day, transform and reveal some amazing information. I don't understand how you manage to connect to so many people on so many levels, but you do! You're a true super woman, and I hope you feel this too :) Lots of love from Berlin!",Ugw3oyszyFP6SR3EPw94AaABAg,0.0,1.0,2018-01-24T22:47:57Z,0.9739654064178467
329.0,Thank you for this practice Adriene! The direction of our thoughts is so important.. My Mum was diagnosed with breast cancer at the beginning of January and had her first chemotherapy treatment today. So thankful for this TRUE journey this month!,UgzOVlMkUTQlA8wArhZ4AaABAg,0.0,5.0,2018-01-25T16:37:30Z,0.9997332692146301
330.0,Really enjoyed this practice!,UgyELgMl13Bh75g-zdd4AaABAg,0.0,0.0,2018-01-24T16:52:41Z,0.9998743534088135
331.0,"Was wobbling about,  but 100 times better than I used to be  trying all those poses ,  thankyou 🙏❤️",Ugw_9roczXWDEBaTNa94AaABAg,0.0,13.0,2018-01-24T16:05:21Z,0.9984423518180847
332.0,"Good Morning Adrienne, I am up to day 19 and this is my first time ever doing something like this. I want to thank you for creating this practice and platform for OUR collective growth. I have been experiencing a greater self awareness and growth that is showing up off on and off the mat. Thank You does not seem like enough. Nonetheless, thank you! Namaste. 👊🏽🎯🙌🏾",Ugykz74ZPi8GDBgjb214AaABAg,0.0,0.0,2018-01-24T11:08:55Z,0.9993985891342163
333.0,i missed a few days because i was sick - its good to be back :),UgxCfh7DYLLT4ouvPLh4AaABAg,0.0,0.0,2018-01-24T06:12:16Z,-0.9702268838882446
334.0,"So worried about missing a day I almost didn’t return. After a practice, I ask myself “ so what?”  Come when u can and be proud. P.s. loved the binds",UgyCe5c_owQS88MMqfh4AaABAg,0.0,4.0,2018-01-24T04:42:58Z,0.8797052502632141
335.0,I think that Adriene and her team are responsible for preventing thousands of headaches through this yoga program! I'd been getting them nightly for a while and whoosh ... an asana a day makes the head feel okay :),Ugzfu7O_ikG-MGihTgt4AaABAg,0.0,6.0,2018-01-24T00:33:04Z,0.9952602982521057
336.0,Just fantastic after a long day at work here in Stockholm Sweden. So peaceful. It all ended up with my cat Snookie joing me at my belly<3 Love your yoga Adriene.,UgzbMqWtJEgWiq-SVUB4AaABAg,0.0,4.0,2018-01-23T17:10:46Z,0.9997841715812683
337.0,This was very much needed. Thank you.,Ugy-4fjxyxCeaCSyDc94AaABAg,0.0,1.0,2018-01-23T16:18:51Z,0.9994425177574158
338.0,wonderful. thanks :) PS how odd I was wearing all black by chance !,UgwIj9zr87SzfvPvN1t4AaABAg,0.0,0.0,2018-01-23T16:01:39Z,0.9997326731681824
339.0,"Thank you! At first I thought you said ""evil position"", and I was like ""yes, that makes sense, all wrapped up, coiled in on yourself"" :)",UgypRkIhd7xXlZUo-Wp4AaABAg,0.0,0.0,2018-01-23T09:04:52Z,0.9989033937454224
340.0,"Everyone's comments are really helpful to see we're all going through different phases. It helps me, especially when, like today, the practice questions me so strongly about how I focus my thoughts. 
""Where attention goes, energy flows"". Definitely one to remind !
Again, thank you so much for all the energy and intentions you put in this work, it's outstanding ! <3",Ugx8UwrZB326bgn3TzJ4AaABAg,0.0,2.0,2018-01-23T05:47:34Z,0.9998639822006226
341.0,"1:58
""that would mean your glutes would need to be turned on""
*** implied hey oh! ***",Ugw6zymDBOdSfwPeInV4AaABAg,0.0,0.0,2018-01-23T05:38:49Z,0.8741058111190796
342.0,Thank you!🙏💗,UgxNSXFnp8PYbFSKMtd4AaABAg,0.0,0.0,2018-01-23T02:02:57Z,0.9998544454574585
343.0,Today's practise totally hit the spot... In my head. Thanks Adriene <3,Ugz0dwxB1QZc2GqAL054AaABAg,0.0,0.0,2018-01-22T19:57:23Z,0.9994811415672302
344.0,Wow,UgyxrJYIzTtZEMAEIgB4AaABAg,0.0,0.0,2018-01-22T17:25:19Z,0.999592125415802
345.0,"I have a really hard time sending my hips back with my knees bent...I spent so many years pushing my weight forward and slouching, so this was a pretty difficult one for me!",UgxIZDKhJZcMnT3Gvqp4AaABAg,1.0,0.0,2018-01-22T16:56:14Z,-0.9917123317718506
346.0,Got a couple days behind but I really needed this practice today! Thanks Adriene!,Ugyb8cnwPLqQG0b3U8x4AaABAg,0.0,0.0,2018-01-22T11:42:44Z,0.9984808564186096
347.0,"I loved this one this morning. I am slightly behind on the 30 days, but catching up :) Adriene - are there any books you can recommend for positive thought and yoga lifestyle type books?xx",UgwqjGX5JeOPfof-dKF4AaABAg,0.0,0.0,2018-01-22T11:19:38Z,0.9959359169006348
348.0,"Hi, I've stopped getting the daily email since Saturday, just wanted to know if there has been an issue with them from your side or if it is my mailbox that has gone wild...",UgyeOq7pLl4d3blTZ9N4AaABAg,0.0,0.0,2018-01-22T09:52:59Z,-0.9993219375610352
349.0,"Working a day behind but feeling good! My legs are pretty sore (and after yesterday's practice, the rest of me is pretty tired) so this was a nice resting point in the 30 days.",Ugw3Fswafl0O2M5lI1B4AaABAg,0.0,0.0,2018-01-22T04:12:11Z,0.9527717232704163
350.0,"I’m a day behind now, but I’m not going to let that deter me! My right knee is injured, so I wasn’t able to do the ankle-to-knee or leg part of the eagle balancing on my left foot, but I was amazed that I could hold my balance while doing the eagle on my right foot! I hope to continue strengthening my balance while also practicing positive self talk. Thanks, Adriene!",UgyDYkul1UkWbN8qBJl4AaABAg,0.0,0.0,2018-01-22T02:54:02Z,0.9988452196121216
351.0,"I was wondering if you had any videos that went into a deeper explanation of the third eye.  It is referenced so often in your videos and I just wanted a bit more information to really pay attention and focus.  P.S. thank you so much for sharing your time and energy with all of us.  Practicing with you ""TRUE-ly"" (<- see what I did there?) is a gift.",UgwH4LZm0mOSocBCHGl4AaABAg,0.0,0.0,2018-01-22T02:18:57Z,0.9994768500328064
352.0,I think I will now be picturing myself with Julie Robert’s hair when I look into my pond,Ugxw4W6yvUnLvJ4eryN4AaABAg,0.0,1.0,2018-01-22T01:08:21Z,0.9811146855354309
353.0,"Blessed Sunday, everyone! :) The way we perceive is everything, indeed! Oh the power thoughts...
This is a practice I will be frequently revisitting, for there is some more work to be done in this area. ;) Thank you for yet another powerful practice and message, Adriene!
Namaste <3",UgwEATbmiBXMvrVsoMl4AaABAg,0.0,0.0,2018-01-21T23:57:29Z,0.999619722366333
354.0,"Out of all the pracrices that we did so far, this one and Self Love are my absolute favourites 😊❤ felt great. Thank you and Namaste, Adriene!",UgxXefMi4jwwT0hDbG54AaABAg,0.0,0.0,2018-01-21T23:52:14Z,0.9998325109481812
355.0,"You're the bomb. I'm a couple of days behind, so I did day 18 yesterday and then went to the women’s march. I could not believe how sore I was when I got home. I did some stretching, took advil and slept like a baby. Thanks for giving me this safe place to get back into my body in a mindful way and helping me start my 50th year with a boatload of peace.",Ugzl74GxSAAjDj3W_Y54AaABAg,0.0,0.0,2018-01-21T22:51:06Z,0.9986756443977356
356.0,"Wow!  Great practice.  I came to the yoga mat tired today.  Now, feeling refreshed and relaxed.",UgyPnbB_ry9gwzogPaR4AaABAg,0.0,0.0,2018-01-21T22:47:07Z,0.9996851682662964
357.0,"as long as i can remember i do not have the flexibility....believe me I'm trying to work at it...but rotate my wrists out in front of me and up, like in the video is something i am unable to do- any alternatives to receiving a stretch in those places? thanks thanks!",UgzdEBv2bEj_SmkmPQ54AaABAg,0.0,0.0,2018-01-21T22:32:02Z,-0.9089022874832153
358.0,"(Catching up on yesterday's practice) It felt great and frustrating at the same time. My thoughts betrayed me during the eagle pose. I kept thinking positive things, telling myself I was amazing but I let go because it was too much. Well, I'm glad for doing the best I can everytime I hop on the mat - not being carried away with negative thoughts.",UgyMv2DyjexsM_7nVMF4AaABAg,0.0,0.0,2018-01-21T21:58:48Z,-0.9789822101593018
359.0,"Wow, I didn't realize how much I needed this today.  My mind has been racing lately with all kinds of thoughts - good , bad and sad.  I really enjoyed this practice, and unexpectedly, at 'Namaste', the floodgates just opened.  It was cathartic.  Thank you.",Ugw54cQNfhUHhNz3YWp4AaABAg,0.0,0.0,2018-01-21T21:40:35Z,0.9995341300964355
360.0,"THANK YOU for including a practice with less shoulder intensive work.  I've been trying to keep up, but had to take a few days off due to chronic shoulder issues.  Even with modification of planks, twists, etc., I've been in a ton of pain.  Want to keep up my practice though!",UgzW7qhwzVZ-xaAjy414AaABAg,0.0,0.0,2018-01-21T20:35:18Z,-0.9780452251434326
361.0,Usually do a morning practice but did this in the evening and wow! 22mins just flew. Could not believe it was over! Namaste thought ninjas!😘,UgypToJfyn3y43vzwfd4AaABAg,0.0,0.0,2018-01-21T20:15:10Z,0.8307429552078247
362.0,"I can't believe this was 22 minutes, it felt like 10 minutes. I think that this was my favourite practice so far :) Going to do day 20 now so I can finally catch up after my one rest day. Namaste! :)",UgzasifI-jFDTTc_xO94AaABAg,0.0,0.0,2018-01-21T20:14:12Z,-0.9834554195404053
363.0,"this was amazing, my favourite so far and loved the eagle  pose.Thank you xxx",UgxvalReqVSY5DwkAAt4AaABAg,0.0,0.0,2018-01-21T20:06:28Z,0.9998656511306763
364.0,AMAZING!!!! I can't believe the things I was able to do today!!!!! Thank youuuuu for so thoughttttfulllyyy creating a journey that would progress us to be able to successfully do things we weren't able to even perceive in the beginning!!! <3 <3 <3 - Ashlee Schmitt *,UgwoNDtB5U10bINo6O94AaABAg,0.0,0.0,2018-01-21T19:02:29Z,0.999218225479126
365.0,"Adrienne, I must say, I have been doing yoga (and yes, I mean doing, and not practicing) for over three years now.  Today, I was finally able to establish and get into the pose.  I realized that your practice helped me believe in myself and my inner strength.  I was not only able to practice the pose but I held it.  Also As I bowed to my heart, the thought that came to mind was :I am thankful to my wonderful heart and grateful to my body.  Thank you Adrienne! I FEEL wonderfully myself! Please keep doing what your doing.  What a difference you make in our day.",Ugw9BjkmtZARzoyt6Qx4AaABAg,0.0,0.0,2018-01-21T18:27:06Z,0.9998165965080261
366.0,"Eagle pose really shuts off the negative thoughts I have, this felt so good!",UgxnU924_clMRmWIRhV4AaABAg,0.0,0.0,2018-01-21T17:30:40Z,0.9995562434196472
367.0,Thank you for being there for me to help me show up for myself everyday. Love you!!,UgxH2gXye0NKBdxUCNR4AaABAg,0.0,0.0,2018-01-21T17:22:49Z,0.9998672008514404
368.0,This one spoke to me in so many ways and once again exactly what I needed!😊❤️,Ugy8nsknzHiBIGKnTJ14AaABAg,0.0,0.0,2018-01-21T17:10:08Z,0.9988804459571838
369.0,"Thank you Adriene for your generous way of giving us your informative knowledge.
I have been practicing yoga since 1974 and I must tell you I just love doing yoga with you every day.
I love your large yoga mat...can you share where you purchased.
❤️Peggy",UgxgV6-x_mlUeliMPep4AaABAg,1.0,0.0,2018-01-21T17:07:03Z,0.9998317956924438
370.0,Today I'm very tired and have a headache and dizziness. my wife is sick and it seems like I'm going to be sick too. So I decided to skip my normal workout for my arms and back today but wanted to try day 19 in a very kind and gentle way just to see what happens. I took good care of myself and reached the end of the practice without falling on the ground or losing my balance. Feeling good mentally and crappy physically now haha but not more crappy like before!,UgwB1611u4R_15LsLS14AaABAg,0.0,0.0,2018-01-21T17:05:01Z,0.9933110475540161
371.0,"Last year's self-love theme really cemented in me the idea of being mindful of thought and self-talk, and honestly my self-esteem is the highest it has ever been, so I'm really happy we're continuing with this theme of thought. Thank you! And I'd totally watch 'Adriene Says the Darnedest Things'~",Ugzm9MXQfPJtowryCUd4AaABAg,0.0,0.0,2018-01-21T16:53:37Z,0.9998551607131958
372.0,Thank you for being the voice of our body in these shared times of yoga practice. It is pleasing to hear my thoughts expressed through your practice. I offer my practice in support of True.,UgzN4feYh9-Cn6pjZgh4AaABAg,0.0,0.0,2018-01-21T16:52:14Z,0.9998733997344971
373.0,Day 19 completed on day 19,Ugz4tbKWIOtVer6XyZF4AaABAg,0.0,0.0,2018-01-21T16:46:23Z,0.9760419130325317
374.0,Namaste!  Thank you.,UgwmKNQPk69tiIxwMXV4AaABAg,0.0,0.0,2018-01-21T16:39:52Z,0.9998595714569092
375.0,My balance was much better today. I've been so frustrated this past week but today renewed my confidence!,Ugwffb0M6p-95qumtTV4AaABAg,0.0,0.0,2018-01-21T15:46:26Z,0.9993170499801636
376.0,"‘The way we perceive is everything’  

You are such an amazing person! You are so creative and you inspired me a lot! Thank you for each session you do perfectly and keep going what you feel like ;) I will be there always with you and do yoga 🤞🏻 Namaste 🙏🏻",Ugyz4Sb9HL6lGA-tEZR4AaABAg,0.0,0.0,2018-01-21T14:54:20Z,0.999875545501709
377.0,"This was so yummy. I tried to do most of it with my eyes closed as to not keep track of the way I'm ""supposed"" to be doing it and to really take my time to feel when my body felt stable enough to transition, etc. It was really nice feeling the internal dance. It's been some time since I've allowed my self to go there. 

I've noticed my everyday movements become more authentic again as well. 

So grateful for this community 🔥💜",UgxfvlApg8NSg0Yl4IF4AaABAg,0.0,0.0,2018-01-21T13:32:03Z,0.9984623193740845
378.0,Thank you! <3,UgywfNA3Isbl7IIAxKp4AaABAg,0.0,0.0,2018-01-21T13:25:59Z,0.9998282194137573
379.0,Happy day 19 everybody!!,UgxVWykhKQZIIAg_uN94AaABAg,0.0,0.0,2018-01-21T13:03:46Z,0.9998537302017212
380.0,"Did this practice whilst looking at the snow out of my window - I feel so peaceful and relaxed, but also strong! Loving this 30 days of yoga, thank you Adriene!",UgxKiI6eP6L5Zh8um414AaABAg,0.0,0.0,2018-01-21T13:03:45Z,0.9998828172683716
381.0,"The glutes being turned on and The silent ""Hey-yo!"". That cheered me no end.",UgxXaU3WS5hIilT53UF4AaABAg,0.0,0.0,2018-01-21T12:33:22Z,-0.9919249415397644
382.0,Yoga with Adrien remind me that I don’t need to be serious too much. Thank you Yoga Ninja. 🙏,Ugw69h1jPQF9y-bryZ14AaABAg,0.0,0.0,2018-01-21T12:32:55Z,0.9988781809806824
383.0,"My reflection in the pond was very giggly today as I wobbled around on one leg. I love balancing poses! Was surprised when we came into it again how still and stable I was as I was more focused on trying to keep my arms binded (not quite eagle arms), and paying less attention to my legs and balance. Some things have a way of sorting themselves if they're just left to do so.",UgxFdXkABlSciMeLmON4AaABAg,0.0,0.0,2018-01-21T12:15:56Z,0.976803183555603
384.0,as of today this was the most challenging and difficult practice yet and I loved every minute of it I will return to this one to work on my one leg balance as well as incorporate  one legged stances throughout my daily life routine Namaste,UgyLMqfnIAUKyfg6-CB4AaABAg,0.0,0.0,2018-01-21T12:11:38Z,0.9995715022087097
385.0,Day 19 ✅ muchas gracias !!! Me siento mas ligera ✨🙏🏾✨,UgxZREC5foyf7Els5Yt4AaABAg,0.0,0.0,2018-01-21T12:03:32Z,-0.8926382660865784
386.0,"I did the last two practices with my 8 year old daughter. She says ""it was fun"". See you tomorrow!",UgyhGhbP_xmqLHAuhK94AaABAg,0.0,0.0,2018-01-21T11:53:32Z,0.9997642636299133
387.0,"WOW.  Great practice to get to the root of it all, so powerful!",Ugxsr_1bGH5JPiTeim94AaABAg,0.0,0.0,2018-01-21T11:48:23Z,0.9998574256896973
388.0,And you look great in your ninja outfit!!,UgzfLpIqxhTBv9GH7Gh4AaABAg,0.0,0.0,2018-01-21T11:12:30Z,0.9998669624328613
389.0,Im a day late..but  this practice was awesome !,UgyIAGfTZKlcxySTNtp4AaABAg,0.0,0.0,2018-01-21T11:10:28Z,0.9996780157089233
390.0,"I feel genuinely excited. See you tomorrow Adriene. Thanks again. X 
Carole x",UgwXIGW6oe_RYwRwq-t4AaABAg,0.0,0.0,2018-01-21T10:02:07Z,0.9997556805610657
391.0,"Wow! Even the most simplest of things can be quite challenging. :) Thank you Adriene for this awesome exercise. The power of thought! I completely agree with the statement that where attention goes, energy flows. I experienced that when we keep the hearth of our thoughts pure, we will receive peace and be happy. Trust you guys are having an awesome weekend.
Cheers!!! :)",Ugxj2hFCl_3dHPmxSfh4AaABAg,0.0,1.0,2018-01-21T09:28:06Z,0.9998809099197388
392.0,"Very cool practice, thanks Adriene!I'm doing this crazy late...like 1am lol. And today wasn't the best day for positive thinking/self talk so honestly this is perfect timing! As soon as I brought my thumbs to my third eye and heard you say Namaste I felt this weight lift and couldn't help but smile! 😊",Ugw_H4zC9AxogE96DfF4AaABAg,0.0,0.0,2018-01-21T08:52:19Z,0.9996083378791809
393.0,you're rocking the Julia Roberts hair ❤️,Ugx83D3vzGIx4Y9sjLx4AaABAg,0.0,0.0,2018-01-21T08:45:15Z,0.9624383449554443
394.0,"Lovely. It's days like this when I see how far I have come. I may not have been able to bend forward in that first standing pose, but I could stand on one leg without falling flat on my butt 😍 that's progress for me.",UgxOiTjc18iaSFQLi1R4AaABAg,0.0,0.0,2018-01-21T08:13:16Z,0.9986448884010315
395.0,"What perfect timing! 
Beautiful, Adriene! 
Namasté <3",Ugz0gozfq8ITyPndmzF4AaABAg,0.0,0.0,2018-01-21T08:11:37Z,0.9998599290847778
396.0,"Yet again, confirmation today that I am truly meant to be doing this practice led by you Adriene - another moment connecting my life, with todays theme & this practice. Something has happened this weekend which has affected my life & body (nothing major, but still stopping me in my tracks till I have it sorted) - and I had been catastrophising it, and going into the ""Seriously...its only the 2-3rd week of the new year, and this happens?!?"" mindframe. I caught my way of thinking, and had been turning it around - then I checked into your email - ""Thought"".  Wow...

Thank you once again Adriene - this is benefiting me on far more levels than I ever thought it would.  See you tomorrow!",UgyowyiO9jUFzlp0-ad4AaABAg,0.0,0.0,2018-01-21T07:55:46Z,0.9990273714065552
397.0,Thank you! I made it right before the end of the day and going to bed. I enjoyed today's and am looking forward to tomorrow. :),Ugy_DJ10y7PeDYfu-g14AaABAg,0.0,0.0,2018-01-21T07:55:29Z,0.9998655319213867
398.0,"Y E S. I need to maintain my yogi mind outside of yoga... but that's what my participation in TRUE is all about, right?",UgwQVURsRnQ1pwtHgjV4AaABAg,0.0,0.0,2018-01-21T07:39:44Z,0.9957159161567688
399.0,I really needed this ... thank you Adriene!,UgzWjt1xiSn5ren8bJV4AaABAg,0.0,0.0,2018-01-21T07:10:23Z,0.9990668892860413
400.0,"I believe that if i fall i will be  be able to catch myself on and off the mat,  practicing tree pose in the super market  was defining moment in my life, love to you Adriene,  you  change lives .",UgypoDhXwuurrheOuwd4AaABAg,0.0,0.0,2018-01-21T07:06:18Z,0.9988952279090881
401.0,Yummy! I never want this 30 days of True to end! Namaste can’t wait for tomorrow :),UgwgAOfB6em5D5v6g9R4AaABAg,0.0,0.0,2018-01-21T07:05:47Z,0.9812114238739014
402.0,Adriene..  My favourite one by far!!  I will come back to this 😎again & again💞.  I thought yoga revolution was amazing.... True has topped it... Thanks so much from the land down under 🇦🇺🇦🇺,Ugzy5JCz-a4wrtNDfQh4AaABAg,0.0,0.0,2018-01-21T06:58:43Z,0.999784529209137
403.0,"Thank you, Adriene!",Ugy31VYB98ePzdTS6hF4AaABAg,0.0,0.0,2018-01-21T06:31:06Z,0.9998525381088257
404.0,I did this at 7 in the morning and now I am totally awake. Thanks. I feel that my spine will hold me today.,UgyHvd1msc5uc7I5ed14AaABAg,0.0,0.0,2018-01-21T06:22:36Z,0.9997451901435852
405.0,fwfd ninja club!,Ugw5a4gguyQMmuoRmTl4AaABAg,0.0,0.0,2018-01-21T05:58:44Z,0.896297812461853
406.0,"Day 19! Great practice ""head to toe"" 🎶 lol great for the mind ❤️",Ugzvfs0n66lHqu9Ww094AaABAg,0.0,0.0,2018-01-21T05:46:38Z,0.9926060438156128
407.0,"Hi Adriene, thank you so much for all your videos, especially this one. I am facing many 'binds' in my life right now, it is so helpful to face them on the mat, breathe through them and shift the thinking.",UgxMZ1F9gDPTCasbl2J4AaABAg,0.0,0.0,2018-01-21T05:25:02Z,0.9996662139892578
408.0,My body was so tight and I was exhausted after 6 hours on my feet on the streets of Seattle today. My heart soared over and over again during the march. When I got home after a long ferry ride and drive I really wanted to bail on today's practice. I'm so glad I showed up!! Such a perfect stretch for today (although a bit wobbly). Thank you so much Adrienne. This is what I needed to complete my day.,Ugzv3oWKGlqR1TWZaNR4AaABAg,0.0,0.0,2018-01-21T05:23:32Z,0.999275267124176
409.0,I loved this yoga so much but I had to pee the whole time and it was pure agony in the yoga squat🤣😬😩,UgxP5Ywfc-wD3BUvirt4AaABAg,0.0,0.0,2018-01-21T05:13:01Z,-0.9959534406661987
410.0,"Honestly, today was not a good day for me. My thoughts towards myself have not been kind in the slightest, and your comment at the end made me cry so much. Thank you Adrienne for reminding me to be kind to myself!",Ugxbw-IFWUycixFGPeF4AaABAg,0.0,0.0,2018-01-21T05:05:10Z,-0.9777997732162476
411.0,Today is a beautiful cold and sunny day in Tokyo. Life is good and my heart feels bright too. This practice is perfect and I’ll get back to it whenever my thoughts are taking a wrong turn. Thank you Adriene. 🙏🏻💕✨,UgxLOzc6CPFNDioOTkh4AaABAg,0.0,0.0,2018-01-21T05:04:31Z,0.9997677206993103
412.0,✅ 🙏 ✨ 🙏 🎈 🙏,Ugw4Rd2yvL5unneO6854AaABAg,0.0,0.0,2018-01-21T04:59:44Z,-0.9046950936317444
413.0,Does anyone know what yoga mat Adriene uses? I love it!,Ugxt4VePWS0oEBn4eMh4AaABAg,1.0,0.0,2018-01-21T04:59:38Z,0.999832034111023
414.0,"As a before sleep practice, this felt wonderful after attending the Women's March today. Thank you!!",Ugx6RQqCwO7AI3InCgR4AaABAg,0.0,0.0,2018-01-21T04:58:14Z,0.9998593330383301
415.0,Wow I needed this so badly today. I've gotten next to no sleep this whole week and have been dealing with some relationship stuff so I've felt very NOT grounded for about three days. I was feeling very disconnected from my physical self and very trapped in my mind. This was exactly what I needed... it's almost like you knew.,Ugy21AGH56muByjKa3h4AaABAg,0.0,0.0,2018-01-21T04:42:53Z,-0.9850186705589294
416.0,"Day 19 done!  I came thiiiiiis close to not doing it today because I was tired, but I made myself get out of bed before my level of coziness had reached the point of no return and I was done for the night.  I'm glad I did.  I'm always proud whenever I do things that are good for me even if I don't feel like it.  That's a muscle that you have to strengthen over time as well.  Oh, and when you said ""Gaze into the pond.  What do you see?""  I was looking into my cats' litter box, so I was like ""turds"" lol.  Then I was thinking about how I needed to clean the litter box after I was done with the video XD",Ugx_p4DYJUgCZukSryt4AaABAg,0.0,0.0,2018-01-21T04:07:07Z,0.9705943465232849
417.0,I truly do not know where to start or how to put my current state in to words....I have never been able to think let alone say kind or positives words about myself but over the last 19 days that has begun to change. I have to admit I almost cried during the eagle pose today and it was not due to frustration but because I found myself being mentally encouraging. It not only helped me with the pose but helped me to realize I can be a mentally strong person as long as I believe in myself and show myself love. I can not thank Adriene enough for opening this door in my life.,Ugxc4Z2LKrt_MdqutZh4AaABAg,0.0,0.0,2018-01-21T04:03:07Z,0.9931318163871765
418.0,👏💪👌❤un gran saludo mil gracias !!NAMASTE,UgzsgWcJ9md6jCo3X8V4AaABAg,0.0,0.0,2018-01-21T04:00:18Z,-0.7522239089012146
419.0,How are we so far into this series already? I don’t get ittttt,UgxkV3BZz_6w5WSqVtl4AaABAg,0.0,0.0,2018-01-21T03:53:00Z,-0.9992824196815491
420.0,this was such a beautiful practice (':,UgxRjMP2iEX3h_ofj_Z4AaABAg,0.0,0.0,2018-01-21T03:47:07Z,0.9995130300521851
421.0,"This is my favorite practice so far! I was able to find so much balance, peace, and strength. See you tomorrow!!",UgzQI9xZXVya42e2wYR4AaABAg,0.0,0.0,2018-01-21T03:45:17Z,0.9998226761817932
422.0,"Not what I was expecting but totally what I needed today, thank you once again ♡ namaste",UgwpSDOgiwPfuDk2oEJ4AaABAg,0.0,0.0,2018-01-21T03:42:30Z,0.9993001222610474
423.0,ty! :),UgytcEgJrHvO7LF4pLd4AaABAg,0.0,0.0,2018-01-21T03:42:19Z,0.7810924053192139
424.0,This was one of my favorite practices so far in TRUE! :) Thank you Adriene!,Ugw3EuckGYh-dpHRaEh4AaABAg,0.0,0.0,2018-01-21T03:39:02Z,0.9997435212135315
425.0,I feel like Yoga has so many lessons to teach me and I am getting a taste of a lot of new concepts which are eye opening to me and I believe can really make a difference in my life.   I am so excited but also feel a bit overwhelmed as it's a lot to think about. I may need to repeat this series again and again to allow me time to really grasp it all!,UgxZmOKpqcEuIVhUu6N4AaABAg,0.0,0.0,2018-01-21T03:35:20Z,0.9981451034545898
