,comment,comment_id,reply_count,like_count,updated_at,calificacion
426.0,"The only thoughts I had were ""stay connected to your center, breathe"" then ""I did it!"" The rest was just feelings of surprise, joy and elation as I trusted that I could go a little further past my comfort zone...Lo and behold, I stayed in that yogi squat the whole time!
I don't even know how to thank you anymore Adriene. Every minute on the mat is refreshing and positive and kind.
Namaste 🙏🏿",Ugwz76o_Dtw_B25BEfN4AaABAg,0.0,0.0,2018-01-21T03:33:37Z,0.9988343119621277
427.0,*I cried*,UgyW_GIsYn8QEnsPEKZ4AaABAg,0.0,0.0,2018-01-21T03:31:01Z,-0.9640935659408569
428.0,"I am loving the different connections I have been making during this years 30 days of yoga. Somedays its a connection with my body, or thoughts. However today was the fact that I too happened to be wearing my all black ninja outfit. Happy day 19!",UgwDoMabkZy5Pt3IQSF4AaABAg,0.0,0.0,2018-01-21T03:01:43Z,0.9972254037857056
429.0,This was such a lovely practice!!,Ugztrgw9zGRnswn45iN4AaABAg,0.0,0.0,2018-01-21T02:47:40Z,0.9997742772102356
430.0,thank you for such a wonderful practice today!,Ugw1TUYf4RCTn1ozc9d4AaABAg,0.0,0.0,2018-01-21T02:45:32Z,0.999879002571106
431.0,"D19  THOUGHT Simply thank you for this, namasté !! 
#YWATRUE",UgwiAaL3hS4wh6BKFCV4AaABAg,0.0,0.0,2018-01-21T02:43:07Z,0.9978838562965393
432.0,"Just about to do this in heatwave Australia ,, just after midday temperatures are 43 degrees Celsius",Ugy-TTdsT9mVQ8nrmqx4AaABAg,0.0,1.0,2018-01-21T02:31:10Z,0.9726253747940063
433.0,Okay but your hair was super fabulous in this practice,UgzBPg7Ibpfsrq3WWOl4AaABAg,0.0,1.0,2018-01-21T02:27:11Z,0.9997860789299011
434.0,"LOVE, LOVE LOVED this session - had to do an extra set!!!",UgwjONJ4wut7AmnusOd4AaABAg,0.0,0.0,2018-01-21T02:09:48Z,0.9989091157913208
435.0,Amazing Adrienne!  Every time I mention my YouTube channel. ...people ask me if I know of You! 🌷  Thanks for leading the way. Blessings 🌎,UgziuecCnRLosSifYVF4AaABAg,0.0,0.0,2018-01-21T01:59:57Z,0.9997881054878235
436.0,SO GOOD!,Ugw1mItVpgyJ0txyjah4AaABAg,0.0,0.0,2018-01-21T01:39:12Z,0.9998397827148438
437.0,today i had my 22 month granddaughter try to join me in this workout.  as cute as she was it is hard to concentrate. but i really loved the time spent sending energy to body parts.,UgxTgj1W274rLayUsLt4AaABAg,0.0,0.0,2018-01-21T01:06:35Z,0.9995519518852234
438.0,"I really did not want to get on my mat today after a super frustrating day of unsuccessful house-hunting but when I saw that the theme of the day was 'thought,' I realized how much I needed that today as I was letting my thoughts go to such a negative place. Thank you so much for today's practice, it allowed me to slow down and be more conscious of how I am letting my frustrations ruin our experience of buying our first home.",UgzSSRRhlfiHX226JVd4AaABAg,0.0,0.0,2018-01-21T01:06:28Z,-0.9934374690055847
439.0,"Usually I practice between 10-11 a.m. but today I'm showing up to my mat a bit later. All day I dream of shavasana ❤️ This practice was like a comforting hug from a friend you haven't seen in a while, with a whole lot of loving truth! Thank you :)",Ugz99t85qX47A-d_Rk14AaABAg,0.0,0.0,2018-01-21T00:48:28Z,0.9997244477272034
440.0,Needed this so much today ♥,UgzVQzXBkGX_0oodCgl4AaABAg,0.0,0.0,2018-01-21T00:33:39Z,-0.840211033821106
441.0,Wow today flew by and I can't believe we're already on day 19! I'd be up for a year long TRUE journey. This has really changed the game for me. Looking forward to tomorrow. Thank you!,UgxptTknPWvftqsz37h4AaABAg,0.0,0.0,2018-01-21T00:30:17Z,0.9998127818107605
442.0,Just before doing this video I was JUST telling my boyfriend that I couldn't get outta my head.  I live in a tiny town and had the general store there.  Just before Christmas it burned.  Since then I've been in survival mode and the fight with the insurance hasn't even begun.  So when I turned this video on and we heard the topic my boyfriend said he was so glad because I needed this.  This series has been a very calming home that I've needed to get through this stressful time.  I had 15 employees and was the center of the town.  I'm trying to build back but encounter more hurdles each day.  I have a long distance yoga buddy and we are doing this series together.  I really believe this has helped me cope.  Looking forward to tomorrow.,Ugx6hkaVijJ8xJcGFq94AaABAg,0.0,0.0,2018-01-21T00:29:25Z,0.9960569143295288
443.0,Struggled today with balancing for the eagle pose.. need to work on my core! But happy that I have made it this far ☺️,Ugw19j3iGRR8iVELkrd4AaABAg,0.0,0.0,2018-01-21T00:17:15Z,0.9993736147880554
444.0,This was a wonderful way to wind down for the evening. <3,UgwL--ZiYUvyCmx4AeJ4AaABAg,0.0,0.0,2018-01-21T00:14:07Z,0.9993017911911011
445.0,Day 19 done! ❤️💚❤️,Ugw27KE3fBTqnMsOpZF4AaABAg,0.0,0.0,2018-01-21T00:09:55Z,0.6446969509124756
446.0,"❤❤ so so grateful for this series at the moment, third night showing up on the 'mat' aka wooden floor with a towel(!) and trying not to disturb the rest of the house while I'm home but really feeling the benefit of these last few sessions -  felt this one in my shoulders so much afterwards! But also in my mind :)",Ugxty5QXNhOGlVFZQHt4AaABAg,0.0,0.0,2018-01-20T23:55:51Z,0.9865884184837341
447.0,"Adriene! Thank you! I carried today's practice with me all the way through hiking in the snowy Maine forests along the oceanside today. :) Mindfulness in every step. One question! I was mildly nauseous during bound eagle pose, what could that mean? I felt pressure in my thyroid and it nearly gagged me, both sides. Very interesting stuff! Just wondering if you have any thoughts as to the cause of that...Anyhoo, grateful for today! Namaste.",UgxZkV7n7FZy0lhuPT54AaABAg,0.0,0.0,2018-01-20T23:54:37Z,0.9847525954246521
448.0,"It's funny how I feel like I am ""fitting"" my TRUE practice into my busy day sometimes, but afterwards, I actually feel like I am ending up with more time.  I loved today's practice.  Learning some balance on and off the mat.  Thank you Adriene.",UgxpMZHTX73KtVxNB-V4AaABAg,0.0,0.0,2018-01-20T23:30:47Z,0.9993315935134888
449.0,"Adriene, a few days ago I thought to myself ""wow, today's practice was a game changer."" Then the next day I thought again, ""this is changing the game!"" And I thought it again the next day and today! I keep learning more about myself, and the way I want to live my life, every day. I feel better than I have in several years, and I'm becoming more motivated to change things in my life for the better. Thank you for sharing your wisdom and insight with all of us. Namaste!",UgxL8tbsby1Py02X3GB4AaABAg,0.0,0.0,2018-01-20T23:23:15Z,0.9992375373840332
450.0,"What an awesome practice! I love when she says, ""Look down into the pond.""",UgzJSCH6P_3LB_nCMbN4AaABAg,0.0,0.0,2018-01-20T23:23:06Z,0.999823272228241
451.0,TY A! Working on self loving thoughts today. :) 🙏,UgwDK_omE5VQEuyN9qx4AaABAg,0.0,0.0,2018-01-20T23:04:52Z,0.9960197806358337
452.0,"I've just done this before bed and it's helped to slow down my thoughts, I hadn't realised how much they were racing and now I feel relaxed enough to sleep.",UgzxKniKKuH28Zcs7O14AaABAg,0.0,0.0,2018-01-20T23:04:02Z,-0.9743983149528503
453.0,loved the part about how thinking positively manifests positive results. i feel like doing yoga with you makes it easier for me to me more mindful of my thoughts and actions. so very grateful for you for creating this amazing series. love you Adriene!,Ugx_Y3bIC_JFoQuWKgN4AaABAg,0.0,0.0,2018-01-20T23:03:25Z,0.9998492002487183
454.0,"I thought it was really interesting your comment that what you pay attention to you send energy to. And if you pay attention to negatives that's where your energy goes and a negative outcome is more likely to follow.

On of my 'kind of new years resolutions' was to be more positive. I had a difficult couple of last months of 2017, but I also found myself moaning a lot, or being negative a lot as well, and thinking everything was terrible, so this year I have actively tried to see the positive in everything and spin a positive light, and not give attention to the negatives and I have felt SO GOOD so far. I don't know if its just that, or its the fact I've done yoga every day, or if its actually material changes in my life but I LOVE IT.

Thank you as always Adriene!",UgzLuvRGamA2vNscdWV4AaABAg,0.0,0.0,2018-01-20T23:01:23Z,0.9904211759567261
455.0,"My favourite session so far, Thank you :) Where attention goes energy flows for sure. 





Today's Mantra: Day 19:- I release any negative energetic ties I have to people and situations from my past. I choose to realign my thoughts with positive outcomes.",UgzCL1MUWo2Wa0uu0Ux4AaABAg,0.0,0.0,2018-01-20T22:58:04Z,0.9962590932846069
456.0,Thank you Adriene. Looking forward to tomorrow's practice!,Ugz0Zu_wwq3fqgbYNGd4AaABAg,0.0,0.0,2018-01-20T22:55:51Z,0.999848484992981
457.0,"Good evening Adriene, this was a beautiful practice today! I felt very calm and in tune with myself, even though I was losing my balance in places for sure! As always, thank you. x",Ugw3_tRWu7jA27QRRrR4AaABAg,0.0,0.0,2018-01-20T22:41:57Z,0.9998219609260559
458.0,"i can't believe how steadier I've gotten, I was able to hold the eagle pose with crossed legs and not tumble!",Ugxj6eSxCM5omNAIuVh4AaABAg,0.0,0.0,2018-01-20T22:39:48Z,0.9991536140441895
459.0,"Wow! As I was doing this practice, there was a lot more noise than usual around me so it was so much harder to focus but your words of wisdom always guided me back in, encouraging me to shift my perspective and noticing how my thoughts were turning negative as the practice wasn't going the way I was hoping it would. As usual, it felt great Adrienne; I loved this practice so much! Day 19 and feeling awesome - after this challenge, I really want to hop on my mat to do yoga more often rather than just once a week as I used to. Thank you for all you do, you are the best!",Ugz1aoRjlIXkRJAQZih4AaABAg,0.0,0.0,2018-01-20T22:37:53Z,0.9997105002403259
460.0,I just so happened to be in ninja attire for today! :),UgzElacGTvzhDQ70ueN4AaABAg,0.0,0.0,2018-01-20T22:26:51Z,-0.9733887910842896
461.0,I did have another neg thought....what am I going to do when this 30 days is over. 🙄,Ugzj4UU5zUOr0qZJ2YJ4AaABAg,0.0,0.0,2018-01-20T22:25:15Z,-0.9974504113197327
462.0,"Hi, my thoughts did lead me down a negative path during the wrap pose, on my left leg I wobbled and fell , I felt disappointed in myself in my body but I gathered myself together and went in to the right side in which I managed to stay up so my thoughts were more relaxed after that. I have to give myself a break sometimes. I expect a lot of me. 😊",UgwG-DEmLKhfgHRJeOx4AaABAg,0.0,0.0,2018-01-20T22:23:52Z,-0.9444606900215149
463.0,So interesting practice! Namaste,Ugzcds2SPNeqBY2iJZJ4AaABAg,0.0,0.0,2018-01-20T22:16:56Z,0.9993206262588501
464.0,"Dear Adriene,
All your alfits are beautiful as are you. Your performance is grace and your sincerity is inspiring. Thanks for participating in helping others on the path of self realization. So glad i discovered you a wonderful way to open the year. Much love and gratitude. 😀🌹💙🎶",UgwaidqJ7tiRakzb1iR4AaABAg,0.0,0.0,2018-01-20T22:14:27Z,0.999884843826294
465.0,"This has become such an important part of my day. Love these practices! 

Question for those more experienced than me (so, almost everyone as I’m a total beginner 😉), but any tips for being able to do the squat near the end? My thighs kept cramping so I couldn’t keep the pose. Any advice is appreciated! 💛",Ugy3qxwl_BYw4EOZbxN4AaABAg,0.0,0.0,2018-01-20T22:06:50Z,0.9910596013069153
466.0,I couldn't believe it when I managed to balance in eagle pose on BOTH sides! Feeling a great sense of achievement. Thanks Adriene,UgyBQekZJLtC5JsBMGl4AaABAg,0.0,0.0,2018-01-20T22:05:23Z,0.9998680353164673
467.0,This was my first time doing it not at home. Did it at a friends house just before a party! Great way to start the night!!,UgzzLrcyVyO9RP8JRod4AaABAg,0.0,0.0,2018-01-20T21:56:47Z,0.9991196990013123
468.0,Thank you for such a thoughtful and loving practice. ❤️,UgzfojQL3TzfvzQGQDZ4AaABAg,0.0,4.0,2018-01-20T21:52:31Z,0.9998735189437866
469.0,"My yoga ninja outfit tonight was my pyjamas. Very comfy. So, I've had shoulder problems for about 9 months now and am having to adapt poses that I didn't have to before, which is frustrating, but hey I'm back on the mat after shying away from it for a while because of the pain and tonight when my eagle arms on one side were ...erm... a bit buggered... I just went with it and realised that a shonky asana was much better for mind and body than avoiding the mat so go Adriene and go me (and go us)! 🙂🙃❤️",Ugz1dS__QnEWGNtbOUJ4AaABAg,0.0,0.0,2018-01-20T21:46:20Z,-0.9170488715171814
470.0,Oh man my balance was so not good in this one... But I did try 😂,Ugy_Pamzd5-bs9SfBa94AaABAg,0.0,0.0,2018-01-20T21:44:40Z,-0.9424349665641785
471.0,Namasteh!,UgxVFO0j5ipeD-pi50B4AaABAg,0.0,0.0,2018-01-20T21:38:51Z,-0.802865743637085
472.0,"Struggled with a sinus headache all day, so this was the perfect practice to end the day. Thank you Adriene x",UgzQ-uhP-HiSCSGTtEN4AaABAg,0.0,0.0,2018-01-20T21:33:41Z,0.9994146823883057
473.0,I'm really tired today after a busy day. I wanted to go straight to bed but I'm glad I joined today's practice. Hopefully some of your words have sinked in through the sleepy haze!,UgzgMndjTNcAq2uLSdh4AaABAg,0.0,0.0,2018-01-20T21:29:15Z,-0.9449412226676941
474.0,The last two days were way too hard for me (just too exhausted from work for that level of yoga on an evening!) but today was 🙌🏻👌🏻 LOVED IT x,Ugz7nCPfckH2ySf5WmV4AaABAg,0.0,0.0,2018-01-20T21:19:20Z,0.997296154499054
475.0,"9pm here in the UK 🇬🇧, wonderful, reluctant to start this evening had a migraine earlier at work and a headache coming on when I started this practice, I feel good now, sleepy but not in pain. Thank you ♥",UgwmbN76gQFrBp4lIsp4AaABAg,0.0,0.0,2018-01-20T21:17:15Z,0.9993540644645691
476.0,"Really needed this after a late shift at work! Thought! Love this. Never noticed until tonight the words that enter my mind as I'm practicing yoga. Tonight the words that came to me were happiness, strength and worry. Great session and I look forward to tomorrow's! Thank you! ❤😙",UgzYqZIsn43-bpX_UCh4AaABAg,0.0,0.0,2018-01-20T21:15:13Z,0.9997574687004089
477.0,I thought I was going to fall over when my leg was wrapped around the other..Oh! My!   Namaste!,UgwJP6wov1MbgSqIoT54AaABAg,0.0,0.0,2018-01-20T21:11:45Z,-0.9550370573997498
478.0,"You seem to know exactly what I need day to day, Adriene; thank you! 💖🙏",Ugy2YBnRZpp2BqDigxB4AaABAg,0.0,0.0,2018-01-20T21:04:14Z,0.9998383522033691
479.0,It took me a little while to get on my yoga mat today but I am so happy I showed up for myself today! This practice feels great. Thanks Adriene💛,UgzDmh49EZilLIVoFWl4AaABAg,0.0,0.0,2018-01-20T21:01:28Z,0.9998501539230347
480.0,Great practice! Thanks! You are a real star!,UgwhoPGVTWnHJnDIOod4AaABAg,0.0,0.0,2018-01-20T20:49:40Z,0.9998680353164673
481.0,"Am turning my thoughts to how happy I feel when I do something just for me. I love the journey I am on and this journey we are taking together! Thanks, y'all!! Am feeling love from all over and I like it!! :-)",UgystVbGiXcrJ2pv2ZF4AaABAg,0.0,0.0,2018-01-20T20:47:11Z,0.9998589754104614
482.0,The kiddo home sick two days this week made it difficult to find the time but I did it including today’s “double down” Day 18 & 19 together! Wow feeling alive from head to toe...I know. Keep the musical references coming Adriene. #Namaste,Ugz5SmjLQBiE13bp3tB4AaABAg,0.0,0.0,2018-01-20T20:44:03Z,0.9983175992965698
483.0,Can you please tell me if you're over weight can you still do yoga. I need help to keep active as I can't go out or go to the gym. Feeling so depressed ugly and fat.,Ugze8vIY5bwrucUoPHd4AaABAg,1.0,0.0,2018-01-20T20:42:46Z,-0.9989945292472839
484.0,This video had me in tears at the end! Girl you always hit it right on the head! You have a way of turning my day around. Namaste to you! 🙏🏻,UgxnLVF4hJy5LxPKN8p4AaABAg,0.0,0.0,2018-01-20T20:41:45Z,0.9951832890510559
485.0,Very energizing practice. :) Anyone have any tips for gaining flexibility for Eagle pose. I’m not sure if it’s my robust thighs or lack of flexibility which prevents my foot from warpping around my leg. I would appreciate any thoughts or ideas.,UgxnOaymsFC8ySCf96h4AaABAg,0.0,0.0,2018-01-20T20:38:37Z,-0.5378519296646118
486.0,"Day 19 - DONE!  Namaste, Adriene!",Ugy-ugM45KY6BzpujWt4AaABAg,0.0,0.0,2018-01-20T20:35:16Z,-0.7773516178131104
487.0,"The daily guided meditation I do after yoga randomly spoke about this EXACT topic! How cool/oddballs is that?!!
SERENDIPITY!",UgzqVYwR5pzK5O4d3tJ4AaABAg,0.0,0.0,2018-01-20T20:31:57Z,0.997327446937561
488.0,"From now on whenever negative thoughts about myself enter my mind, I am going to here captain Picard say ""Make it so!"" and I will have to make positive thoughts! Namaste Adriene and MAKE IT SO!",Ugyva6vAthn57PkrV8N4AaABAg,0.0,0.0,2018-01-20T20:07:32Z,0.9953983426094055
489.0,Yet another great practice Adriene! My only concern for me is too much time in eagle arms and it's really hard on my collar bones (I dislocated one about 10 years ago and it still is a bit twitchy at times). Are there any modifications to it that might help? Thanks everyone for your input!,UgxuV9P14LQ5v0Wbx-54AaABAg,0.0,0.0,2018-01-20T20:04:50Z,-0.9710379242897034
490.0,Thank you Adriene!,UgxK03HeCwdSCU774j94AaABAg,0.0,0.0,2018-01-20T20:02:51Z,0.9998526573181152
491.0,"Amazing session...I really focused on my breathing & core control while in the eagle pose; was able to hold the pose far longer than I normally can! Plus I loved the reminder to ""slowly"" come out of pose...so much emotion flows through when you take your time:)",UgwNlM_KZPLuBB_hq3N4AaABAg,0.0,0.0,2018-01-20T19:57:14Z,0.9996850490570068
492.0,"Loved yesterday's butt whoopin practice and today's ""Thought"" practice. Feelin like a Ninja!!!",UgwFu_ROV-3V2bZU8GV4AaABAg,0.0,0.0,2018-01-20T19:50:13Z,0.998134970664978
493.0,"Today's session was most welcome and appreciated, thank you Adriene. 
Also, I have noticed that since the beginning of this challenge, nothing much has changed in my somewhat stiff and sore body, but I can notice there is something softer on my face, like I'm softer and more loving about myself. Plus, I became aware of multiple moments during the day when I was holding my breath (out of fear and non-stop anxiety) and I have started breathing deep through the fear and anxiety and it brings much acceptance, which helps a lot.
I started this challenge for my body and it's working on levels I did not expect, thank you so much for this help.
Love from Paris :-)",UgzmWXyLExTcA1wufTd4AaABAg,0.0,0.0,2018-01-20T19:43:36Z,0.9996539354324341
494.0,It is impossible to take myself to seriously when you are making me laugh out loud ever couple if minutes! Thanks for another joyful and challenging practice!,UgxcLryHJW_mEEbYyhN4AaABAg,0.0,0.0,2018-01-20T19:37:54Z,0.999541163444519
495.0,"Adriene! Question for you: what would you recommend work-out/yoga wise that partners well with doing daily yoga videos? Is the one video enough to sustain and maintain, or do you have any other recommendations? Thanks for always making yoga a fun time!",Ugyigu91i7aEdwXUMsh4AaABAg,0.0,0.0,2018-01-20T19:34:26Z,0.9979519248008728
496.0,"What a coincidence, I was already in a kinda of ninfa outfit. Love this.",UgzwOtY52G_rnKI2PIR4AaABAg,0.0,0.0,2018-01-20T19:30:37Z,0.9997984766960144
497.0,Thank you Adriene 🌼,Ugz-BNTdLyjpiHRowDB4AaABAg,0.0,0.0,2018-01-20T19:19:21Z,0.9997859597206116
498.0,Fantastic practice. Thank you.,UgwWFJH-_ujXFag5k0h4AaABAg,0.0,0.0,2018-01-20T19:18:52Z,0.9998793601989746
499.0,I really appreciate this 30 Days of True Yoga it's such a positive in my life,UgzxjAlRwHvhlP9BAjZ4AaABAg,0.0,0.0,2018-01-20T19:15:53Z,0.9998757839202881
500.0,"Today was quick and sweet, I don’t have much *thought* to it.

Other than the fact that how awesome yoga training at home is, because you can take it your own pace and be mindful of your movement. 

I can’t believe tomorrow is day 20! Wow!
#YWATRUE

Namaste.",Ugyf4MT1ahuPif7ZIVl4AaABAg,0.0,0.0,2018-01-20T19:09:27Z,0.9972395896911621
501.0,"I've been doing yoga for about a year now and this was possibly my favorite practice so far! The eagle arms and legs wrapped together pose made me feel like some kind of ancient yoga master. I was so focused.  It probably didn't look that cool, but it sure felt awesome haha",UgxcJW9H6IFRxzRZ82F4AaABAg,0.0,0.0,2018-01-20T19:03:04Z,0.9992434978485107
502.0,ANOTHER great practice to keep up my mindfulness skills - thanks again Adriene. My youngest son challenged me on that later in the day though. It's all in the blog post:  https://www.abigailyardimci.com/muminthemoment/30-days-of-yoga-thought,UgyE5U7Rw3xerGZGnbN4AaABAg,0.0,0.0,2018-01-20T18:59:56Z,0.9869197607040405
503.0,"Okay to be honest I have a kind of terrible relationship with my mind this period of my life .. and the reason that I really begin to listen to it and notice and be aware of my thoughts and omg they are insane ! During this practice I asked my mind to be a friend with me and my heart , to not betray me and to be on my team ! I hope it's gonna listen and appreciate my efforts :)",Ugx-kgrcM67LU-OjhX94AaABAg,0.0,0.0,2018-01-20T18:59:34Z,0.999197781085968
504.0,fabulous experience today.,Ugw2NKpqnDE2O4L4gAJ4AaABAg,0.0,0.0,2018-01-20T18:57:31Z,0.999883770942688
505.0,Thanks for uploading yet another wonderful practice on my 30th birthday.,UgxNSrD6RunO6BjUQ9N4AaABAg,1.0,0.0,2018-01-20T18:41:57Z,0.9998570680618286
506.0,"So soothing and lush, thank you! x x x Namaste",UgwEzX-GyhWjjwcDAAV4AaABAg,0.0,0.0,2018-01-20T18:41:32Z,0.9998278617858887
507.0,Waiting for me to decide an easier decision that needs trust and getting committed with confidence that I wouldn't fail,UgwEOteCpsf32WJ-Toh4AaABAg,0.0,0.0,2018-01-20T18:35:32Z,0.9967135190963745
508.0,"Love it! Also love looking at how many people are doing this at exactly the same time - a lady put a comment about this a few videos back and I've started doing it , normally there are 2000 more views from when I started to when I finished. Love this lovely community x",Ugyn6M4FU0W7hWDoEVR4AaABAg,0.0,0.0,2018-01-20T18:34:58Z,0.9992637038230896
509.0,"After feeling frustrated with trying to grab my feet the other day, I felt as if I wasn't practicing positive talk. But, now that self-love has taken hold of my thoughts-- I embraced the Eagle pose. I fell... but then I found my footing and became strong and determined. When Adriene said that when we switched sides, I was like... yes... that's how I feel today. Embracing the challenge and embracing I'm only a few months new to establishing a yoga practice. Of course, I'm not going to be great at it yet, but I'm on my mat trying. This is a much-needed practice for on the mat and definitely OFF the mat. I feel ready to tackle anything today. And, reminding myself of my goal is to be aware of my thoughts. Are they self-defeating or self-loving! Practice will only make those self-loving thoughts become easier.",UgzC1l4-ElEKcvdUteR4AaABAg,0.0,0.0,2018-01-20T18:34:40Z,0.9977967739105225
510.0,Thank you Adriene 🙏🏼,Ugy77o763yFl9KV1Gdp4AaABAg,0.0,0.0,2018-01-20T18:34:26Z,0.9997859597206116
511.0,"I loved the entire practice, my favorite part was Eagle pose. I'm getting better at it! Thank you Adriene for all of your help. Love ya! 😙💞",Ugzy6jzPl4bE-UVuW3R4AaABAg,0.0,0.0,2018-01-20T18:29:14Z,0.9998138546943665
512.0,"D-19 was outstanding i loved the practice trying to focus and clear my thoughts, especially the negative ones to build a positive energy for me to improve and appreciate the outcome.
thank you Adriene and love and peace everyone.",UgzIbHh5T2NnSY-Ux8J4AaABAg,0.0,0.0,2018-01-20T18:22:32Z,0.9998743534088135
513.0,"D-19 was outstanding i loved the practice trying to focus and clear my thoughts, especially the negative ones to build a positive energy for me to improve and appreciate the outcome.
thank you Adriene and love and peace everyone.",Ugz31juJrnnUaO2kiCx4AaABAg,0.0,0.0,2018-01-20T18:22:26Z,0.9998743534088135
514.0,"I've lost a friend in a fight today.. it hurt a lot and I had bad thoughts all day... Thank you for this break, I've gained more confidence and am feeling better now. See you tomorrow, lots so love, Namaste 💖🙏",UgwMpvoux-uPD-SdOuh4AaABAg,1.0,0.0,2018-01-20T18:22:11Z,0.9922377467155457
515.0,"Absolutely loved this practice! Felt strong, focused, determined, and that helped me keep my balance. Day 19 going strong! <3",Ugygh_m5vEVE7pYiRwd4AaABAg,0.0,0.0,2018-01-20T18:17:56Z,0.9998782873153687
516.0,"power of thought is right
that beach was REAL! and it was peaceful. i could hear the ocean :)",UgzOXzUz4GS6Pg7A7MR4AaABAg,0.0,0.0,2018-01-20T18:16:57Z,0.9996989965438843
517.0,Is it okay to do these true yoga series in my own order?,UgznGnViSNI6UORy5kl4AaABAg,1.0,0.0,2018-01-20T18:15:49Z,-0.9543976783752441
518.0,"I'm dealing with a lot of anxiety lately and doing the challenge helps me reduce it and stay focused! Today's video was the best one yet! Thanks for that, Adriene! Lots of love!",UgwpMk-kaSSRREQULCt4AaABAg,0.0,0.0,2018-01-20T18:13:57Z,0.9998302459716797
519.0,"man i LOVED this one! what a perfect practice. all those forward bends felt so good on my hamstrings. i think i must just really love balancing poses and the challenges they present. thanks as always! can't wait to come back to this one as it was full of things that made me feel good which is what it's allll about, right?",UgwIEKs56lnNcqkRob14AaABAg,0.0,0.0,2018-01-20T18:13:08Z,0.9998202919960022
520.0,I was wondering where you got your yoga mat I love it!,UgwsOv0q5KUwuuKTSSp4AaABAg,2.0,0.0,2018-01-20T18:09:54Z,0.9993801116943359
